basepk,hid,speechdate,pid,opid,speakeroldname,speakerposition,maintopic,subtopic,subsubtopic,speechtext,speakerparty,speakerriding,speakername,speakerurl
4594249,ca.proc.d.2014-04-01.15965.267,2014-04-01,02c2cb20-f27d-46a5-8e78-ab4b405bf07b,453,The Acting Speaker (Mr. Bruce Stanton),,Government Orders,Business of Supply,Opposition Motion—Government Aircraft,"Before we go to the hon. member for Notre-Dame-de-Grâce—Lachine, I take it that the parliamentary secretary is wanting to raise a point of order on his first comment. I did not hear anything unparliamentary, but, of course, we will check the record and get back to the House as the need may be.
The hon. member for Notre-Dame-de-Grâce—Lachine.",Conservative,Simcoe North,Bruce Stanton,http://www.parl.gc.ca/parlinfo/Files/Parliamentarian.aspx?Item=02c2cb20-f27d-46a5-8e78-ab4b405bf07b&Language=E&Section=ALL
4594250,ca.proc.d.2014-04-01.15965.268,2014-04-01,aa391262-e2bb-43aa-a00e-454730c269ef,8603,Ms. Isabelle Morin,Interjection,Government Orders,Business of Supply,Opposition Motion—Government Aircraft,"Mr. Speaker, my colleague said that it happened eight times in the past eight years and that there are more important matters. Even if it happened only once, it would be one time too many.
This is not about whether or not eight times is too many. It amounts to one misuse of public funds every year. My colleague said that it did not happen often enough to be taken seriously and to represent an ethical problem. Really? What are they talking about? That does not make sense. If I steal something from a grocery store, I am not going to tell my constituents that it is not serious because it only happened eight times. However, that is what my colleague is saying. That is ridiculous.
With respect to the other part of his question, the F-word is not part of my vocabulary. However, he says that I said it. If that is the case, I apologize, because I did not mean to. However, I really do not believe that I used such colourful language in the House.",New Democratic Party,Notre-Dame-de-Grâce--Lachine,Isabelle Morin,http://www.parl.gc.ca/parlinfo/Files/Parliamentarian.aspx?Item=aa391262-e2bb-43aa-a00e-454730c269ef&Language=E&Section=ALL
4594251,ca.proc.d.2014-04-01.15965.269,2014-04-01,07cf5767-802c-406c-92a7-7dc92af79b40,4264,"Mr. Kevin Lamoureux (Winnipeg North, Lib.)",,Government Orders,Business of Supply,Opposition Motion—Government Aircraft,"Mr. Speaker, in the member's comments, she talked about the misuse of public funds and made reference to the Liberal Party. I find it somewhat interesting that it was not that long ago, days or possibly a week, when the leader of the official opposition, the leader of her party, the New Democrats, took money that had been allocated for staffing of the leader's office to establish “outreach” offices in provinces like Saskatchewan and Quebec. 
In essence, these outreach offices are no more than political party offices that are being established at the taxpayers' expense. That is the reality of what the leader of the NDP is doing. 
I question the member on whether she would apply the same code of ethics to the leader of her own political party and the manner in which he is abusing tax dollars, and make the suggestion that he should repay that money to Revenue Canada. 
If the NDP is going to have a political office in Saskatchewan, it should be the NDP that pays for the office, not the taxpayer.",Liberal,Winnipeg North,Kevin Lamoureux,http://www.parl.gc.ca/parlinfo/Files/Parliamentarian.aspx?Item=07cf5767-802c-406c-92a7-7dc92af79b40&Language=E&Section=ALL
4594252,ca.proc.d.2014-04-01.15965.270,2014-04-01,aa391262-e2bb-43aa-a00e-454730c269ef,8603,Ms. Isabelle Morin,Interjection,Government Orders,Business of Supply,Opposition Motion—Government Aircraft,"Mr. Speaker, I thank my colleague for his question.
It is typical of the Liberal Party to say that it would seem that a few weeks ago the leader may have misused public funds. The use of the conditional in that sentence indicates that it cannot be true.
I invite my colleague to come to my Montreal office. I will show him what our employees do. In my case, my employees prepare householders and help me write press releases, among other things. They are completely non-partisan. They help me with my work as an MP and not with my partisan work. We have never engaged in that kind of activity.
The Liberals and Conservatives are all about entitlement. When they form the government, they raid the public purse for partisan ends. That has been going on for far too long in our country.
It is time to put an end to this charade and to elect an ethical party that will do things differently and stand by its principles for a long time, even if it is in power for a long time.",New Democratic Party,Notre-Dame-de-Grâce--Lachine,Isabelle Morin,http://www.parl.gc.ca/parlinfo/Files/Parliamentarian.aspx?Item=aa391262-e2bb-43aa-a00e-454730c269ef&Language=E&Section=ALL
4594253,ca.proc.d.2014-04-01.15965.271,2014-04-01,02c2cb20-f27d-46a5-8e78-ab4b405bf07b,453,The Acting Speaker (Mr. Bruce Stanton),,Government Orders,Business of Supply,Opposition Motion—Government Aircraft,"With respect to the recent point of order raised by the hon. Parliamentary Secretary to the Minister of National Defence, I recognize that the hon. member for Notre-Dame-de-Grâce—Lachine has withdrawn the remark in her comments. On that basis, I will consider the issue closed.
Resuming debate, the hon. member for New Westminster—Coquitlam.",Conservative,Simcoe North,Bruce Stanton,http://www.parl.gc.ca/parlinfo/Files/Parliamentarian.aspx?Item=02c2cb20-f27d-46a5-8e78-ab4b405bf07b&Language=E&Section=ALL
4594254,ca.proc.d.2014-04-01.15965.272,2014-04-01,d013e8ca-fdd5-4eb4-a0e4-b5f0782a8f6d,8333,"Mr. Fin Donnelly (New Westminster—Coquitlam, NDP)",,Government Orders,Business of Supply,Opposition Motion—Government Aircraft,"Mr. Speaker, I rise to speak in support of the NDP motion before us about the misuse of taxpayers' dollars. 
It seems that the Prime Minister and his friends have been wracking up flights on government Challenger aircraft as if these jets are their own personal planes. Access to Information documents reveal that the Prime Minister is increasingly using Challenger jets, not only for his own family's travel, but for personal friends and Conservative Party fundraisers.
Furthermore, the government has changed the rules so that it only has to reimburse taxpayers an amount equivalent to economy class airfare. Those jets cost nearly $4,000 an hour to fly, yet the Conservatives, after changing the rules in their favour, only reimbursed taxpayers an average of $260 a flight. Wow. No wonder they are using these jets so frequently for personal and partisan reasons; they get to travel like rock stars but pay seat sale rates.
When average Canadians are looking to book a flight, they tend to go online, compare prices and schedules, then choose the best deal. They wait for seats to go on sale because they have a budget to worry about. However, not the Conservatives. They have devised quite the scheme to get taxpayers to subsidize their non-government-related travel.
iPolitics, through an access to information request for documents, found that the Conservative Party has reimbursed the Department of National Defence 17 times, for a total cost of over $37,000, but the actual cost of the flights in question is about $118,000. Let us not forget that taxpayers were also on the hook last year for about $50,000 for a paint job for one of these jets, after the Conservatives decided to paint it Conservative colours.
I speak on behalf of the majority of British Columbians when I say that the Conservative Party is unrecognizable from the party that people once hoped would come to Ottawa to clean up the Liberal legacy of corruption and entitlement. The Conservatives said they would make changes once in Ottawa, but instead Ottawa has changed them. I have three examples to illustrate this point.
The first example is with respect to the Senate. The Conservatives promised not to nominate new senators but went ahead and appointed 59 of their closest friends, including Pamela Wallin, Mike Duffy, and Patrick Brazeau. The Senate is under investigation. A Senate expense scandal showed a complete disregard for ethics and transparency. The NDP says that it is time to roll up that red carpet. The record of the Conservatives on the Senate shows they are no different from the Liberals when it comes to a sense of entitlement.
The second example is with respect to the Conservatives abuse of Parliament, specifically time allocation. The Conservatives have shut down debate more than 50 times over the past two years. That is more than any other government in Canadian history. There is a constant use of in-camera proceedings in committees, thereby shutting Canadians out of the proceedings. That severely restricts studies. The Conservatives also pick pro-government witnesses.
When it comes to contempt, the 2011 election was triggered after the Conservatives were found to be in contempt of Parliament for misleading parliamentarians and refusing to provide key details on proposed bills and their cost estimates. The Conservatives record of abusing Parliament as a democratic institution shows they are no different from the Liberals when it comes to transparency and accountability.
The third example is with respect to the Conservatives unfair elections act. The bill would remove powers from the Chief Electoral Officer. That individual would be stripped of investigative powers as well as the power to engage in public education. The bill would make voting much harder for vulnerable Canadians. It would end the practice of vouching, and voter ID cards would no longer be accepted to confirm identification. The unfair elections bill would change political financing rules in favour of the Conservatives. It would increase allowable levels for individuals to contribute, from $1,200 to $1,500, and it would give an advantage to wealthy Canadians by allowing—",New Democratic Party,New Westminster--Coquitlam,Fin Donnelly,http://www.parl.gc.ca/parlinfo/Files/Parliamentarian.aspx?Item=d013e8ca-fdd5-4eb4-a0e4-b5f0782a8f6d&Language=E&Section=ALL
4594255,ca.proc.d.2014-04-01.15965.273,2014-04-01,02c2cb20-f27d-46a5-8e78-ab4b405bf07b,453,The Acting Speaker (Mr. Bruce Stanton),,Government Orders,Business of Supply,Opposition Motion—Government Aircraft,Order. The hon. Minister of State for Foreign Affairs is rising on a point of order.,Conservative,Simcoe North,Bruce Stanton,http://www.parl.gc.ca/parlinfo/Files/Parliamentarian.aspx?Item=02c2cb20-f27d-46a5-8e78-ab4b405bf07b&Language=E&Section=ALL
4594256,ca.proc.d.2014-04-01.15965.274,2014-04-01,7d30ceff-1d85-4736-bbc8-293337c0423e,307,Hon. Lynne Yelich,Interjection,Government Orders,Business of Supply,Opposition Motion—Government Aircraft,"Mr. Speaker, I have to check what the debate is about. I thought we did the elections debate yesterday. If we are on the debate that I thought we were on, I think the member is being very irrelevant.",Conservative,Blackstrap,Lynne Yelich,http://www.parl.gc.ca/parlinfo/Files/Parliamentarian.aspx?Item=7d30ceff-1d85-4736-bbc8-293337c0423e&Language=E&Section=ALL
4594257,ca.proc.d.2014-04-01.15965.275,2014-04-01,02c2cb20-f27d-46a5-8e78-ab4b405bf07b,453,The Acting Speaker (Mr. Bruce Stanton),,Government Orders,Business of Supply,Opposition Motion—Government Aircraft,"I thank the hon. minister of state for her intervention. Members know that there are rules with respect to relevance to the question before the House. I know there have been points raised on this matter earlier in the day during this debate. I recognize that the member is about halfway into his time and I am sure that he will be presenting arguments that bring his commentary around to the question that is before the House.
 It is always instructive to all hon. members to be aware that while they have great liberty to provide arguments around the question before us, we encourage them to make comments relevant, either in the early part of their remarks or certainly toward the end of their remarks so that it will be understood how their particular arguments all connect together.
The hon. member for New Westminster—Coquitlam.",Conservative,Simcoe North,Bruce Stanton,http://www.parl.gc.ca/parlinfo/Files/Parliamentarian.aspx?Item=02c2cb20-f27d-46a5-8e78-ab4b405bf07b&Language=E&Section=ALL
4594258,ca.proc.d.2014-04-01.15965.276,2014-04-01,d013e8ca-fdd5-4eb4-a0e4-b5f0782a8f6d,8333,Mr. Fin Donnelly,Interjection,Government Orders,Business of Supply,Opposition Motion—Government Aircraft,"Mr. Speaker, I think I did link the topic of ethics. I also talked about transparency and accountability. I am going to finish with priorities, in terms of where we should be spending the money that is being wasted by the government. 
Hopefully the member is paying attention to this intervention and does make the link to my points. I spent a lot of time in preparing my comments and I hope members do take note.
As I was saying, this does give an advantage to wealthy candidates. They can contribute up to $5,000 to their own campaign and $25,000 to their own leadership campaign. It exempts fundraising calls made during elections from counting as electoral expenses.
The NDP has fundamental concerns with the bill. We join with journalists, academics, and other Canadians speaking up for democracy, who are now saying that if the bill is not amended, we should kill it. 
When it comes to improving our democracy, Canadians cannot rely on the Conservative Party. Its record is one scandal after another. Once again, Conservatives cannot be trusted.
What should we be talking about? What should we be focused on in terms of spending? When it comes to transparency and accountability, Canadians deserve better leadership than what the Conservative government has been offering.
I would like to expand on what this means. Last month I held my annual series of town hall meetings as part of my community consultations. I asked constituents to rank by importance a variety of public policy issues and economic concerns. As was the case in every year I have held these consultations, health care was the highest-ranked issue. 
Since coming to power, the government has made little to no progress on reducing wait times, increasing home care, ensuring better access to primary care, or implementing a cost-saving pharmacare plan.
Yesterday the 2004 health care accord officially expired, with no new accord to replace it. Instead of negotiating a new deal, the Conservatives unilaterally imposed a new funding formula on the provinces and have walked away from the commitments to setting standards on wait times, home care, and prescription drugs. The government's record on health care is clear. It is failing to show leadership on this crucial file and is opening the door to increased disparities across our country.
As official opposition, the NDP is listening to Canadians and is holding the government to account for its failed record on health care.
Today we are holding Conservatives to account for their abuse of taxpayers' money and the culture of corruption and entitlement that seems to have overtaken the leadership of the Conservative Party. The public purse is out $118,000 because the government has been treating government jets as personal and partisan taxis. That $118,000 equals old age security for 19 seniors, GIS allowance for 20 seniors, or the average annual pension for five retired veterans. 
The Conservative government has done little to address the challenges facing Canada's aging population or to provide adequate services to our Canadian veterans. I find this appalling. 
Instead, Conservatives have made it harder for seniors to retire with dignity. OAS changes mean many are forced to work an additional two years before they are allowed to retire. 
This is unacceptable. We need change. The NDP is focused on change, and we will bring that change in 2015.",New Democratic Party,New Westminster--Coquitlam,Fin Donnelly,http://www.parl.gc.ca/parlinfo/Files/Parliamentarian.aspx?Item=d013e8ca-fdd5-4eb4-a0e4-b5f0782a8f6d&Language=E&Section=ALL
4594259,ca.proc.d.2014-04-01.15965.277,2014-04-01,aa58e8f5-4a46-4c79-8e97-b9ebe28c9d9a,295,"Hon. Peter Van Loan (Leader of the Government in the House of Commons, CPC)",,Government Orders,Offshore Health and Safety Act,Bill C-5—Notice of Time Allocation,"Mr. Speaker, I would like to advise that agreement could not be reached under the provisions of Standing Order 78(1) or 78(2) with respect to the third reading stage of Bill C-5, An Act to amend the Canada-Newfoundland Atlantic Accord Implementation Act, the Canada-Nova Scotia Offshore Petroleum Resources Accord Implementation Act and other Acts and to provide for certain other measures.
Under the provisions of Standing Order 78(3), I give notice that a minister of the Crown will propose, at the next sitting, a motion to allot a specific number of days or hours for the consideration and disposal of proceedings at the said stage of the bill.",Conservative,York--Simcoe,Peter Van Loan,http://www.parl.gc.ca/parlinfo/Files/Parliamentarian.aspx?Item=aa58e8f5-4a46-4c79-8e97-b9ebe28c9d9a&Language=E&Section=ALL
4594260,ca.proc.d.2014-04-01.15965.278,2014-04-01,aa58e8f5-4a46-4c79-8e97-b9ebe28c9d9a,295,"Hon. Peter Van Loan (Leader of the Government in the House of Commons, CPC)",,Government Orders,Combating Counterfeit Products Act,Bill C-8—Notice of Time Allocation,"Mr. Speaker, I would like to advise that agreement could not be reached under the provisions of Standing Order 78(1) or 78(2) with respect to the third reading stage of Bill C-8, An Act to amend the Copyright Act and the Trade-marks Act and to make consequential amendments to other Acts.
 Under the provisions of Standing Order 78(3), I give notice that a minister of the Crown will propose, at the next sitting, a motion to allot a specific number of days or hours for the consideration and disposal of proceedings at the said stage of the bill.",Conservative,York--Simcoe,Peter Van Loan,http://www.parl.gc.ca/parlinfo/Files/Parliamentarian.aspx?Item=aa58e8f5-4a46-4c79-8e97-b9ebe28c9d9a&Language=E&Section=ALL
4594261,ca.proc.d.2014-04-01.15965.279,2014-04-01,02c2cb20-f27d-46a5-8e78-ab4b405bf07b,453,The Acting Speaker (Mr. Bruce Stanton),,Government Orders,Combating Counterfeit Products Act,Bill C-8—Notice of Time Allocation,I am sure the House appreciates the notice on the part of the government House leader.,Conservative,Simcoe North,Bruce Stanton,http://www.parl.gc.ca/parlinfo/Files/Parliamentarian.aspx?Item=02c2cb20-f27d-46a5-8e78-ab4b405bf07b&Language=E&Section=ALL
4594262,ca.proc.d.2014-04-01.15965.280,2014-04-01,,,,stagedirection,Government Orders,Business of Supply,Opposition Motion—Government Aircraft,The House resumed consideration of the motion.,,,,
4594263,ca.proc.d.2014-04-01.15965.281,2014-04-01,07cf5767-802c-406c-92a7-7dc92af79b40,4264,"Mr. Kevin Lamoureux (Winnipeg North, Lib.)",,Government Orders,Business of Supply,Opposition Motion—Government Aircraft,"Mr. Speaker, I have been listening to the member address the House on the opposition day motion and to the point of order that was raised. I am all for leniency in ensuring members get to say what is on their minds, and I was making a note of the issues he raised.
The member pointed out health care as a very important issue to his constituents, and the 2014 health care accord has now expired. The government has made a mess of that. Debating the expiration of the health care accord would have been a great opposition day motion. In Canada we now do not have a valid accord.
He pointed out improving democracy, the Senate, the Elections Act, and the issue of time allocation. We just witnessed the government House leader bringing forward time allocation. He mentioned in camera proceedings and government priorities. Very little that was talked about had to do with the planes. The misuse of taxpayers' dollars was also referred to.
I have a question for the member. Can he explain to us how the NDP came up with the current motion as the priority, given the list of other priority issues that were provided as potential opposition day motions? The member made reference to a number of them that would have been of great value in a debate here today. In the member's opinion, would some of those other issues have been better opposition day motions?",Liberal,Winnipeg North,Kevin Lamoureux,http://www.parl.gc.ca/parlinfo/Files/Parliamentarian.aspx?Item=07cf5767-802c-406c-92a7-7dc92af79b40&Language=E&Section=ALL
4594264,ca.proc.d.2014-04-01.15965.282,2014-04-01,d013e8ca-fdd5-4eb4-a0e4-b5f0782a8f6d,8333,Mr. Fin Donnelly,Interjection,Government Orders,Business of Supply,Opposition Motion—Government Aircraft,"Mr. Speaker, I appreciate the member's comments and his observation of my speech and intervention. I was trying to point out some relevant priorities that we could be looking at for the use of those dollars, and that Canadians want to see a better use of taxpayer dollars.
To add to the list that I have, the truth is the government does not care about the growing inequality in our country. It does not care that child care is wildly unaffordable or that poverty among seniors is on the rise or that British Columbia has the highest child poverty rate in the country. In fact, the government does not think it has a responsibility to feed our neighbour's child. It simply does not care.
For the government, it is business as usual, whether it is bringing friends on the Challenger jets or trying to find loopholes and ways that are not fair. The average Canadian would not have that opportunity.
 That is what I am trying to point out to the House as what we do not want to see. We want to change that situation. The NDP is bringing forward motions that address this kind of waste and inequity.",New Democratic Party,New Westminster--Coquitlam,Fin Donnelly,http://www.parl.gc.ca/parlinfo/Files/Parliamentarian.aspx?Item=d013e8ca-fdd5-4eb4-a0e4-b5f0782a8f6d&Language=E&Section=ALL
4594265,ca.proc.d.2014-04-01.15965.283,2014-04-01,383ed93c-f141-4f87-b873-124d3051a31f,8621,"Ms. Élaine Michaud (Portneuf—Jacques-Cartier, NDP)",,Government Orders,Business of Supply,Opposition Motion—Government Aircraft,"Mr. Speaker, the Liberal Party is trying to tell the NDP what issues are important to Canadians and how we should be doing our jobs.
Throughout this debate, instead of talking about the issue at hand, the Conservatives have gone off track, taking their time. They are praising our military, but they are completely out of touch with the debate. My colleagues in the other parties do not seem to see a problem with the abuse of Canadians' trust and taxpayers' dollars. That does not seem to be an issue or a priority.
Can my NDP colleague elaborate on why we in the NDP feel that the abuse of trust and the waste of public funds for the benefit of the Prime Minister's friends is an important issue to Canadians?",New Democratic Party,Portneuf--Jacques-Cartier,Élaine Michaud,http://www.parl.gc.ca/parlinfo/Files/Parliamentarian.aspx?Item=383ed93c-f141-4f87-b873-124d3051a31f&Language=E&Section=ALL
4594266,ca.proc.d.2014-04-01.15965.284,2014-04-01,d013e8ca-fdd5-4eb4-a0e4-b5f0782a8f6d,8333,Mr. Fin Donnelly,Interjection,Government Orders,Business of Supply,Opposition Motion—Government Aircraft,"Mr. Speaker, that is a great point. I think that is at the heart of the matter of why we were debating this motion that we have brought forward.
It is the responsibility of each of us as parliamentarians to ensure that public money is spent with a frugal and restrained spirit. When spent properly, tax dollars can be used by government to make smart investments, provide impressive returns, and improve the socio-economic prosperity of all Canadians.
We are pointing out that the use of tax dollars is critical when we are seeing cuts across the country to all departments that provide important services and programs to Canadians. Canadians do not want to see flagrant misuse of tax dollars by the Prime Minister's wealthy friends when we know what they are doing is fundraising for the party through specific partisan purposes and rewarding their friends by using taxpayer-funded jets. We find that unacceptable.",New Democratic Party,New Westminster--Coquitlam,Fin Donnelly,http://www.parl.gc.ca/parlinfo/Files/Parliamentarian.aspx?Item=d013e8ca-fdd5-4eb4-a0e4-b5f0782a8f6d&Language=E&Section=ALL
