basepk,hid,speechdate,pid,opid,speakeroldname,speakerposition,maintopic,subtopic,subsubtopic,speechtext,speakerparty,speakerriding,speakername,speakerurl
4593982,ca.proc.d.2014-04-01.15965.0,2014-04-01,26c8b0bc-42d4-4db5-bf7d-1e1544c7b4b5,9172,"Mr. Dan Albas (Parliamentary Secretary to the President of the Treasury Board, CPC)",,Routine Proceedings,Government Response to Petitions,,"Mr. Speaker, pursuant to Standing Order 36(8), I have the honour to table, in both official languages, the government's responses to 11 petitions.",Conservative,Okanagan--Coquihalla,Dan Albas,http://www.parl.gc.ca/parlinfo/Files/Parliamentarian.aspx?Item=26c8b0bc-42d4-4db5-bf7d-1e1544c7b4b5&Language=E&Section=ALL
4593983,ca.proc.d.2014-04-01.15965.1,2014-04-01,8880684e-3bb8-4705-a2b4-767f37811391,5,"Mr. Dean Allison (Niagara West—Glanbrook, CPC)",,Routine Proceedings,Interparliamentary Delegations,,"Mr. Speaker, pursuant to Standing Order 34(1), I have the honour to present, in both official languages, the fall report of the Canadian delegation to the Organization for Security and Co-operation in the European Parliamentary Assembly respecting its participation at the 22nd annual session of the OSCEPA in Istanbul from June 29 to July 3, 2013.",Conservative,Niagara West--Glanbrook,Dean Allison,http://www.parl.gc.ca/parlinfo/Files/Parliamentarian.aspx?Item=8880684e-3bb8-4705-a2b4-767f37811391&Language=E&Section=ALL
4593984,ca.proc.d.2014-04-01.15965.2,2014-04-01,df92b768-cbe1-4222-9526-8f3fd5d9f540,596,"Mr. Bruce Hyer (Thunder Bay—Superior North, GP)",,Routine Proceedings,Petitions,Experimental Lakes Area,"Mr. Speaker, petitions continue to pour in from Canadians across the country who are urging the government to save the Experimental Lakes Area. The government revoked funding for the ELA in 2012, but it has been negotiating to save the research facility after public outcry.
It gives me great pleasure to remind my fellow parliamentarians that the Experimental Lakes Area is not yet dead and hopefully we can still save it.",Green,Thunder Bay--Superior North,Bruce Hyer,http://www.parl.gc.ca/parlinfo/Files/Parliamentarian.aspx?Item=df92b768-cbe1-4222-9526-8f3fd5d9f540&Language=E&Section=ALL
4593985,ca.proc.d.2014-04-01.15965.3,2014-04-01,e6d671ec-9039-4ed6-bd6f-cca3ddd257e1,8790,"Mr. Ted Hsu (Kingston and the Islands, Lib.)",,Routine Proceedings,Petitions,Experimental Lakes Area,"Mr. Speaker, I also have a petition from Canadians who are interested in saving the Experimental Lakes Area. It is a place where science is done for the good of all of society, indeed, the whole world, because of the importance of freshwater to human beings.
It is my pleasure to present this petition to the House today.",Liberal,Kingston and the Islands,Ted Hsu,http://www.parl.gc.ca/parlinfo/Files/Parliamentarian.aspx?Item=e6d671ec-9039-4ed6-bd6f-cca3ddd257e1&Language=E&Section=ALL
4593986,ca.proc.d.2014-04-01.15965.4,2014-04-01,26c8b0bc-42d4-4db5-bf7d-1e1544c7b4b5,9172,"Mr. Dan Albas (Parliamentary Secretary to the President of the Treasury Board, CPC)",,Routine Proceedings,Questions on the Order Paper,,"Mr. Speaker, I ask that all questions be allowed to stand.",Conservative,Okanagan--Coquihalla,Dan Albas,http://www.parl.gc.ca/parlinfo/Files/Parliamentarian.aspx?Item=26c8b0bc-42d4-4db5-bf7d-1e1544c7b4b5&Language=E&Section=ALL
4593987,ca.proc.d.2014-04-01.15965.5,2014-04-01,,,,,Routine Proceedings,Questions on the Order Paper,, Is that agreed?,,,The Speaker,
4593988,ca.proc.d.2014-04-01.15965.6,2014-04-01,,,,intervention,Routine Proceedings,Questions on the Order Paper,, Agreed.,,,Some hon. members,
4593989,ca.proc.d.2014-04-01.15965.7,2014-04-01,50a18bf1-9be3-4563-b657-6af367453ba0,11,"Mr. Charlie Angus (Timmins—James Bay, NDP)",,Government Orders,Business of Supply,Opposition Motion—Government Aircraft," moved: 
 That, in the opinion of the House, government planes, and in particular the plane used by the Prime Minister, should only be used for government purposes and should not be used to transport anyone other than those associated with such purposes or those required for the safety and security of the Prime Minister and his family. 
Mr. Speaker, as always, it is a great honour to stand in this place and be chosen to speak on behalf of the people of Timmins—James Bay. I am certainly proud to rise today on the issue of the abuse of the public trust in taxpayers with the misuse of government resources, particularly the use of the Challenger jet.
Mr. Speaker, I will be sharing my time with the member for Portneuf—Jacques-Cartier. 
This issue needs to be debated in the House because we see within the government the continual and deliberate blurring of the lines between the use of government resources that are meant to serve the people of Canada and the partisan narrow interests of the Conservative war machine. Whether it is the misuse of government resources or the redrawing of the websites, everything the government seems to be doing is taking public resources and turning them to the personal use of the party or its friends. That is something the Conservatives used to rail against in the old Liberal regime. 
Very clear rules about the use of flights were set up by the Board of Internal Economy. For members of Parliament who do have to charter planes into isolated regions—for example, I have had to charter flights up into James Bay—there are clear rules. Number one is, we have to ensure that the only people on those planes actually are government staff. Anyone else on the plane would have to be put on the flight manifest and would have to pay the full charge. The Board of Internal Economy is very clear on this, so when we find out that a guy who raised $3.5 million for the Prime Minister gets to fly back and forth from Calgary, that is simply not acceptable. That is an abuse of trust.
I would like to read a few quotes that will put this into context: 
 We have seen the Prime Minister flying around the country on Challenger jets doing a few hours of government work, then spending the rest of the time campaigning and fundraising…. Meet the new boss, same as the old boss. The…culture of entitlement goes on. The public must be given a chance to put an end to it. 
Who said that? It was our present Prime Minister when he was in opposition. Yes, meet the new boss; same as the old boss over there. The issue here is that this is a government that is telling the rest of Canadians that the cupboard is bare and yet the Prime Minister can fly one of his buddies down to watch the New York Yankees at a ball game, where the Challenger jet cost taxpayers anywhere between $8,000 and $11,000 an hour to run. When the government is telling senior citizens in my riding that the cupboard is bare, while it is flying its friends to ball games, I would ask the Canadian people if they think that is fair. 
A number of people have spoken out on this issue. I would like to quote them now: 
 Mr. Speaker, while Canadians are barely coping with higher gasoline prices, the…ministers do not share such mundane concerns. They prefer going from Ottawa to Toronto aboard a luxury jet that costs $11,000 an hour to operate…. How can the Prime Minister justify such a waste of public funds? 
Who said that? It was the present Minister of Employment and Social Development. 
There are a few others: 
 Mr. Speaker, if $1 million on airfare were not enough, it turns out, through access to information, that of the 141 flights taken on the Challenger jet between January and July, over $71,000 was spent on food. That does not include the bar bill. That represents an average of $508 per flight, just less than the monthly grocery bill for a Nova Scotia family of four. How does the Prime Minister justify spending the equivalent of the cost of a monthly family grocery bill on an air flight? Just what was on that menu? 
Who said that? It was the present Minister of Justice. We all remember him when he was minister of defence. He is the man who ordered a search and rescue helicopter to pick him up from his hunting camp because he was too lazy to come out on his own. He used our military government resources to fly him from his hunting camp. ",New Democratic Party,Timmins--James Bay,Charlie Angus,http://www.parl.gc.ca/parlinfo/Files/Parliamentarian.aspx?Item=50a18bf1-9be3-4563-b657-6af367453ba0&Language=E&Section=ALL
4593990,ca.proc.d.2014-04-01.15965.8,2014-04-01,2576a113-8173-4faf-9a51-558c6087a2a1,,,,Government Orders,Business of Supply,Opposition Motion—Government Aircraft, He had to get to dinner though.,,,Mr. Robert Chisholm,
4593991,ca.proc.d.2014-04-01.15965.9,2014-04-01,50a18bf1-9be3-4563-b657-6af367453ba0,11,Mr. Charlie Angus,,Government Orders,Business of Supply,Opposition Motion—Government Aircraft," Oh, he had to get to dinner, yes. He had the lobster dinner he had to go to. 
Here is the man who is the Minister of National Defence, using taxpayers’ resources to go to court to tell veterans of our country that this government has no obligation to them. If we asked any Canadian on the street what they think of our obligation to veterans, they would say that it is shameful that the Conservatives are using taxpayers' dollars to argue that they have no social contract with veterans. 
Yet the Minister of Justice had a total social contract with the military when he needed to be picked up from hunting camp to be flown to his lobster dinner. This is the kind of abuse that Canadians-—",New Democratic Party,Timmins--James Bay,Charlie Angus,http://www.parl.gc.ca/parlinfo/Files/Parliamentarian.aspx?Item=50a18bf1-9be3-4563-b657-6af367453ba0&Language=E&Section=ALL
4593992,ca.proc.d.2014-04-01.15965.10,2014-04-01,2576a113-8173-4faf-9a51-558c6087a2a1,,,,Government Orders,Business of Supply,Opposition Motion—Government Aircraft, Got any more?,,,Mr. Robert Chisholm,
4593993,ca.proc.d.2014-04-01.15965.11,2014-04-01,50a18bf1-9be3-4563-b657-6af367453ba0,11,Mr. Charlie Angus,,Government Orders,Business of Supply,Opposition Motion—Government Aircraft," We have got lots of them, Mr. Speaker. I have been holding this one back, because it comes from one of the most quotable and most ridiculous members of Parliament that have ever sat in this House in the last 150 years.
…the minister has been at his post for five years…. The Sea Kings are no closer to being replaced.… Instead there are Challenger jets to fly the Prime Minister and his cabinet around in luxury. 
Who said that? Think, folks. It was the member for Calgary West.
We are having fun with this, but this is not a funny issue. This is about a contempt for the Canadian people. The Prime Minister told Canadians in 2006 that he would clean up this culture of entitlement. Instead, his attitude was that he would clean up the Liberals, and once they were done, then he and his friends would pork out at the trough.
That is not what Canadians voted for. This is not about saying that the Prime Minister and his family should not use the Challenger for security reasons, although I note that the present Minister of Industry said:
 There is something else the government can do. If the government wants to show confidence in the commercial airline industry, here is a suggestion. Will the Prime Minister park his Challenger jet and fly commercial skies as other Canadians do as a sign of faith that security works? 
That is what the present Minister of Industry said when he was in opposition. He wanted the Liberal Prime Minister to fly commercial air, but he has not said that in cabinet because they enjoy the perks.
Again, this is abuse of the public trust from a government that said it would do something better. The Conservatives are doing it at a time when they are telling senior citizens that the cupboard is bare; when they are telling veterans who served our country, “Hey, buzz off, we are done with you, and we will go to court to fight you”; when they are telling first nations children in the north, “You do not deserve schools because we cannot afford them”. However, when it comes to looking after their pals, there is all the money in the world.
Speaking of which, I go back to the Minister of Justice and his complaint about the cost of food. He wanted to know how they could justify wasting that much money on a flight. Yet we just found out that the Prime Minister spent $32,000 feeding his hand-picked crew who went to Israel. That was $150 per meal, and if we look at what they were serving, oh, man, those sandwiches looked pretty brutal. If they are going to blow money like that, at least they could serve people well.
We Canadians expect better from this Prime Minister and we are not getting it. That is why we brought this forward, and we are doing it in a non-partisan manner. This is what the Conservative Party stood for. We are asking Conservatives to return to their roots. Perhaps they have forgotten where they came from. Perhaps they have forgotten how they used to be offended by the use of taxpayers' dollars to help friends, insiders, and buddies.
This is a moment where we reach out across the aisle to our poor, wayward, lost children of the Conservative Party and try to bring them back into the fold of accountability and say, “This is just one little way of doing this”.",New Democratic Party,Timmins--James Bay,Charlie Angus,http://www.parl.gc.ca/parlinfo/Files/Parliamentarian.aspx?Item=50a18bf1-9be3-4563-b657-6af367453ba0&Language=E&Section=ALL
4593994,ca.proc.d.2014-04-01.15965.12,2014-04-01,2576a113-8173-4faf-9a51-558c6087a2a1,,,,Government Orders,Business of Supply,Opposition Motion—Government Aircraft, We could rehabilitate them.,,,Mr. Robert Chisholm,
4593995,ca.proc.d.2014-04-01.15965.13,2014-04-01,50a18bf1-9be3-4563-b657-6af367453ba0,11,Mr. Charlie Angus,,Government Orders,Business of Supply,Opposition Motion—Government Aircraft," We can rehabilitate them, Mr. Speaker. I do not know if we could rehabilitate all of them, but we are willing to try. That just shows the kind of people we have on our side; that we believe that people can be reformed, even the old Reformers, who have certainly given up on their sense of accountability.
We are asking for all-party support on this. We are not saying the Prime Minister cannot fly the Challenger. We are not saying his family cannot fly on it, but people like bagmen and buddies have no business getting free and cheap flights on the taxpayers' dime. Let us have some rules. Let us follow the rules. Canadians follow the rules. It is time the government followed the rules.",New Democratic Party,Timmins--James Bay,Charlie Angus,http://www.parl.gc.ca/parlinfo/Files/Parliamentarian.aspx?Item=50a18bf1-9be3-4563-b657-6af367453ba0&Language=E&Section=ALL
4593996,ca.proc.d.2014-04-01.15965.14,2014-04-01,07cf5767-802c-406c-92a7-7dc92af79b40,4264,"Mr. Kevin Lamoureux (Winnipeg North, Lib.)",,Government Orders,Business of Supply,Opposition Motion—Government Aircraft,"Mr. Speaker, I was a little surprised when I saw that the NDP has brought to the floor an issue it has decided is one of abuse of public trust. The reason I am having a difficult time with that is because we need to appreciate what the leader of the New Democratic Party has been up to lately.
We can talk about the millions of tax dollars that have been abused through the direct mail that has gone out. We can talk about the outreach office. The outreach office is supposed to be in Saskatchewan where the NDP does not have any members of Parliament, and it is there to service constituents.
The NDP does not have any right to give lectures regarding the issue of public trust. It has done a disservice to public trust. Remember how it had to be dragged kicking and screaming on proactive disclosure because it did not want to tell Canadians where it was flying and the prices it was charging? It had to be dragged, kicking and screaming on this issue.
Why does the member feel that the NDP has to have an outreach office in Saskatchewan and have the taxpayers pay for that, as opposed to its own political party that should be footing the bill?",Liberal,Winnipeg North,Kevin Lamoureux,http://www.parl.gc.ca/parlinfo/Files/Parliamentarian.aspx?Item=07cf5767-802c-406c-92a7-7dc92af79b40&Language=E&Section=ALL
4593997,ca.proc.d.2014-04-01.15965.15,2014-04-01,50a18bf1-9be3-4563-b657-6af367453ba0,11,Mr. Charlie Angus,Interjection,Government Orders,Business of Supply,Opposition Motion—Government Aircraft,"Mr. Speaker, I am not surprised that I struck a nerve with the Liberals when it comes to the abuse of the taxpayers. This is the party that invented it. My colleague is jumping up and down like an angry man. I am not surprised. I have certainly touched a chord with the Liberals.
The member has the gall to refer to mailings and to Bourassa, when Elections Canada has ruled that we did everything perfectly legally. That is different from what happened with the Liberals. It was a government that was corrupt from the beginning. It is as corrupt now. The Liberals are certainly angry.
When their new leader came in, they were going to do politics differently. All they have done in terms of their politics is continually attack the New Democrats for the fact that we stand up for regions, that we go to the House of Commons and talk with them about what is legal and how to do things right so that we can represent people. At the same time, the new Liberal leader is off selling Keystone XL for the oil lobby. We talk to average Canadians; he talks to oil lobbyists. 
I know that the member is angry. He is an angry old man, but that is because his party has been relegated to the wilderness for its contempt of the Canadian people.",New Democratic Party,Timmins--James Bay,Charlie Angus,http://www.parl.gc.ca/parlinfo/Files/Parliamentarian.aspx?Item=50a18bf1-9be3-4563-b657-6af367453ba0&Language=E&Section=ALL
4593998,ca.proc.d.2014-04-01.15965.16,2014-04-01,383ed93c-f141-4f87-b873-124d3051a31f,8621,"Ms. Élaine Michaud (Portneuf—Jacques-Cartier, NDP)",,Government Orders,Business of Supply,Opposition Motion—Government Aircraft,"Mr. Speaker, I first wish to congratulate my hon. colleague on his eloquent speech.
As entertaining as his quotations were, I find the current state of affairs quite unfortunate. People spent years criticizing the Liberals when they were in power. Some Liberals are even making a lot of noise. I have a new seat in the House, and I had forgotten how loud it can get in this part of the House.
People have been having strong reactions; they feel as though they are being attacked. There seems to be a culture of corruption and an abuse of Canadians' trust.
My colleague already mentioned this in his speech, but I wonder if he could elaborate. Could he comment on how the NDP would respect the trust that Canadians have placed in us to represent them, as well as the trust they will place in us in 2015, when Canadians vote in a new government to replace both corrupt parties?",New Democratic Party,Portneuf--Jacques-Cartier,Élaine Michaud,http://www.parl.gc.ca/parlinfo/Files/Parliamentarian.aspx?Item=383ed93c-f141-4f87-b873-124d3051a31f&Language=E&Section=ALL
4593999,ca.proc.d.2014-04-01.15965.17,2014-04-01,50a18bf1-9be3-4563-b657-6af367453ba0,11,Mr. Charlie Angus,Interjection,Government Orders,Business of Supply,Opposition Motion—Government Aircraft,"Mr. Speaker, I will try another one:
 Madam Speaker, the government each day and every day continues to show the Canadian taxpayer that it does not care. [...] 
 One of the most recent examples of this is the use of the Challenger jets as flying limos, as party taxis, as a way of not having to sit with the regular folk. 
 [...] In just a few hours of travel the government has spent the annual earnings of a family in Canada. 
 [...]...if a year's salary spent on these flights home is okay. Let us ask seniors or farmers who just had the oil tank filled for the winter if these flights are okay. 
Who said that? That was the member for Elgin—Middlesex—London. Come on down and show us that you stand for accountability and that you are not going to hide behind a government of corruption. Stand up and stand with us. We are calling on you. This is your chance.",New Democratic Party,Timmins--James Bay,Charlie Angus,http://www.parl.gc.ca/parlinfo/Files/Parliamentarian.aspx?Item=50a18bf1-9be3-4563-b657-6af367453ba0&Language=E&Section=ALL
4594000,ca.proc.d.2014-04-01.15965.18,2014-04-01,1b175d0f-9278-4e04-9fa8-0368e591c5a5,69,The Deputy Speaker,,Government Orders,Business of Supply,Opposition Motion—Government Aircraft,"The member for Timmins—James Bay has been here long enough to know that he should address his questions and comments to the Chair, not to other members in the House.
Resuming debate, the hon. member for Portneuf—Jacques-Cartier.",New Democratic Party,Windsor--Tecumseh,Joe Comartin,http://www.parl.gc.ca/parlinfo/Files/Parliamentarian.aspx?Item=1b175d0f-9278-4e04-9fa8-0368e591c5a5&Language=E&Section=ALL
