basepk,hid,speechdate,pid,opid,speakeroldname,speakerposition,maintopic,subtopic,subsubtopic,speechtext,speakerparty,speakerriding,speakername,speakerurl
4590512,ca.proc.d.2014-02-28.15885.160,2014-02-28,d00c3703-619a-496a-8369-0e113da41c9f,405,Mr. Dennis Bevington,Interjection,Government Orders,Qalipu Mi'kmaq First Nation Act,,"Mr. Speaker, in many cases, for things that come forward to us in committee, there is a process whereby the time is limited and the choices people have to invite people to speak in front of the committee are constrained. Opposition parties are only given as many committee members as the government chooses, in relation to their seats in the House of Commons. Right there, simply through that process, the government holds an ability to limit the choices of witnesses that will be in front of the committee. Since the current majority government has come into place, we have seen that happen.
It is a game that is played at committee now. It is difficult. The government wants to move legislation through as quickly as possible, in many cases. Witnesses are assigned, as I say, per capita, according to the number of seats in the House. That is a very limiting factor.",New Democratic Party,Western Arctic,Dennis Bevington,http://www.parl.gc.ca/parlinfo/Files/Parliamentarian.aspx?Item=d00c3703-619a-496a-8369-0e113da41c9f&Language=E&Section=ALL
4590513,ca.proc.d.2014-02-28.15885.161,2014-02-28,c846297d-8bc7-4e69-b6eb-31d0e19f7ec1,554,"Mr. Jack Harris (St. John's East, NDP)",,Government Orders,Qalipu Mi'kmaq First Nation Act,,"Mr. Speaker, I would like the member to clarify whether his understanding is that there are really two issues at stake here. One is that a fair number of people actually disagree with the eligibility criteria, because they are not included in it for one reason or another. A criterion relates to people who have a direct and ongoing association with these particular communities. That is one question that is out there politically.
The second question is about the fairness of the process. Would the member agree that what is really necessary is to ensure that we have a fair and equitable process for all those who have applied, including those who were already previously accepted?",New Democratic Party,St. John's East,Jack Harris,http://www.parl.gc.ca/parlinfo/Files/Parliamentarian.aspx?Item=c846297d-8bc7-4e69-b6eb-31d0e19f7ec1&Language=E&Section=ALL
4590514,ca.proc.d.2014-02-28.15885.162,2014-02-28,d00c3703-619a-496a-8369-0e113da41c9f,405,Mr. Dennis Bevington,Interjection,Government Orders,Qalipu Mi'kmaq First Nation Act,,"Mr. Speaker, that is true. I completely agree with the member. There is one other issue, and that is if people's expectations, through the original process, were raised, and they actually changed their lives in any fashion or did something that would have put them at some degree of risk, or they relied on this for some part of their future activities and planned accordingly. That implies some degree of responsibility on the part of the government.
 Courts are very good at deciding responsibility. That is our system. I do not like seeing that opportunity being taken away from people to make those choices.",New Democratic Party,Western Arctic,Dennis Bevington,http://www.parl.gc.ca/parlinfo/Files/Parliamentarian.aspx?Item=d00c3703-619a-496a-8369-0e113da41c9f&Language=E&Section=ALL
4590515,ca.proc.d.2014-02-28.15885.163,2014-02-28,a2d5c8bf-d42e-4b53-be9e-70af2a6fe169,9130,Mr. Mark Strahl,Interjection,Government Orders,Qalipu Mi'kmaq First Nation Act,,"Mr. Speaker, although I do not know if the hon. member heard it, I was clear in my speech that those 23,877 members who received status in the initial enrolment will continue to receive Indian status benefits until this process is completed and the appeals process has been exhausted. We are looking at late 2015.
These people have been receiving benefits. They will continue to receive benefits during this phase, even as a result of this bill. However, everyone is aware now and has been put on notice that there is a new process and that everyone will be evaluated again. That will give some time to those individuals. There is no cutting-off of benefits right now, which might be a concern of the member.
Also, clause 4, the legal clause in the bill about protecting the government, which the member talked about, would not prevent individuals from appealing the enrolment committee's determination, nor would this clause prevent court challenges to the agreement or to the exclusion from the schedule of the Qalipu Mi'kmaq First Nation Band order. This is a very limited clause that has been enacted in other pieces of legislation.
 It was also part of Bill C-3, the Gender Equity in Indian Registration Act. It says that if people are determined not to be members of the Qalipu band, they do not have the right to seek compensation for that decision. They still have the right to the court process on the actual enrolment order. I want the member to be aware of that.",Conservative,Chilliwack--Fraser Canyon,Mark Strahl,http://www.parl.gc.ca/parlinfo/Files/Parliamentarian.aspx?Item=a2d5c8bf-d42e-4b53-be9e-70af2a6fe169&Language=E&Section=ALL
4590516,ca.proc.d.2014-02-28.15885.164,2014-02-28,d00c3703-619a-496a-8369-0e113da41c9f,405,Mr. Dennis Bevington,Interjection,Government Orders,Qalipu Mi'kmaq First Nation Act,,"Mr. Speaker, I am glad the parliamentary secretary repeated what he said. I did not really have a problem with anything he said.
 I am talking about people who over the past five years have received notification that they have membership in the Qalipu Mi'kmaq First Nation. They may have moved to a different community. They may have reasserted their lifestyle as first nations. They may have bought houses or set up businesses. Those are the types of choices that have been made by these 23,800, and they will still be making these choices right up until the time somebody tells them they are no longer members. Until that time, they have to live their lives based on the fact that they have now been taken on as members of a first nation.
 Those are the types of liabilities. I do not think the government has a right to take away from individuals the right to sue government for making mistakes that they suffer for directly.",New Democratic Party,Western Arctic,Dennis Bevington,http://www.parl.gc.ca/parlinfo/Files/Parliamentarian.aspx?Item=d00c3703-619a-496a-8369-0e113da41c9f&Language=E&Section=ALL
4590517,ca.proc.d.2014-02-28.15885.165,2014-02-28,4bc128a9-b349-4867-a545-ad05122c0e46,598,"Ms. Niki Ashton (Churchill, NDP)",,Government Orders,Qalipu Mi'kmaq First Nation Act,,"Mr. Speaker, I am honoured to rise in the House to speak to Bill C-25, an act respecting the Qalipu Mi'kmaq First Nation Band Order.
We in the NDP are concerned about the indemnification provisions in the bill and whether or not they will deny anyone the right to further action in being recognized as a member of the Qalipu first nation. I would like to refer to the work my colleagues the MPs for St. John's East and St. John's South—Mount Pearl have already undertaken on this important issue. They have raised problems with the original agreement in principle creating a landless Qalipu first nation where children removed from Mi'kmaq families and adopted out would seem to lose all rights to membership under the agreement.
 We recognize that the agreement before us is a negotiated agreement with the first nation, but we are concerned that the Conservatives have once again rushed a process and, instead of providing certainty, they have created anxiety and concern among all people applying to be part of the Qalipu Mi'kmaq First Nation. 
Since the Indian Act separated first nations into status Indians and those without status, determining the citizenship rights of any person to be part of a first nation has been a highly charged process. We in the NDP are only offering equivocal support to the bill because we have questions about its provisions, and as we know, we will only get those answers from witnesses at committee. We have made it very clear that we are concerned when it comes to two areas in particular. One is the membership criteria and the second is the fairness of the process. 
Speaking to those points, I want to refer to some of the coverage that Bill C-25 has received from Mi'kmaq people in Newfoundland itself. I refer specifically to Mr. Hector Pearce of the Mi'kmaq First Nations Assembly of Newfoundland, which has real concerns about Bill C-25. He stated:
 We are not shocked but we are very disappointed with the legislation. This government has put up so many roadblocks to this Qalipu registration process that nothing surprises us anymore. 
Mr. Pearce goes on not just to express concern but to refer to possible actions that he and the Mi'kmaq First Nations Assembly of Newfoundland will be taking.
What we in the NDP have been saying on Bill C-25, and also on other bills that relate to first nations people, is that it is time for the government to learn from the wrongs of the past and recognize that in negotiating with first nations directly, which is a very important step, we must respect the importance of a fair membership process and a clear understanding that status membership has been an issue that has been very problematic for indigenous people in our country. I know from my constituency, many first nations people are proud of their status in their first nation and of their treaty rights, but they are very concerned about the continued existence of their nation, particularly with respect to how their children and their grandchildren will be considered under the Indian Act. We know that Bill C-31 created significant change. It allowed for fairness by recognizing the children of first nations women who had children with non-indigenous men. However, we know that, as people intermarry and as families grow across the country, there needs to be a continued understanding of Indian status and respect for Indian status of indigenous people coming down the line. This is something that has been raised by first nations leaders across the country. 
I recognize that Newfoundland has a very different experience, in terms of its entry into Confederation later on and the recognition of first nations people, and has had a different trajectory from other parts of the country. However, that is no excuse not to learn that first nations must be partners at the table in making sure that something as important as membership, as status in their community, must be front and centre. 
I also share the concern around the process. I realize that the Mi'kmaq first nation and its advocates have worked a long time with the federal government to seek recognition. I want to acknowledge that work, because I realize from first nations leaders in my part of the country how important and how tireless that work can be.
There is nothing more frustrating for first nation members, for first nation leaders and advocates, than a process that seems rushed and that seems not to have taken into consideration the kinds of key factors that should have been considered all along. I think of first nations in northern Manitoba that have struggled to ensure that their land claims are recognized and that their children and grandchildren down the line will be recognized as members of that first nation, as I mentioned.
Even though some first nations in my area had great success in having band membership recognized amongst future generations, the federal government has been slow in equipping those members with their treaty cards. I think of the Peguis first nation, the largest first nation in Manitoba. About 1,300 members of the Peguis band are still waiting for their treaty cards from the federal government.
The process matters to all Canadians. For first nations people who have worked far too long on an issue as important as this, it is of the utmost importance.
We have great hopes that this issue will be dealt with fairly in committee and that we will receive the kinds of answers we need, so we can make a decision accordingly. Unfortunately, the Conservative government has a pretty dark history when it comes to shepherding legislation on indigenous issues through committee. We only hope that the Conservatives will take this issue seriously when it gets to committee. We will certainly be doing the very same every step of the way. ",New Democratic Party,Churchill,Niki Ashton,http://www.parl.gc.ca/parlinfo/Files/Parliamentarian.aspx?Item=4bc128a9-b349-4867-a545-ad05122c0e46&Language=E&Section=ALL
4590518,ca.proc.d.2014-02-28.15885.166,2014-02-28,1b175d0f-9278-4e04-9fa8-0368e591c5a5,69,The Deputy Speaker,,Government Orders,Qalipu Mi'kmaq First Nation Act,,"The member for Churchill will have 10 minutes when the debate resumes for questions and comments.
It being 1:30 p.m. the House will now proceed to the consideration of private members' business as listed on today's order paper. ",New Democratic Party,Windsor--Tecumseh,Joe Comartin,http://www.parl.gc.ca/parlinfo/Files/Parliamentarian.aspx?Item=1b175d0f-9278-4e04-9fa8-0368e591c5a5&Language=E&Section=ALL
4590519,ca.proc.d.2014-02-28.15885.167,2014-02-28,640aa965-9166-4aa6-b864-278dd1071a10,119,"Mr. Yvon Godin (Acadie—Bathurst, NDP)",,Private Members' Business,Supreme Court Act,," moved that Bill C-208, An Act to amend the Supreme Court Act (understanding the official languages), be read the second time and referred to a committee.
Mr. Speaker, I am proud to rise for the third time in the House to speak to Bill C-208, which would require Supreme Court justices to be bilingual so that they can respond to Canadian citizens.
Thirteen years ago, on February 28, two hours before I made a speech in the House of Commons about taxes on mechanics' tools, I was thinking that my grandson Jonathan, who was born two days later, might one day use these tools if he decided to become a mechanic. 
Today, as I wish Jonathan a happy birthday, I hope that my other grandson and my granddaughter will be able to be heard in the official language of their choice, which is French, if they ever need to go to the Supreme Court.
Today, my New Democrat colleagues and I are back with my Bill C-208, which would make being bilingual in French and English a new condition for appointing justices to the Supreme Court of Canada.
This is my third attempt to get this initiative passed. In 2010, this bill, known at the time as Bill C-232, was passed by the House of Commons. To my great disappointment, the Conservative senators used their majority in the Senate to block the bill. The bill then died on the order paper when the 2011 election was called. 
The Conservatives have repeatedly shown their contempt for official languages by appointing two unilingual anglophone justices to the Supreme Court and by appointing a unilingual auditor general.
The NDP thinks that there is another way to do things. The NDP is the only party that is proposing concrete measures to promote and protect our official languages. Thanks to the NDP, the House recently passed Bill C-419, which corrects the Conservatives' mistake by ensuring that officers of Parliament will now have to be bilingual when they are appointed. It is time for us to make understanding both official languages an essential condition of being appointed to the Supreme Court.
I would like to speak to the importance of this bill. This is a question of access to justice. The Supreme Court is the highest court in the country, and it is very important that the justices be able to understand both official languages without the help of an interpreter. I have the utmost respect for the work of interpreters, but we know that interpretation has its limits. Numerous lawyers have noticed errors and omissions in the interpretation of their arguments before the Supreme Court. 
I am thinking, in particular, about Michel Doucet, a law professor at the Université de Moncton, the former dean of the law faculty at the university and a language rights expert. He spoke to the issue when he appeared before the Standing Committee on Official Languages:
 In the week after I had argued a case before the Supreme Court, I had an opportunity to hear the English version of my arguments on CPAC, and I understood why I had lost the case five to four. The translation did not allow me to understand my own words. I wonder how justices can fully understand the matter at hand when they have to go through translation in which significant aspects of a submission are missing. When you win 9:0, there is no problem, but when you lose 5 to 4, you automatically wonder whether you should not have argued in English. 
There are many examples of questionable interpretation at the Supreme Court. A lawyer arguing his case before the court mentioned a Monsieur Saint-Coeur and the interpreter rendered it as “Mr. Five O'clock”. Even the Commissioner of Official Languages, Graham Fraser, has weighed in on the importance of understanding the arguments presented without the help of an intermediary.
In June 2009, he told members of the Standing Committee on Justice and Human Rights: 
 Given the complexity and the extreme importance of the cases heard by this court, judges should be able to hear arguments presented to them without using an interpreter to understand nuanced and complex legal arguments. 
 According to Sébastien Grammond, Dean of the Faculty of Law at the University of Ottawa, interpretation may lead to “loss of precision which, in some cases, can even involve the omission of certain sentences”.
This loss of precision can also be found in the documents submitted by the parties to the proceedings. These documents are not translated by the court. Unilingual judges must rely on the briefs prepared by court clerks, who are often young lawyers with little legal experience.
The presence of unilingual judges on the bench of the Supreme Court also poses a problem during closed-door deliberations without an interpreter. Francophone judges must always express their opinions, ideas and knowledge in their second language. Therefore, there is a risk that they will be much less precise.
If the justices can function in both official languages, everyone can work in the language of their choice. The bilingualism of judges is therefore a question of the equality of francophones and anglophones in terms of access to justice.
The bilingualism of Supreme Court justices ensures the equality of both official languages.
We have to remember that the Supreme Court has recognized the equality of French and English.
Laws are drafted in both official languages. Both versions have the same weight and neither one takes precedence over the other. 
Our language duality is part of our Canadian identity. We have to embrace it. 
Is there substantive equality when a francophone appears before the Supreme Court? The Supreme Court is not there to reward ambitious lawyers or judges. It is there to dispense justice for all Canadians.
Serving on the Supreme Court is not a right, but having fair access to justice is a right. Remember that the court is there to serve Canadians, not the interests of the judge.
The issue of requiring Supreme Court judges to be bilingual has been debated for several years.
I think it is wrong for francophones to have to make themselves understood by unilingual judges through the filter of interpretation, especially before the highest court in the land.
If Canada's two official languages are to be truly equal, it is important that bilingualism be an essential requirement when judges are appointed to the Supreme Court.
Lastly, my bill would ensure that the Supreme Court can serve all Canadians equally, whether their mother tongue is English or French.
The Commissioner of Official Languages, Graham Fraser, who is highly respected by all Canadians, has said several times that he supports requiring Supreme Court judges to be bilingual.
The Barreau du Québec has supported this bill for years now:
 The Barreau has always believed that functional bilingualism should be among a Supreme Court judge's required skills in order to ensure equal access to justice, and it deplores that even today federal legislation has no provisions requiring that the nine Supreme Court judges be proficient in both official languages. 
Many stakeholders in the official languages community support my bill, particularly the Fédération des communautés francophones et acadienne and its members:
 The FCFA believes that all citizens have a right to be heard and understood before the highest court of Canada in their official language of choice, without the assistance of an interpreter. 
Lastly, various linguistic rights experts have spoken out in favour of my bill, including Sébastien Grammond, Dean of Civil Law at the University of Ottawa, Gérard Lévesque, a very well-known lawyer for language rights, and Serge Rousselle and Michel Doucet, both law professors at the Université de Moncton.
Let me remind members that the NDP is the only party that proposes concrete measures to advance Canada's linguistic duality.
Bill C-419 on the mandatory bilingualism of officers of Parliament, introduced by my colleague, was passed by the House of Commons in 2013.
Let us not forget that the Quebec City marine rescue sub-centre remained open thanks to the pressure that my NDP colleagues and I put on the Conservative government, which intended to close this centre, the only French-language marine rescue centre in Canada.
The Conservative government has not shown any respect toward our official languages. I want to remind the House that it is the Prime Minister who appointed two unilingual judges to the Supreme Court. It is also the Conservative government that appointed a unilingual Auditor General to Parliament. Even the minister responsible for official languages is not in favour of my bill. Her riding of Saint Boniface, in Manitoba, includes thousands of francophones. What an insult to that community.
I also want to remind the members opposite that this former bill, Bill C-232, was passed by the House of Commons in 2010.
All the Conservative members voted against that bill, even the members from Quebec and those who have francophone communities in their ridings, such as the members for Moncton—Riverview—Dieppe and Madawaska—Restigouche. Despite the opposition of the Conservative members, Bill C-232 was passed by the House of Commons; however, the unelected Conservative senators, including a number of francophones, held up the bill until the 2011 election was called.
The majority of the members in the House of Commons, who were elected by Canadians, voted in favour of this bill, but the unelected senators defeated the bill. Do not try to tell me that the Senate stands up for linguistic minorities.
In closing, I ask the members of all the parties to support this bill so that it can move along and be considered at the Standing Committee of Justice and Human Rights. We must protect the equality of our two official languages and equal access to justice.
In particular, I am calling on the Conservative members from Quebec and the members who have francophone communities in their ridings, such as the members for Madawaska—Restigouche, Moncton—Riverview—Dieppe, and Saint Boniface, to pressure their colleagues to support my bill, which seeks to ensure that the Supreme Court judges are bilingual.
If the Conservatives thought that bilingualism was necessary for becoming an officer of Parliament, then there is no reason why they should not do the same for the judges who sit on the benches of the highest court in the land.
The bill is a matter of justice and equality.
It is a matter of justice and equality.
Canadians have the right—it is more than just a privilege—to appear before a judge at the Federal Court of Canada and be heard and understood in the language of their choice. The same applies to the Federal Court of Appeal. It should also apply to the Supreme Court, the highest court in the country.
I was at the Standing Committee on Justice and Human Rights this week, and I asked officials from the Department of Justice whether there are enough bilingual judges in each province. If Canadians were to read the committee minutes, they would see that the response was yes. I then asked whether there are a lot of judges, and they said that there are enough.
I am waiting to hear the Parliamentary Secretary to the Minister of Justice tell us that the pool is not big enough, even though officials from his own department clearly told us in committee that it is a big pool. They told us that there are enough bilingual judges in every province.
I hope that the Conservatives will support my bill and bilingualism in Canada.",New Democratic Party,Acadie--Bathurst,Yvon Godin,http://www.parl.gc.ca/parlinfo/Files/Parliamentarian.aspx?Item=640aa965-9166-4aa6-b864-278dd1071a10&Language=E&Section=ALL
