basepk,hid,speechdate,pid,opid,speakeroldname,speakerposition,maintopic,subtopic,subsubtopic,speechtext,speakerparty,speakerriding,speakername,speakerurl
4590457,ca.proc.d.2014-02-28.15885.105,2014-02-28,ea476a5f-790f-416f-842b-f4ac57acb57b,417,"Hon. Tony Clement (President of the Treasury Board, CPC)",,Oral Questions,Pensions,,"Mr. Speaker, I can assure this chamber that negotiations are ongoing. The hon. member may have been briefed by one side, but I can assure him that we have been negotiating for eight months.
What we have now is the preference of this government to continue those negotiations and to arrive at a fair and reasonable solution to the matter, which of course involves a voluntary supplemental plan that is still an excellent plan for our retirees, former public servants across the country.
The hon. member seems to be a mouthpiece for the union. I am going to be a mouthpiece for the taxpayer and for good common sense.",Conservative,Parry Sound--Muskoka,Tony Clement,http://www.parl.gc.ca/parlinfo/Files/Parliamentarian.aspx?Item=ea476a5f-790f-416f-842b-f4ac57acb57b&Language=E&Section=ALL
4590458,ca.proc.d.2014-02-28.15885.106,2014-02-28,07e5eac1-e115-483c-bb86-972736ca953d,609,"Mr. LaVar Payne (Medicine Hat, CPC)",,Oral Questions,Infrastructure,,"Mr. Speaker, it was only two weeks ago in Stouffville that the Prime Minister announced the largest infrastructure spending program in Canada's history.
That means it only took the Liberal leader two weeks to spin some classic Liberal arithmetic, repeatedly stating that our government has foregone thousands of billions of dollars in infrastructure funding, numbers straight from the mouth of a part-time teacher.
Can the Parliamentary Secretary for Infrastructure and Communities correct the record?",Conservative,Medicine Hat,LaVar Payne,http://www.parl.gc.ca/parlinfo/Files/Parliamentarian.aspx?Item=07e5eac1-e115-483c-bb86-972736ca953d&Language=E&Section=ALL
4590459,ca.proc.d.2014-02-28.15885.107,2014-02-28,a20523be-cae0-4d31-9595-e9303275e40d,583,"Mr. Peter Braid (Parliamentary Secretary for Infrastructure and Communities, CPC)",,Oral Questions,Infrastructure,,"Mr. Speaker, indeed, our infrastructure plan is the largest and the longest in Canada's history, delivering $53 billion in new money for Canadian communities.
Unlike what the leader of the Liberal Party has said, it certainly does not remove thousands of billions in infrastructure funding. 
We would expect a former teacher to know that thousands of billions are normally referred to as trillions. Thousands of billions and budgets that balance themselves are typical Liberal accounting.",Conservative,Kitchener--Waterloo,Peter Braid,http://www.parl.gc.ca/parlinfo/Files/Parliamentarian.aspx?Item=a20523be-cae0-4d31-9595-e9303275e40d&Language=E&Section=ALL
4590460,ca.proc.d.2014-02-28.15885.108,2014-02-28,8131817f-bf86-4739-9a70-6ef9de6f11b6,23,"Mr. André Bellavance (Richmond—Arthabaska, BQ)",,Oral Questions,Infrastructure,,"Mr. Speaker, the cat is out of the bag. Yesterday, the Minister of Infrastructure put together a hasty announcement about funding to build an ice oval in Quebec City.
When asked where the money would come from, the minister stated that it was money left over from the infrastructure fund. What he did not say was that Quebec and the municipalities were already planning to spend those millions of dollars on other projects, such as widening highway 185 and the drinking water projects in Quebec City, Lévis and Trois-Rivières. Now they are worried that the federal government will cross those major projects off its list.
Can the minister guarantee that the money set aside for those other projects and for the Quebec City ice oval will definitely be available?",Bloc Québécois,Richmond--Arthabaska,André Bellavance,http://www.parl.gc.ca/parlinfo/Files/Parliamentarian.aspx?Item=8131817f-bf86-4739-9a70-6ef9de6f11b6&Language=E&Section=ALL
4590461,ca.proc.d.2014-02-28.15885.109,2014-02-28,a20523be-cae0-4d31-9595-e9303275e40d,583,"Mr. Peter Braid (Parliamentary Secretary for Infrastructure and Communities, CPC)",,Oral Questions,Infrastructure,,"Mr. Speaker, again, it is important to point out that it was the Province of Quebec, in its recent budget, that identified this particular ice oval project in Quebec City as a priority.
We have announced support for this project through uncommitted funds from the 2007 building Canada fund.
With respect to Highway 185, we have not yet received a specific request from the province for the third phase of this project. This project would be eligible under the new building Canada plan.",Conservative,Kitchener--Waterloo,Peter Braid,http://www.parl.gc.ca/parlinfo/Files/Parliamentarian.aspx?Item=a20523be-cae0-4d31-9595-e9303275e40d&Language=E&Section=ALL
4590462,ca.proc.d.2014-02-28.15885.110,2014-02-28,548690b8-3ef5-4bfa-b1ad-bb32de4dfaa1,607,"Mr. Brent Rathgeber (Edmonton—St. Albert, Ind.)",,Oral Questions,The Budget,,"Mr. Speaker, last fall's Speech from the Throne made a vague reference to the government's commitment to balanced budget legislation.
On October 22, the Minister of Finance assured me and this House that the government intended to introduce balanced budget legislation, although his explanation as to what that might look like was somewhat perplexing.
On Wednesday I supported budget 2014, and I congratulate the government on its commitment to balancing the budget. However, I remain concerned about future budgets and future governments.
Why is there no mention of balanced budget legislation in the government's budget plan?",Independent,Edmonton--St. Albert,Brent Rathgeber,http://www.parl.gc.ca/parlinfo/Files/Parliamentarian.aspx?Item=548690b8-3ef5-4bfa-b1ad-bb32de4dfaa1&Language=E&Section=ALL
4590463,ca.proc.d.2014-02-28.15885.111,2014-02-28,f66407a4-934e-4c46-b524-b4dacd035ceb,613,"Mr. Andrew Saxton (Parliamentary Secretary to the Minister of Finance, CPC)",,Oral Questions,The Budget,,"Mr. Speaker, in fact we will be balancing the budget in 2015. I am happy to say that we will not be balancing the budget on the backs of the provinces and individual Canadians.
I do not know why the member opposite does not like our budget, because so many Canadians across this country are actually praising the budget. 
For example, the Association of Universities and Colleges of Canada, the Alzheimer Society of Canada, the Heart and Stroke Foundation, Grand Challenges Canada, Canadian Digital Media Network, the Canadian Council of Chief Executives, the Federation of Canadian Municipalities, Moody's, et cetera. We are getting praise from across the country on our budget 2014.",Conservative,North Vancouver,Andrew Saxton,http://www.parl.gc.ca/parlinfo/Files/Parliamentarian.aspx?Item=f66407a4-934e-4c46-b524-b4dacd035ceb&Language=E&Section=ALL
4590464,ca.proc.d.2014-02-28.15885.112,2014-02-28,cfbb2e3f-a8fa-43c0-ad2a-1d2e4c7b865d,442,"Mrs. Maria Mourani (Ahuntsic, Ind.)",,Oral Questions,Citizenship and Immigration,,"Mr. Speaker, during the 2006 crisis in Lebanon and after the 2009 earthquake in Haiti, the government issued guidelines allowing non-Canadian parents to accompany their Canadian minor children to Canada. Again last week, two Canadian children—Gabriel, 3 and Laya, 4—were unable to come to Canada because their Syrian mother was denied a visa. The only reasons provided were the war in Syria and the possibility that they may not be able to return home. I should add that this file was followed by the minister's office.
What has happened to the government since 2006? Why is it now asking a father and mother to abandon their children?",Independent,Ahuntsic,Maria Mourani,http://www.parl.gc.ca/parlinfo/Files/Parliamentarian.aspx?Item=cfbb2e3f-a8fa-43c0-ad2a-1d2e4c7b865d&Language=E&Section=ALL
4590465,ca.proc.d.2014-02-28.15885.113,2014-02-28,1e6e9765-853d-440f-be8f-e39b76082465,675,"Mr. Chungsen Leung (Parliamentary Secretary for Multiculturalism, CPC)",,Oral Questions,Citizenship and Immigration,,"Mr. Speaker, in the immigration file, we do have a process for adoptions to come through and these are going through a normal process and we will have the department look into it.",Conservative,Willowdale,Chungsen Leung,http://www.parl.gc.ca/parlinfo/Files/Parliamentarian.aspx?Item=1e6e9765-853d-440f-be8f-e39b76082465&Language=E&Section=ALL
4590466,ca.proc.d.2014-02-28.15885.114,2014-02-28,fe517b95-bc62-4fe8-96aa-998994aefd48,173,"Mr. Tom Lukiwski (Parliamentary Secretary to the Leader of the Government in the House of Commons, CPC)",,Routine Proceedings,Government Response to Petitions,,"Mr. Speaker, pursuant to Standing Order 38(6) I have the honour to table, in both official languages, the government's response to 655 petitions.",Conservative,Regina--Lumsden--Lake Centre,Tom Lukiwski,http://www.parl.gc.ca/parlinfo/Files/Parliamentarian.aspx?Item=fe517b95-bc62-4fe8-96aa-998994aefd48&Language=E&Section=ALL
4590467,ca.proc.d.2014-02-28.15885.115,2014-02-28,86dd8955-957c-4ff9-9a81-76305a0f26ac,421,"Mr. Paul Dewar (Ottawa Centre, NDP)",,Routine Proceedings,Situation in Venezuela,,"Mr. Speaker, if you seek it I believe you would find unanimous consent for the following motion. I move:
 That the House express its deep concern at the escalation of violence in Venezuela; convey its condolences to the families of those killed or injured during the ongoing public protests; ask the Government of Canada to urge Venezuelan authorities to proactively de-escalate the conflict, protect the human and democratic freedoms of Venezuelan citizens, release all those detained during the protests, immediately cease all government interference with peaceful protesters, and ensure that those people who perpetrated the violence be brought to justice and bear the full weight of the law; encourage the Government of Canada to play a leading role in supporting a political dialogue in Venezuela that respects legitimate grievances and differences of opinion; and call for an end to divisive rhetoric and actions that only delay and jeopardize the inclusive political solution that the Venezuelan people deserve. 
",New Democratic Party,Ottawa Centre,Paul Dewar,http://www.parl.gc.ca/parlinfo/Files/Parliamentarian.aspx?Item=86dd8955-957c-4ff9-9a81-76305a0f26ac&Language=E&Section=ALL
4590468,ca.proc.d.2014-02-28.15885.116,2014-02-28,1b175d0f-9278-4e04-9fa8-0368e591c5a5,69,The Deputy Speaker,,Routine Proceedings,Situation in Venezuela,,Does the hon. member have the unanimous consent of the House to move the motion?,New Democratic Party,Windsor--Tecumseh,Joe Comartin,http://www.parl.gc.ca/parlinfo/Files/Parliamentarian.aspx?Item=1b175d0f-9278-4e04-9fa8-0368e591c5a5&Language=E&Section=ALL
4590469,ca.proc.d.2014-02-28.15885.117,2014-02-28,,,,intervention,Routine Proceedings,Situation in Venezuela,, Agreed.,,,Some hon. members,
4590470,ca.proc.d.2014-02-28.15885.118,2014-02-28,1b175d0f-9278-4e04-9fa8-0368e591c5a5,69,The Deputy Speaker,,Routine Proceedings,Situation in Venezuela,, The House has heard the terms of the motion. Is it the pleasure of the House to adopt the motion?,New Democratic Party,Windsor--Tecumseh,Joe Comartin,http://www.parl.gc.ca/parlinfo/Files/Parliamentarian.aspx?Item=1b175d0f-9278-4e04-9fa8-0368e591c5a5&Language=E&Section=ALL
4590471,ca.proc.d.2014-02-28.15885.119,2014-02-28,,,,intervention,Routine Proceedings,Situation in Venezuela,, Agreed.,,,Some hon. members,
4590472,ca.proc.d.2014-02-28.15885.120,2014-02-28,1b175d0f-9278-4e04-9fa8-0368e591c5a5,69,The Deputy Speaker,,Routine Proceedings,Situation in Venezuela,,(Motion agreed to),New Democratic Party,Windsor--Tecumseh,Joe Comartin,http://www.parl.gc.ca/parlinfo/Files/Parliamentarian.aspx?Item=1b175d0f-9278-4e04-9fa8-0368e591c5a5&Language=E&Section=ALL
4590473,ca.proc.d.2014-02-28.15885.121,2014-02-28,ed49dd5f-e734-4267-a451-422ef9f0e95b,8661,"Mr. Tarik Brahmi (Saint-Jean, NDP)",,Routine Proceedings,Petitions,Mining Industry,"Mr. Speaker, I have the honour to present a petition signed by several hundred people in my riding of Saint-Jean and neighbouring ridings. The petitioners are calling for the creation of a legal ombudsman mechanism for responsible mining that would ensure compliance with international standards regarding social responsibility, labour and environmental practices and respect for human rights.",New Democratic Party,Saint-Jean,Tarik Brahmi,http://www.parl.gc.ca/parlinfo/Files/Parliamentarian.aspx?Item=ed49dd5f-e734-4267-a451-422ef9f0e95b&Language=E&Section=ALL
4590474,ca.proc.d.2014-02-28.15885.122,2014-02-28,d89e2700-537a-48d1-96f2-c55ef4f7caf1,400,"Mr. Alex Atamanenko (British Columbia Southern Interior, NDP)",,Routine Proceedings,Petitions,Agriculture,"Mr. Speaker, I have here close to 100 names of citizens from Kaslo, Ainsworth, Trail, Meadow Creek, and Nelson, who are concerned about Bill C-18, especially the changes to the Seeds Act or plant breeders' rights. They do not want further restrictions of farmers' rights or addition to farmers' costs, and they call upon Parliament to enshrine in legislation the inalienable rights of farmers and other Canadians to save, reuse, select, exchange, and sell seeds.",New Democratic Party,British Columbia Southern Interior,Alex Atamanenko,http://www.parl.gc.ca/parlinfo/Files/Parliamentarian.aspx?Item=d89e2700-537a-48d1-96f2-c55ef4f7caf1&Language=E&Section=ALL
4590475,ca.proc.d.2014-02-28.15885.123,2014-02-28,d89e2700-537a-48d1-96f2-c55ef4f7caf1,400,"Mr. Alex Atamanenko (British Columbia Southern Interior, NDP)",,Routine Proceedings,Petitions,Health of Animals and Meat Inspection,"Mr. Speaker, in my second petition there are hundreds of names from B.C., Ontario, and Quebec in support of my Bill C-322, an act to prohibit the exportation of horses for slaughter for human consumption, as well as horse meat products for human consumption, mainly because horses are commonly administered drugs that are strictly prohibited in the food chain and, thus, people would like us to support this bill.",New Democratic Party,British Columbia Southern Interior,Alex Atamanenko,http://www.parl.gc.ca/parlinfo/Files/Parliamentarian.aspx?Item=d89e2700-537a-48d1-96f2-c55ef4f7caf1&Language=E&Section=ALL
4590476,ca.proc.d.2014-02-28.15885.124,2014-02-28,28af576a-0312-4caf-8b49-2dd09744395d,597,"Mr. Malcolm Allen (Welland, NDP)",,Routine Proceedings,Petitions,Income Tax Deductions for Tradespeople,"Mr. Speaker, I have two petitions to present.
The first is on the ability of tradespeople who have to travel for work to be allowed deductions when it comes to income tax.",New Democratic Party,Welland,Malcolm Allen,http://www.parl.gc.ca/parlinfo/Files/Parliamentarian.aspx?Item=28af576a-0312-4caf-8b49-2dd09744395d&Language=E&Section=ALL
4590477,ca.proc.d.2014-02-28.15885.125,2014-02-28,28af576a-0312-4caf-8b49-2dd09744395d,597,"Mr. Malcolm Allen (Welland, NDP)",,Routine Proceedings,Petitions,Cluster Munitions,"Mr. Speaker, my second petition is on cluster munitions. The petitioners are saying that they should, indeed, be brought to an end and that Bill S-10 should be amended accordingly to make sure that actually happens.",New Democratic Party,Welland,Malcolm Allen,http://www.parl.gc.ca/parlinfo/Files/Parliamentarian.aspx?Item=28af576a-0312-4caf-8b49-2dd09744395d&Language=E&Section=ALL
4590478,ca.proc.d.2014-02-28.15885.126,2014-02-28,2576a113-8173-4faf-9a51-558c6087a2a1,8406,"Mr. Robert Chisholm (Dartmouth—Cole Harbour, NDP)",,Routine Proceedings,Petitions,Mining Industry,"Mr. Speaker, I have a couple of petitions here dealing with the issue of a mining ombudsman. 
People are concerned about the mining practices of Canadian companies in other parts of the world. They wish that the Government of Canada would take more responsibility to make sure that it listens to the complaints and concerns heard from workers and others in these countries, and that it would conduct investigations to make sure that our companies conduct themselves with the level of respect and moral standards that we would expect.",New Democratic Party,Dartmouth--Cole Harbour,Robert Chisholm,http://www.parl.gc.ca/parlinfo/Files/Parliamentarian.aspx?Item=2576a113-8173-4faf-9a51-558c6087a2a1&Language=E&Section=ALL
4590479,ca.proc.d.2014-02-28.15885.127,2014-02-28,2576a113-8173-4faf-9a51-558c6087a2a1,8406,"Mr. Robert Chisholm (Dartmouth—Cole Harbour, NDP)",,Routine Proceedings,Petitions,Democratic Reform,"Mr. Speaker, I have another petition about fair electoral representation. It is from members of my constituency, who are concerned about the winner-takes-all, first-past-the-post system. They urge members of the House to conduct an investigation and to undertake significant consultation in the country to examine alternatives to the system we have right now.
Is it not ironic that we have this particular petition for a fairer electoral system at the same time we are dealing with the foolishness of the government's bringing in its unfair elections act?",New Democratic Party,Dartmouth--Cole Harbour,Robert Chisholm,http://www.parl.gc.ca/parlinfo/Files/Parliamentarian.aspx?Item=2576a113-8173-4faf-9a51-558c6087a2a1&Language=E&Section=ALL
4590480,ca.proc.d.2014-02-28.15885.128,2014-02-28,ccfa05f8-2114-48f1-9ff4-5434e3279acb,148,"Mr. Randy Kamp (Pitt Meadows—Maple Ridge—Mission, CPC)",,Routine Proceedings,Petitions,Impaired Driving,"Mr. Speaker, I am pleased to present a petition signed by residents of Fraser Valley and the Lower Mainland, B.C., who believe that the current impaired driving laws are too lenient. In the interest of public safety, they want to see tougher laws and the implementation of new mandatory minimum sentences.",Conservative,Pitt Meadows--Maple Ridge--Mission,Randy Kamp,http://www.parl.gc.ca/parlinfo/Files/Parliamentarian.aspx?Item=ccfa05f8-2114-48f1-9ff4-5434e3279acb&Language=E&Section=ALL
4590481,ca.proc.d.2014-02-28.15885.129,2014-02-28,6f07c370-1b80-4b71-a801-e5e8e70cf1d4,593,"Mr. Glenn Thibeault (Sudbury, NDP)",,Routine Proceedings,Petitions,The Environment,"Mr. Speaker, I rise to introduce two petitions. The first calls on Parliament and the Conservative government to really look at the way we work with scientists, and to take some collective action on global warming.",New Democratic Party,Sudbury,Glenn Thibeault,http://www.parl.gc.ca/parlinfo/Files/Parliamentarian.aspx?Item=6f07c370-1b80-4b71-a801-e5e8e70cf1d4&Language=E&Section=ALL
4590482,ca.proc.d.2014-02-28.15885.130,2014-02-28,6f07c370-1b80-4b71-a801-e5e8e70cf1d4,593,"Mr. Glenn Thibeault (Sudbury, NDP)",,Routine Proceedings,Petitions,Canada Post,"Mr. Speaker, I also rise in the chamber to table a petition signed by hundreds of constituents of my great riding of Sudbury. They call on the government to reverse the cuts to services announced by Canada Post and to look instead for ways to innovate, for example, by establishing postal banking services.
These cuts to a service as essential as home mail delivery will affect the most vulnerable Canadians, such as seniors and people with physical disabilities.",New Democratic Party,Sudbury,Glenn Thibeault,http://www.parl.gc.ca/parlinfo/Files/Parliamentarian.aspx?Item=6f07c370-1b80-4b71-a801-e5e8e70cf1d4&Language=E&Section=ALL
4590483,ca.proc.d.2014-02-28.15885.131,2014-02-28,fe517b95-bc62-4fe8-96aa-998994aefd48,173,"Mr. Tom Lukiwski (Parliamentary Secretary to the Leader of the Government in the House of Commons, CPC)",,Routine Proceedings,Questions on the Order Paper,,"Mr. Speaker, I ask that the remaining questions be allowed to stand.",Conservative,Regina--Lumsden--Lake Centre,Tom Lukiwski,http://www.parl.gc.ca/parlinfo/Files/Parliamentarian.aspx?Item=fe517b95-bc62-4fe8-96aa-998994aefd48&Language=E&Section=ALL
4590484,ca.proc.d.2014-02-28.15885.132,2014-02-28,1b175d0f-9278-4e04-9fa8-0368e591c5a5,69,The Deputy Speaker,,Routine Proceedings,Questions on the Order Paper,,Is that agreed?,New Democratic Party,Windsor--Tecumseh,Joe Comartin,http://www.parl.gc.ca/parlinfo/Files/Parliamentarian.aspx?Item=1b175d0f-9278-4e04-9fa8-0368e591c5a5&Language=E&Section=ALL
4590485,ca.proc.d.2014-02-28.15885.133,2014-02-28,,,,intervention,Routine Proceedings,Questions on the Order Paper,, Agreed.,,,Some hon. members,
4590486,ca.proc.d.2014-02-28.15885.134,2014-02-28,,,,stagedirection,Government Orders,Qalipu Mi'kmaq First Nation Act,,"The House resumed consideration of the motion that Bill C-25, An Act respecting the Qalipu Mi'kmaq First Nation Band Order, be read the second time and referred to a committee.",,,,
4590487,ca.proc.d.2014-02-28.15885.135,2014-02-28,1b175d0f-9278-4e04-9fa8-0368e591c5a5,69,The Deputy Speaker,,Government Orders,Qalipu Mi'kmaq First Nation Act,,"Resuming debate, we have eight minutes left in the question and comments period for the member for St. John's East.
The hon. member for Western Arctic.",New Democratic Party,Windsor--Tecumseh,Joe Comartin,http://www.parl.gc.ca/parlinfo/Files/Parliamentarian.aspx?Item=1b175d0f-9278-4e04-9fa8-0368e591c5a5&Language=E&Section=ALL
4590488,ca.proc.d.2014-02-28.15885.136,2014-02-28,d00c3703-619a-496a-8369-0e113da41c9f,405,"Mr. Dennis Bevington (Western Arctic, NDP)",,Government Orders,Qalipu Mi'kmaq First Nation Act,,"Mr. Speaker, I thank my colleague for his speech and his concern about getting this bill right. Quite obviously, some things have gone wrong already with the process that has been undertaken for this legislation. The minister indicated that they thought they were going to get 8,000 or 9,000 people signed up, but they ended up with 23,800. Now they have had another 58,000 show up in the very short period after that.
I guess I can go back to the more than 23,000 who have been registered and accepted already. The indication from the minister is that all of those registrations are now under question. Over the past four years, anyone who was first nation and would have been accepted under this registration may have made choices in their lives. They may have made choices about investing in the Mi'kmaq communities and in Newfoundland. They may have made choices about where and how they live. They may have made choices about their relationships. All of a sudden, those 23,000 people are put in some degree of question.
This bill would actually take out the liability of the government for anything that it does to those 23,000 people. Is that not the case?",New Democratic Party,Western Arctic,Dennis Bevington,http://www.parl.gc.ca/parlinfo/Files/Parliamentarian.aspx?Item=d00c3703-619a-496a-8369-0e113da41c9f&Language=E&Section=ALL
4590489,ca.proc.d.2014-02-28.15885.137,2014-02-28,c846297d-8bc7-4e69-b6eb-31d0e19f7ec1,554,Mr. Jack Harris,Interjection,Government Orders,Qalipu Mi'kmaq First Nation Act,,"Mr. Speaker, that is one of the concerns here. Obviously, the legislation appears to be necessary to remove people who have been included, but what we are really looking at here is the importance of aboriginal status and the need for a fair and equitable process.
The member raised the question, what about the people who may have been wrongfully included? It is a very good question, “wrongfully” meaning only in the sense that this new enrollment process may exclude them. However, they do have a right to appeal; I do know that much. 
We want to find out if there is some provision to ensure that people who have made decisions and choices as a result of being included and are now not included have some recompense. The bill specifically says that one cannot sue for damages for being either excluded or left out.
These are absolutely some of the questions in the process that have to be answered by the Conservative government as to what would happen to them.",New Democratic Party,St. John's East,Jack Harris,http://www.parl.gc.ca/parlinfo/Files/Parliamentarian.aspx?Item=c846297d-8bc7-4e69-b6eb-31d0e19f7ec1&Language=E&Section=ALL
4590490,ca.proc.d.2014-02-28.15885.138,2014-02-28,6f07c370-1b80-4b71-a801-e5e8e70cf1d4,593,"Mr. Glenn Thibeault (Sudbury, NDP)",,Government Orders,Qalipu Mi'kmaq First Nation Act,,"Mr. Speaker, I would like to thank my hon. colleague for his speech, with so much information, and for sharing on an important matter like this.
Some of the facts and figures the member was speaking about were such that over 101,000 people applied for membership from this first nation, but during the reassessment process approximately 6,000 of those claims were found to be invalid, and approximately 94,000 were deemed valid if further documentation were provided. 
I would like to hear my hon. colleague's comments on this and how we could ensure fairness in the whole process. 
Also, under article 33 of the UN Declaration on the Rights of Indigenous Peoples, first nations have the right to determine their own membership. Perhaps I could hear the member's comments on that piece as well, because I know he is actively involved.",New Democratic Party,Sudbury,Glenn Thibeault,http://www.parl.gc.ca/parlinfo/Files/Parliamentarian.aspx?Item=6f07c370-1b80-4b71-a801-e5e8e70cf1d4&Language=E&Section=ALL
