basepk,hid,speechdate,pid,opid,speakeroldname,speakerposition,maintopic,subtopic,subsubtopic,speechtext,speakerparty,speakerriding,speakername,speakerurl
4588892,ca.proc.d.2014-02-13.15838.238,2014-02-13,9c9a64e6-58f1-4367-9f49-93ad31744c96,612,"Mrs. Cathy McLeod (Parliamentary Secretary to the Minister of Labour and for Western Economic Diversification, CPC)",,Government Orders,The Budget,Financial Statement of Minister of Finance,"Mr. Speaker, I am delighted to stand up here today and speak to our economic action plan 2014. I also want to congratulate the Minister of Finance on again having a budget that is absolutely right for Canada in these times.
Today I will talk about the context, because I think it is important. People are hearing about the measures that are in the budget, but I need to set the stage for the debate in terms of the context, going back to 2009.
I do want to make one comment. Certainly our approach is not the NDP approach of raising taxes and having myriad programs for which it wants to use the money of everyday Canadians.
Unlike the Liberals, we know we need a long-term plan. We need a plan. The budget does not actually balance itself by magic, but it balances itself through a lot of hard work, a lot of thinking, and creating a plan.
I will demonstrate where we are today and why this plan is working; so throughout my speech, I will take very liberally from some of the past budget speeches given by the Minister of Finance, because as we go from 2009 to 2010, we will see the very dramatic things that were happening in our history, and indeed, the global recession impacting the entire world.
First, I go back to January 27, 2009. I was a newly elected MP at the time. I was elected in 2008. The government previous to that had been paying down the debt, and to give the Liberals their due, they had paid down some debt, and we continued on that path. We paid down, I believe, close to $39 billion in debt in the first two years.
In 2008-2009 we recognized we were heading into some very challenging times across the world. These are some quotes from the speech of January 27, 2009.
 Since last fall, the global economic situation has deteriorated further and faster than anyone predicted.... Canadians are feeling the effects of the global recession, and they are concerned. They are concerned about their jobs and their savings. They are concerned about their families, their businesses, and their communities.... ...we must do what it takes to keep our economy moving and to protect Canadians during this extraordinary time. 
Back in 2009, in response to the global recession, it was the industrialized countries that agreed they needed to take unprecedented action.
I often hear, again, the opposition members talking out of both sides of their mouths, because I remember at that time they were saying we should spend more, spend more. Then they would say we had a debt. They cannot have it both ways. They cannot say to spend more and then criticize the debt.
It truly was a very difficult time, and so the Government of Canada and the Minister of Finance made the deliberate choice to run a substantial, short-term deficit. It was a temporary deficit, and it was an investment that was to stimulate our economy and to meet the short-term needs while serving the long-term goals.
It is also important to note that Canada, unlike the United States and Europe, did not enter this very difficult time with a heavy deficit, like the other countries; so we really had more capacity within Canada to respond to the risk we were facing.
We also said at that time that we would not be running a permanent deficit, that as the economy recovered, we fully expected to emerge from deficit and return to surplus. It was also said that Canadians regretted the need to run a deficit in order to invest in our economy and the government also shared that regret.
That sets the stage for 2009, a very difficult time, and a purposeful decision was made.
A year and a couple of months later—again I will take liberally from the speech at the time—the minister rose in the House and said:
 ...our nation is at a crossroads. We have passed through steep and rocky terrain. Much of the territory was uncharted. We were prepared and we protected ourselves. We are making our way through, and our compass has not failed us. The way forward remains challenging. Some would urge us to turn at this crossroads. Experience tells us that this would eventually lead us backward. We need to keep helping those who need a hand up. We need to stay on course. We can see our destination on the horizon. 
 It is important to note that there were many international institutions that were failing at that time, but they were not failing in Canada. Stock markets around the world had plunged deeply, and for a time the whole global financial system was at risk of shutting down. However, we worked in partnership with the G7 and G20 in terms of an effective coordinated response.
These numbers are going to be important as I go through my comments. In July 2009, Canada had generated 135,000 net new jobs, and at the same time the U.S. was continuing to lose jobs. Let us go another year, to March 22, 2011, and Canada was emerging from this recession as one of the world's top performing economies. Compared to other countries, Canada's economy was performing very well, but our continued recovery was by no means assured. We had a plan. It was working. We needed to stay on the track.
We were looking at additional targeted investments to support jobs and growth, but we also committed to tackle government spending and eliminate the deficit. We also indicated that we were not going to do that like the Liberals did, through cuts to transfers for health care and education and imposing massive tax increases. We now had 480,000 net new jobs, more than were lost in the recession.
It was at that time that the opposition decided that we did not have a plan that was working. We took it to the Canadian public. The Canadian public gave us a strong, stable Conservative majority government because they believed in this plan to move forward. We then introduced a very similar budget, I believe it was almost word-for-word, on June 6, 2011.
I have to note, again, in the few short months between when the budget was presented and the election was called and the next budget was presented, we were at 540,000 jobs that had been created since July 2009. That was the height of the recession. And, we had seven quarters of positive GDP growth. 
Heading into March 2012, of course, Canadians had every reason to be confident. Other western countries faced the risk of long-term economic decline. Our goal was to strengthen the financial security of Canadian workers and families, and to help create good jobs and prosperity in every region of the country. We also looked toward positioning our country as dynamic, moving forward, and able to compete. We were then at 610,000 net new jobs. Again, this was a year later. We saw very important improvements.
At this point, we were looking for innovation. We needed to plan for a rapidly aging population to secure our long-term prosperity. Again, that does not sound like magical wishful thinking. We have an aging populations and we needed to create a plan to help our country move through the challenges that it faces
At that time, we were on track. We had cut the deficit in half. We did this by doing exactly what the finance minister said when he introduced the economic action plan: the stimulus spending. 
He then ended it. I know it is often very difficult to end stimulus measures because it is very popular. However, it was temporary, and he did take the steps necessary to look at controlling the growth of new spending. We made the commitment to implement some moderate restraint in government spending, with the vast majority coming from eliminating waste in the internal operation of the government to make it leaner and more efficient.
Finally, at that time we were looking at ambitious trade expansion. I only have a minute left, and this is such a great story. On March 20, 2013, we were at 950,000 new jobs. We were taking strong decisive action, which was required, but we were moving forward as per the plan.
I would suggest to the opposition members that if they look at that history, what our finance minister indicated was going to happen has moved along directly. Obviously, there were some twists and turns along the way because there were factors outside of our control, but we have been at the reins. We have been guiding things.
I am proud of our record. I am proud to see that we are approaching a balanced budget, and I look forward to a balanced budget in 2015-16.
The measures that we see in the budget this year are targeted toward those important strategic investments that would continue to leave Canada prosperous and in the great position it has in the world.",Conservative,Kamloops--Thompson--Cariboo,Cathy McLeod,http://www.parl.gc.ca/parlinfo/Files/Parliamentarian.aspx?Item=9c9a64e6-58f1-4367-9f49-93ad31744c96&Language=E&Section=ALL
4588893,ca.proc.d.2014-02-13.15838.239,2014-02-13,c67d63e0-3483-4f07-81fb-8646ebd23a69,8486,"Mr. Pierre Jacob (Brome—Missisquoi, NDP)",,Government Orders,The Budget,Financial Statement of Minister of Finance,"Mr. Speaker, to begin, I would like to thank the hon. member opposite for her speech.
I would like to ask her why there is no mention of climate change in the budget. Climate change and sustainable development are a priority for the NDP. In that regard, I hope that tomorrow everyone will tune in to the second hour of debate on Bill C-481 at second reading, which will put sustainable development in the spotlight in the House of Commons.
On that note, I would like to quote the Conservative member for Kitchener—Waterloo. On January 6, on CBC, he said: “We are seeing the effects, the impacts of climate change. With climate change comes extreme weather events. We saw that through the floods in southern Alberta, we’re now seeing that with the ice storms in Kitchener-Waterloo and Toronto”.
Those are wise words. We need to take urgent action because, simply put, we have only one planet Earth. It is all well and good to balance the budget and have election strategies, as some are saying, but we need to protect our planet.",New Democratic Party,Brome--Missisquoi,Pierre Jacob,http://www.parl.gc.ca/parlinfo/Files/Parliamentarian.aspx?Item=c67d63e0-3483-4f07-81fb-8646ebd23a69&Language=E&Section=ALL
4588894,ca.proc.d.2014-02-13.15838.240,2014-02-13,9c9a64e6-58f1-4367-9f49-93ad31744c96,612,Mrs. Cathy McLeod,Interjection,Government Orders,The Budget,Financial Statement of Minister of Finance,"Mr. Speaker, I find it ironic that in past budgets we have had measures around climate change and navigable waters, yet we had been heavily criticized by the opposition members who said the budget should be about the budget and that these were omnibus budgets.
Now that we have a budget that is focused on some important budgetary measures, I would suggest that the hon. member go to the Government of Canada's website on the environment. He would see that there is an important and strategic plan. The goals are there. We are looking at how we would go ahead in terms of our environmental commitment to Canadians.
Again, I must point out the dichotomy of the two different positions. In one minute we are criticized for having it in, and now we are criticized for not having it in.",Conservative,Kamloops--Thompson--Cariboo,Cathy McLeod,http://www.parl.gc.ca/parlinfo/Files/Parliamentarian.aspx?Item=9c9a64e6-58f1-4367-9f49-93ad31744c96&Language=E&Section=ALL
4588895,ca.proc.d.2014-02-13.15838.241,2014-02-13,e6d671ec-9039-4ed6-bd6f-cca3ddd257e1,8790,"Mr. Ted Hsu (Kingston and the Islands, Lib.)",,Government Orders,The Budget,Financial Statement of Minister of Finance,"Mr. Speaker, I thank my Conservative colleague for her review of the government's stimulus of the economy during and following the 2008-09 great recession. However, I am reminded of an article in The Globe and Mail this past weekend that talked about how billions of dollars were wasted in that stimulus.
This is not meant as a criticism. However, given the member's recounting of the history, I want to ask whether she thinks it would be a good idea to do what was suggested by Martin Shubik, an economist in the United States, and also by Michael Mackenzie here in Canada, which is to have an independent panel that maintains a list of pre-evaluated public works projects. Therefore, if a recession hits and we need to provide stimulus, we would have a list of quality, non-partisan, economically viable projects that are ready for stimulus. Would that be a good way to avoid wasting billions of dollars in the hurried stimulus of the next economic recession?",Liberal,Kingston and the Islands,Ted Hsu,http://www.parl.gc.ca/parlinfo/Files/Parliamentarian.aspx?Item=e6d671ec-9039-4ed6-bd6f-cca3ddd257e1&Language=E&Section=ALL
4588896,ca.proc.d.2014-02-13.15838.242,2014-02-13,9c9a64e6-58f1-4367-9f49-93ad31744c96,612,Mrs. Cathy McLeod,Interjection,Government Orders,The Budget,Financial Statement of Minister of Finance,"Mr. Speaker, I would point out that Canada was not alone. We were with the G20 nations in terms of this economic action plan.
I would also point out that the Auditor General gave an incredibly favourable report. It was unprecedented in the history of Canada to have such a positive response to our economic action plan and economic stimulus.
When I look at the important projects in my riding, not only did they create jobs, they have created valuable infrastructure for the citizens of those communities.
We have a list of infrastructure projects from our municipalities right now, which we know very well will keep us going for a long time in terms of what we need to do moving forward.",Conservative,Kamloops--Thompson--Cariboo,Cathy McLeod,http://www.parl.gc.ca/parlinfo/Files/Parliamentarian.aspx?Item=9c9a64e6-58f1-4367-9f49-93ad31744c96&Language=E&Section=ALL
4588897,ca.proc.d.2014-02-13.15838.243,2014-02-13,c0132e73-a431-4e7e-8f75-051a95a8edf0,1820,"Mr. Denis Blanchette (Louis-Hébert, NDP)",,Government Orders,The Budget,Financial Statement of Minister of Finance,"Mr. Speaker, before I start, I would like to indicate that I will be sharing my time with the excellent member for Montcalm.
When I first looked at the budget, I did so from a local and regional perspective. The first thing I noticed was that there was nothing for the Quebec City region or my riding of Louis-Hébert in the budget. None of the federal government's sectors of activity had anything for the Quebec Bridge, the episodes of red dust in Limoilou or the Davie shipyard or anything to reassure our city's seniors, who should continue having door-to-door postal delivery instead of having to go out in winter. There was nothing for pension plans, even though our society has a growing population of seniors.
My riding has a university and two other post-secondary institutions. There was nothing for post-secondary education in the way of provincial transfers. There was nothing about that. There was nothing for basic research. There was mention of applied research and industrial research. However, basic research is the basis for the wealth of our future society. I saw nothing about that.
I would like to talk a little about the Quebec Bridge, which is in my riding. Over the past nine years, this government has spent more than $400,000 on legal expenses. However, I did not see anything in the budget about that. In 2005, the Prime Minister gave a speech to the Quebec City chamber of commerce. He promised to take the paint brush away from the Liberals in order to get the bridge painted. Nine years and four ministers later, they are still looking for the brush.
The Conservatives have cloned the Liberals' incompetence. One might say that the older the government gets, the more it likes to copy the Liberals. That is how it goes.
I would remind members that, during the last election, the government's slogan was “Our region in power”. What have the Conservative members from the greater Quebec City area done for the area in the budget? The answer is nothing.
Let us get back to the budget. We were told that the deficit is $2.9 billion. That is a false deficit because there is a $3 billion provision on the books. We are seeing once again the ploy used by Paul Martin when he was the finance minister. By underestimating the ability to have a budget surplus, all of a sudden, at the end of the year, they look like good managers. It is going to happen.
The Minister of Public Safety and Emergency Preparedness has said in a television interview that we already had a virtual balanced budget. It is in fact quite real. I hope the Minister of Finance will not needlessly borrow that $3 billion from the reserve fund to make taxpayers needlessly pay interest. I hope he does not do that.
The Minister of Public Safety and Emergency Preparedness said something else that was interesting. He said that a government should serve only to create wealth. I am sorry, but it should serve its citizens, first and foremost. Creating wealth is part of serving the people.
As a final point, I would like to draw the attention of the House to another aspect of this budget. As my colleague from Charlesbourg—Haute-Saint-Charles said, many people are paying so that this government can achieve a balanced budget. Retired public servants are one example. Taking $1.5 billion away from people who are no longer working is rather meanspirited. It is petty and it is shameful. There are no words strong enough, not even unparliamentary ones, to describe how meanspirited that is. When you have reached the point of stealing from people on a fixed income, whose incomes are actually going down, when you achieve a surplus on the backs of people like that, that is petty.
In my riding alone, there are 679 retired public servants.
In the greater Quebec City area, 7,200 retirees will get a taste of this shameful plan; in Quebec, the total is 34,000 and, in Canada, 186,000.
Is this how the government treats those who have made our federal public service an international model? When you work and you have a pension plan, a portion of your salary is deferred for your pension, meaning that you will get the money later. Is the government's idea to have an agreement with workers and then turn around and say that the agreement no longer applies? What is this way of thinking?
The government's attitude toward job training is equally shameful. The government made an announcement on this matter in last year's budget, but it did not follow through with it. In fact, the provinces are opposed to it. The government has needlessly spent $2.5 million of taxpayers' money on a program that does not exist. Now it says that it will have constructive discussions for six weeks and that it will still move forward with the program on April 1st.
Actually, this is what the Minister of Finance had to say about it: 
 Job training in Canada is not provincial tax money; it's federal tax money. And it's not for a provincial government to tell the federal government how to spend federal tax money. 
However, this is an area of provincial jurisdiction. This government has always boasted about respecting jurisdictions, but now it jumps in with both feet for the sake of its ideology. That is completely unacceptable.
That is why the NDP stated, in the Sherbrooke declaration, that any province can opt out of a program with full compensation in those types of situations. I therefore urge this government to uphold the principles set out in the Sherbrooke declaration. It is important for us and for everyone.
 For the Liberals, a budget writes itself. For the Conservatives, it is an accounting exercise in which figures that must balance are compared. This cold-blooded accounting exercise could not care less about the consequences for Canadians.
 While it is true that they are balancing the budget, people are going to have to pay. This is not being done properly. A budget should benefit ordinary people. It should help people, help companies grow, help create jobs and help young people study and achieve their full potential. It should support seniors and help farmers.
 Is there anything like that in this budget? Not at all. It is nothing more than an unfeeling accounting exercise. No one studied the consequences or thought about the people who will pay the price or the purpose of the budget.
 The parliamentary secretary spoke about history just now, and I would like to do the same. As part of the cuts made to the various departments, 300 food inspection jobs were eliminated. What is more, we witnesses the largest food recall in Canada's history.
 Today, the government solves problems by simply making announcements. It makes cuts randomly and haphazardly without looking at the consequences and then transforms that into a budget announcement. This is unacceptable.
 A budget should give hope to Canadians. We should be able to live a healthy life, teach our young people, think about the future and invest in research so that our companies can innovate and prosper. A government is not a publicly traded corporation that has to balance the books at the end of the fiscal year.
 A government should take a sustainable development approach to society in all its aspects and have an employment strategy, rather than simply an exercise to fill vacant positions. That is why I deplore the fact that this government has chosen the path of confrontation and come up with a budget that is just laying the groundwork for the next election.
 On behalf of the people of Louis-Hébert, I deplore the fact that in this budget no mention is made of the landmark that is the Quebec Bridge.",New Democratic Party,Louis-Hébert,Denis Blanchette,http://www.parl.gc.ca/parlinfo/Files/Parliamentarian.aspx?Item=c0132e73-a431-4e7e-8f75-051a95a8edf0&Language=E&Section=ALL
4588898,ca.proc.d.2014-02-13.15838.244,2014-02-13,c67d63e0-3483-4f07-81fb-8646ebd23a69,8486,"Mr. Pierre Jacob (Brome—Missisquoi, NDP)",,Government Orders,The Budget,Financial Statement of Minister of Finance,"Mr. Speaker, I thank my colleague for his excellent and very passionate speech. 
A few words from his speech stood out for me. He said that the budget is an obsession with an accounting exercise that is void of emotion. Balancing the budget is indeed an obsession for our friends opposite.
We in the NDP propose to make life as affordable as possible for consumers and Canadians.
Can my colleague explain how the NDP will make life more affordable in 2015?",New Democratic Party,Brome--Missisquoi,Pierre Jacob,http://www.parl.gc.ca/parlinfo/Files/Parliamentarian.aspx?Item=c67d63e0-3483-4f07-81fb-8646ebd23a69&Language=E&Section=ALL
4588899,ca.proc.d.2014-02-13.15838.245,2014-02-13,c0132e73-a431-4e7e-8f75-051a95a8edf0,1820,Mr. Denis Blanchette,Interjection,Government Orders,The Budget,Financial Statement of Minister of Finance,"Mr. Speaker, I thank my colleague for his excellent question. That is what my speech was actually all about.
In addition to passing legislation, the budget is a significant part of the work that we do in the House. It is supposed to be a tool that helps people grow. Among other things, this means that, for life to be affordable, we do not want interest rates to be exorbitant.
We know that Canadians have too much debt. It is important to support them in paying off their personal debts. We hear about the government's debt, but the debt of Canadians is conveniently forgotten. The NDP is proposing a whole host of measures.
For instance, I am thinking about the fees that seniors have to pay just to receive paper invoices or to use a bank machine. These are all simple, inexpensive measures that allow people to get value for their money.",New Democratic Party,Louis-Hébert,Denis Blanchette,http://www.parl.gc.ca/parlinfo/Files/Parliamentarian.aspx?Item=c0132e73-a431-4e7e-8f75-051a95a8edf0&Language=E&Section=ALL
4588900,ca.proc.d.2014-02-13.15838.246,2014-02-13,07cf5767-802c-406c-92a7-7dc92af79b40,4264,"Mr. Kevin Lamoureux (Winnipeg North, Lib.)",,Government Orders,The Budget,Financial Statement of Minister of Finance,"Mr. Speaker, I want to pick up on one aspect of the budget that the government has unfortunately not addressed, and that is the issue of citizenship.
It is going to become more difficult for an individual to get Canadian citizenship. It is also going to become much more costly. There are 1.5 million landed immigrants here in Canada. Ultimately we want them to become citizens of Canada, but they are going to pay a lot more money to get their citizenship as a direct result of the Conservative government. They will have to pay somewhere in the neighbourhood of $300 or $400. As well, they will have to get IELTS testing done, and the government is expanding the age for this testing from 54 to 60. The Conservatives seem to have missed the mark. 
There has been a huge increase in the backlog. Even after someone qualifies for Canadian citizenship, he or she has to wait another two or three years. It seems to me that the government should be speeding up the process so that when individuals qualify for citizenship, they will not have to wait for two or three years, and possibly far longer, to acquire it. 
I wonder if the member could comment on that.",Liberal,Winnipeg North,Kevin Lamoureux,http://www.parl.gc.ca/parlinfo/Files/Parliamentarian.aspx?Item=07cf5767-802c-406c-92a7-7dc92af79b40&Language=E&Section=ALL
