basepk,hid,speechdate,pid,opid,speakeroldname,speakerposition,maintopic,subtopic,subsubtopic,speechtext,speakerparty,speakerriding,speakername,speakerurl
4590371,ca.proc.d.2014-02-28.15885.19,2014-02-28,1e6e9765-853d-440f-be8f-e39b76082465,675,"Mr. Chungsen Leung (Willowdale, CPC)",,Statements By Members,Winter Olympic Games,,"Mr. Speaker, it is also my honour to congratulate our Canadian Olympic team for their incredible success at the 2014 Winter Olympic Games in Sochi, Russia.
 Canadians from coast to coast to coast have witnessed excellence and are truly inspired by the performance of all of our great athletes. This is the result of years of hard work, skill, and dedication, qualities that we all aspire to and admire. Winning 10 gold, 10 silver and 5 bronze medals, Canada has proven to be a world power on the world Olympic stage and the Canadian Olympic team has captured the spirit and joy of all Canadians. The sense of pride that we all feel as a nation is incredibly monumental. 
I am especially proud of the seven Torontonian athletes, who all competed with passion and professionalism. The diversity of our Canadian Olympians is truly inspirational. In 2018, we will look forward to sending our Canadian athletes to the next winter games in Pyeongchang, South Korea. This will be the third time in Olympic history that the winter games will be held in Asia.
Once again, congratulations Team Canada.",Conservative,Willowdale,Chungsen Leung,http://www.parl.gc.ca/parlinfo/Files/Parliamentarian.aspx?Item=1e6e9765-853d-440f-be8f-e39b76082465&Language=E&Section=ALL
4590372,ca.proc.d.2014-02-28.15885.20,2014-02-28,5dcb8c60-bb95-4d0f-9e2f-06dd3624a80f,8656,"Mrs. Djaouida Sellah (Saint-Bruno—Saint-Hubert, NDP)",,Statements By Members,Rail Safety,,"Mr. Speaker, there was another train derailment last Saturday. This time, it happened in Montreal, right next to where people live.
This disaster reminds us of the many others that have occurred since the Lac-Mégantic tragedy. Following two days of consultation with my constituents, I can sense their concerns and bewilderment regarding the long freight trains that go through my riding every day. Saint-Bruno is the busiest stretch of track in Canada, and thousands of cars carry dangerous goods right next to people's homes.
The Auditor General's report recommended that the department ensure that it has enough competent inspectors to monitor railway companies and safety management systems. 
Despite this troubling situation, there is nothing in budget 2014 to improve rail safety. The government must act immediately to prevent future tragedies like Lac-Mégantic.",New Democratic Party,Saint-Bruno--Saint-Hubert,Djaouida Sellah,http://www.parl.gc.ca/parlinfo/Files/Parliamentarian.aspx?Item=5dcb8c60-bb95-4d0f-9e2f-06dd3624a80f&Language=E&Section=ALL
4590373,ca.proc.d.2014-02-28.15885.21,2014-02-28,26c8b0bc-42d4-4db5-bf7d-1e1544c7b4b5,9172,"Mr. Dan Albas (Okanagan—Coquihalla, CPC)",,Statements By Members,The Budget,,"Mr. Speaker, last week the Leader of the Opposition visited my beautiful riding of Okanagan—Coquihalla.
While in the riding, the Leader of the Opposition visited Structurlam Products in Okanagan Falls. Structurlam is an exciting and innovative success story as the producer of value-added wood products, using a new technology called cross-lam construction. The Leader of the Opposition was quoted as saying, “This factory is a great example of something that is succeeding, and that is great to see.” I could not agree more. Structurlam Products and cross-lam construction were supported by our government's economic action plan under the investments in forest industry transformation program.
Now that the Leader of the Opposition has witnessed firsthand that our economic action plan is “succeeding, and that is great to see”, I hope that the members opposite will join our government in supporting the economic action plan in budget 2014 so that we can continue creating more good jobs here in Canada.",Conservative,Okanagan--Coquihalla,Dan Albas,http://www.parl.gc.ca/parlinfo/Files/Parliamentarian.aspx?Item=26c8b0bc-42d4-4db5-bf7d-1e1544c7b4b5&Language=E&Section=ALL
4590374,ca.proc.d.2014-02-28.15885.22,2014-02-28,c4273cb6-4d3d-4d46-a5f9-2a6c1914a32e,8818,"Ms. Eve Adams (Mississauga—Brampton South, CPC)",,Statements By Members,Food Labelling,,"Mr. Speaker, in the Speech from the Throne, our government committed to consulting with Canadian parents to improve the way nutritional information is presented on food labels.
I have been thrilled to work with our Minister of Health, who has asked me to spearhead consultations with families across the country to ensure that labels provide the best information for moms and dads.
I was pleased this week to see the First Lady of the United States announce new ways that they plan to present this information. It is encouraging to see these efforts toward healthy eating and healthy living not only here in Canada but also internationally.
In the coming months, I look forward to continuing these face-to-face consultations with Canadian families to gather the information about what food-labelling changes are needed to make healthier and more informed choices. Our government is going to make sure that Canadians receive the information they need to make the most healthy choices for their families.",Conservative,Mississauga--Brampton South,Eve Adams,http://www.parl.gc.ca/parlinfo/Files/Parliamentarian.aspx?Item=c4273cb6-4d3d-4d46-a5f9-2a6c1914a32e&Language=E&Section=ALL
4590375,ca.proc.d.2014-02-28.15885.23,2014-02-28,86dd8955-957c-4ff9-9a81-76305a0f26ac,421,"Mr. Paul Dewar (Ottawa Centre, NDP)",,Statements By Members,Public Service of Canada,,"Mr. Speaker, it is my great pleasure and honour to represent many public service workers. These men and women provide important services for Canadians. They help immigrants settle in Canada and support our veterans and seniors. They make sure that pensions, employment insurance, and tax refunds are delivered on time. They keep our food safe, and they help grow Canadian businesses.
They deserve our respect, not false Conservative claims about wages and sick leave. Canadians deserve a strong public service, not more Conservative cuts. The Conservatives say that front-line services will not be affected by their cuts, but anyone who actually relies on these services knows it is not true. More and more of my constituents are coming to me and my staff, seeking help they cannot get from underfunded and overworked government offices.
Canadians deserve better. It is time for the government to start respecting and supporting our public service.",New Democratic Party,Ottawa Centre,Paul Dewar,http://www.parl.gc.ca/parlinfo/Files/Parliamentarian.aspx?Item=86dd8955-957c-4ff9-9a81-76305a0f26ac&Language=E&Section=ALL
4590376,ca.proc.d.2014-02-28.15885.24,2014-02-28,688c6645-b71f-4182-a105-c85eb869e1f7,9183,"Mr. Bob Zimmer (Prince George—Peace River, CPC)",,Statements By Members,Richmond Cenotaph,,"Mr. Speaker, it is with regret that I advise this House that two nights ago the cenotaph located in Richmond, British Columbia was vandalized.
Vandalizing a memorial for fallen soldiers is simply shameful. These are the men and women who sacrificed their lives to protect our country. This is why I support my colleague's private member's bill to bring criminal penalties against instead of a simple slap of the wrist of people who denigrate our veterans monuments.
I call on those who are responsible to come forward, and if anyone has any information about this crime to contact police immediately.",Conservative,Prince George--Peace River,Bob Zimmer,http://www.parl.gc.ca/parlinfo/Files/Parliamentarian.aspx?Item=688c6645-b71f-4182-a105-c85eb869e1f7&Language=E&Section=ALL
4590377,ca.proc.d.2014-02-28.15885.25,2014-02-28,6fda5a4f-19c6-4cf2-b72d-9a00b48e0d21,8558,"Ms. Hélène Laverdière (Laurier—Sainte-Marie, NDP)",,Statements By Members,Artists for Peace,,"Mr. Speaker, on February 14, I attended a very moving ceremony by Artistes pour la paix, an organization celebrating its 30th anniversary this year. At the ceremony, the artist for peace award went to Serge Lavoie, who is also known as the “guitar strummer”. In 2012, Mr. Lavoie was the victim of police brutality, an experience that did not deter, but perhaps reinforced his commitment to peace.
Tribute awards were presented to screenwriter Fabienne Larouche, visual artist Dominique Blain and, posthumously, filmmaker Arthur Lamothe, distinguished artists who inspire us all.
These awards prove that everyone can commit to peace in their respective fields. Individual commitment is essential to the health of our democracy, which is currently under attack. Congratulations to all those who are doing their part for peace and social justice. ",New Democratic Party,Laurier--Sainte-Marie,Hélène Laverdière,http://www.parl.gc.ca/parlinfo/Files/Parliamentarian.aspx?Item=6fda5a4f-19c6-4cf2-b72d-9a00b48e0d21&Language=E&Section=ALL
4590378,ca.proc.d.2014-02-28.15885.26,2014-02-28,a20523be-cae0-4d31-9595-e9303275e40d,583,"Mr. Peter Braid (Kitchener—Waterloo, CPC)",,Statements By Members,Leader of the Liberal Party of Canada,,"Mr. Speaker, the member for Papineau once again yesterday demonstrated that he is in way over his head. Speaking about our government's historic investments in infrastructure, he alleged that our government had in fact cut—wait for it—“thousands of billions” of dollars, whereas one might want to say trillions of dollars.
Our infrastructure plan is very generous, the most generous in Canadian history. We are investing $70 billion in infrastructure over the next 10 years. This compares very favourably with the former Liberal government, which starved provinces and invested only a fraction of what we have invested in provincial and municipal infrastructure.
Perhaps, in the world of the member for Papineau, where budgets balance themselves, investing “thousands of billions” sounds realistic, but in the real world, the member for Papineau is clearly in way over his head.",Conservative,Kitchener--Waterloo,Peter Braid,http://www.parl.gc.ca/parlinfo/Files/Parliamentarian.aspx?Item=a20523be-cae0-4d31-9595-e9303275e40d&Language=E&Section=ALL
4590379,ca.proc.d.2014-02-28.15885.27,2014-02-28,44647433-13cb-467e-8632-d49b131d5bb6,166,"Hon. Dominic LeBlanc (Beauséjour, Lib.)",,Statements By Members,Angèle Arsenault,,"Mr. Speaker, it is with great sadness that Acadia and all of Canada learned of the passing of Angèle Arsenault on Wednesday, February 26.
An ambassador for Acadia and music outside Acadia, Angèle Arsenault never forgot her roots, which inspired her to write fabulous songs such as Grand Pré and Y'a une étoile pour vous.
Originally from Prince Edward Island, Angèle Arsenault also played a major role in the life and cultural development of the Acadian community on the island.
There are very few people who have had such a great and profound impact in Acadia as Angèle Arsenault. She helped francophone Canada discover and come to know Acadian music and culture.
I join my colleagues in the House in offering our condolences to her family and saying one last goodbye to the great artist, Angèle Arsenault. We will always remember her.",Liberal,Beauséjour,Dominic LeBlanc,http://www.parl.gc.ca/parlinfo/Files/Parliamentarian.aspx?Item=44647433-13cb-467e-8632-d49b131d5bb6&Language=E&Section=ALL
4590380,ca.proc.d.2014-02-28.15885.28,2014-02-28,78cd5419-2f3c-4798-9c5b-0e55843ef9fb,604,"Mrs. Kelly Block (Saskatoon—Rosetown—Biggar, CPC)",,Statements By Members,Tidal Power,,"Mr. Speaker, I was pleased to participate in the unveiling of a tidal turbine on Wednesday at the technology park of the Canada Science and Technology Museum. It was developed as part of project led by Clean Current, funded by Sustainable Development Technology Canada. 
Based upon this project, Clean Current was able to incorporate further developments into its turbine technology. This is significant. It helps Canada secure its place at the forefront of efforts to develop sustainable energy. This 65-kilowatt turbine was Canada's first free-stream tidal power project. It generated 1,495 kilowatt hours of electricity, replacing diesel-generated electricity.
This is an innovative project. Our government is proud to support efforts to harness the power of the ocean and support Canadian clean technologies.",Conservative,Saskatoon--Rosetown--Biggar,Kelly Block,http://www.parl.gc.ca/parlinfo/Files/Parliamentarian.aspx?Item=78cd5419-2f3c-4798-9c5b-0e55843ef9fb&Language=E&Section=ALL
4590381,ca.proc.d.2014-02-28.15885.29,2014-02-28,eb8710eb-e6dd-4c04-9d9a-60e7c8503565,3139,"Mr. Kennedy Stewart (Burnaby—Douglas, NDP)",,Statements By Members,Government Expenditures,,"Mr. Speaker, yesterday, the Conservative government tabled the main estimates. Once again, it is one reckless cut after another, after another, after another. 
The Auditor General's budget is being slashed by $6.6 million; the Canada Revenue Agency is losing more than $175 million; and the Canada Food Inspection Agency is losing another $69 million. These agencies keep our food safe, go after tax cheats, and provide accountability for government spending, yet they are falling under the indiscriminate axe of the Conservative government.
However, not everyone is getting cut. While food safety, tax inspectors, and accountability face cuts, the budget of the organization tasked with electronic eavesdropping, the one that we recently learned was spying on Canadians, is almost doubling to $829 million.
Canadians deserve a government that will respect their privacy and invest in programs that help them. Canadians deserve an NDP government.",New Democratic Party,Burnaby--Douglas,Kennedy Stewart,http://www.parl.gc.ca/parlinfo/Files/Parliamentarian.aspx?Item=eb8710eb-e6dd-4c04-9d9a-60e7c8503565&Language=E&Section=ALL
4590382,ca.proc.d.2014-02-28.15885.30,2014-02-28,661a3062-86d1-4ba3-9e70-81c866aa2fc3,9,"Mr. David Anderson (Cypress Hills—Grasslands, CPC)",,Statements By Members,New Democratic Party of Canada,,"Mr. Speaker, the next federal election is over a year away. The NDP is already waving the white flag, pleading to join a Liberal-led coalition. Canadians know what a Liberal-led NDP high-tax coalition would mean: a soft on crime agenda, repealing mandatory prison sentences for violent offenders; a reckless plan to legalize marijuana, making it easier for children to smoke; and massive spending increases of, as the Liberal leader put it, thousands of billions of dollars, otherwise known as trillions. Of course, the coalition would have budgets that balance themselves. Perhaps this is why the Liberal leader should not claim to be a math teacher.
When will the anti-trade leader of the official opposition stop passing the pipe in an effort to close a deal with the pro-drug-trade, high on smiles, low on substance leader of the third party? Canadians are looking for the opposition to do its job, not toke the flames of an unwanted coalition fire. ",Conservative,Cypress Hills--Grasslands,David Anderson,http://www.parl.gc.ca/parlinfo/Files/Parliamentarian.aspx?Item=661a3062-86d1-4ba3-9e70-81c866aa2fc3&Language=E&Section=ALL
4590383,ca.proc.d.2014-02-28.15885.31,2014-02-28,6fda5a4f-19c6-4cf2-b72d-9a00b48e0d21,8558,"Ms. Hélène Laverdière (Laurier—Sainte-Marie, NDP)",,Oral Questions,Foreign Affairs,,"Mr. Speaker, this morning we learned that Russian troops are occupying the two main airports in Crimea, and Ukraine's border guards have indicated that 30 Russian marines have surrounded a Ukrainian coast guard base in Sevastopol.
Can the government tell the House what information it has about the situation in Crimea?",New Democratic Party,Laurier--Sainte-Marie,Hélène Laverdière,http://www.parl.gc.ca/parlinfo/Files/Parliamentarian.aspx?Item=6fda5a4f-19c6-4cf2-b72d-9a00b48e0d21&Language=E&Section=ALL
4590384,ca.proc.d.2014-02-28.15885.32,2014-02-28,661a3062-86d1-4ba3-9e70-81c866aa2fc3,9,"Mr. David Anderson (Parliamentary Secretary to the Minister of Foreign Affairs, CPC)",,Oral Questions,Foreign Affairs,,"Mr. Speaker, as we have said before, Canada fully supports the territorial integrity and sovereignty of Ukraine. Any outside involvement in Ukraine's democratic aspirations would be a dangerous development. All countries should be working together in the pursuit of unity, freedom, and democracy.",Conservative,Cypress Hills--Grasslands,David Anderson,http://www.parl.gc.ca/parlinfo/Files/Parliamentarian.aspx?Item=661a3062-86d1-4ba3-9e70-81c866aa2fc3&Language=E&Section=ALL
4590385,ca.proc.d.2014-02-28.15885.33,2014-02-28,6fda5a4f-19c6-4cf2-b72d-9a00b48e0d21,8558,"Ms. Hélène Laverdière (Laurier—Sainte-Marie, NDP)",,Oral Questions,Foreign Affairs,,"Mr. Speaker, former president Yanukovych has fled the country. There are reports of Russian troops occupying airports in Crimea. Ukraine has said that a coast guard base in Sevastopol has been surrounded by Russian marines. 
Can the minister update the House on the situation and tell us what the government has communicated to the Russian government regarding this very troubling situation?",New Democratic Party,Laurier--Sainte-Marie,Hélène Laverdière,http://www.parl.gc.ca/parlinfo/Files/Parliamentarian.aspx?Item=6fda5a4f-19c6-4cf2-b72d-9a00b48e0d21&Language=E&Section=ALL
4590386,ca.proc.d.2014-02-28.15885.34,2014-02-28,661a3062-86d1-4ba3-9e70-81c866aa2fc3,9,"Mr. David Anderson (Parliamentary Secretary to the Minister of Foreign Affairs, CPC)",,Oral Questions,Foreign Affairs,,"Mr. Speaker, Canada will continue to work with our allies and like-minded countries to build a coordinated a path forward.
I would like to talk about some of the leadership that we have provided. The Prime Minister's decision to send a Canadian delegation to Ukraine is another example of Canada's leadership on the issue. This delegation is on the ground. It is listening and making clear that Canada wants to play a part in helping the Ukrainian people build their future.",Conservative,Cypress Hills--Grasslands,David Anderson,http://www.parl.gc.ca/parlinfo/Files/Parliamentarian.aspx?Item=661a3062-86d1-4ba3-9e70-81c866aa2fc3&Language=E&Section=ALL
4590387,ca.proc.d.2014-02-28.15885.35,2014-02-28,031462db-8f61-48ed-bf9f-b033eb8312bb,75,"Mr. Nathan Cullen (Skeena—Bulkley Valley, NDP)",,Oral Questions,Democratic Reform,,"Mr. Speaker, although we have tried many times to get answers, Canadians still do not know why the Conservatives refuse to consult them about the Canada Elections Act.
Committees are always travelling across the country to consult Canadians. The Conservatives are willing to waste more than $600,000 for the other committees that travel, but not to consult Canadians about this bill. This time, the government does not want to hear anything.
Why, exactly, is the minister refusing to consult and respect Canadians?",New Democratic Party,Skeena--Bulkley Valley,Nathan Cullen,http://www.parl.gc.ca/parlinfo/Files/Parliamentarian.aspx?Item=031462db-8f61-48ed-bf9f-b033eb8312bb&Language=E&Section=ALL
4590388,ca.proc.d.2014-02-28.15885.36,2014-02-28,ad4032f2-6bb1-497b-b146-f321cfb71ba9,233,"Hon. Pierre Poilievre (Minister of State (Democratic Reform), CPC)",,Oral Questions,Democratic Reform,,"Mr. Speaker, we have already conducted consultations and will continue to do so.
The fair elections act will ensure that political power stays in the hands of average Canadians by preventing special interest groups from wielding power and preventing violations of the law. It gives more powers to the commissioner, who can conduct investigations to enforce the law. It will make it easier for Canadians to vote.",Conservative,Nepean--Carleton,Pierre Poilievre,http://www.parl.gc.ca/parlinfo/Files/Parliamentarian.aspx?Item=ad4032f2-6bb1-497b-b146-f321cfb71ba9&Language=E&Section=ALL
4590389,ca.proc.d.2014-02-28.15885.37,2014-02-28,031462db-8f61-48ed-bf9f-b033eb8312bb,75,"Mr. Nathan Cullen (Skeena—Bulkley Valley, NDP)",,Oral Questions,Democratic Reform,,"Mr. Speaker, that was a simple question on a reasonable and democratic proposal to consult with Canadians, yet the minister thinks only Ottawa Conservatives have a right to be heard.
The Conservatives were willing to spend more than $600,000 on travel for other committees and they did not think any of that was an expensive circus, so why now? Why with this bill? Why would they refuse to allow open and public consultations on such a critical piece of legislation that is the foundation of our democratic principles? Is the government really that scared of hearing what Canadians think of its unfair election act?",New Democratic Party,Skeena--Bulkley Valley,Nathan Cullen,http://www.parl.gc.ca/parlinfo/Files/Parliamentarian.aspx?Item=031462db-8f61-48ed-bf9f-b033eb8312bb&Language=E&Section=ALL
4590390,ca.proc.d.2014-02-28.15885.38,2014-02-28,ad4032f2-6bb1-497b-b146-f321cfb71ba9,233,"Hon. Pierre Poilievre (Minister of State (Democratic Reform), CPC)",,Oral Questions,Democratic Reform,,"Mr. Speaker, if the member wants people to provide input on the fair elections act, then he should simply put together a list of witnesses he wants to have testify on that very act. The committee in question would then take into consideration their ideas and consider the amendments that those witnesses bring forward. However, the NDP declared its opposition to the fair elections act before even reading a single word.
The Canadian people understand that the fair elections act would keep everyday Canadians in charge of democracy by putting special interest groups on the sidelines and rule breakers out of business.",Conservative,Nepean--Carleton,Pierre Poilievre,http://www.parl.gc.ca/parlinfo/Files/Parliamentarian.aspx?Item=ad4032f2-6bb1-497b-b146-f321cfb71ba9&Language=E&Section=ALL
4590391,ca.proc.d.2014-02-28.15885.39,2014-02-28,031462db-8f61-48ed-bf9f-b033eb8312bb,75,"Mr. Nathan Cullen (Skeena—Bulkley Valley, NDP)",,Oral Questions,Democratic Reform,,"Mr. Speaker, historically, changing the laws that govern our elections has always been a non-partisan exercise, but not for these Ottawa Conservatives. Canadians from all walks of life and in every region of the country need to be able to tell their government how our democracy will run, not the other way around. 
MPs travel and consult on new legislation all the time. What are the Conservatives afraid to hear with respect to their unfair elections act? Why will the minister not step out of his Ottawa bubble for just one minute, respect Canadians, consult with them, and allow the committee to travel?",New Democratic Party,Skeena--Bulkley Valley,Nathan Cullen,http://www.parl.gc.ca/parlinfo/Files/Parliamentarian.aspx?Item=031462db-8f61-48ed-bf9f-b033eb8312bb&Language=E&Section=ALL
4590392,ca.proc.d.2014-02-28.15885.40,2014-02-28,ad4032f2-6bb1-497b-b146-f321cfb71ba9,233,"Hon. Pierre Poilievre (Minister of State (Democratic Reform), CPC)",,Oral Questions,Democratic Reform,,"Mr. Speaker, the member talks about partisanship, which is why I regret so much that his party has taken such a partisan approach to this bill.
 NDP members announced before they even read the bill that they were opposed to it simply because it came from a different party. That is not the kind of leadership Canadians expect. He should have read the bill and studied his contents. He should be supporting a new ban on impersonators. He should support the new voter contact registry that would allow us to track robocalls and mass calling. He should support tougher penalties for voter deception. 
All of these things are right in the fair elections act, if only he would read it.",Conservative,Nepean--Carleton,Pierre Poilievre,http://www.parl.gc.ca/parlinfo/Files/Parliamentarian.aspx?Item=ad4032f2-6bb1-497b-b146-f321cfb71ba9&Language=E&Section=ALL
4590393,ca.proc.d.2014-02-28.15885.41,2014-02-28,3176068f-62ee-4b2f-aacd-1131201c6db1,242,"Hon. Geoff Regan (Halifax West, Lib.)",,Oral Questions,Finance,,"Mr. Speaker, two weeks ago, the Prime Minister and his Minister of Finance agreed that income splitting is bad economic policy. This week, while the Minister of Finance was out of the country, the Prime Minister backtracked and decided that he wants to implement this bad economic policy.
Is the government still listening to the Minister of Finance, or is he just a figurehead with no real power?",Liberal,Halifax West,Geoff Regan,http://www.parl.gc.ca/parlinfo/Files/Parliamentarian.aspx?Item=3176068f-62ee-4b2f-aacd-1131201c6db1&Language=E&Section=ALL
4590394,ca.proc.d.2014-02-28.15885.42,2014-02-28,f66407a4-934e-4c46-b524-b4dacd035ceb,613,"Mr. Andrew Saxton (Parliamentary Secretary to the Minister of Finance, CPC)",,Oral Questions,Finance,,"Mr. Speaker, the only income splitting the opposition understands is splitting the hard-earned income of Canadians from their pockets. 
Once we balance the budget, we will look at all ways of reducing the tax burden on Canadian families. In fact, since taking office in 2006, we have reduced over 160 different taxes, resulting in a savings to the average Canadian family of over $3,400 in 2014 alone. 
We are the only party reducing taxes on Canadian families. The Liberals and the NDP would both raise taxes to pay for their reckless spending schemes.",Conservative,North Vancouver,Andrew Saxton,http://www.parl.gc.ca/parlinfo/Files/Parliamentarian.aspx?Item=f66407a4-934e-4c46-b524-b4dacd035ceb&Language=E&Section=ALL
