basepk,hid,speechdate,pid,opid,speakeroldname,speakerposition,maintopic,subtopic,subsubtopic,speechtext,speakerparty,speakerriding,speakername,speakerurl
4588786,ca.proc.d.2014-02-13.15838.132,2014-02-13,95e9d5a2-e9a6-4037-b6a7-218bfdc01a33,425,"Hon. Jim Flaherty (Minister of Finance, CPC)",,Oral Questions,Taxation,,"Mr. Speaker, because of our government, Canadians enjoy the lowest taxes they have had in 50 years. We have done something that Liberals and NDP people do not do anything about. That is, we have reduced government spending. We have reduced government spending for three years in a row.
I know this is a foreign concept to the members opposite, but we have done it without reducing transfers to the provinces for health and education and transfers to individuals, including persons with disabilities.",Conservative,Whitby--Oshawa,Jim Flaherty,http://www.parl.gc.ca/parlinfo/Files/Parliamentarian.aspx?Item=95e9d5a2-e9a6-4037-b6a7-218bfdc01a33&Language=E&Section=ALL
4588787,ca.proc.d.2014-02-13.15838.133,2014-02-13,37174f12-1dc0-44f0-8065-4c09cf9ebca1,557,"Ms. Megan Leslie (Halifax, NDP)",,Oral Questions,Democratic Reform,,"Mr. Speaker, the NDP people, power to the people.
This morning, the Minister of State for Democratic Reform was at the Standing Committee on Procedure and House Affairs, but he did not explain his attacks on Marc Mayrand or his refusal to consult Canadians outside the Ottawa bubble. I would like to give him another opportunity to explain himself. 
Why does he refuse to travel to the various provinces across the country to consult all Canadians about his electoral reform plans?",New Democratic Party,Halifax,Megan Leslie,http://www.parl.gc.ca/parlinfo/Files/Parliamentarian.aspx?Item=37174f12-1dc0-44f0-8065-4c09cf9ebca1&Language=E&Section=ALL
4588788,ca.proc.d.2014-02-13.15838.134,2014-02-13,ad4032f2-6bb1-497b-b146-f321cfb71ba9,233,"Hon. Pierre Poilievre (Minister of State (Democratic Reform), CPC)",,Oral Questions,Democratic Reform,,"Mr. Speaker, I always travel outside Ottawa to speak to all Canadians.
I have spoken to Canadians about the fair elections act. For example, I spoke to organizations that represent persons with disabilities who have a hard time voting with the methods we use now.
We will develop better information for these people, so that they can learn about the special services available to help them vote. That is just one example of the ideas I heard from Canadians that I included in the fair elections act.",Conservative,Nepean--Carleton,Pierre Poilievre,http://www.parl.gc.ca/parlinfo/Files/Parliamentarian.aspx?Item=ad4032f2-6bb1-497b-b146-f321cfb71ba9&Language=E&Section=ALL
4588789,ca.proc.d.2014-02-13.15838.135,2014-02-13,d3b34b92-4b9c-4beb-9c3b-dd6146fb8b2c,65,"Mr. David Christopherson (Hamilton Centre, NDP)",,Oral Questions,Democratic Reform,,"Mr. Speaker, the parliamentary secretary to the government House leader left today's committee meeting on the unfair elections act to say he was against cross-country hearings, and said that meeting with Canadians would be a “gong show”. Does the Minister of State for Democratic Reform agree with the parliamentary secretary? Is that why they will not have cross-country public hearings, or are they just afraid to face Canadians?",New Democratic Party,Hamilton Centre,David Christopherson,http://www.parl.gc.ca/parlinfo/Files/Parliamentarian.aspx?Item=d3b34b92-4b9c-4beb-9c3b-dd6146fb8b2c&Language=E&Section=ALL
4588790,ca.proc.d.2014-02-13.15838.136,2014-02-13,ad4032f2-6bb1-497b-b146-f321cfb71ba9,233,"Hon. Pierre Poilievre (Minister of State (Democratic Reform), CPC)",,Oral Questions,Democratic Reform,,"Mr. Speaker, obviously the committee will hear from Canadians. The member merely has to provide a list of witnesses and they can all be brought to the committee for testimony. They can share their views. We will take them into consideration. I know the learned members of the committee will consider those views as they improve the bill, which has been described by the former CEO as an A minus. Hopefully the committee can work with the government for a change to turn it into an A plus.",Conservative,Nepean--Carleton,Pierre Poilievre,http://www.parl.gc.ca/parlinfo/Files/Parliamentarian.aspx?Item=ad4032f2-6bb1-497b-b146-f321cfb71ba9&Language=E&Section=ALL
4588791,ca.proc.d.2014-02-13.15838.137,2014-02-13,d3b34b92-4b9c-4beb-9c3b-dd6146fb8b2c,65,"Mr. David Christopherson (Hamilton Centre, NDP)",,Oral Questions,Democratic Reform,,"Mr. Speaker, the parliamentary secretary said he was opposed to cross-country hearings on the unfair elections act because it would influence public opinion. Is that what the minister is afraid of, Canadians having the audacity to exercise their democratic right to express their personal views on this bill?",New Democratic Party,Hamilton Centre,David Christopherson,http://www.parl.gc.ca/parlinfo/Files/Parliamentarian.aspx?Item=d3b34b92-4b9c-4beb-9c3b-dd6146fb8b2c&Language=E&Section=ALL
4588792,ca.proc.d.2014-02-13.15838.138,2014-02-13,ad4032f2-6bb1-497b-b146-f321cfb71ba9,233,"Hon. Pierre Poilievre (Minister of State (Democratic Reform), CPC)",,Oral Questions,Democratic Reform,,"Mr. Speaker, nothing could be further from the truth. The member and his party declared their opposition to the fair elections act before they had read a single word of it. Now they are trying to obstruct further examination of the question with an attempt at holding a costly circus that will distract from the work the committee needs to do, which is to study how we can keep everyday Canadians in charge of democracy by putting special interest groups to the sidelines and rule-breakers out of the game altogether.",Conservative,Nepean--Carleton,Pierre Poilievre,http://www.parl.gc.ca/parlinfo/Files/Parliamentarian.aspx?Item=ad4032f2-6bb1-497b-b146-f321cfb71ba9&Language=E&Section=ALL
4588793,ca.proc.d.2014-02-13.15838.139,2014-02-13,b8c04eca-f237-48a8-8975-374ccd40d1a9,567,"Mr. Justin Trudeau (Papineau, Lib.)",,Oral Questions,Health,,"Mr. Speaker, yesterday the ministers of finance, transport and small business all expressed reservations about the income-splitting campaign promise. The employment minister rebuked them, saying that Conservatives “always keep campaign commitments”.
Well, in the 2006 election, the Conservatives—",Liberal,Papineau,Justin Trudeau,http://www.parl.gc.ca/parlinfo/Files/Parliamentarian.aspx?Item=b8c04eca-f237-48a8-8975-374ccd40d1a9&Language=E&Section=ALL
4588794,ca.proc.d.2014-02-13.15838.140,2014-02-13,,,,intervention,Oral Questions,Health,," Oh, oh!",,,Some hon. members,
4588795,ca.proc.d.2014-02-13.15838.141,2014-02-13,6519cfba-0080-419d-baa9-8ae6e56d032f,256,The Speaker,,Oral Questions,Health,,"Order. I have asked members before to hold off until members are finished asking the questions before they applaud. I know they are eager to applaud the member, but they will be free to do so when he is finished asking the question.
The hon. member for Papineau.",Conservative,Regina--Qu'Appelle,Andrew Scheer,http://www.parl.gc.ca/parlinfo/Files/Parliamentarian.aspx?Item=6519cfba-0080-419d-baa9-8ae6e56d032f&Language=E&Section=ALL
4588796,ca.proc.d.2014-02-13.15838.142,2014-02-13,b8c04eca-f237-48a8-8975-374ccd40d1a9,567,Mr. Justin Trudeau,Interjection,Oral Questions,Health,,"Mr. Speaker, in the 2006 election, the Conservatives promised Canadians a patient wait times guarantee.
My question is for the Minister of Health. It has been eight years. When can we expect this promise to be kept?",Liberal,Papineau,Justin Trudeau,http://www.parl.gc.ca/parlinfo/Files/Parliamentarian.aspx?Item=b8c04eca-f237-48a8-8975-374ccd40d1a9&Language=E&Section=ALL
4588797,ca.proc.d.2014-02-13.15838.143,2014-02-13,cf6f39df-d304-45e1-a559-70a0cf20a720,6,"Hon. Rona Ambrose (Minister of Health, CPC)",,Oral Questions,Health,,"Mr. Speaker, in fact, we have invested over a billion dollars in the patient wait times guarantee. According to the Canadian Institute for Health information, there have been excellent results on the wait time guarantees, which we are working on with the provinces.",Conservative,Edmonton--Spruce Grove,Rona Ambrose,http://www.parl.gc.ca/parlinfo/Files/Parliamentarian.aspx?Item=cf6f39df-d304-45e1-a559-70a0cf20a720&Language=E&Section=ALL
4588798,ca.proc.d.2014-02-13.15838.144,2014-02-13,b8c04eca-f237-48a8-8975-374ccd40d1a9,567,"Mr. Justin Trudeau (Papineau, Lib.)",,Oral Questions,Taxation,,"They are still working on it eight years later.
Mr. Speaker, in the 2008 election, the Conservatives' most expensive campaign promise was to reduce taxes on diesel fuel by nearly a billion dollars each year.
My question is for the Minister of Finance. It has been over five years. Has he reconsidered that promise as well?",Liberal,Papineau,Justin Trudeau,http://www.parl.gc.ca/parlinfo/Files/Parliamentarian.aspx?Item=b8c04eca-f237-48a8-8975-374ccd40d1a9&Language=E&Section=ALL
4588799,ca.proc.d.2014-02-13.15838.145,2014-02-13,95e9d5a2-e9a6-4037-b6a7-218bfdc01a33,425,"Hon. Jim Flaherty (Minister of Finance, CPC)",,Oral Questions,Taxation,,"Mr. Speaker, we have reduced taxes in more than 160 ways since we were elected in 2006. We will continue to keep taxes low and balance the budget.
We do have a plan for a balanced budget. Unlike the members opposite, we will stick to our plan and the budget will be balanced in 2015.",Conservative,Whitby--Oshawa,Jim Flaherty,http://www.parl.gc.ca/parlinfo/Files/Parliamentarian.aspx?Item=95e9d5a2-e9a6-4037-b6a7-218bfdc01a33&Language=E&Section=ALL
4588800,ca.proc.d.2014-02-13.15838.146,2014-02-13,b8c04eca-f237-48a8-8975-374ccd40d1a9,567,"Mr. Justin Trudeau (Papineau, Lib.)",,Oral Questions,The Environment,,"Mr. Speaker, during the 2008 election campaign, the Conservatives promised to introduce emission regulations for the oil and gas sector. This Prime Minister even boasted that it would be the equivalent of a $65 price on carbon. That was over five years ago.
My question is for the Minister of the Environment. When can we expect this promise to be kept?",Liberal,Papineau,Justin Trudeau,http://www.parl.gc.ca/parlinfo/Files/Parliamentarian.aspx?Item=b8c04eca-f237-48a8-8975-374ccd40d1a9&Language=E&Section=ALL
4588801,ca.proc.d.2014-02-13.15838.147,2014-02-13,3ad715ec-41ca-4448-a759-7d1d2b901ae4,618,"Hon. Leona Aglukkaq (Minister of the Environment, Minister of the Canadian Northern Economic Development Agency and Minister for the Arctic Council, CPC)",,Oral Questions,The Environment,,"Mr. Speaker, our budget is committed to protecting our environment, as well as keeping our economy strong.
Building on our record of protecting historic amounts of land, budget 2014 is investing a significant amount of money in urgent areas, including nearly $400 million to fix dams, bridges, and highways through the national parks that are in urgent need of repair.
I have a question for the other side of the House. Why, after a decade of being in power, did the Liberals do nothing to maintain the infrastructure in these parks?",Conservative,Nunavut,Leona Aglukkaq,http://www.parl.gc.ca/parlinfo/Files/Parliamentarian.aspx?Item=3ad715ec-41ca-4448-a759-7d1d2b901ae4&Language=E&Section=ALL
4588802,ca.proc.d.2014-02-13.15838.148,2014-02-13,dead179f-dfcc-4f4d-a76b-7d2e4792095c,445,"Ms. Peggy Nash (Parkdale—High Park, NDP)",,Oral Questions,Intergovernmental Affairs,,"Mr. Speaker, we know that the finance minister and the employment minister are at odds over income-splitting. They are also at odds over working with the provinces. While the employment minister claims he is committed to negotiating a deal on job training, the finance minister is delivering threats and an ultimatum. He is uniting the provinces in opposition to this budget. The premiers of Ontario, Quebec, and even Saskatchewan are calling out the finance minister.
Will the finance minister start to listen to premiers like Brad Wall and maybe start working with the provinces?",New Democratic Party,Parkdale--High Park,Peggy Nash,http://www.parl.gc.ca/parlinfo/Files/Parliamentarian.aspx?Item=dead179f-dfcc-4f4d-a76b-7d2e4792095c&Language=E&Section=ALL
4588803,ca.proc.d.2014-02-13.15838.149,2014-02-13,95e9d5a2-e9a6-4037-b6a7-218bfdc01a33,425,"Hon. Jim Flaherty (Minister of Finance, CPC)",,Oral Questions,Intergovernmental Affairs,,"Mr. Speaker, what the budget says, if the hon. member cares to read it, is that negotiations are continuing with the provinces, the employment minister is continuing his discussions with the provinces, but that we want to move ahead by April 1.
The reason is that we have thousands of Canadians who are not matched with the thousands of jobs that are available. This matters to these young people in this country, and that is why we are moving ahead.",Conservative,Whitby--Oshawa,Jim Flaherty,http://www.parl.gc.ca/parlinfo/Files/Parliamentarian.aspx?Item=95e9d5a2-e9a6-4037-b6a7-218bfdc01a33&Language=E&Section=ALL
4588804,ca.proc.d.2014-02-13.15838.150,2014-02-13,dead179f-dfcc-4f4d-a76b-7d2e4792095c,445,"Ms. Peggy Nash (Parkdale—High Park, NDP)",,Oral Questions,The Budget,,"Mr. Speaker, clearly, this cabinet is divided and confused, and Canadians are being made to wait for help until the next election. No wonder the budget is being panned.
The Minister of Finance's budget also had nothing to say about climate change. We know the Conservatives' approach: it is to get marching orders from oil and gas lobbyists and then pit first nations, environmentalists, and concerned Canadians against resource companies.
Does the Minister of Finance really think that new snowmobile trails qualify as an environmental plan?",New Democratic Party,Parkdale--High Park,Peggy Nash,http://www.parl.gc.ca/parlinfo/Files/Parliamentarian.aspx?Item=dead179f-dfcc-4f4d-a76b-7d2e4792095c&Language=E&Section=ALL
4588805,ca.proc.d.2014-02-13.15838.151,2014-02-13,3ad715ec-41ca-4448-a759-7d1d2b901ae4,618,"Hon. Leona Aglukkaq (Minister of the Environment, Minister of the Canadian Northern Economic Development Agency and Minister for the Arctic Council, CPC)",,Oral Questions,The Budget,,"Mr. Speaker, our government is a world leader when it comes to addressing climate change.
We continue to work with the provinces and the territories on reducing emissions from the oil and gas sector. It is premature to comment further on any future regulations.
What I can say is that thanks to our actions, we have seen significant reductions in greenhouse gases, unlike the NDP who think that we can tax our way out of greenhouse gases.",Conservative,Nunavut,Leona Aglukkaq,http://www.parl.gc.ca/parlinfo/Files/Parliamentarian.aspx?Item=3ad715ec-41ca-4448-a759-7d1d2b901ae4&Language=E&Section=ALL
4588806,ca.proc.d.2014-02-13.15838.152,2014-02-13,a71a1741-7ff2-4246-b0da-4622e96b10cf,1082,"Mr. Guy Caron (Rimouski-Neigette—Témiscouata—Les Basques, NDP)",,Oral Questions,The Budget,,"Mr. Speaker, more and more provinces are coming out against the Conservatives' budgetary approach. One thing that really frustrates them is the April 1 ultimatum regarding the Canada job grant. By refusing to hold consultations and interfering in provincial jurisdictions, the Conservatives are punishing workers first and foremost, and they are stifling economic development.
I understand that things are not so rosy right now between the Minister of Finance and the Minister of Employment. Could they at least talk to one another and commit to withdrawing their ultimatum, which is doing nothing to help train workers?",New Democratic Party,Rimouski-Neigette--Témiscouata--Les Basques,Guy Caron,http://www.parl.gc.ca/parlinfo/Files/Parliamentarian.aspx?Item=a71a1741-7ff2-4246-b0da-4622e96b10cf&Language=E&Section=ALL
4588807,ca.proc.d.2014-02-13.15838.153,2014-02-13,106c623c-3606-40ae-a2f6-f4a619cf02f6,152,"Hon. Jason Kenney (Minister of Employment and Social Development and Minister for Multiculturalism, CPC)",,Oral Questions,The Budget,,"Mr. Speaker, we obviously need to do better when it comes to public investments in skills training. We also need to increase private sector investments in training. We need to connect training with real jobs. That is the goal of the Canada job grant. That is why we are working closely with the provinces to reach an agreement.
By the end of the fiscal year, we hope to be able to deliver not only training, but also jobs for young Canadians.",Conservative,Calgary Southeast,Jason Kenney,http://www.parl.gc.ca/parlinfo/Files/Parliamentarian.aspx?Item=106c623c-3606-40ae-a2f6-f4a619cf02f6&Language=E&Section=ALL
4588808,ca.proc.d.2014-02-13.15838.154,2014-02-13,d76f3534-c5d6-48cc-812f-00d8be4017ef,8500,"Mr. Sylvain Chicoine (Châteauguay—Saint-Constant, NDP)",,Oral Questions,Veterans,,"Mr. Speaker, this budget does not reverse the irresponsible and shameful cuts to veterans' services and, what is more, the Conservatives are also increasing taxes on the pensions of those who have served our country. Like public servants, members of the military will have to pay more for their pension plan. The Conservatives want to take hundreds of dollars more out of veterans' pockets.
Why are the Conservatives looking for more concessions from our veterans?",New Democratic Party,Châteauguay--Saint-Constant,Sylvain Chicoine,http://www.parl.gc.ca/parlinfo/Files/Parliamentarian.aspx?Item=d76f3534-c5d6-48cc-812f-00d8be4017ef&Language=E&Section=ALL
4588809,ca.proc.d.2014-02-13.15838.155,2014-02-13,26c8b0bc-42d4-4db5-bf7d-1e1544c7b4b5,9172,"Mr. Dan Albas (Parliamentary Secretary to the President of the Treasury Board, CPC)",,Oral Questions,Veterans,,"Mr. Speaker, the question is misleading.
Veterans with service-related conditions are covered by the new veterans charter program. What we are discussing here are changes to voluntary supplementary health benefits.
It is fair and reasonable that the costs of this voluntary supplementary health care coverage be split evenly with the taxpayers of Canada. Even with the changes, this remains an excellent deal and it will remain an affordable plan.",Conservative,Okanagan--Coquihalla,Dan Albas,http://www.parl.gc.ca/parlinfo/Files/Parliamentarian.aspx?Item=26c8b0bc-42d4-4db5-bf7d-1e1544c7b4b5&Language=E&Section=ALL
4588810,ca.proc.d.2014-02-13.15838.156,2014-02-13,c6909a0f-8a8f-4a2f-a882-ca2c7ea15be3,276,"Mr. Peter Stoffer (Sackville—Eastern Shore, NDP)",,Oral Questions,Veterans,,"Mr. Speaker, in 1995 the Liberal government changed the means test of the Last Post Fund from an entry level of $24,000 in income to $12,000 in income. Unfortunately, 19 years later, the means test is still at $12,000.
Now I thank the government very much for the fact that there is more money in the Last Post Fund. Some modern day veterans may now be eligible. However, if the means test is not changed, many families and their veterans who pass away will not have access to the Last Post Fund.
Will the government now change the means test so that more veterans who pass away and their families will have access to the program?",New Democratic Party,Sackville--Eastern Shore,Peter Stoffer,http://www.parl.gc.ca/parlinfo/Files/Parliamentarian.aspx?Item=c6909a0f-8a8f-4a2f-a882-ca2c7ea15be3&Language=E&Section=ALL
4588811,ca.proc.d.2014-02-13.15838.157,2014-02-13,e0ce3609-8e02-4fd0-ab57-193d8a295263,8361,"Hon. Julian Fantino (Minister of Veterans Affairs, CPC)",,Oral Questions,Veterans,,"Mr. Speaker, I want to assure the member that our government remains committed to ensuring that Canadian veterans and their families have the support they need.
That is why in economic action plan 2014, veterans' families can now avail themselves of some $108 million-plus with regard to the Last Post Fund to ensure that the modern day veterans previously excluded will be able to have a dignified burial.
We are doing the best we can, and we will continue working for our veterans.",Conservative,Vaughan,Julian Fantino,http://www.parl.gc.ca/parlinfo/Files/Parliamentarian.aspx?Item=e0ce3609-8e02-4fd0-ab57-193d8a295263&Language=E&Section=ALL
4588812,ca.proc.d.2014-02-13.15838.158,2014-02-13,1c721843-28d0-423b-94ae-ede577509178,415,"Ms. Chris Charlton (Hamilton Mountain, NDP)",,Oral Questions,Democratic Reform,,"Mr. Speaker, the Conservatives have blocked cross-country hearings on their unfair elections act. Obviously, they are afraid of public opinion. They are proposing massive and complex changes to our election laws that would significantly change the way our democracy operates.
Unlike the Conservatives, the NDP wants Canadians to have their say. Why are the Conservatives so opposed to consulting Canadians?",New Democratic Party,Hamilton Mountain,Chris Charlton,http://www.parl.gc.ca/parlinfo/Files/Parliamentarian.aspx?Item=1c721843-28d0-423b-94ae-ede577509178&Language=E&Section=ALL
4588813,ca.proc.d.2014-02-13.15838.159,2014-02-13,ad4032f2-6bb1-497b-b146-f321cfb71ba9,233,"Hon. Pierre Poilievre (Minister of State (Democratic Reform), CPC)",,Oral Questions,Democratic Reform,,"Mr. Speaker, she mentions the changes in the fair elections act. In fact, there are changes that would keep everyday Canadians in charge of democracy by putting special interests on the sidelines and rule breakers out of business. The bill would close loopholes to big money, such as the one the Liberals used to turn unpaid debts into illegal donations. It would crack down on political impostors who make rogue calls. It would make it easier to vote for law-abiding citizens, while preventing voter fraud.",Conservative,Nepean--Carleton,Pierre Poilievre,http://www.parl.gc.ca/parlinfo/Files/Parliamentarian.aspx?Item=ad4032f2-6bb1-497b-b146-f321cfb71ba9&Language=E&Section=ALL
4588814,ca.proc.d.2014-02-13.15838.160,2014-02-13,1c721843-28d0-423b-94ae-ede577509178,415,"Ms. Chris Charlton (Hamilton Mountain, NDP)",,Oral Questions,Democratic Reform,,"Mr. Speaker, the Conservatives have admitted that the reason they do not want hearings is because they are too afraid of public opinion. They are shutting down debate in the House and refusing to consult Canadians.
From Squamish to St. John's, Canadians are concerned, and they want an opportunity to have their say. Elections belong to the people, not to politicians.
Why will the government take the time to listen to Canadians?",New Democratic Party,Hamilton Mountain,Chris Charlton,http://www.parl.gc.ca/parlinfo/Files/Parliamentarian.aspx?Item=1c721843-28d0-423b-94ae-ede577509178&Language=E&Section=ALL
4588815,ca.proc.d.2014-02-13.15838.161,2014-02-13,ad4032f2-6bb1-497b-b146-f321cfb71ba9,233,"Hon. Pierre Poilievre (Minister of State (Democratic Reform), CPC)",,Oral Questions,Democratic Reform,,"Mr. Speaker, we have listened to Canadians. They told us that they want better law enforcement. That is why we are giving the watchdog of elections law sharper teeth, a longer reach, and a freer hand.
“Sharper teeth” means stronger penalties for existing offences. “Longer reach” means dozens of new offences that he would enforce, including a prohibition on obstructing the watchdog's investigations or lying to his investigators. “A freer hand” means that the watchdog would be completely independent, controlling his own investigations and his own staff, and that no one could fire him without cause.",Conservative,Nepean--Carleton,Pierre Poilievre,http://www.parl.gc.ca/parlinfo/Files/Parliamentarian.aspx?Item=ad4032f2-6bb1-497b-b146-f321cfb71ba9&Language=E&Section=ALL
4588816,ca.proc.d.2014-02-13.15838.162,2014-02-13,9bcb731e-774b-4fe3-bb03-8c92f59eaa6c,1823,"Ms. Alexandrine Latendresse (Louis-Saint-Laurent, NDP)",,Oral Questions,Democratic Reform,,"Mr. Speaker, the Conservatives stubbornly refuse to consult Canadians because, according to the Parliamentary Secretary to the Leader of the Government in the House of Commons, the NDP might mobilize too many people to challenge the bill. 
I would like to thank him very much for complimenting our organizational abilities. In fact, the NDP does not have to do anything to mobilize people against this affront to our democracy. The Conservatives should leave their Ottawa bubble and listen to what people in Quebec City, Sept-Îles, Trois-Rivières and Sherbrooke have to say. What are they afraid of?",New Democratic Party,Louis-Saint-Laurent,Alexandrine Latendresse,http://www.parl.gc.ca/parlinfo/Files/Parliamentarian.aspx?Item=9bcb731e-774b-4fe3-bb03-8c92f59eaa6c&Language=E&Section=ALL
4588817,ca.proc.d.2014-02-13.15838.163,2014-02-13,ad4032f2-6bb1-497b-b146-f321cfb71ba9,233,"Hon. Pierre Poilievre (Minister of State (Democratic Reform), CPC)",,Oral Questions,Democratic Reform,,"Mr. Speaker, that is why we want a debate on the substance of the Fair Elections Act. Even before reading a single word of the bill, the NDP were against it. They should work with us to strengthen our legislation and prevent fraudulent calls and illegal donations, such as the union donations that the NDP accepted.",Conservative,Nepean--Carleton,Pierre Poilievre,http://www.parl.gc.ca/parlinfo/Files/Parliamentarian.aspx?Item=ad4032f2-6bb1-497b-b146-f321cfb71ba9&Language=E&Section=ALL
4588818,ca.proc.d.2014-02-13.15838.164,2014-02-13,9bcb731e-774b-4fe3-bb03-8c92f59eaa6c,1823,"Ms. Alexandrine Latendresse (Louis-Saint-Laurent, NDP)",,Oral Questions,Democratic Reform,,"Mr. Speaker, I knew that the Conservatives routinely prevent debate in the House. I knew that they prefer to circumvent the legislative process and disregard any democratic legitimacy, but this time the Conservatives are clearly laughing at Canadians.
They are using the bill to give their party an advantage in the next election, and they do not even bother to listen to what Canadians have to say, probably because they are afraid of what they will hear.
If the Conservatives want to judge the quality of the Chief Electoral Officer's work, why not ask Canadians what they think?",New Democratic Party,Louis-Saint-Laurent,Alexandrine Latendresse,http://www.parl.gc.ca/parlinfo/Files/Parliamentarian.aspx?Item=9bcb731e-774b-4fe3-bb03-8c92f59eaa6c&Language=E&Section=ALL
