basepk,hid,speechdate,pid,opid,speakeroldname,speakerposition,maintopic,subtopic,subsubtopic,speechtext,speakerparty,speakerriding,speakername,speakerurl
4588721,ca.proc.d.2014-02-13.15838.67,2014-02-13,2347a7b8-8e45-4c51-bdc6-f6c32375ad50,189,Mr. Brian Masse,Interjection,Government Orders,The Budget,Financial Statement of Minister of Finance,"Mr. Speaker, my mother-in-law and father-in-law had a small business; a restaurant. I can tell members that one of the things I would first do is cap those terrible fees on small businesses that the banks with the credit cards are costing them. It is unreasonable.",New Democratic Party,Windsor West,Brian Masse,http://www.parl.gc.ca/parlinfo/Files/Parliamentarian.aspx?Item=2347a7b8-8e45-4c51-bdc6-f6c32375ad50&Language=E&Section=ALL
4588722,ca.proc.d.2014-02-13.15838.68,2014-02-13,14433f87-ee9b-4bcf-97f1-4e5fb273de36,729,Mrs. Stella Ambler,Interjection,Government Orders,The Budget,Financial Statement of Minister of Finance,"Oh, that is ridiculous.",Conservative,Mississauga South,Stella Ambler,http://www.parl.gc.ca/parlinfo/Files/Parliamentarian.aspx?Item=14433f87-ee9b-4bcf-97f1-4e5fb273de36&Language=E&Section=ALL
4588723,ca.proc.d.2014-02-13.15838.69,2014-02-13,2347a7b8-8e45-4c51-bdc6-f6c32375ad50,189,Mr. Brian Masse,Interjection,Government Orders,The Budget,Financial Statement of Minister of Finance,"No, it is not ridiculous. The member is saying that it is ridiculous, but it is not.
Those fees are costing small business a significant amount of revenue at the expense of the consumer and the business. Some businesses actually encourage people not to use their credit cards because it costs them more. That is a fact. It is a reality.
 The banks are doing well enough, but they are also getting corporate tax cuts right now. So if we are in a deficit still, according to the Conservative government, then we are still borrowing money to pay for corporate taxes because we do not have a surplus.
 That is wrong. That is what I would change.",New Democratic Party,Windsor West,Brian Masse,http://www.parl.gc.ca/parlinfo/Files/Parliamentarian.aspx?Item=2347a7b8-8e45-4c51-bdc6-f6c32375ad50&Language=E&Section=ALL
4588724,ca.proc.d.2014-02-13.15838.70,2014-02-13,b9a66490-c202-452b-bf24-fb82db6159f7,1766,"Mr. Jean Rousseau (Compton—Stanstead, NDP)",,Government Orders,The Budget,Financial Statement of Minister of Finance,"Mr. Speaker, today, I will focus on the reaction of my constituents to this non-budget tabled by the “sinister” Minister of Finance. Clearly, the government's intent was to go after the middle class and the working class—our country's workforce and the pillars of our economy—in order to actually destroy Canada's social fabric. This social fabric, woven by our predecessors, great prime ministers and people from across Canada, from coast to coast to coast, who have worked tirelessly for decades to uphold the fundamental rights— ",New Democratic Party,Compton--Stanstead,Jean Rousseau,http://www.parl.gc.ca/parlinfo/Files/Parliamentarian.aspx?Item=b9a66490-c202-452b-bf24-fb82db6159f7&Language=E&Section=ALL
4588725,ca.proc.d.2014-02-13.15838.71,2014-02-13,de0591ef-9a02-4f97-9541-63de484c96e3,87,The Acting Speaker (Mr. Barry Devolin),,Government Orders,The Budget,Financial Statement of Minister of Finance,Order. The hon. member for Chatham-Kent—Essex is rising on a point of order.,Conservative,Haliburton--Kawartha Lakes--Brock,Barry Devolin,http://www.parl.gc.ca/parlinfo/Files/Parliamentarian.aspx?Item=de0591ef-9a02-4f97-9541-63de484c96e3&Language=E&Section=ALL
4588726,ca.proc.d.2014-02-13.15838.72,2014-02-13,6dfe3b54-024b-432d-bc01-7f89da30b7cd,458,Mr. Dave Van Kesteren,Interjection,Government Orders,The Budget,Financial Statement of Minister of Finance,"Mr. Speaker, I would like clarification. 
I thought I heard the member refer to the Minister of Finance as the “Sinister of Finance”. That is totally unparliamentary behaviour. I wonder if we could maybe have that checked and, if that is the case, if we could have an apology.",Conservative,Chatham-Kent--Essex,Dave Van Kesteren,http://www.parl.gc.ca/parlinfo/Files/Parliamentarian.aspx?Item=6dfe3b54-024b-432d-bc01-7f89da30b7cd&Language=E&Section=ALL
4588727,ca.proc.d.2014-02-13.15838.73,2014-02-13,de0591ef-9a02-4f97-9541-63de484c96e3,87,The Acting Speaker (Mr. Barry Devolin),,Government Orders,The Budget,Financial Statement of Minister of Finance,"The chair appreciates the point of order, and I would remind all hon. members that in this place they are to refer to their colleagues either by their riding or by their office and to refrain from taking those titles or names of ridings and using them in a disparaging way.
The hon. member for Compton—Stanstead.",Conservative,Haliburton--Kawartha Lakes--Brock,Barry Devolin,http://www.parl.gc.ca/parlinfo/Files/Parliamentarian.aspx?Item=de0591ef-9a02-4f97-9541-63de484c96e3&Language=E&Section=ALL
4588728,ca.proc.d.2014-02-13.15838.74,2014-02-13,b9a66490-c202-452b-bf24-fb82db6159f7,1766,Mr. Jean Rousseau,Interjection,Government Orders,The Budget,Financial Statement of Minister of Finance,"Mr. Speaker, I would like to apologize to my colleagues. I misspoke and I apologize. What I said was inappropriate. Thank you for the reminder.
However, what is going on right now is a national catastrophe. The Conservatives show no regard for the environment. They ignore climate change and have absolutely no use for science. Now, they are targeting people and workers all across Canada. That is unacceptable. Perhaps that is why I got carried away and misspoke.
GDP growth has been going down after each budget, year after year. Why? Because the government is not thinking about stimulating the economy. It has not developed the framework and the environment needed to stimulate and diversify Canada's economy. That is evident everywhere, especially in the rural regions. Rural regions are doing especially poorly, since the government has abandoned the pioneering sectors that helped build our country, such as forestry and agriculture. Furthermore, it is cutting employment insurance, a program that is meant to be there during tough times, when people are transitioning between jobs. Once again, from coast to coast, rural economies are in jeopardy because the government is not supporting workers during these transitional periods.
We currently have $618 billion of national debt. We had a $20 billion surplus and now, over the past few years, we have had a $60 billion deficit. Debt has increased by nearly $130 billion in recent years. That is unacceptable. This has all happened at the expense of public services. The government has cut essential services for veterans, employment insurance and social housing, which is essential in our urban communities. Not necessarily in rural areas, but certainly in urban areas. The government has also completely ignored public transit. I think members can understand why some ministers are considered as sinister. I apologize, but it is what it is. That is what people are telling me. They are disappointed. They seriously think that this is a violation of their rights and freedoms. Why? Because 39% of people voted for this government, which means that 61% of the people who voted in the 2011 election did not vote for this government. When the time comes to draft a budget and create programs to stimulate the economy, the government abandons people.
We have talked more than once about the need to address the high costs that retailers pay banks to process credit card transactions, as my colleague who spoke before me mentioned. The only thing the government can come up with is to hold consultations to determine the best way to disclose these costs.
What we want are much stricter, more draconian measures to fight these practices that are costing consumers because the costs are passed down to them after all. Again, if the government wants to stimulate the retail economy then it will have to address these costs one of these days.
I was talking about workers' rights earlier. Cutting the public service, the services that Canadians are entitled to, by attacking the pay and benefits that have been negotiated over the past few decades is an affront.
It is no wonder that occupational illnesses are on the rise, especially in the public service. The workplace is no longer healthy. It has become unbearable, including for some employment insurance officers who are under pressure because of quotas that are forcing them to attack people who are entitled to benefits. These measures are hindering tourism, agriculture, culture and sports in the regions. It is unbelievable.
On the topic of transport, infrastructure and communities, need I mention the Lac-Mégantic tragedy to explain how important rail safety is to the people in my region? Again yesterday, a group stood up to Transport Canada to denounce its ineptitude at dealing with the infractions committed by private companies. It is inaction. 
In the past three years, there was a tremendous number of infractions in my region, and no one ever did anything about it. There was a three-foot stretch of track that had not been repaired in two years. A month before the Lac-Mégantic tragedy, there was a spill that caused environmental damage. A month later, tragedy struck.
It is irresponsible and unacceptable for an industrialized country that is a member of the G7 and the G20 to table such a budget, given that the railway sector supports economic development across Canada. The government literally could not care less about rail safety. People living next to railway tracks are scratching their heads and wondering when the next tragedy will strike.
Well, there was already one in New Brunswick a few months ago, and we knew that would happen. All the players reviewing the Lac-Mégantic tragedy were certain that another tragedy would occur in that part of the country. People were abandoned.
It is the government's responsibility to make sure that private and public railways are safe. However, there is still nothing in this budget to protect my constituents. It is unacceptable.
I will quickly mention the government's interference in health and education. The only thing the provinces have always asked for is the money owed to them. It is up to them to decide where and how to invest it. They have this right under the Constitution. The NDP reaffirmed this right in the Sherbrooke declaration. We are the only ones to guarantee that right.
The government has abandoned agriculture, food safety and the environment, just to name a few areas. There is no mention of climate change or environmental concerns. 
To conclude, Canadians deserve much better than this government, which is completely out of touch with the realities and needs of the people. If Canadians want to support the development of a just society and a prosperous economy, they must vote for the NDP in 2015.",New Democratic Party,Compton--Stanstead,Jean Rousseau,http://www.parl.gc.ca/parlinfo/Files/Parliamentarian.aspx?Item=b9a66490-c202-452b-bf24-fb82db6159f7&Language=E&Section=ALL
4588729,ca.proc.d.2014-02-13.15838.75,2014-02-13,14433f87-ee9b-4bcf-97f1-4e5fb273de36,729,"Mrs. Stella Ambler (Mississauga South, CPC)",,Government Orders,The Budget,Financial Statement of Minister of Finance,"Mr. Speaker, the hon. member mentioned that there were no initiatives in the budget related to the environment.
 I am holding a copy of budget 2014, the economic action plan, here in my hands, and I am wondering if the member is aware of the initiatives to sustain Canada's national parks; to conserve recreational fisheries, one of my favourites that I will be thinking about a little bit later; to encourage donations of ecologically sensitive land; to improve recreational trails; and to expand tax support, for example, for clean energy generation. These are all very clear and concrete environmental initiatives.
Perhaps the member has not come to page 160, but I would suggest that if he has not, he read that part, because it includes these very concrete measures to improve Canada's environment. I am just wondering if he has seen these ones.",Conservative,Mississauga South,Stella Ambler,http://www.parl.gc.ca/parlinfo/Files/Parliamentarian.aspx?Item=14433f87-ee9b-4bcf-97f1-4e5fb273de36&Language=E&Section=ALL
4588730,ca.proc.d.2014-02-13.15838.76,2014-02-13,b9a66490-c202-452b-bf24-fb82db6159f7,1766,Mr. Jean Rousseau,Interjection,Government Orders,The Budget,Financial Statement of Minister of Finance,"Mr. Speaker, of course I saw those measures, but they were pretty insignificant and not at all proactive. Polluters are under no obligation to take responsibility for spills or environmentally destructive activities. Major polluters are not responsible at all.
The government is using tax credits to provide billions in subsidies to the mining and oil industries. When those industries leave Quebec's far north a few years later, they leave behind sites that need to be decontaminated. The companies that make the messes leave the country or go into hiding. The first nations are fed up with all these contaminated sites. Major polluters do not take any responsibility at all.",New Democratic Party,Compton--Stanstead,Jean Rousseau,http://www.parl.gc.ca/parlinfo/Files/Parliamentarian.aspx?Item=b9a66490-c202-452b-bf24-fb82db6159f7&Language=E&Section=ALL
4588731,ca.proc.d.2014-02-13.15838.77,2014-02-13,0c9d00b0-a035-46d3-ba51-0db3e8da19b8,9253,"Mr. Murray Rankin (Victoria, NDP)",,Government Orders,The Budget,Financial Statement of Minister of Finance,"Mr. Speaker, speaking of the environment, I noticed that the words “climate change” do not even exist in the budget document. I notice that the Conservatives have spent millions on the National Energy Board to help us get fossil fuels to market more efficiently. I notice that there are more subsidies for promoting offshore oil and gas facilities. Yet I notice that there is nothing about renewable energy such as the eco-energy retrofit program that has been sought.
 I wonder if those are the sorts of things the member was talking about. I wonder if he could elaborate on the government's environmental commitments as reflected in the budget document.",New Democratic Party,Victoria,Murray Rankin,http://www.parl.gc.ca/parlinfo/Files/Parliamentarian.aspx?Item=0c9d00b0-a035-46d3-ba51-0db3e8da19b8&Language=E&Section=ALL
4588732,ca.proc.d.2014-02-13.15838.78,2014-02-13,b9a66490-c202-452b-bf24-fb82db6159f7,1766,Mr. Jean Rousseau,Interjection,Government Orders,The Budget,Financial Statement of Minister of Finance,"Mr. Speaker, this shows the extent to which the government is thumbing its nose at research, innovation and science. It has cut geological departments even though we have a flourishing mining industry. It fired vast numbers of scientists working for Environment Canada and geological services. Now the government is trying to convince me that it cares about the environment.
Unfortunately, the budget does not even mention climate change. We already know that some crops can no longer be grown in some parts of Canada because of climate change, so the government will have a very hard time convincing me that it is taking meaningful action on the environment. It is just not true.",New Democratic Party,Compton--Stanstead,Jean Rousseau,http://www.parl.gc.ca/parlinfo/Files/Parliamentarian.aspx?Item=b9a66490-c202-452b-bf24-fb82db6159f7&Language=E&Section=ALL
4588733,ca.proc.d.2014-02-13.15838.79,2014-02-13,eaa6694f-1e20-4aae-ad3b-e694b0e12c59,9187,"Ms. Elizabeth May (Saanich—Gulf Islands, GP)",,Government Orders,The Budget,Financial Statement of Minister of Finance,"Mr. Speaker, to cast some light on what was said earlier by my friend from Mississauga South, one must remember that in the 2012 budget, Parks Canada was cut by 10%. That has been a significant, really deep, and devastating cut to Parks Canada's capacity. All the scientific work in Parks Canada has ended because all the scientists have been laid off. 
One of the consequences of these deep cuts across Canada has been that Parks Canada's infrastructure is crumbling. The money in the budget for Parks Canada, which I am glad to see, it is not to protect national parks but to protect Canadians who are trying to drive through national parks. It is to repair the roads, the bridges, and existing dams. There is nothing new in the budget to repair the damage done to Parks Canada in previous budgets.",Green,Saanich--Gulf Islands,Elizabeth May,http://www.parl.gc.ca/parlinfo/Files/Parliamentarian.aspx?Item=eaa6694f-1e20-4aae-ad3b-e694b0e12c59&Language=E&Section=ALL
4588734,ca.proc.d.2014-02-13.15838.80,2014-02-13,b9a66490-c202-452b-bf24-fb82db6159f7,1766,Mr. Jean Rousseau,Interjection,Government Orders,The Budget,Financial Statement of Minister of Finance,"Mr. Speaker, Parks Canada used to be a source of national pride from coast to coast. There are national parks in my riding. People were proud to work there. It was a flourishing industry for tourism and economic development in many regions of the country. Now the government is abandoning that sector, that source of national pride. Once again, that is unacceptable. It will take years to repair the damage that the Conservatives have done over the past nine years. In 2015, people will have to take action and elect an NDP government.",New Democratic Party,Compton--Stanstead,Jean Rousseau,http://www.parl.gc.ca/parlinfo/Files/Parliamentarian.aspx?Item=b9a66490-c202-452b-bf24-fb82db6159f7&Language=E&Section=ALL
4588735,ca.proc.d.2014-02-13.15838.81,2014-02-13,14433f87-ee9b-4bcf-97f1-4e5fb273de36,729,"Mrs. Stella Ambler (Mississauga South, CPC)",,Government Orders,The Budget,Financial Statement of Minister of Finance,"Mr. Speaker, it is my distinct pleasure and honour today to speak to the budget. I will be splitting my time with my hon. colleague the member for Dauphin—Swan River—Marquette.
I have been reading the budget and making a few notes, and there are a couple of highlights I would like to flag not just for members of the House, but also for my constituents back home in Mississauga South who will benefit from the budget.
I realize that not many viewers are watching because everyone is probably rivetted to the Canadian men's Olympic hockey game that is going on right now. This budget reflects the excitement that many Canadians are feeling about the Olympics and about the hockey game.
 The captain of our team for budget 2014, the hon. Minister of Finance, has stickhandled the budget once again. This is his 10th budget and he has once again done a great job. With over one million new jobs created since the worst of the recession, I am very proud at how the Minister of Finance has dealt with this. 
I appreciate that those who are not watching the hockey game are listening to me. I would like to tell the House about a couple of things that are important to me, my constituents, and all Canadians. I would like to continue on the theme of the environment, which we have been talking a bit about today. This issue is of great importance in the riding of Mississauga South. 
 I have had some experience with recreational fisheries in working with Credit Valley Conservation. It has done a wonderful job in restoring the wetlands in the Rattray Marsh area of Lake Ontario in south Mississauga, and I thank it for that. 
I also want to thank the Minister of Finance for renewing the recreational fisheries community partnerships program. An additional $15 million will be provided over two years to extend this partnership program. My colleague across the way will also probably highlight this program but I wanted to mention it because people sometimes do not know that urban areas also benefit from these types of programs. 
My riding, which is situated on beautiful Lake Ontario and has the Credit River running through it, has been able to benefit from this program and leverage double the funds as a result. We have been able to help restore the Rattray Marsh wetlands. As I said earlier, in concrete ways we are actually helping the environment, and that is a big deal to me.
In terms of the environment and families, I am quite proud that the budget recognizes the Earth Rangers Foundation. This organization is dedicated to educating children and families about biodiversity and empowers them to become directly involved in protecting animals and their habitats. It is an organization that operates across Canada. I have seen the work it does in the GTA. I am particularly pleased that economic action plan 2014 would provide $3 million over three years to support and expand the existing family oriented conservation and biodiversity programs of the Earth Rangers Foundation .
I would like to switch gears for a moment. I am not sure if the House is aware that I had the honour to chair a special parliamentary standing committee on missing and murdered aboriginal women. The committee studied violence against aboriginal women in Canada.
This is a huge problem—not just in the aboriginal community—one that all Canadians care deeply about and one that our government is working very hard to erase. That is why I was so proud when I saw that this government is making this a priority by establishing a DNA-based missing persons index or registry. Essentially, we would be using technology to help find these women. We need to use all the tools available to us to solve this very tragic problem. Budget 2014 would provide $8.1 million over five years to create this DNA-based missing persons index. Once this DNA data bank is established, it will be much easier for the RCMP to continue doing the work it needs to do to find missing women and to identify remains.
While that is very important, I would also like to point out that, related to that, there has been a renewal of $25 million to address violence against aboriginal women and girls in general. This same pocket of funding actually started in 2010 with $25 million, so we renewed it in this budget because the five years was almost up. In the last few years, with that funding, the government has made targeted improvements to law enforcement and the justice system, including the creation of a national centre for missing persons and unidentified remains. 
The government has also made enhancements to the victims fund to ensure that aboriginal victims and families of missing and murdered aboriginal women have access to culturally appropriate services; and it has supported the development of community-based awareness initiatives, which are very important, as well as safety plans to promote the safety of aboriginal women and girls. These are issues that the committee has been discussing for the past year, almost, and I am delighted that the government has recognized we need to take action. We are putting our money where our mouth is on this issue. As I say, there will be another $25 million over five years to continue efforts to reduce violence against women; this is an issue that all Canadians care about.
I was on the phone this morning with a representative of Community Living Mississauga. Her name is Debbie Moffatt. We were talking about the ready, willing, and able initiative, which is mentioned on page 62 of the budget. For people who are not aware, this organization helps people with intellectual disabilities—autism, for example—to gain employment, because people sometimes need a little extra help and a hand up. They are able to become contributing members of society with the help of the Canadian Association for Community Living. I am familiar with the Mississauga branch, which does very good work. 
In fact, when we met in my office quite a few months ago, Debbie was telling me about Costco, which is one of the companies that has taken on the ready, willing, and able program. It is having great success in hiring folks through this program. I would like to quote, from the budget, one of the new Costco employees, as a result of this program, who said:
 I'm very happy about getting this job, and I'm getting paid an equal wage—and a good one at that. I look forward to being part of a team and not being treated any differently—now I can tell my brother, my friends and my mom that I work at Costco! 
These are the kinds of things that ready, willing, and able does for folks with intellectual disabilities.
I wanted to talk about supporting women entrepreneurs, but perhaps I can fit that into one of the answers.",Conservative,Mississauga South,Stella Ambler,http://www.parl.gc.ca/parlinfo/Files/Parliamentarian.aspx?Item=14433f87-ee9b-4bcf-97f1-4e5fb273de36&Language=E&Section=ALL
