basepk,hid,speechdate,pid,opid,speakeroldname,speakerposition,maintopic,subtopic,subsubtopic,speechtext,speakerparty,speakerriding,speakername,speakerurl
4588654,ca.proc.d.2014-02-13.15838.0,2014-02-13,aa58e8f5-4a46-4c79-8e97-b9ebe28c9d9a,295,"Hon. Peter Van Loan (Leader of the Government in the House of Commons, CPC)",,Routine Proceedings,"Supplementary Estimates (C), 2013-14",,"Mr. Speaker, I have a message from His Excellency the Governor General, signed by his own hand.",Conservative,York--Simcoe,Peter Van Loan,http://www.parl.gc.ca/parlinfo/Files/Parliamentarian.aspx?Item=aa58e8f5-4a46-4c79-8e97-b9ebe28c9d9a&Language=E&Section=ALL
4588655,ca.proc.d.2014-02-13.15838.1,2014-02-13,6519cfba-0080-419d-baa9-8ae6e56d032f,256,The Speaker,,Routine Proceedings,"Supplementary Estimates (C), 2013-14",,"His Excellency the Governor General transmits to the House of Commons the supplementary estimates (C) of sums required to defray expenses of the federal public administration for the fiscal year ending on March 31, 2014; and, in accordance with section 54 of the Constitution Act 1867, recommends those estimates to the House of Commons.",Conservative,Regina--Qu'Appelle,Andrew Scheer,http://www.parl.gc.ca/parlinfo/Files/Parliamentarian.aspx?Item=6519cfba-0080-419d-baa9-8ae6e56d032f&Language=E&Section=ALL
4588656,ca.proc.d.2014-02-13.15838.2,2014-02-13,9afd15e3-d6df-4779-ba0f-5a305ebb77b5,268,"Mrs. Joy Smith (Kildonan—St. Paul, CPC)",,Routine Proceedings,Petitions,Criminal Code,"Mr. Speaker, I have with me this morning a petition with 3,000 signatures from all over our great nation, calling on Parliament to decriminalize the selling of sexual services by victims, and to criminalize the purchase of the sexual services by the predators who use them.
I respectfully submit this from petitioners all across Canada.",Conservative,Kildonan--St. Paul,Joy Smith,http://www.parl.gc.ca/parlinfo/Files/Parliamentarian.aspx?Item=9afd15e3-d6df-4779-ba0f-5a305ebb77b5&Language=E&Section=ALL
4588657,ca.proc.d.2014-02-13.15838.3,2014-02-13,d013e8ca-fdd5-4eb4-a0e4-b5f0782a8f6d,8333,"Mr. Fin Donnelly (New Westminster—Coquitlam, NDP)",,Routine Proceedings,Petitions,Shark Finning,"Mr. Speaker, I rise today to present a petition from thousands of Canadians who are calling on the Government of Canada to immediately impose a ban on the importation of shark fins to Canada.",New Democratic Party,New Westminster--Coquitlam,Fin Donnelly,http://www.parl.gc.ca/parlinfo/Files/Parliamentarian.aspx?Item=d013e8ca-fdd5-4eb4-a0e4-b5f0782a8f6d&Language=E&Section=ALL
4588658,ca.proc.d.2014-02-13.15838.4,2014-02-13,f470e27a-a074-4b16-8304-960ffe8c9289,24,"Hon. Carolyn Bennett (St. Paul's, Lib.)",,Routine Proceedings,Petitions,Aboriginal Affairs,"Mr. Speaker, I am honoured to rise today to present a petition on behalf of the Native Women's Association of Canada, which urges the government to hold a national public inquiry into the ongoing tragedy of the drastically disproportionate numbers of missing and murdered indigenous women and girls in Canada. The petition also calls on the government to involve those most affected by this tragic issue, aboriginal women, in the design and implementation of this inquiry.
I would like to take the opportunity to recognize that the president of the Native Women's Association of Canada, Michèle Audette, is on the Hill today, with Elder Annie St. Georges and loved ones of the victims, to speak about their online petition which also calls for a national inquiry. It has more than 17,000 signatures.",Liberal,St. Paul's,Carolyn Bennett,http://www.parl.gc.ca/parlinfo/Files/Parliamentarian.aspx?Item=f470e27a-a074-4b16-8304-960ffe8c9289&Language=E&Section=ALL
4588659,ca.proc.d.2014-02-13.15838.5,2014-02-13,6f07c370-1b80-4b71-a801-e5e8e70cf1d4,593,"Mr. Glenn Thibeault (Sudbury, NDP)",,Routine Proceedings,Petitions,Canada Post,"Mr. Speaker, I am very pleased to rise today in the House to present petitions from a few hundred Canadians who are upset with Canada Post's decision to axe good jobs and home delivery, and the cost of stamps. They are asking the government to reverse these cuts to services that were recently announced and to look at ways to modernize operations instead.",New Democratic Party,Sudbury,Glenn Thibeault,http://www.parl.gc.ca/parlinfo/Files/Parliamentarian.aspx?Item=6f07c370-1b80-4b71-a801-e5e8e70cf1d4&Language=E&Section=ALL
4588660,ca.proc.d.2014-02-13.15838.6,2014-02-13,5f76e2e0-e77a-4928-aa31-a8d066f384a4,1813,"Ms. Lise St-Denis (Saint-Maurice—Champlain, Lib.)",,Routine Proceedings,Petitions,VIA Rail,"Mr. Speaker, today I am presenting part of a petition signed by 24,000 people in New Brunswick who, like those in northern Mauricie, are struggling with cuts to rail service.",Liberal,Saint-Maurice--Champlain,Lise St-Denis,http://www.parl.gc.ca/parlinfo/Files/Parliamentarian.aspx?Item=5f76e2e0-e77a-4928-aa31-a8d066f384a4&Language=E&Section=ALL
4588661,ca.proc.d.2014-02-13.15838.7,2014-02-13,0253e859-f573-4a61-8c88-0466545df2fa,8547,"Ms. Ève Péclet (La Pointe-de-l'Île, NDP)",,Routine Proceedings,Petitions,Gatineau Park,"Mr. Speaker, today I am presenting two petitions signed by hundreds of people. They are calling on the government to make regulations to protect Gatineau Park.
Gatineau Park is home to about 90 endangered plant and 50 endangered animal species. The park is a gem, and it would be in the government's interest to listen to what Canadians and Quebeckers are saying. The government should make regulations to protect this magnificent park.",New Democratic Party,La Pointe-de-l'Île,Ève Péclet,http://www.parl.gc.ca/parlinfo/Files/Parliamentarian.aspx?Item=0253e859-f573-4a61-8c88-0466545df2fa&Language=E&Section=ALL
4588662,ca.proc.d.2014-02-13.15838.8,2014-02-13,c5378648-5d94-4645-bc05-339090e1077b,577,"Ms. Kirsty Duncan (Etobicoke North, Lib.)",,Routine Proceedings,Petitions,Multiple Sclerosis,"Mr. Speaker, I am pleased to present this petition on CCSVI. 
It has been four years since Canadians began travelling overseas for treatment for CCSVI. Canadians with MS are wondering how the government is going to judge the radically different CCSVI data from the east and west of Canada, and when there might be an update on the government's MS registry, which was announced in March 2011.
The petitioners call upon the Minister of Health to undertake phase III clinical trials on an urgent basis in the multiple centres across Canada, and to require follow-up care.",Liberal,Etobicoke North,Kirsty Duncan,http://www.parl.gc.ca/parlinfo/Files/Parliamentarian.aspx?Item=c5378648-5d94-4645-bc05-339090e1077b&Language=E&Section=ALL
4588663,ca.proc.d.2014-02-13.15838.9,2014-02-13,a71a1741-7ff2-4246-b0da-4622e96b10cf,1082,"Mr. Guy Caron (Rimouski-Neigette—Témiscouata—Les Basques, NDP)",,Routine Proceedings,Petitions,VIA Rail,"Mr. Speaker, I would like to present a petition signed by more than 100 people. It can be added to the others that have been signed by hundreds of people, urging the Canadian government to take any measure necessary to preserve the rail line between Montreal and Halifax.
We know that the segment between Bathurst and Miramichi is currently for sale and may close down, which could compromise rail transportation in eastern Quebec and the Maritimes. The more than 100 names on this petition are an addition to the hundreds of signatures that the House has already received. We are asking the Canadian government to take action.",New Democratic Party,Rimouski-Neigette--Témiscouata--Les Basques,Guy Caron,http://www.parl.gc.ca/parlinfo/Files/Parliamentarian.aspx?Item=a71a1741-7ff2-4246-b0da-4622e96b10cf&Language=E&Section=ALL
4588664,ca.proc.d.2014-02-13.15838.10,2014-02-13,669a6720-3704-48ff-a218-4035d05107a6,553,"Ms. Judy Foote (Random—Burin—St. George's, Lib.)",,Routine Proceedings,Petitions,The Environment,"Mr. Speaker, I have two petitions to present today. 
The first petition is on behalf of my constituents with respect to hydraulic fracturing. 
The petitioners call upon the Government of Canada to ban the practice of hydraulic fracturing. They are speaking to the process itself and what is required for it to take place.
 The petitioners point out that several Canadian provinces, as well as several U.S. states, have halted the practice. The petitioners are calling on the Government of Canada to do the same. ",Liberal,Random--Burin--St. George's,Judy Foote,http://www.parl.gc.ca/parlinfo/Files/Parliamentarian.aspx?Item=669a6720-3704-48ff-a218-4035d05107a6&Language=E&Section=ALL
4588665,ca.proc.d.2014-02-13.15838.11,2014-02-13,669a6720-3704-48ff-a218-4035d05107a6,553,"Ms. Judy Foote (Random—Burin—St. George's, Lib.)",,Routine Proceedings,Petitions,Mining Industry,"Mr. Speaker, the second petition is also from my constituents, who are concerned about mining. The petitioners want the creation of a legislative ombudsman mechanism for responsible mining. 
The petitioners are saying that there is not enough oversight in terms of mining practices. Therefore, they call upon the Government of Canada to create a legislative ombudsman mechanism for responsible mining.",Liberal,Random--Burin--St. George's,Judy Foote,http://www.parl.gc.ca/parlinfo/Files/Parliamentarian.aspx?Item=669a6720-3704-48ff-a218-4035d05107a6&Language=E&Section=ALL
4588666,ca.proc.d.2014-02-13.15838.12,2014-02-13,5447e155-ea58-4c9e-b7bc-b712c698691a,416,"Ms. Olivia Chow (Trinity—Spadina, NDP)",,Routine Proceedings,Petitions,Parks Canada,"Mr. Speaker, I have two petitions.
The first petition is from people who are worried about the cutbacks in operation hours for the Rideau Canal and Trent-Severn Waterway. The petitioners would like the hours to be restored to the service level of 2011. ",New Democratic Party,Trinity--Spadina,Olivia Chow,http://www.parl.gc.ca/parlinfo/Files/Parliamentarian.aspx?Item=5447e155-ea58-4c9e-b7bc-b712c698691a&Language=E&Section=ALL
4588667,ca.proc.d.2014-02-13.15838.13,2014-02-13,5447e155-ea58-4c9e-b7bc-b712c698691a,416,"Ms. Olivia Chow (Trinity—Spadina, NDP)",,Routine Proceedings,Petitions,Public Transit,"Mr. Speaker, the second petition is from constituents who call upon the government to provide long-term, predictable, and non-partisan funding for public transit.
 The petitioners believe that Canadians deserve fast, reliable, and affordable public transit, and that there is an estimated $32-billion investment gap in public transit infrastructure needs across Canada.",New Democratic Party,Trinity--Spadina,Olivia Chow,http://www.parl.gc.ca/parlinfo/Files/Parliamentarian.aspx?Item=5447e155-ea58-4c9e-b7bc-b712c698691a&Language=E&Section=ALL
4588668,ca.proc.d.2014-02-13.15838.14,2014-02-13,4bc128a9-b349-4867-a545-ad05122c0e46,598,"Ms. Niki Ashton (Churchill, NDP)",,Routine Proceedings,Petitions,Aboriginal Affairs,"Mr. Speaker, it is my honour to present a petition on behalf of the Native Women's Association of Canada. It is a petition that has been signed by tens of thousands of Canadians.
The petitioners are asking the Conservative government to call a national inquiry into missing and murdered indigenous women. It is time to do that for the families of those who are grieving for their communities. It is time for justice. 
I want to acknowledge the hard work in moving this petition by people like Elder Annie St. Georges; family members of women who are missing, such as Lorna Martin, Sue Martin, and Gail Nepinak; as well as the team at the Native Women's Association of Canada, president Michéle Audette; Irene Goodwin, Teresa Edwards, Daryle Gardipy, Jackie Brennan, Amanda Mitchell, Rebekah Elkerton, and Sarah MacLean. I thank them very much.",New Democratic Party,Churchill,Niki Ashton,http://www.parl.gc.ca/parlinfo/Files/Parliamentarian.aspx?Item=4bc128a9-b349-4867-a545-ad05122c0e46&Language=E&Section=ALL
4588669,ca.proc.d.2014-02-13.15838.15,2014-02-13,07cf5767-802c-406c-92a7-7dc92af79b40,4264,"Mr. Kevin Lamoureux (Winnipeg North, Lib.)",,Routine Proceedings,Petitions,Ukraine,"Mr. Speaker, I am tabling a petition today that expresses the concerns of people from across Canada who are urging Parliament to take action to help facilitate a peaceful resolution to the current unrest and government-sanctioned, anti-democratic crackdown against Ukrainians. 
In cities across Ukraine, Euromania protesters are demanding a democratic Ukraine that must allow for opposition voices to exist and be heard. The current treatment of protesters and human rights violations must be admonished.
This petition asks Parliament to stand in solidarity with Ukrainians and to impose targeted sanctions against individuals who are responsible for the ongoing violations in Ukraine.",Liberal,Winnipeg North,Kevin Lamoureux,http://www.parl.gc.ca/parlinfo/Files/Parliamentarian.aspx?Item=07cf5767-802c-406c-92a7-7dc92af79b40&Language=E&Section=ALL
4588670,ca.proc.d.2014-02-13.15838.16,2014-02-13,000a129f-5449-40ed-94d2-7e21a262b0b1,8528,"Ms. Nycole Turmel (Hull—Aylmer, NDP)",,Routine Proceedings,Petitions,Gatineau Park,"Mr. Speaker, I too have the pleasure to present a petition signed by residents of the national capital region who are calling on the government to pass legislation that would give Gatineau Park full protection.",New Democratic Party,Hull--Aylmer,Nycole Turmel,http://www.parl.gc.ca/parlinfo/Files/Parliamentarian.aspx?Item=000a129f-5449-40ed-94d2-7e21a262b0b1&Language=E&Section=ALL
4588671,ca.proc.d.2014-02-13.15838.17,2014-02-13,699ff70f-3ea7-44fb-91a0-cd238afd535c,1788,"Ms. Francine Raynault (Joliette, NDP)",,Routine Proceedings,Petitions,Manawan School,"Mr. Speaker, I am presenting a petition signed by 688 people.
We, the undersigned, are calling on the Government of Canada to fulfill the commitment it made by adopting Motion No. 571 on September 16, 2010, and address the untenable situation in Manawan. These children are looking forward to going to a building that can actually be called a school.",New Democratic Party,Joliette,Francine Raynault,http://www.parl.gc.ca/parlinfo/Files/Parliamentarian.aspx?Item=699ff70f-3ea7-44fb-91a0-cd238afd535c&Language=E&Section=ALL
4588672,ca.proc.d.2014-02-13.15838.18,2014-02-13,fe517b95-bc62-4fe8-96aa-998994aefd48,173,"Mr. Tom Lukiwski (Parliamentary Secretary to the Leader of the Government in the House of Commons, CPC)",,Routine Proceedings,Questions on the Order Paper,,"Mr. Speaker, I ask that all questions be allowed to stand.",Conservative,Regina--Lumsden--Lake Centre,Tom Lukiwski,http://www.parl.gc.ca/parlinfo/Files/Parliamentarian.aspx?Item=fe517b95-bc62-4fe8-96aa-998994aefd48&Language=E&Section=ALL
4588673,ca.proc.d.2014-02-13.15838.19,2014-02-13,,,,,Routine Proceedings,Questions on the Order Paper,, Is that agreed?,,,The Deputy Speaker,
4588674,ca.proc.d.2014-02-13.15838.20,2014-02-13,,,,intervention,Routine Proceedings,Questions on the Order Paper,, Agreed.,,,Some hon. members,
4588675,ca.proc.d.2014-02-13.15838.21,2014-02-13,,,,stagedirection,Government Orders,The Budget,Financial Statement of Minister of Finance,"The House resumed from February 12 consideration of the motion that this House approves in general the budgetary policy of the government, of the amendment and of the amendment to the amendment. ",,,,
