basepk,hid,speechdate,pid,opid,speakeroldname,speakerposition,maintopic,subtopic,subsubtopic,speechtext,speakerparty,speakerriding,speakername,speakerurl
4622341,ca.proc.d.2014-12-04.16510.198,2014-12-04,6519cfba-0080-419d-baa9-8ae6e56d032f,256,The Speaker,,Oral Questions,Northern Development,,The hon. member for Abitibi—Baie-James—Nunavik—Eeyou.,Conservative,Regina--Qu'Appelle,Andrew Scheer,http://www.parl.gc.ca/parlinfo/Files/Parliamentarian.aspx?Item=6519cfba-0080-419d-baa9-8ae6e56d032f&Language=E&Section=ALL
4622342,ca.proc.d.2014-12-04.16510.199,2014-12-04,13a21d52-bc44-4a96-a206-f18432ef9191,8606,"Mr. Romeo Saganash (Abitibi—Baie-James—Nunavik—Eeyou, NDP)",,Oral Questions,Northern Development,,"Mr. Speaker, now that the Minister of the Environment has recognized that it was a bad idea to read the newspaper during question period, maybe we can get her to answer our lingering questions over the food crisis going on in her riding and throughout the north.
Will the minister now recognize that the nutrition north program is a failure and will she act now to ensure that none of her constituents have to resort to landfills to find food, especially over the holidays?",New Democratic Party,Abitibi--Baie-James--Nunavik--Eeyou,Romeo Saganash,http://www.parl.gc.ca/parlinfo/Files/Parliamentarian.aspx?Item=13a21d52-bc44-4a96-a206-f18432ef9191&Language=E&Section=ALL
4622343,ca.proc.d.2014-12-04.16510.200,2014-12-04,5d65749e-0cdb-4c03-88d4-f57a905acc33,8436,"Hon. Bernard Valcourt (Minister of Aboriginal Affairs and Northern Development, CPC)",,Oral Questions,Northern Development,,"Mr. Speaker, the record is clear. The Auditor General has reported and has made recommendations so that we can improve the effectiveness of a program, which has already brought significant results. The shipment of nutritious food has gone up by 25%. Those members cannot deny that. The average food basket for an average family of four has gone down by $110 a month, whereas it has gone up everywhere else in the country. They cannot see it. Stop playing politics on the backs of northerners.",Conservative,Madawaska--Restigouche,Bernard Valcourt,http://www.parl.gc.ca/parlinfo/Files/Parliamentarian.aspx?Item=5d65749e-0cdb-4c03-88d4-f57a905acc33&Language=E&Section=ALL
4622344,ca.proc.d.2014-12-04.16510.201,2014-12-04,6519cfba-0080-419d-baa9-8ae6e56d032f,256,The Speaker,,Oral Questions,Northern Development,,"I know the hon. Minister of Aboriginal Affairs and Northern Development will remember not to address his comments directly to his colleagues but to the Chair.
The hon. member for Abitibi—Baie-James—Nunavik—Eeyou.",Conservative,Regina--Qu'Appelle,Andrew Scheer,http://www.parl.gc.ca/parlinfo/Files/Parliamentarian.aspx?Item=6519cfba-0080-419d-baa9-8ae6e56d032f&Language=E&Section=ALL
4622345,ca.proc.d.2014-12-04.16510.202,2014-12-04,13a21d52-bc44-4a96-a206-f18432ef9191,8606,"Mr. Romeo Saganash (Abitibi—Baie-James—Nunavik—Eeyou, NDP)",,Oral Questions,Northern Development,,"Mr. Speaker, you know, shaving $100 off the cost of a basket of groceries that costs $1,000 or $1,200 is not a lot.
In the Minister of the Environment's riding, dozens of people are reduced to rummaging through garbage to find food because the Conservatives are incapable of setting up a program to cut prices. Those who speak out against the situation are threatened with legal action by their own MP.
Will the minister also apologize for the government's failures and her bullying?",New Democratic Party,Abitibi--Baie-James--Nunavik--Eeyou,Romeo Saganash,http://www.parl.gc.ca/parlinfo/Files/Parliamentarian.aspx?Item=13a21d52-bc44-4a96-a206-f18432ef9191&Language=E&Section=ALL
4622346,ca.proc.d.2014-12-04.16510.203,2014-12-04,5d65749e-0cdb-4c03-88d4-f57a905acc33,8436,"Hon. Bernard Valcourt (Minister of Aboriginal Affairs and Northern Development, CPC)",,Oral Questions,Northern Development,,"Mr. Speaker, whether in English or in French, it is the same charade.
They refuse to admit the facts, which have been well established. Since introducing the nutrition north Canada program, the amount of nutritious food transported to the North has increased by almost 25%. The cost of a food basket for a family of four has decreased by $110 a month on average. I know that $110 a month is not a lot for a socialist in a suit and tie, but it is something for the people of Nunavut.",Conservative,Madawaska--Restigouche,Bernard Valcourt,http://www.parl.gc.ca/parlinfo/Files/Parliamentarian.aspx?Item=5d65749e-0cdb-4c03-88d4-f57a905acc33&Language=E&Section=ALL
4622347,ca.proc.d.2014-12-04.16510.204,2014-12-04,0253e859-f573-4a61-8c88-0466545df2fa,8547,"Ms. Ève Péclet (La Pointe-de-l'Île, NDP)",,Oral Questions,Agriculture and Agri-Food,,"Mr. Speaker, there is one thing they definitely cannot deny. Since the Conservatives have been in power, patronage appointments have skyrocketed.
Yesterday the Department of Agriculture and Agri-Food appointed Sylvie Cloutier to Farm Credit Canada. I would be hard pressed to find anyone more “blue” than her. This former assistant to minister Robert de Cotret was a campaign organizer in Saint-Jean and for Jean Lambert, who twice ran as a Conservative candidate. Under the Mulroney government, with Chuck Guité, she was the one who preselected Conservative-friendly communications agencies. 
Instead of taking care of their friends, perhaps the minister could take care of our farmers.",New Democratic Party,La Pointe-de-l'Île,Ève Péclet,http://www.parl.gc.ca/parlinfo/Files/Parliamentarian.aspx?Item=0253e859-f573-4a61-8c88-0466545df2fa&Language=E&Section=ALL
4622348,ca.proc.d.2014-12-04.16510.205,2014-12-04,febe5b3f-1a40-472b-873d-11be938a0e59,246,"Hon. Gerry Ritz (Minister of Agriculture and Agri-Food, CPC)",,Oral Questions,Agriculture and Agri-Food,,"Mr. Speaker, of course, all of these candidates go through a rigorous hiring process. They are hired on merit by the board of FCC. They fit in. They bring skills to that board that serve farmers. I went through a list, for one of her colleagues yesterday, of how much better farmers are doing under this Conservative government. Of course, New Democrats voted against every one of those initiatives.
The member from Winnipeg would be the grinch at Christmastime and take away marketing freedom. We will not allow that to happen.",Conservative,Battlefords--Lloydminster,Gerry Ritz,http://www.parl.gc.ca/parlinfo/Files/Parliamentarian.aspx?Item=febe5b3f-1a40-472b-873d-11be938a0e59&Language=E&Section=ALL
4622349,ca.proc.d.2014-12-04.16510.206,2014-12-04,4ac38ab4-c480-4dde-8f12-a80ff2b4f215,185,"Mr. Pat Martin (Winnipeg Centre, NDP)",,Oral Questions,Agriculture and Agri-Food,,"Mr. Speaker, I cannot believe the minister. His ideological crusade is wreaking havoc across the Prairies. The grain bins are still bursting at the seams. The quality control system has collapsed, and yet what is the minister's priority? It seems to be finding a cushy—",New Democratic Party,Winnipeg Centre,Pat Martin,http://www.parl.gc.ca/parlinfo/Files/Parliamentarian.aspx?Item=4ac38ab4-c480-4dde-8f12-a80ff2b4f215&Language=E&Section=ALL
4622350,ca.proc.d.2014-12-04.16510.207,2014-12-04,,,,intervention,Oral Questions,Agriculture and Agri-Food,," Oh, oh!",,,Some hon. members,
4622351,ca.proc.d.2014-12-04.16510.208,2014-12-04,4ac38ab4-c480-4dde-8f12-a80ff2b4f215,185,Mr. Pat Martin,,Oral Questions,Agriculture and Agri-Food,, I can hardly hear myself think.,New Democratic Party,Winnipeg Centre,Pat Martin,http://www.parl.gc.ca/parlinfo/Files/Parliamentarian.aspx?Item=4ac38ab4-c480-4dde-8f12-a80ff2b4f215&Language=E&Section=ALL
4622352,ca.proc.d.2014-12-04.16510.209,2014-12-04,6519cfba-0080-419d-baa9-8ae6e56d032f,256,The Speaker,,Oral Questions,Agriculture and Agri-Food,,Order. Members of the government will have the opportunity to respond to the question when the member for Winnipeg Centre is finished asking it. I will ask members to come to order so he can finish. He has about 16 seconds left to conclude his question.,Conservative,Regina--Qu'Appelle,Andrew Scheer,http://www.parl.gc.ca/parlinfo/Files/Parliamentarian.aspx?Item=6519cfba-0080-419d-baa9-8ae6e56d032f&Language=E&Section=ALL
4622353,ca.proc.d.2014-12-04.16510.210,2014-12-04,4ac38ab4-c480-4dde-8f12-a80ff2b4f215,185,Mr. Pat Martin,Interjection,Oral Questions,Agriculture and Agri-Food,,"Them's the rules, Mr. Speaker.
His priority seems to be finding a cushy patronage job for none other than Sylvie Cloutier, a well-known Conservative organizer, whose previous claim to fame was helping the notorious Chuck Guité, of all people, finding the right ads to suit Conservative needs.
Would the minister start spending a little more time cleaning up the mess he has created on the Prairies and a little less time trying to find cushy patronage jobs for well-connected Conservatives?",New Democratic Party,Winnipeg Centre,Pat Martin,http://www.parl.gc.ca/parlinfo/Files/Parliamentarian.aspx?Item=4ac38ab4-c480-4dde-8f12-a80ff2b4f215&Language=E&Section=ALL
4622354,ca.proc.d.2014-12-04.16510.211,2014-12-04,febe5b3f-1a40-472b-873d-11be938a0e59,246,"Hon. Gerry Ritz (Minister of Agriculture and Agri-Food, CPC)",,Oral Questions,Agriculture and Agri-Food,,"Mr. Speaker, the member opposite cannot hear himself think. We can certainly see them sink.
 Having said that, there were several hundred farmers here in town last week for the GrowCanada convention. I had the great opportunity to speak to them. They are all celebrating the success in western Canada.
When it comes to complaints, we are shipping, on average, 17% more tonnage, year after year, since the single desk has gone, and our complaints have gone down 40%. That is a success.",Conservative,Battlefords--Lloydminster,Gerry Ritz,http://www.parl.gc.ca/parlinfo/Files/Parliamentarian.aspx?Item=febe5b3f-1a40-472b-873d-11be938a0e59&Language=E&Section=ALL
4622355,ca.proc.d.2014-12-04.16510.212,2014-12-04,d159adfa-ef98-4bcd-814c-67e49c714163,9244,"Ms. Joan Crockatt (Calgary Centre, CPC)",,Oral Questions,Public Safety,,"Mr. Speaker, the events of last October starkly showed us that ISIL is a real and present threat to Canada. They also spurred us to resolve to tackle this treat. I am very proud of our government for rising to this challenge.
Yesterday, the RCMP in Montreal announced that it has charged a man for robbery at the direction of or for the benefit of a terrorist group. Allegedly, he was going to travel abroad to conduct terrorist activities.
Would the Parliamentary Secretary to the Minister of Public Safety and Emergency Preparedness please inform this House about this dangerous situation?",Conservative,Calgary Centre,Joan Crockatt,http://www.parl.gc.ca/parlinfo/Files/Parliamentarian.aspx?Item=d159adfa-ef98-4bcd-814c-67e49c714163&Language=E&Section=ALL
4622356,ca.proc.d.2014-12-04.16510.213,2014-12-04,7e517cde-1b3a-46c1-afdb-4ddddeec7b81,1037,"Ms. Roxanne James (Parliamentary Secretary to the Minister of Public Safety and Emergency Preparedness, CPC)",,Oral Questions,Public Safety,,"Mr. Speaker, yesterday an individual in Montreal was charged with offences brought in under the Combating Terrorism Act. While I cannot comment on the matter that is currently before the courts, I would like to thank law enforcement for its efforts to keep Canadians safe. 
This arrest clearly demonstrates that our approach is effective. I would encourage all members of this House to support our efforts to give national security agencies the tools they need.",Conservative,Scarborough Centre,Roxanne James,http://www.parl.gc.ca/parlinfo/Files/Parliamentarian.aspx?Item=7e517cde-1b3a-46c1-afdb-4ddddeec7b81&Language=E&Section=ALL
4622357,ca.proc.d.2014-12-04.16510.214,2014-12-04,cedf1659-ebb1-4f26-b723-5c7c5353988b,573,"Mrs. Carol Hughes (Algoma—Manitoulin—Kapuskasing, NDP)",,Oral Questions,Health,,"Mr. Speaker, for over 10 years, the Canadian Institutes of Health Research were a strong voice and an important source of funding for aboriginal health research. 
However, the Conservatives have cut that organization's funding, eliminated successful programs and gotten rid of the advisory committee, as though they were not already doing enough to show how little they care about the aboriginal community. 
Will the Conservatives give the institutes the importance they deserve?",New Democratic Party,Algoma--Manitoulin--Kapuskasing,Carol Hughes,http://www.parl.gc.ca/parlinfo/Files/Parliamentarian.aspx?Item=cedf1659-ebb1-4f26-b723-5c7c5353988b&Language=E&Section=ALL
4622358,ca.proc.d.2014-12-04.16510.215,2014-12-04,c4273cb6-4d3d-4d46-a5f9-2a6c1914a32e,8818,"Ms. Eve Adams (Parliamentary Secretary to the Minister of Health, CPC)",,Oral Questions,Health,,"Mr. Speaker, the changes made by the Canadian Institutes of Health Research's board of governance were made independently. These changes will allow for additional support for researchers as they leverage new dollars.
I can assure this House that Canada, through Health Canada and through the Canadian Institutes of Health Research, remains the single largest contributor to health research, spending over $1 billion each year. Since we have formed government, we have invested almost a quarter billion dollars in aboriginal health research.",Conservative,Mississauga--Brampton South,Eve Adams,http://www.parl.gc.ca/parlinfo/Files/Parliamentarian.aspx?Item=c4273cb6-4d3d-4d46-a5f9-2a6c1914a32e&Language=E&Section=ALL
4622359,ca.proc.d.2014-12-04.16510.216,2014-12-04,cedf1659-ebb1-4f26-b723-5c7c5353988b,573,"Mrs. Carol Hughes (Algoma—Manitoulin—Kapuskasing, NDP)",,Oral Questions,Health,," Mr. Speaker, the Conservatives have made all their changes to the Institute of Aboriginal Peoples' Health and its partners without consulting the affected community. 
The Canadian Institutes of Health Research went under a model review, and key recommendations came only from an external group consultation, bypassing anyone who actually had experience with the institute. As a result, there is minimal interaction now between the aboriginal health research community and CIHR.
Why is the minister allowing the CIHR to undermine aboriginal health research, when it is so important?",New Democratic Party,Algoma--Manitoulin--Kapuskasing,Carol Hughes,http://www.parl.gc.ca/parlinfo/Files/Parliamentarian.aspx?Item=cedf1659-ebb1-4f26-b723-5c7c5353988b&Language=E&Section=ALL
4622360,ca.proc.d.2014-12-04.16510.217,2014-12-04,c4273cb6-4d3d-4d46-a5f9-2a6c1914a32e,8818,"Ms. Eve Adams (Parliamentary Secretary to the Minister of Health, CPC)",,Oral Questions,Health,,"Mr. Speaker, to the contrary. The Canadian Institutes of Health Research operates independently. It is its board of governance that came up with and developed these changes. It is the one that recommended them.
As I have assured members, we have invested over $247 million in aboriginal health research since we took office, and that is in addition to the $2 billion we invest each and every year in direct aboriginal health care.",Conservative,Mississauga--Brampton South,Eve Adams,http://www.parl.gc.ca/parlinfo/Files/Parliamentarian.aspx?Item=c4273cb6-4d3d-4d46-a5f9-2a6c1914a32e&Language=E&Section=ALL
4622361,ca.proc.d.2014-12-04.16510.218,2014-12-04,640aa965-9166-4aa6-b864-278dd1071a10,119,"Mr. Yvon Godin (Acadie—Bathurst, NDP)",,Oral Questions,CBC/Radio-Canada,," Mr. Speaker, the Fédération des communautés francophones et acadienne du Canada, or the FCFA, is calling for the creation of an independent commission on the future of CBC/Radio-Canada and a moratorium on cuts.
For many francophone communities outside Quebec, the drastic cuts to our public broadcaster mean that they will no longer have access to programming about their own reality.
Will the government listen to the FCFA and create an independent commission to assess the impact of the cuts to CBC/Radio-Canada on minority communities?",New Democratic Party,Acadie--Bathurst,Yvon Godin,http://www.parl.gc.ca/parlinfo/Files/Parliamentarian.aspx?Item=640aa965-9166-4aa6-b864-278dd1071a10&Language=E&Section=ALL
4622362,ca.proc.d.2014-12-04.16510.219,2014-12-04,64baabef-e32d-4384-a8eb-ac38c91ed3a6,601,"Hon. Shelly Glover (Minister of Canadian Heritage and Official Languages, CPC)",,Oral Questions,CBC/Radio-Canada,,"Mr. Speaker, we expect the CBC to fulfill its mandate to provide quality programming to those communities under the Official Languages Act and the Broadcasting Act, using the $1.1 billion it receives from taxpayers every year.
Let us not forget that the CRTC has the power to ensure that CBC/Radio-Canada fulfills its mandate under the law.",Conservative,Saint Boniface,Shelly Glover,http://www.parl.gc.ca/parlinfo/Files/Parliamentarian.aspx?Item=64baabef-e32d-4384-a8eb-ac38c91ed3a6&Language=E&Section=ALL
4622363,ca.proc.d.2014-12-04.16510.220,2014-12-04,640aa965-9166-4aa6-b864-278dd1071a10,119,"Mr. Yvon Godin (Acadie—Bathurst, NDP)",,Oral Questions,CBC/Radio-Canada,,"Mr. Speaker, it is shameful to hear the minister say such things.
In 1998, the Liberals made $258 million in cuts to CBC/Radio-Canada. Last year, the Conservatives made $115 million in cuts. They want to get rid of our public broadcaster. That is unacceptable. We will fight and CBC/Radio-Canada will go on.
Will the Conservative government minister save CBC/Radio-Canada or will she just make unacceptable excuses?",New Democratic Party,Acadie--Bathurst,Yvon Godin,http://www.parl.gc.ca/parlinfo/Files/Parliamentarian.aspx?Item=640aa965-9166-4aa6-b864-278dd1071a10&Language=E&Section=ALL
4622364,ca.proc.d.2014-12-04.16510.221,2014-12-04,64baabef-e32d-4384-a8eb-ac38c91ed3a6,601,"Hon. Shelly Glover (Minister of Canadian Heritage and Official Languages, CPC)",,Oral Questions,CBC/Radio-Canada,,"Mr. Speaker, what is shameful is to see an MP lose control like that in front of Canadians across the country. 
With regard to the CBC, once again, the CRTC is responsible for ensuring that the public broadcaster fulfills its mandate. We are going to let the CRTC do its job.",Conservative,Saint Boniface,Shelly Glover,http://www.parl.gc.ca/parlinfo/Files/Parliamentarian.aspx?Item=64baabef-e32d-4384-a8eb-ac38c91ed3a6&Language=E&Section=ALL
4622365,ca.proc.d.2014-12-04.16510.222,2014-12-04,550141c4-bdc7-48ea-9e5e-6b40f5ad1bed,100,"Hon. Mark Eyking (Sydney—Victoria, Lib.)",,Oral Questions,Agriculture and Agri-Food,,"Mr. Speaker, we recently learned that the avian flu has been detected on several poultry farms in our biggest producing region, the Fraser Valley.
 Canada's poultry industry is so important to farmers and consumers. Thousands of jobs on the farm and in processing depend on it.
 What is the scope of the outbreak? What is this government doing to contain it and prevent this disaster from happening again? How much of the farmers' losses will the government compensate?",Liberal,Sydney--Victoria,Mark Eyking,http://www.parl.gc.ca/parlinfo/Files/Parliamentarian.aspx?Item=550141c4-bdc7-48ea-9e5e-6b40f5ad1bed&Language=E&Section=ALL
4622366,ca.proc.d.2014-12-04.16510.223,2014-12-04,febe5b3f-1a40-472b-873d-11be938a0e59,246,"Hon. Gerry Ritz (Minister of Agriculture and Agri-Food, CPC)",,Oral Questions,Agriculture and Agri-Food,,"Mr. Speaker, as is well known, a couple of days ago, avian flu was detected on four farms, which are under quarantine now, in the Fraser Valley. That, of course, has an eight-kilometre range that is taken into account.
So far, the testing is ongoing. We are working with industry right now. They will begin putting birds down in those affected barns very soon.
When it comes to compensation, of course, that was all redone some two years ago, so farmers know exactly what they will be compensated, per bird, and we will certainly honour that.
This is totally unlike what happened in 2004, when the Liberals at that time let this just run like a prairie fire up through that Fraser Valley. Not this time.",Conservative,Battlefords--Lloydminster,Gerry Ritz,http://www.parl.gc.ca/parlinfo/Files/Parliamentarian.aspx?Item=febe5b3f-1a40-472b-873d-11be938a0e59&Language=E&Section=ALL
4622367,ca.proc.d.2014-12-04.16510.224,2014-12-04,1a1a9dee-c228-40fc-b926-42f8441d84f0,121,"Hon. Ralph Goodale (Wascana, Lib.)",,Oral Questions,Agriculture and Agri-Food,,"When the government eliminated the single-desk selling system for western grain, they acceded to the U.S. government's number one demand in its trade with Canada, but Canada got nothing in return: no guaranteed market access, no end to country of origin labelling, no approval for Keystone XL. We got nothing.
 Now the vandalized remnants of the CWB are simply being gifted, absolutely free, to a U.S. multinational. Again, Canadian taxpayers and farmers get nothing in return.
 Why does the government always lose in dealing with the United States?",Liberal,Wascana,Ralph Goodale,http://www.parl.gc.ca/parlinfo/Files/Parliamentarian.aspx?Item=1a1a9dee-c228-40fc-b926-42f8441d84f0&Language=E&Section=ALL
4622368,ca.proc.d.2014-12-04.16510.225,2014-12-04,febe5b3f-1a40-472b-873d-11be938a0e59,246,"Hon. Gerry Ritz (Minister of Agriculture and Agri-Food, CPC)",,Oral Questions,Agriculture and Agri-Food,,"Mr. Speaker, any good Habs fan will tell you that is not true. Certainly we have done very well when it comes to dealing with the United States on a number of different levels.
I have a good working relationship with Secretary Tom Vilsack. I know the Minister of International Trade has a good working relationship with Ambassador Froman.
Having said that, what the member for Wascana is alluding to when it comes to the single-desk is absolutely wrong. He needs better research. He actually needs to get out of Regina at some point and talk to farmers, and if he would like, I could introduce him to some from Saskatchewan later today. They are here attending GrowCanada. They are thrilled with the changes that were made, and I am sure they would be happy to speak to the member for Wascana.",Conservative,Battlefords--Lloydminster,Gerry Ritz,http://www.parl.gc.ca/parlinfo/Files/Parliamentarian.aspx?Item=febe5b3f-1a40-472b-873d-11be938a0e59&Language=E&Section=ALL
4622369,ca.proc.d.2014-12-04.16510.226,2014-12-04,ee8f6ddb-8734-41d4-9d72-00bff431336a,9166,"Ms. Jinny Jogindera Sims (Newton—North Delta, NDP)",,Oral Questions,Child Care,,"In order to form government, Conservatives promised Canadian families that they would help create 125,000 child care spaces. In the years since, they have created none, and now the Conservatives are attacking their own workplace daycare policy, unilaterally cancelling a critical subsidy that allowed a non-profit daycare to operate in a federally owned building. 
Why have the Conservatives abandoned families that need access to affordable child care?",New Democratic Party,Newton--North Delta,Jinny Sims,http://www.parl.gc.ca/parlinfo/Files/Parliamentarian.aspx?Item=ee8f6ddb-8734-41d4-9d72-00bff431336a&Language=E&Section=ALL
4622370,ca.proc.d.2014-12-04.16510.227,2014-12-04,106c623c-3606-40ae-a2f6-f4a619cf02f6,152,"Hon. Jason Kenney (Minister of Employment and Social Development and Minister for Multiculturalism, CPC)",,Oral Questions,Child Care,,"Mr. Speaker, we have done the opposite through our significant, in fact enormous, increases in the Canada social transfer to provinces. They have been able to use part of those funds to create over 175,000 additional day care spaces, compared to 2006.
Last month the Prime Minister announced that this government will be increasing the child care tax deduction that will provide further assistance to families using institutional child care, in addition to which, of course, the child tax benefit package will deliver, on average, $1,200 in incremental benefits to families with children in a way that respects the choices they make.",Conservative,Calgary Southeast,Jason Kenney,http://www.parl.gc.ca/parlinfo/Files/Parliamentarian.aspx?Item=106c623c-3606-40ae-a2f6-f4a619cf02f6&Language=E&Section=ALL
4622371,ca.proc.d.2014-12-04.16510.228,2014-12-04,86dd8955-957c-4ff9-9a81-76305a0f26ac,421,"Mr. Paul Dewar (Ottawa Centre, NDP)",,Oral Questions,Child Care,,"Mr. Speaker, if the Conservatives are not going to build the 125 spaces they promised, they could at least stop shutting them down.
Last week, Ottawa lost Tupper Tots, a non-profit daycare, because the government killed the federal workplace daycare policy. 
Right now, dozens of parents in Ottawa are desperately scrambling to find care for their children. There are nine other similar sites and centres across Canada, four of them in Ottawa.
The question is: Will the government work with those of us who want to preserve these child care spaces and make sure there is child care for these families and others?",New Democratic Party,Ottawa Centre,Paul Dewar,http://www.parl.gc.ca/parlinfo/Files/Parliamentarian.aspx?Item=86dd8955-957c-4ff9-9a81-76305a0f26ac&Language=E&Section=ALL
4622372,ca.proc.d.2014-12-04.16510.229,2014-12-04,106c623c-3606-40ae-a2f6-f4a619cf02f6,152,"Hon. Jason Kenney (Minister of Employment and Social Development and Minister for Multiculturalism, CPC)",,Oral Questions,Child Care,,"Mr. Speaker, I am not familiar with the precise subsidy to which the member is referring. I can tell him, however, that the government is increasing the child care tax deduction, which will assist parents who pay for institutional child care. 
Of course, we have announced billions of dollars in additional support for families with kids, including through the child tax benefit. All together, these benefits will amount to about $1,200 in incremental support for the average family with pre-school children. That is considerable support that respects the choices of families.",Conservative,Calgary Southeast,Jason Kenney,http://www.parl.gc.ca/parlinfo/Files/Parliamentarian.aspx?Item=106c623c-3606-40ae-a2f6-f4a619cf02f6&Language=E&Section=ALL
