basepk,hid,speechdate,pid,opid,speakeroldname,speakerposition,maintopic,subtopic,subsubtopic,speechtext,speakerparty,speakerriding,speakername,speakerurl
4622426,ca.proc.d.2014-12-04.16510.283,2014-12-04,cedf1659-ebb1-4f26-b723-5c7c5353988b,573,Mrs. Carol Hughes,Interjection,Government Orders,Yukon and Nunavut Regulatory Improvement Act,,"Mr. Speaker, as the member knows, in any legislation there are some good parts, just as there are some good parts in the budget. However, that does not mean that we have to swallow the bad parts with it.
In looking at this I must reiterate the fact that the majority of the first nations in Yukon have indicated that they are not supportive of this and feel that some changes need to be made to it. They are not against the whole bill, but only against some of the changes the government has made. The government is not listening to the changes being requested. 
Again, one of the changes falls under the delegation of federal powers, on which the CYFN has expressedd the following view:
 The CYFN opposes any amendment that would allow the AANDC Minister to delegate any or all of his or her powers, duties and functions under the YESAA to the territorial Minister. The CYFN has several concerns relating to this proposed amendment. There is no requirement for the AANDC Minister to obtain the consent of Yukon First Nations before delegating any powers, duties or functions. The AANDC Minister only has to provide notice to the Yukon First Nations. 
That is not me saying so, but Grand Chief Ruth Massie of the Council of Yukon First Nations. As I mentioned before, that organization represents a variety of first nations. ",New Democratic Party,Algoma--Manitoulin--Kapuskasing,Carol Hughes,http://www.parl.gc.ca/parlinfo/Files/Parliamentarian.aspx?Item=cedf1659-ebb1-4f26-b723-5c7c5353988b&Language=E&Section=ALL
4622427,ca.proc.d.2014-12-04.16510.284,2014-12-04,2e8ec565-8749-41c1-ac4c-98f9d939cf16,733,"Mr. Mike Sullivan (York South—Weston, NDP)",,Government Orders,Yukon and Nunavut Regulatory Improvement Act,,"Mr. Speaker, I appreciate the comments made by my colleague from northern Ontario. However, one of the things I noticed that the government has done over the past few years, particularly since the 2012 budget, is to attack environmental legislation and environmental assessments, starting in 2012, when the budget implementation act eliminated the Environmental Assessment Act and rebuilt it in such a manner that it was a sham. As a result, there are portions of that bill that have not yet been enacted. There are regulations that were to come later that have not yet been enacted some two years later.
When the government did that, it said that it was just to avoid duplication because the provinces and territories would be doing their own assessments and it did not want to duplicate those with federal assessments. Of course, we know that the end result is that federal issues do not get assessed at all, because the provinces do not have the right. Now we see the government, through its own actions, taking away or diminishing the right of the territories. It is not allowing the territories themselves to amend this legislation. Instead, the government is taking it away from them and reducing the environmental assessments in the territories. 
I think it is appalling that this is happening. Would the member like to comment on that?",New Democratic Party,York South--Weston,Mike Sullivan,http://www.parl.gc.ca/parlinfo/Files/Parliamentarian.aspx?Item=2e8ec565-8749-41c1-ac4c-98f9d939cf16&Language=E&Section=ALL
4622428,ca.proc.d.2014-12-04.16510.285,2014-12-04,cedf1659-ebb1-4f26-b723-5c7c5353988b,573,Mrs. Carol Hughes,Interjection,Government Orders,Yukon and Nunavut Regulatory Improvement Act,,"Mr. Speaker, that is exactly why we had that visit yesterday with respect to those concerns.
Here is an article by Kirk Cameron of CBC News about the fact there was a meeting with over a hundred people, who packed a small room at the Kwanlin Dün Cultural Centre. It states:
 In the crowd were people from around Yukon, about one half of First Nation ancestry and the rest equally concerned Yukoners. Most, if not all, were of the view that the amendments, known as Bill S-6, violate the fundamental relationship secured between First Nations, Yukoners and Canadians through land claims agreements, modern treaties that have been in place (at least the first four) since 1993. 
It goes on to say:
 Most of the crowd saw the amendments for what they are—an affront not just to the aboriginal people of Yukon who spent 20 years in treaty negotiations, but to all Yukoners. 
",New Democratic Party,Algoma--Manitoulin--Kapuskasing,Carol Hughes,http://www.parl.gc.ca/parlinfo/Files/Parliamentarian.aspx?Item=cedf1659-ebb1-4f26-b723-5c7c5353988b&Language=E&Section=ALL
4622429,ca.proc.d.2014-12-04.16510.286,2014-12-04,55c46957-54e9-422a-8afd-7c709bcf16a0,9281,"Mr. John Barlow (Macleod, CPC)",,Government Orders,Yukon and Nunavut Regulatory Improvement Act,,"Mr. Speaker, the member for Algoma—Manitoulin—Kapuskasing spoke quite at length about how dialogue is extremely important. I could not agree more. It is important that we engage first nations, learn what some of the issues are, and have feet on the ground to discuss them. Unfortunately, it is the member's own party that is stopping us from doing just that. 
As a member of the Standing Committee on Aboriginal Affairs and Northern Development, I would like the opportunity to go to Yukon and discuss first hand with the residents there some of these issues. I would like to hear the member's response and why the NDP is blocking us from doing those important jobs.",Conservative,Macleod,John Barlow,
4622430,ca.proc.d.2014-12-04.16510.287,2014-12-04,cedf1659-ebb1-4f26-b723-5c7c5353988b,573,Mrs. Carol Hughes,Interjection,Government Orders,Yukon and Nunavut Regulatory Improvement Act,,"Mr. Speaker, I do not know what the member is talking about, because we have clearly said that we will actually go to Yukon. Our leader has indicated that there is no problem. If we want to go to Yukon and hear these witnesses—",New Democratic Party,Algoma--Manitoulin--Kapuskasing,Carol Hughes,http://www.parl.gc.ca/parlinfo/Files/Parliamentarian.aspx?Item=cedf1659-ebb1-4f26-b723-5c7c5353988b&Language=E&Section=ALL
4622431,ca.proc.d.2014-12-04.16510.288,2014-12-04,a10a55d4-becb-4b98-b780-9fa8cfd5aa12,575,Mr. Phil McColeman,Interjection,Government Orders,Yukon and Nunavut Regulatory Improvement Act,,No travel.,Conservative,Brant,Phil McColeman,http://www.parl.gc.ca/parlinfo/Files/Parliamentarian.aspx?Item=a10a55d4-becb-4b98-b780-9fa8cfd5aa12&Language=E&Section=ALL
4622432,ca.proc.d.2014-12-04.16510.289,2014-12-04,cedf1659-ebb1-4f26-b723-5c7c5353988b,573,Mrs. Carol Hughes,Interjection,Government Orders,Yukon and Nunavut Regulatory Improvement Act,,"Mr. Speaker, I am telling them right now. Book the travel. We are on our way.
Here we are. This is from CBC News, posted yesterday, on December 3. It says:
 The news release points out that the Yukon First Nations have the backing of at least two mining companies in Yukon, ""which have sent letters to Minister Valcourt warning that regulatory reforms without meaningful consultation will create tension and uncertainty and urging the government to find a solution."" 
I am going to add as well that, during the treaty negotiations, first nations actually agreed to retain less than 10% of their traditional territory in exchange for the partnership and management of all Yukon land and resources, and this is what they get from the government.",New Democratic Party,Algoma--Manitoulin--Kapuskasing,Carol Hughes,http://www.parl.gc.ca/parlinfo/Files/Parliamentarian.aspx?Item=cedf1659-ebb1-4f26-b723-5c7c5353988b&Language=E&Section=ALL
4622433,ca.proc.d.2014-12-04.16510.290,2014-12-04,02c2cb20-f27d-46a5-8e78-ab4b405bf07b,453,The Acting Speaker (Mr. Bruce Stanton),,Government Orders,Yukon and Nunavut Regulatory Improvement Act,,"We have time for one more question and response.
Just as a reminder to hon. members, with respect to using the proper name of another hon. member, even if it is included in a citation, it is still not permitted. When one is reading the citation, one would simply change the name to the riding or title of the hon. member.
Questions and comments, the hon. member for Brant.",Conservative,Simcoe North,Bruce Stanton,http://www.parl.gc.ca/parlinfo/Files/Parliamentarian.aspx?Item=02c2cb20-f27d-46a5-8e78-ab4b405bf07b&Language=E&Section=ALL
4622434,ca.proc.d.2014-12-04.16510.291,2014-12-04,a10a55d4-becb-4b98-b780-9fa8cfd5aa12,575,"Mr. Phil McColeman (Brant, CPC)",,Government Orders,Yukon and Nunavut Regulatory Improvement Act,,"Mr. Speaker, it was interesting to listen to this debate today and hear the member relay the news that her party was somehow going to change its view on committee travel and travel for members of Parliament to go out to first nations and actually find out.
 I am chair of the Standing Committee on Human Resources, Skills and Social Development and the Status of Persons with Disabilities, and we were doing a study on first nations about job opportunities for them. We had our travel planned and booked, but it was not allowed to proceed because of the NDP's position.
Could the member explain that to the House please?",Conservative,Brant,Phil McColeman,http://www.parl.gc.ca/parlinfo/Files/Parliamentarian.aspx?Item=a10a55d4-becb-4b98-b780-9fa8cfd5aa12&Language=E&Section=ALL
4622435,ca.proc.d.2014-12-04.16510.292,2014-12-04,02c2cb20-f27d-46a5-8e78-ab4b405bf07b,453,The Acting Speaker (Mr. Bruce Stanton),,Government Orders,Yukon and Nunavut Regulatory Improvement Act,,"Before I recognize the hon. member for Algoma—Manitoulin—Kapuskasing, I do note that the question from the hon. member for Brant really does not pertain to the question that is before the House. However, I note that the member for Algoma—Manitoulin—Kapuskasing did make those comments in her remarks in response to another question, so I will allow the question and recognize the hon. member for Algoma—Manitoulin—Kapuskasing.",Conservative,Simcoe North,Bruce Stanton,http://www.parl.gc.ca/parlinfo/Files/Parliamentarian.aspx?Item=02c2cb20-f27d-46a5-8e78-ab4b405bf07b&Language=E&Section=ALL
4622436,ca.proc.d.2014-12-04.16510.293,2014-12-04,cedf1659-ebb1-4f26-b723-5c7c5353988b,573,Mrs. Carol Hughes,Interjection,Government Orders,Yukon and Nunavut Regulatory Improvement Act,,"Mr. Speaker, we have always been willing to meet at committees. It is just that the government did not call the meetings until just this week. We are willing to travel. We are willing to travel to Yukon to hear these witnesses.
With respect to all that is going on here, at the end of the day, with this type of legislation, the government has basically said it is a take it or leave it package, and these people are against the taking of it at this point, the way it is.",New Democratic Party,Algoma--Manitoulin--Kapuskasing,Carol Hughes,http://www.parl.gc.ca/parlinfo/Files/Parliamentarian.aspx?Item=cedf1659-ebb1-4f26-b723-5c7c5353988b&Language=E&Section=ALL
4622437,ca.proc.d.2014-12-04.16510.294,2014-12-04,02c2cb20-f27d-46a5-8e78-ab4b405bf07b,453,The Acting Speaker (Mr. Bruce Stanton),,Government Orders,Yukon and Nunavut Regulatory Improvement Act,,"Before we resume debate, it is my duty pursuant to Standing Order 38 to inform the House that the question to be raised tonight at the time of adjournment is as follows: the hon. member for Malpeque, Agriculture and Agri-food.",Conservative,Simcoe North,Bruce Stanton,http://www.parl.gc.ca/parlinfo/Files/Parliamentarian.aspx?Item=02c2cb20-f27d-46a5-8e78-ab4b405bf07b&Language=E&Section=ALL
4622438,ca.proc.d.2014-12-04.16510.295,2014-12-04,07cf5767-802c-406c-92a7-7dc92af79b40,4264,"Mr. Kevin Lamoureux (Winnipeg North, Lib.)",,Government Orders,Yukon and Nunavut Regulatory Improvement Act,,"Mr. Speaker, it is with pleasure that I rise today to speak to Bill S-6, a bill that would have a significant impact upon us all, no matter what region of the country we happen to live in. Obviously, it would have a larger impact in our northern region, in particular, Nunavut and Yukon.
I would like to start off by, first, acknowledging and welcoming the suggestion, the possibility of a standing committee being able to travel to get direct input on issues such as this, as it would have a very positive effect in certain situations. We will have to wait and see, through the critics and the minister, whether or not that will actually take place. I was under the impression that the official opposition party was not allowing for committees to travel, but I would hope that position has changed, when in fact there is legitimacy for committees to travel. We will have to wait to see. 
 One member across the way made reference to the aboriginal affairs committee. I, for one, would welcome the aboriginal affairs committee doing something more tangible on a very important issue, which we saw raised inside the House today; that is, the hundreds of murdered and missing aboriginal women and young girls.
Having said that, I will go right back to Bill S-6.
 When I think of Bill S-6, a number of thoughts come to mind. I have been listening very closely to a lot of the questions that have been put forward to the New Democrats, in particular, with respect to the whole issue of consultation. I have had the opportunity to ask some questions, again, with respect to the idea of consultation. I recognize that the bill itself would make some very significant changes. Consultations were in fact warranted, and I think there is a huge question mark in terms of to what degree the government did, in good faith, go into the consultation process.
What I do know is that I have had the opportunity to receive some feedback from a couple of people in particular, from the north. One individual who I had known very briefly when I was first elected in the byelection was the former member of Parliament from Yukon, Larry Bagnell. He was sure that we had an understanding that it would appear as if there was a genuine lack of consultation that had taken place and raised a number of concerns that we felt were important, and one would question why the government was unable to build the consensus that was necessary to get more of a consensus in passing the legislation we have here today. I do not think they have achieved that. 
We start to get wind of that, whether it was individuals or stakeholders making contact with caucus critics or caucus offices, but we get that sense in terms of the way in which the government also responds to the legislation.
We have Bill S-6, which has already been time allocated. That says something in itself. It means there will be a limited number of members of Parliament allowed to speak on this legislation. I suspect there might be keener interest from certain members of Parliament, quite frankly, over others, but at the very least, I think that all those who would like the opportunity to share their thoughts on this legislation should in fact be afforded the opportunity. However, like other pieces of legislation, Bill S-6 was time allocated 
It does seem, on the surface, that the government uses it as a form of process, that the way it gets its legislation passed in the House is to bring in the time allocation tool.
The unfortunate aspect of that is that we have legislation before us that, ultimately, would have been much better had the government been successful in being able to consult in good faith—and I underline the words “good faith” for the simple reason that many of the answers from the government side are that it has consulted. I have even heard quotes from the government side saying that it has consulted. I suspect that, to a certain degree, it has conducted some form of consultation, but obviously the type of consultation the government espouses has not been effective because of the response we are hearing, that there seems to be a genuine need for the government to go back to the drawing board.
What would Bill S-6 actually do? When we read the summary of the bill, we find that it would, in essence, establish time limits for environmental assessments and a cost recovery regime. It further states:
 It also amends that Act to provide for binding ministerial policy directions to the Board and the delegation of any of the Minister’s powers, duties and functions to the territorial minister, and allows for a member of the board who is participating in a screening or review to continue to act for that purpose after the expiry of their term or their removal due to a loss of residency in Yukon, until decision documents are issued.... 
 Part 2 amends the Nunavut Waters and Nunavut Surface Rights Tribunal Act to modify the maximum term of certain licences, to establish time limits with respect to the making of certain decisions, to allow for the making of arrangements relating to security, to establish a cost recovery regime.... 
Very substantial things would be applied through Bill S-6 to two pieces of legislation.
Issues have been brought forward. When I say that there was lack of consultation, a few points were specifically brought to my attention. The government is now proposing some new measures through Bill S-6, and it is questionable as to whether there was consultation to the same degree on these new measures. 
The bill would provide sweeping powers for the minister to issue binding policy direction to the assessment board; the minister could unilaterally hand over his power to the territory without the consent of first nations; and there could be exemptions of assessment renewals and amendments to projects. There is also the issue with regard to timelines and whether they are unrealistic. These are some of the areas. The general feeling is that there was no real, genuine consultation on those points, and I suspect others.
In terms of the potential development in the north, it would be wrong for us as a nation, as we continue to evolve and develop, not to recognize the potential of the north, in terms of how Canada as a whole would benefit if it is done properly and well under good stewardship; we can all benefit. That benefit goes beyond just finances. Quite often, when there is legislation of this nature or when we talk about the north, we do not put enough emphasis on the environment, the natural beauty, and how we can help the north become that much more alive for people who have a desire to get the northern experience. There is so much more we can do.
The Liberal Party supports assessing resource wealth in the north in a sustainable way. Unlocking this economic activity is contingent on environmental sustainability and on the impacted aboriginal communities being engaged as equal partners.
The government as a whole has fallen short when it comes to the development of our natural resources. That does not necessarily apply just up north. If we look at the Prairies or any other region in Canada, there has been a vacuum created by the Prime Minister in terms of leadership. We have not seen leadership coming from the Prime Minister's Office on the development of our resources. 
We could come up with a number of examples. We could make reference to the legislation before us today or to the controversial issue of our pipelines, where one province is negotiating with another province and the Prime Minister is just standing at the side, not providing any form of leadership to bring the different stakeholders together to try to build consensus. 
If we want to develop and promote our resources, we need to build that social contract. Ottawa has a responsibility to be engaged with the different stakeholders and to demonstrate strong leadership. That has been lacking for the last number of years, at a great cost to our community, both economically and socially in terms of development. Opportunities have been lost because the Prime Minister has not seen fit to demonstrate strong leadership in building that social contract.
 I have had the opportunity to speak on a number of occasions on legislation affecting our first nations and our aboriginal peoples. If there is a common theme, virtually on anything affecting our first nations or aboriginal peoples, it has been the issue of consultation. That is one of the biggest criticisms, once again.
How can the Conservatives expect an opposition party to get behind legislation if the stakeholders are saying that they were not adequately consulted? We are getting feedback that there are legitimate concerns about the legislation and the impact it would have on development. The government seems to have the attitude that it knows best and does not necessarily need to consult. It wants to say that it consulted, but is it genuine consultation that has taken place? 
Eleven self-governing first nations have made it clear that the federal government has not held enough adequate consultation on the bill to merit support. That is a substantial statement. They do not feel that they were adequately consulted. The government has brought things into the legislation that they had no idea were going to be incorporated into the legislation. Were they in fact consulted on all aspects of the legislation that has been brought forward? Based on information we are being provided, that has not been the case, and it has been at a great cost. 
I have had the opportunity to fly over, and on one occasion be in, Yellowknife. I used to be a serving member of the Canadian Forces, and what a privilege it was. I was posted out in Lancaster Park, just north of Edmonton. We had the C-130 Hercs, and we would do that northern run for the char up north. Everyone loved having that beautiful fish.
Flying over Yellowknife, one gets a good sense of just how vast our country is. There are so many opportunities there. We can talk about gold, silver, copper, zinc, and many more that are being mined in the north. The potential development there is overwhelming.
The entire population of the north is probably somewhere around 100,000 or maybe a little bit more. We need to play a role, but we need to be working with the territorial governments. We need to be working with the Inuit, our first nations, people of aboriginal heritage, and the communities, those who actually have intelligence on the ground on how we can best develop the north for future generations. It is not just about extracting; it is where we might be able to have additional value.
If we want to move forward, the first priority in bringing in legislation of this nature should be to build consensus. I do not think the government has been successful in building consensus. 
I do not think the Liberal Party and the member for Labrador would oppose the idea of the standing committee going to the north to get a better understanding and see first-hand some of the things that are taking place. 
At the end of the day, Bill S-6 would have a significant impact. We are looking to the government to deal with the issue in a conciliatory fashion and to respect consultation. That is a word I might have said a dozen times in my speech. 
If we are not prepared to do the work, we should think twice before bringing in legislation. If we fail on consultation and force through the legislation, what can happen is more confrontation and problems in the future. It is better to get it right the first time and work in co-operation. If that means taking the extra month or two to get it right, let us take the extra month or two. The attitude the government has demonstrated, even by passing this legislation and bringing in time allocation, speaks volumes. 
I realize that my time has expired, so I will leave it at that.",Liberal,Winnipeg North,Kevin Lamoureux,http://www.parl.gc.ca/parlinfo/Files/Parliamentarian.aspx?Item=07cf5767-802c-406c-92a7-7dc92af79b40&Language=E&Section=ALL
4622439,ca.proc.d.2014-12-04.16510.296,2014-12-04,a2d5c8bf-d42e-4b53-be9e-70af2a6fe169,9130,"Mr. Mark Strahl (Parliamentary Secretary to the Minister of Aboriginal Affairs and Northern Development, CPC)",,Government Orders,Yukon and Nunavut Regulatory Improvement Act,,"Mr. Speaker, the hon. member suggests that perhaps another month or two would solve the problem. We have already conducted consultations for over a year, with meetings taking place and, as I stated previously, over $98,000 provided to first nations specifically to consult on the four issues they have raised. They have been reimbursed over $98,000 to compensate them for their time and expertise in participating in that. I would argue that, if over a year of meetings has not solved the issue and brought us to an agreement, another month or two is not going to get the job done.
The member referred to the delegation of federal powers. I want to refer back to the actual umbrella final agreement. The concern seems to be that this violates that somehow. The delegation of federal powers is specifically addressed in section 2.11.8, which says:
 Government may determine, from time to time, how and by whom any power or authority of Government or a Minister set out in a Settlement Agreement...shall be exercised. 
I have addressed some issues of concern previously in the debate. One of the issues is the delegation of federal powers specifically contemplated and laid out in the umbrella final agreement. Would the member not agree that the delegation of federal powers is already part of the final agreement? The final agreement takes precedence over any legislation that is being contemplated here, so why would that not be acceptable to the hon. member?",Conservative,Chilliwack--Fraser Canyon,Mark Strahl,http://www.parl.gc.ca/parlinfo/Files/Parliamentarian.aspx?Item=a2d5c8bf-d42e-4b53-be9e-70af2a6fe169&Language=E&Section=ALL
