basepk,hid,speechdate,pid,opid,speakeroldname,speakerposition,maintopic,subtopic,subsubtopic,speechtext,speakerparty,speakerriding,speakername,speakerurl
4622143,ca.proc.d.2014-12-04.16510.0,2014-12-04,fe517b95-bc62-4fe8-96aa-998994aefd48,173,"Mr. Tom Lukiwski (Parliamentary Secretary to the Leader of the Government in the House of Commons, CPC)",,Routine Proceedings,Government Response to Petitions,,"Mr. Speaker, pursuant to Standing Order 36 (8) I have the honour to table, in both official languages, the government's response to seven petitions. ",Conservative,Regina--Lumsden--Lake Centre,Tom Lukiwski,http://www.parl.gc.ca/parlinfo/Files/Parliamentarian.aspx?Item=fe517b95-bc62-4fe8-96aa-998994aefd48&Language=E&Section=ALL
4622144,ca.proc.d.2014-12-04.16510.1,2014-12-04,474155a0-d5ce-4780-9881-898c2502398d,237,"Mr. Joe Preston (Elgin—Middlesex—London, CPC)",,Routine Proceedings,Interparliamentary Delegations,,"Mr. Speaker, I have the honour to present, in both official languages, the report of the Canadian Branch of the Commonwealth Parliamentary Association concerning a conference in London, England, the International Parliamentary Conference Growth for Development, November 18-20, 2014. ",Conservative,Elgin--Middlesex--London,Joe Preston,http://www.parl.gc.ca/parlinfo/Files/Parliamentarian.aspx?Item=474155a0-d5ce-4780-9881-898c2502398d&Language=E&Section=ALL
4622145,ca.proc.d.2014-12-04.16510.2,2014-12-04,4c0122f7-7958-4cbd-b99e-9d70a4dca1e8,8678,"Mr. Pierre-Luc Dusseault (Sherbrooke, NDP)",,Routine Proceedings,Committees of the House,Government Operations and Estimates," Mr. Speaker, I have the honour to present, in both official languages, the seventh report of the Standing Committee on Government Operations and Estimates in relation to Bill C-21, An Act to control the administrative burden that regulations impose on businesses. 
The committee has studied the bill and has decided to report the bill back to the House without amendment.",New Democratic Party,Sherbrooke,Pierre-Luc Dusseault,http://www.parl.gc.ca/parlinfo/Files/Parliamentarian.aspx?Item=4c0122f7-7958-4cbd-b99e-9d70a4dca1e8&Language=E&Section=ALL
4622146,ca.proc.d.2014-12-04.16510.3,2014-12-04,288315ef-2fe8-48ad-8ae0-833ac097bac0,3658,"Mr. Philip Toone (Gaspésie—Îles-de-la-Madeleine, NDP)",,Routine Proceedings,VIA Rail Canada Act,," moved for leave to introduce Bill C-614, An Act respecting VIA Rail Canada and making consequential amendments to another Act.
Mr. Speaker, this bill would give parliamentarians far more control over the decisions made concerning VIA Rail. It would also allow for a partnership to be established with the communities and industries involved in VIA Rail service. This bill is designed to create the legislative framework that VIA Rail has never had.
In the U.S., Amtrak was in rough shape without a legislative framework. Now, with that framework, Amtrak is on the right track. This company serves far more communities than it used to. We hope to learn from that and improve service in Canada.
VIA Rail is in crisis. Ridership is down and many routes have been cancelled. It is time that Parliament took this seriously. Do we really want passenger rail service in Canada? We must not forget that passenger rail service and the rail system built our country. We hope to maintain it for future generations.
(Motions deemed adopted, bill read the first time and printed)",New Democratic Party,Gaspésie--Îles-de-la-Madeleine,Philip Toone,http://www.parl.gc.ca/parlinfo/Files/Parliamentarian.aspx?Item=288315ef-2fe8-48ad-8ae0-833ac097bac0&Language=E&Section=ALL
4622147,ca.proc.d.2014-12-04.16510.4,2014-12-04,13a21d52-bc44-4a96-a206-f18432ef9191,8606,"Mr. Romeo Saganash (Abitibi—Baie-James—Nunavik—Eeyou, NDP)",,Routine Proceedings,United Nations Declaration on the Rights of Indigenous Peoples Act,," moved for leave to introduce Bill C-641, An Act to ensure that the laws of Canada are in harmony with the United Nations Declaration on the Rights of Indigenous Peoples.
Mr. Speaker, I have the honour and privilege of introducing this bill to ensure that federal laws are in harmony with the declaration. When the declaration was adopted in 2007, the Secretary-General of the United Nations called it the path of reconciliation between states and indigenous peoples. Now more than ever, that is the path this country must take.
I am very honoured to stand here today to introduce the bill, an act to ensure that the laws of Canada are in harmony with the United Nations Declaration on the Rights of Indigenous Peoples.
When the declaration was adopted by the UN General Assembly in 2007, Ban Ki-moon had qualified it as the path to reconciliation between states and indigenous peoples. Indeed, more than ever, that is the path we need to take in the House and in the country.
 (Motion deemed adopted, bill read the first time and printed) ",New Democratic Party,Abitibi--Baie-James--Nunavik--Eeyou,Romeo Saganash,http://www.parl.gc.ca/parlinfo/Files/Parliamentarian.aspx?Item=13a21d52-bc44-4a96-a206-f18432ef9191&Language=E&Section=ALL
4622148,ca.proc.d.2014-12-04.16510.5,2014-12-04,c01339dd-da66-4748-8991-3c84a24e72ca,561,"Mr. Rodney Weston (Saint John, CPC)",,Routine Proceedings,Corrections and Conditional Release Act,," moved for leave to introduce Bill C-642, An Act to amend the Corrections and Conditional Release Act (high profile offender).
Mr. Speaker, I rise to introduce my very first private member's bill in this House. I feel confident that my colleagues will see the wisdom of these amendments to the Corrections and Conditional Release Act. The amendments are meant to address the concerns of any community that is home to a halfway house that houses high profile offenders after their release.
In my riding of Saint John, a situation arose last year when three such offenders were released to a halfway facility without warning to the community. This prompted a wave of fear throughout the community that I am sure is not unique to Saint John, but it was nonetheless unsettling.
This bill asks that an offender's name and photograph be posted on the Correctional Service website, along with any previous convictions, date of release, destination, and any conditions attached to the statutory release. 
The bill also requires that Correctional Service Canada provide communities with notice of the proposed release of any high profile offenders, hold public consultations with community representatives, including police, and take into account the views of the host community.
I look forward to hearing the views of my colleagues on these proposed amendments to the Corrections and Conditional Release Act. I also hope that it addresses the concerns raised by my constituents in Saint John.
 (Motions deemed adopted, bill read the first time and printed) ",Conservative,Saint John,Rodney Weston,http://www.parl.gc.ca/parlinfo/Files/Parliamentarian.aspx?Item=c01339dd-da66-4748-8991-3c84a24e72ca&Language=E&Section=ALL
4622149,ca.proc.d.2014-12-04.16510.6,2014-12-04,07e5eac1-e115-483c-bb86-972736ca953d,609,"Mr. LaVar Payne (Medicine Hat, CPC)",,Routine Proceedings,Petitions,Species at Risk Act,"Mr. Speaker, I rise today to present three petitions from constituents in my riding as well as that of my colleague, the member for Cypress Hills—Grasslands, with respect to SARA, the Species at Risk Act. The petitioners request that the House of Commons rescind the Species at Risk Act and replace it with something that encourages voluntary implementation.",Conservative,Medicine Hat,LaVar Payne,http://www.parl.gc.ca/parlinfo/Files/Parliamentarian.aspx?Item=07e5eac1-e115-483c-bb86-972736ca953d&Language=E&Section=ALL
4622150,ca.proc.d.2014-12-04.16510.7,2014-12-04,07e5eac1-e115-483c-bb86-972736ca953d,609,"Mr. LaVar Payne (Medicine Hat, CPC)",,Routine Proceedings,Petitions,Emergency Protection Order,"Mr. Speaker, the other petitions are with respect to the sage grouse. They are signed by residents in my riding and in Cypress Hills—Grasslands. The petitioners are asking that the House of Commons rescind this strategy and replace it with something that ensures strategies are created with formal input from landowners. The same applies for the third petition.",Conservative,Medicine Hat,LaVar Payne,http://www.parl.gc.ca/parlinfo/Files/Parliamentarian.aspx?Item=07e5eac1-e115-483c-bb86-972736ca953d&Language=E&Section=ALL
4622151,ca.proc.d.2014-12-04.16510.8,2014-12-04,2b5e6bf0-39d0-4d35-bcaa-dacd1834246d,396,"Mr. Harold Albrecht (Kitchener—Conestoga, CPC)",,Routine Proceedings,Petitions,Sex Selection,"Mr. Speaker, I have the honour to present a petition signed by many Canadians pointing out that gendercide has created a global crisis of gender imbalance, resulting in violence and the human trafficking of girls. The petitioners are calling upon members of Parliament to condemn the discrimination of girls that is occurring through sex-selective pregnancy termination.",Conservative,Kitchener--Conestoga,Harold Albrecht,http://www.parl.gc.ca/parlinfo/Files/Parliamentarian.aspx?Item=2b5e6bf0-39d0-4d35-bcaa-dacd1834246d&Language=E&Section=ALL
4622152,ca.proc.d.2014-12-04.16510.9,2014-12-04,d013e8ca-fdd5-4eb4-a0e4-b5f0782a8f6d,8333,"Mr. Fin Donnelly (New Westminster—Coquitlam, NDP)",,Routine Proceedings,Petitions,National Sustainable Seafood Day,"Mr. Speaker, I rise to present two petitions today. The first petition calls upon the House of Commons to introduce a national sustainable seafood day. It calls upon the government to designate March 18 as national sustainable seafood day. The petitioners are concerned about overfishing and destructive fishing practices in Canada.",New Democratic Party,New Westminster--Coquitlam,Fin Donnelly,http://www.parl.gc.ca/parlinfo/Files/Parliamentarian.aspx?Item=d013e8ca-fdd5-4eb4-a0e4-b5f0782a8f6d&Language=E&Section=ALL
4622153,ca.proc.d.2014-12-04.16510.10,2014-12-04,d013e8ca-fdd5-4eb4-a0e4-b5f0782a8f6d,8333,"Mr. Fin Donnelly (New Westminster—Coquitlam, NDP)",,Routine Proceedings,Petitions,Shark Finning,"Mr. Speaker, in the second petition, with thousands of signatures, petitioners call upon the government to immediately adopt a ban on the importation of shark fin to Canada.",New Democratic Party,New Westminster--Coquitlam,Fin Donnelly,http://www.parl.gc.ca/parlinfo/Files/Parliamentarian.aspx?Item=d013e8ca-fdd5-4eb4-a0e4-b5f0782a8f6d&Language=E&Section=ALL
4622154,ca.proc.d.2014-12-04.16510.11,2014-12-04,550141c4-bdc7-48ea-9e5e-6b40f5ad1bed,100,"Hon. Mark Eyking (Sydney—Victoria, Lib.)",,Routine Proceedings,Petitions,Canada Post,"Mr. Speaker, I rise to present a petition signed by hundreds of constituents in my riding concerning the reduction of Canada Post services. The petition calls upon the government to reverse these cuts to Canada Post and look instead for an option to fill the void, such as postal banking.",Liberal,Sydney--Victoria,Mark Eyking,http://www.parl.gc.ca/parlinfo/Files/Parliamentarian.aspx?Item=550141c4-bdc7-48ea-9e5e-6b40f5ad1bed&Language=E&Section=ALL
4622155,ca.proc.d.2014-12-04.16510.12,2014-12-04,c846297d-8bc7-4e69-b6eb-31d0e19f7ec1,554,"Mr. Jack Harris (St. John's East, NDP)",,Routine Proceedings,Petitions,Human Rights,"Mr. Speaker, I have the honour to present two petitions. 
The first petition is from a number of individuals in St. John's and other communities in Newfoundland and Labrador. The petitioners are calling upon the House of Commons and Parliament assembled to ensure that the Government of Canada takes action in allowing individuals to have access to all different professions and not be limited by their physical appearance. The petitioners state that the citizens of Canada have a right to be accepted for their physical appearance whether or not they exhibit body modifications, have disabilities, or are minorities in the workplace.",New Democratic Party,St. John's East,Jack Harris,http://www.parl.gc.ca/parlinfo/Files/Parliamentarian.aspx?Item=c846297d-8bc7-4e69-b6eb-31d0e19f7ec1&Language=E&Section=ALL
4622156,ca.proc.d.2014-12-04.16510.13,2014-12-04,c846297d-8bc7-4e69-b6eb-31d0e19f7ec1,554,"Mr. Jack Harris (St. John's East, NDP)",,Routine Proceedings,Petitions,Human Rights,"Mr. Speaker, the second petition is also signed by a number of individuals in St. John's and other communities in Newfoundland and Labrador. The petitioners state that Canada does not recognize transpersons who identify as a particular gender without genital reconstructive surgery or persons who identify as neither male nor female, and that the effects of denying correct gender markers to transcitizens denies them the freedom to fully express who they are. Therefore, the petitioners call upon the House of Commons and Parliament assembled to ensure the Government of Canada takes action to ensure equal rights for all citizens by allowing all citizens to identify truly to themselves.",New Democratic Party,St. John's East,Jack Harris,http://www.parl.gc.ca/parlinfo/Files/Parliamentarian.aspx?Item=c846297d-8bc7-4e69-b6eb-31d0e19f7ec1&Language=E&Section=ALL
4622157,ca.proc.d.2014-12-04.16510.14,2014-12-04,ff795583-83a8-4d3d-9759-78bc0f70245e,8736,"Mr. Andrew Cash (Davenport, NDP)",,Routine Proceedings,Petitions,Employment,"Mr. Speaker, about 50% of all workers in Toronto cannot access a full-time, stable job. What does that mean? They are working part time, they are working freelance, they are self-employed, many are working for free as unpaid interns, and they have no access to a workplace pension, benefits, or job security.
The folks who have signed this petition come from all over the greater Toronto area, and they are urging the government to support a national urban worker strategy that would build up a broader and stronger safety net for precarious workers in Canada.",New Democratic Party,Davenport,Andrew Cash,http://www.parl.gc.ca/parlinfo/Files/Parliamentarian.aspx?Item=ff795583-83a8-4d3d-9759-78bc0f70245e&Language=E&Section=ALL
4622158,ca.proc.d.2014-12-04.16510.15,2014-12-04,0c9d00b0-a035-46d3-ba51-0db3e8da19b8,9253,"Mr. Murray Rankin (Victoria, NDP)",,Routine Proceedings,Petitions,Pensions,"Mr. Speaker, my petition calls for the improvements to retirement security of the 62% of Canadian workers without any workplace pension.
The petitioners call for expansion of the Canada pension plan and specifically for the government to reject any changes that would allow employers to renege on existing defined benefit pension promises, and to refrain from allowing the conversion of defined benefit plans to so-called shared risk plans that would permit the subsequent reduction of pension benefits paid by retirees.",New Democratic Party,Victoria,Murray Rankin,http://www.parl.gc.ca/parlinfo/Files/Parliamentarian.aspx?Item=0c9d00b0-a035-46d3-ba51-0db3e8da19b8&Language=E&Section=ALL
4622159,ca.proc.d.2014-12-04.16510.16,2014-12-04,3c3ee442-a873-4845-84d0-7da07a66ce61,939,"Mr. Alexandre Boulerice (Rosemont—La Petite-Patrie, NDP)",,Routine Proceedings,Petitions,Agriculture,"Mr. Speaker, I rise today to present a petition from people in my riding, Rosemont—La Petite-Patrie, who are concerned about agriculture, specifically, the freedom to use seeds to grow any variety of grain or vegetable now that more and more of those seeds are being patented and controlled by the agri-food industry. These people are concerned about the fact that in some countries, using, saving and exchanging seeds may now be considered illegal and punishable by law.
I am presenting this petition in the name of biodiversity and small farmers' ability to do their work. ",New Democratic Party,Rosemont--La Petite-Patrie,Alexandre Boulerice,http://www.parl.gc.ca/parlinfo/Files/Parliamentarian.aspx?Item=3c3ee442-a873-4845-84d0-7da07a66ce61&Language=E&Section=ALL
4622160,ca.proc.d.2014-12-04.16510.17,2014-12-04,eb8710eb-e6dd-4c04-9d9a-60e7c8503565,3139,"Mr. Kennedy Stewart (Burnaby—Douglas, NDP)",,Routine Proceedings,Petitions,Animal Welfare,"Mr. Speaker, I am pleased to present a petition signed by hundreds of my constituents of Burnaby—Douglas and across Canada.
The petitioners note that we have an obligation to protect animals in care from needless cruelty and suffering. They are calling on the Government of Canada to recognize that the use of electric shock collars on household pets is barbaric and unnecessary.
The petitioners also want the government to ban the sale and use of electric shock collars in Canada, as has been done in other countries. I have had many articulate and well-meaning constituents come into my office and talk to me about this issue, so I would urge the government to take this petition seriously.",New Democratic Party,Burnaby--Douglas,Kennedy Stewart,http://www.parl.gc.ca/parlinfo/Files/Parliamentarian.aspx?Item=eb8710eb-e6dd-4c04-9d9a-60e7c8503565&Language=E&Section=ALL
4622161,ca.proc.d.2014-12-04.16510.18,2014-12-04,fe517b95-bc62-4fe8-96aa-998994aefd48,173,"Mr. Tom Lukiwski (Parliamentary Secretary to the Leader of the Government in the House of Commons, CPC)",,Routine Proceedings,Questions Passed as Orders for Returns,,"Mr. Speaker, if Questions Nos. 755 and 761 could be made orders for returns, these returns would be tabled immediately.",Conservative,Regina--Lumsden--Lake Centre,Tom Lukiwski,http://www.parl.gc.ca/parlinfo/Files/Parliamentarian.aspx?Item=fe517b95-bc62-4fe8-96aa-998994aefd48&Language=E&Section=ALL
4622162,ca.proc.d.2014-12-04.16510.19,2014-12-04,6519cfba-0080-419d-baa9-8ae6e56d032f,256,The Speaker,,Routine Proceedings,Questions Passed as Orders for Returns,,Is that agreed?,Conservative,Regina--Qu'Appelle,Andrew Scheer,http://www.parl.gc.ca/parlinfo/Files/Parliamentarian.aspx?Item=6519cfba-0080-419d-baa9-8ae6e56d032f&Language=E&Section=ALL
4622163,ca.proc.d.2014-12-04.16510.20,2014-12-04,,,,intervention,Routine Proceedings,Questions Passed as Orders for Returns,, Agreed.,,,Some hon. members,
4622164,ca.proc.d.2014-12-04.16510.21,2014-12-04,c7c870dc-abda-4577-802a-5f1fa1d7654c,8614,Ms. Lysane Blanchette-Lamothe,,Routine Proceedings,Questions Passed as Orders for Returns,Question No. 755," With regard to the Federal Internship for Newcomers Program: (a) how many applications did Citizenship and Immigration Canada receive, (i) in total, (ii) by year, (iii) by month; (b) how many applications were approved, (i) in total, (ii) by year, (iii) by month; (c) how many applications were rejected, (i) in total, (ii) by year, (iii) by month; (d) how many positions were available, (i) in total, (ii) by year, (iii) by month; (e) how many applicants have remained in Canada today; (f) how many applicants have found full-time, permanent employment; and (g) what was the budget allocated to this program, (i) by year, (ii) by city?",New Democratic Party,Pierrefonds--Dollard,Lysane Blanchette-Lamothe,http://www.parl.gc.ca/parlinfo/Files/Parliamentarian.aspx?Item=c7c870dc-abda-4577-802a-5f1fa1d7654c&Language=E&Section=ALL
4622165,ca.proc.d.2014-12-04.16510.22,2014-12-04,,,,stagedirection,Routine Proceedings,Questions Passed as Orders for Returns,Question No. 755,(Return tabled),,,,
4622166,ca.proc.d.2014-12-04.16510.23,2014-12-04,9e8dc941-5170-448f-8b08-591892bb1d05,109,Hon. Hedy Fry,,Routine Proceedings,Questions Passed as Orders for Returns,Question No. 761,"With regard to the Canada Revenue Agency, for each year since 2004 inclusively: (a) how many Reminder Letters has the Charities Directorate issued to charities; (b) how many formal complaints have been received concerning the political activities of charities; (c) how many political-activity audits have been commenced, (i) of those audits, how many have been concluded, (ii) how long did each audit last; and (d) what has been (i) the total expenditure on the political-activity audit program in each fiscal year since the program was established, (ii) the total expenditure on each completed audit? ",Liberal,Vancouver Centre,Hedy Fry,http://www.parl.gc.ca/parlinfo/Files/Parliamentarian.aspx?Item=9e8dc941-5170-448f-8b08-591892bb1d05&Language=E&Section=ALL
4622167,ca.proc.d.2014-12-04.16510.24,2014-12-04,,,,stagedirection,Routine Proceedings,Questions Passed as Orders for Returns,Question No. 761,(Return tabled),,,,
4622168,ca.proc.d.2014-12-04.16510.25,2014-12-04,fe517b95-bc62-4fe8-96aa-998994aefd48,173,Mr. Tom Lukiwski,Interjection,Routine Proceedings,Questions Passed as Orders for Returns,,"Mr. Speaker, I ask that the remaining questions be allowed to stand.",Conservative,Regina--Lumsden--Lake Centre,Tom Lukiwski,http://www.parl.gc.ca/parlinfo/Files/Parliamentarian.aspx?Item=fe517b95-bc62-4fe8-96aa-998994aefd48&Language=E&Section=ALL
4622169,ca.proc.d.2014-12-04.16510.26,2014-12-04,6519cfba-0080-419d-baa9-8ae6e56d032f,256,The Speaker,,Routine Proceedings,Questions Passed as Orders for Returns,,Is that agreed?,Conservative,Regina--Qu'Appelle,Andrew Scheer,http://www.parl.gc.ca/parlinfo/Files/Parliamentarian.aspx?Item=6519cfba-0080-419d-baa9-8ae6e56d032f&Language=E&Section=ALL
4622170,ca.proc.d.2014-12-04.16510.27,2014-12-04,,,,intervention,Routine Proceedings,Questions Passed as Orders for Returns,, Agreed.,,,Some hon. members,
4622171,ca.proc.d.2014-12-04.16510.28,2014-12-04,6519cfba-0080-419d-baa9-8ae6e56d032f,256,The Speaker,,Routine Proceedings,Privilege,Economic and Fiscal Update—Speaker's Ruling," I am now prepared to rule on the question of privilege raised by the hon. member for Skeena—Bulkley Valley concerning the economic and fiscal update by the Minister of Finance on November 12, 2014.
I would like to thank the hon. member for Skeena—Bulkley Valley for raising this matter, as well as the hon. Leader of the Government in the House of Commons and the hon. House Leader of the Official Opposition for their interventions.
The hon. member for Skeena—Bulkley Valley explained that on November 12, 2014, the Minister of Finance delivered the government's official economic and fiscal update to a private audience of financial professionals rather than in the House. This, he argued, obstructed members' access to that critical information, which is required to fulfill their parliamentary functions, thereby constituting contempt of Parliament if not a breach of members' privileges.
The hon. government House leader responded that, since the economic and fiscal update is not the budget, it is not governed by the Standing Orders. Consequently, the minister was not obligated to deliver that statement in the House and, in fact, there is a long-standing practice of the government making announcements outside the House on a range of policy issues.
The release of and accessibility to information is, of course, a matter of importance to all members since it touches the role of members as legislators. The chair shares Speaker Parent's views when he indicated on November 6, 1997 at page 1618 of Debates that this role should not be trivialized. In fact, we should take every opportunity to underline its significance in our system of responsible government. 
That is not to say, however, that every proceeding or activity related to delivering or accessing information by members implicitly involves their parliamentary duties.
 For instance, in 2009, Speaker Milliken was asked to determine whether the public release of the government's third report on the economic action plan made in Saint John, New Brunswick, was a breach of privilege.
 In a ruling on October 5, 2009, Speaker Milliken stated:
 Matters of press conferences or release of documents, the policy initiatives of the government, are not ones that fall within the jurisdiction of the Speaker of the House unless they happen to be made in the House itself. 
 It is very difficult for the Chair to intervene in a situation where a minister has chosen to have a press conference, or a briefing or a meeting and release material when the Speaker has nothing to do with the organization of that [event]. 
In fact, a review of economic and fiscal updates delivered by the Minister of Finance has revealed that, since 2009, the minister has provided this update to a business audience in various provinces, with last year's being delivered to the Edmonton Chamber of Commerce on November 12, 2013. Furthermore, the Chair can find no cases of questions of privilege or points of order in relation to these updates.
In addition, Speakers have consistently ruled that there are certain fundamental conditions that must exist in order for it to constitute a matter of contempt or privilege. As O’Brien and Bosc states at page 109:
 In order to find a prima facie breach of privilege, the Speaker must be satisfied that there is evidence to support the Member's claim that he or she has been impeded in the performance of his or her parliamentary functions and that the matter is directly related to a proceeding in Parliament. 
Based on the precedents established by previous Speakers, I cannot find evidence that members were obstructed in the performance of their parliamentary functions. Accordingly, I must conclude that there are not sufficient grounds to arrive at a finding of a prima facie breach of privilege in this case.
I thank the House for its attention.",Conservative,Regina--Qu'Appelle,Andrew Scheer,http://www.parl.gc.ca/parlinfo/Files/Parliamentarian.aspx?Item=6519cfba-0080-419d-baa9-8ae6e56d032f&Language=E&Section=ALL
