basepk,hid,speechdate,pid,opid,speakeroldname,speakerposition,maintopic,subtopic,subsubtopic,speechtext,speakerparty,speakerriding,speakername,speakerurl
4620524,ca.proc.d.2014-11-26.16473.79,2014-11-26,634edc34-ea0d-406f-ade1-eeec6c5bad04,9289,"Mr. Adam Vaughan (Trinity—Spadina, Lib.)",,Oral Questions,Infrastructure,,"Mr. Speaker, last week local leaders from across the country were on Parliament Hill asking all of us to make hometowns proud. 
The request of the Federation of Canadian Municipalities was dead simple. It needs funding for housing, for transit, and for water systems. There is a $400 billion infrastructure deficit in this country, and what has this government done? It has announced a cobbled-together group of plans that essentially are scheduled state of good repair budgets for federal assets, with nothing for cities and municipalities and towns across this country—nothing. In fact, all they get is a 90% cut to their budgets this year.
When is the government going to make its hometowns proud? When is it going to make hometowns built perfectly again and fixed again?",Liberal,Trinity--Spadina,Adam Vaughan,
4620525,ca.proc.d.2014-11-26.16473.80,2014-11-26,655f75f0-7c4c-4dd1-b0d7-317be0595660,545,"Hon. Denis Lebel (Minister of Infrastructure, Communities and Intergovernmental Affairs and Minister of the Economic Development Agency of Canada for the Regions of Quebec, CPC)",,Oral Questions,Infrastructure,,"Mr. Speaker, the premise of this question is completely wrong. We already invested a lot last year in municipalities, and we will continue to do so. It is under the leadership of this Prime Minister that, finally, municipalities of this country have received money. It was not received when the Liberals were in government. We are doing our job.",Conservative,Roberval--Lac-Saint-Jean,Denis Lebel,http://www.parl.gc.ca/parlinfo/Files/Parliamentarian.aspx?Item=655f75f0-7c4c-4dd1-b0d7-317be0595660&Language=E&Section=ALL
4620526,ca.proc.d.2014-11-26.16473.81,2014-11-26,c846297d-8bc7-4e69-b6eb-31d0e19f7ec1,554,"Mr. Jack Harris (St. John's East, NDP)",,Oral Questions,National Defence,,"Mr. Speaker, on Monday, the Parliamentary Secretary to the Minister of National Defence implied that the minister would finally reveal the cost of the Iraq mission at yesterday's defence committee meeting, but yesterday the minister was mum. Either his parliamentary secretary was misleading Canadians or the minister got cold feet. This is not a state secret we are talking about. The Americans have shared their costs with the American people, and the Australians have shared their costs with the Australian people. 
The minister has been given these costs by the Chief of the Defence Staff, so when will the minister share the costs of the Iraq mission with Canadians?",New Democratic Party,St. John's East,Jack Harris,http://www.parl.gc.ca/parlinfo/Files/Parliamentarian.aspx?Item=c846297d-8bc7-4e69-b6eb-31d0e19f7ec1&Language=E&Section=ALL
4620527,ca.proc.d.2014-11-26.16473.82,2014-11-26,b42374fa-e181-4337-93e9-2a5c41eb5d1e,212,"Hon. Rob Nicholson (Minister of National Defence, CPC)",,Oral Questions,National Defence,,"Mr. Speaker, the mission is not over. We are only into it a little over a month. We have indicated that we will report the costs in the appropriate way, through the parliamentary mechanisms.
I know there is one thing we can all agree on, which is that even spending $1 fighting the atrocities of ISIL will not have the support of the NDP. At least we have that in common.",Conservative,Niagara Falls,Rob Nicholson,http://www.parl.gc.ca/parlinfo/Files/Parliamentarian.aspx?Item=b42374fa-e181-4337-93e9-2a5c41eb5d1e&Language=E&Section=ALL
4620528,ca.proc.d.2014-11-26.16473.83,2014-11-26,383ed93c-f141-4f87-b873-124d3051a31f,8621,"Ms. Élaine Michaud (Portneuf—Jacques-Cartier, NDP)",,Oral Questions,National Defence,,"Mr. Speaker, it is not true that we are going to give them a blank cheque.
The minister told us that he would inform us of the costs of the mission, and I quote, “when they are fully known”. The problem is that he knows how much the mission is going to cost. The Chief of the Defence Staff, Tom Lawson, says that he has already forwarded a cost assessment to the minister.
The cost of the U.S. mission is $7.5 million a day; for the Australians, it is $500 million a year. Why do we know how much our allies spend, but not how much the mission will cost Canadians?",New Democratic Party,Portneuf--Jacques-Cartier,Élaine Michaud,http://www.parl.gc.ca/parlinfo/Files/Parliamentarian.aspx?Item=383ed93c-f141-4f87-b873-124d3051a31f&Language=E&Section=ALL
4620529,ca.proc.d.2014-11-26.16473.84,2014-11-26,b42374fa-e181-4337-93e9-2a5c41eb5d1e,212,"Hon. Rob Nicholson (Minister of National Defence, CPC)",,Oral Questions,National Defence,,"Mr. Speaker, the no-defence party over there does not want to spend anything fighting the atrocities of ISIL. One of the things it might just want to focus on for just a little is the human cost of doing nothing, which is what it has been advocating. We will stand up against the atrocities committed by ISIL with or without the support of the NDP.",Conservative,Niagara Falls,Rob Nicholson,http://www.parl.gc.ca/parlinfo/Files/Parliamentarian.aspx?Item=b42374fa-e181-4337-93e9-2a5c41eb5d1e&Language=E&Section=ALL
4620530,ca.proc.d.2014-11-26.16473.85,2014-11-26,be18e524-864d-40a1-b883-39784bc6db5a,8749,"Mr. Ted Opitz (Etobicoke Centre, CPC)",,Oral Questions,National Defence,,"Mr. Speaker, our government is committed to supporting the people of Ukraine as they fight for a democracy they have sacrificed so dearly for, all in the face of the Putin regime's military aggression. As our Prime Minister has said, whether it takes five months or 50 years, we will not drop the subject and we will always stand stalwart along the side of the Ukrainian people.
With winter fast approaching, can the Minister of National Defence please update the House on the support that Canada is providing to the people of Ukraine?",Conservative,Etobicoke Centre,Ted Opitz,http://www.parl.gc.ca/parlinfo/Files/Parliamentarian.aspx?Item=be18e524-864d-40a1-b883-39784bc6db5a&Language=E&Section=ALL
4620531,ca.proc.d.2014-11-26.16473.86,2014-11-26,b42374fa-e181-4337-93e9-2a5c41eb5d1e,212,"Hon. Rob Nicholson (Minister of National Defence, CPC)",,Oral Questions,National Defence,,"Mr. Speaker, I am proud to announce today that Canada will be making another delivery of non-lethal aid to Ukraine. There are 30,000 coats and pants, 70,000 pairs of Gore-Tex boots, and 4,500 pairs of gloves deemed surplus by the Canadian Armed Forces that will be shipped out starting at the end of this month.
The government is also coordinating the purchase and later shipment of equipment, including tactical communication systems, explosive ordinance disposal equipment, tactical medical kits, and both night and thermal vision goggles. President Poroshenko has said that shipments like this have saved Canadian lives. We remain steadfast in our support for a free and—",Conservative,Niagara Falls,Rob Nicholson,http://www.parl.gc.ca/parlinfo/Files/Parliamentarian.aspx?Item=b42374fa-e181-4337-93e9-2a5c41eb5d1e&Language=E&Section=ALL
4620532,ca.proc.d.2014-11-26.16473.87,2014-11-26,6519cfba-0080-419d-baa9-8ae6e56d032f,256,The Speaker,,Oral Questions,National Defence,,"Order, please. The hon. member for Winnipeg North.",Conservative,Regina--Qu'Appelle,Andrew Scheer,http://www.parl.gc.ca/parlinfo/Files/Parliamentarian.aspx?Item=6519cfba-0080-419d-baa9-8ae6e56d032f&Language=E&Section=ALL
4620533,ca.proc.d.2014-11-26.16473.88,2014-11-26,07cf5767-802c-406c-92a7-7dc92af79b40,4264,"Mr. Kevin Lamoureux (Winnipeg North, Lib.)",,Oral Questions,Ethics,,"Mr. Speaker, one week ago, in an attempt to defend the government's income-splitting plan, the Minister of Employment and Social Development stood in question period and read what he claimed was a quote from Marlo Raynolds, the Liberal candidate in Banff-Airdrie. Sun News has since retracted its story and has apologized to Mr. Raynolds for claiming he said something that he did not say.
 Surely the minister's standards of decency are as high as those of Sun News. Will he please get up, withdraw his misquote, and apologize for misleading the House?",Liberal,Winnipeg North,Kevin Lamoureux,http://www.parl.gc.ca/parlinfo/Files/Parliamentarian.aspx?Item=07cf5767-802c-406c-92a7-7dc92af79b40&Language=E&Section=ALL
4620534,ca.proc.d.2014-11-26.16473.89,2014-11-26,106c623c-3606-40ae-a2f6-f4a619cf02f6,152,"Hon. Jason Kenney (Minister of Employment and Social Development and Minister for Multiculturalism, CPC)",,Oral Questions,Ethics,,"Mr. Speaker, that Liberal candidate, that Liberal member, and every Liberal member opposes tax fairness for families. The Liberals opposed the child care benefit. They opposed $3,800 in benefits for single moms with two kids under the age of six. They opposed tax cuts for families. They voted against the ways and means motion recently. They want to take these benefits away from families, and they do so because they believe that Liberal politicians know better how to spend money than moms and dads. We profoundly disagree on this side.",Conservative,Calgary Southeast,Jason Kenney,http://www.parl.gc.ca/parlinfo/Files/Parliamentarian.aspx?Item=106c623c-3606-40ae-a2f6-f4a619cf02f6&Language=E&Section=ALL
4620535,ca.proc.d.2014-11-26.16473.90,2014-11-26,c0132e73-a431-4e7e-8f75-051a95a8edf0,1820,"Mr. Denis Blanchette (Louis-Hébert, NDP)",,Oral Questions,Quebec Bridge,,"Mr. Speaker, the consensus and mobilization of the people in the Quebec City area is beginning to bear fruit. 
The Minister of Infrastructure  is beginning to see the light at the end of the tunnel, or at the end of the bridge in this case. He finally decided to pick up the phone and talk to his provincial and municipal counterparts in order to find a solution. Now he has to find the paint brush that Jean Lapierre and the Liberals lost.
Will the minister keep the Prime Minister's promise and ensure that the Quebec Bridge restoration is completed?",New Democratic Party,Louis-Hébert,Denis Blanchette,http://www.parl.gc.ca/parlinfo/Files/Parliamentarian.aspx?Item=c0132e73-a431-4e7e-8f75-051a95a8edf0&Language=E&Section=ALL
4620536,ca.proc.d.2014-11-26.16473.91,2014-11-26,655f75f0-7c4c-4dd1-b0d7-317be0595660,545,"Hon. Denis Lebel (Minister of Infrastructure, Communities and Intergovernmental Affairs and Minister of the Economic Development Agency of Canada for the Regions of Quebec, CPC)",,Oral Questions,Quebec Bridge,,"Mr. Speaker, as we have already said, a legal process is underway and a ruling was recently handed down. 
We will continue to have discussions with the different partners in this matter. The New Democrats believe that just because they think it is going to snow this winter, they can take credit for it.
They definitely cannot take the credit for the current talks being held.",Conservative,Roberval--Lac-Saint-Jean,Denis Lebel,http://www.parl.gc.ca/parlinfo/Files/Parliamentarian.aspx?Item=655f75f0-7c4c-4dd1-b0d7-317be0595660&Language=E&Section=ALL
4620537,ca.proc.d.2014-11-26.16473.92,2014-11-26,4cb0ba6b-f142-4b9d-921b-e1ee27d48e24,413,"Hon. Ron Cannan (Kelowna—Lake Country, CPC)",,Oral Questions,International Trade,,"Mr. Speaker, in an increasingly globalized world, it is vital that Canadian businesses have access to dynamic and fast-growing markets in order to create jobs and long-term prosperity for hard-working Canadians and their families. Our Conservative government has a proven track record of opening new markets for Canadian exporters. 
As we recently heard from the Minister of International Trade, our government has signed free trade agreements with 38 countries. Can the tireless and hard-working Minister of International Trade please update Canadians on our government's latest efforts to create jobs and prosperity through trade?",Conservative,Kelowna--Lake Country,Ron Cannan,http://www.parl.gc.ca/parlinfo/Files/Parliamentarian.aspx?Item=4cb0ba6b-f142-4b9d-921b-e1ee27d48e24&Language=E&Section=ALL
4620538,ca.proc.d.2014-11-26.16473.93,2014-11-26,fc9a44ff-23e0-45df-8ec4-a9cccefa71e1,424,"Hon. Ed Fast (Minister of International Trade, CPC)",,Oral Questions,International Trade,,"Mr. Speaker, I am pleased to inform the House that the Canada–Korea free trade agreement passed third reading in the Senate. Canadian companies will soon have preferential access to South Korea, which will become a strategic gateway for Canadian businesses into Asia. This agreement will increase Canadian exports to South Korea by 32% and boost our economy by almost $2 billion annually. Exporters from across our country asked us to support them as they compete in the global marketplace, and once again we are delivering.",Conservative,Abbotsford,Ed Fast,http://www.parl.gc.ca/parlinfo/Files/Parliamentarian.aspx?Item=fc9a44ff-23e0-45df-8ec4-a9cccefa71e1&Language=E&Section=ALL
4620539,ca.proc.d.2014-11-26.16473.94,2014-11-26,d89e2700-537a-48d1-96f2-c55ef4f7caf1,400,"Mr. Alex Atamanenko (British Columbia Southern Interior, NDP)",,Oral Questions,Rail Transportation,,"Mr. Speaker, for over 40 years my constituents in Castlegar, Blueberry, Genelle, and Rivervale have been able to sleep without being disturbed by trains at night. However, now CP has begun to run night trains without prior warning. The community has made its opposition very clear at two public meetings. Letters have been written, people are upset, lives have been severely disrupted.
Right now, there is no incentive for CP to find a solution or to work with the local community to find a compromise. Will the minister work with me to help convince CP Rail that a workable solution is possible and would benefit all?",New Democratic Party,British Columbia Southern Interior,Alex Atamanenko,http://www.parl.gc.ca/parlinfo/Files/Parliamentarian.aspx?Item=d89e2700-537a-48d1-96f2-c55ef4f7caf1&Language=E&Section=ALL
4620540,ca.proc.d.2014-11-26.16473.95,2014-11-26,379a808d-9183-4a07-90c7-cdeb0ec3de63,302,"Mr. Jeff Watson (Parliamentary Secretary to the Minister of Transport, CPC)",,Oral Questions,Rail Transportation,,"Mr. Speaker, obviously, in the minister's place right now, I will not commit her to a specific action, but I will take this matter under advisement to her. Of course, in all of these circumstances we encourage railway companies to speak directly with municipalities and work on these issues.",Conservative,Essex,Jeff Watson,http://www.parl.gc.ca/parlinfo/Files/Parliamentarian.aspx?Item=379a808d-9183-4a07-90c7-cdeb0ec3de63&Language=E&Section=ALL
4620541,ca.proc.d.2014-11-26.16473.96,2014-11-26,27d16187-5e2a-448b-b76a-fd6229606f1b,8589,"Mr. Jean-François Fortin (Haute-Gaspésie—La Mitis—Matane—Matapédia, FD)",,Oral Questions,Natural Resources,,"Mr. Speaker, the truth behind TransCanada's energy east project is that the pipeline would have a serious impact on fragile natural environments and the people living around them. 
All across Quebec and in Lanaudière, farmers are concerned about their land, peat bogs and the sensitive ecosystems that are at risk. As the project continues to take shape, more and more people are speaking out against the idea of more than a million barrels of oil crossing that land every day.
Will the Minister of Natural Resources acknowledge the opposition to the energy east project and stop claiming, as the leader of the NDP has done, that a pipeline next to the St. Lawrence River is a reasonable option?",Forces et Démocratie,Haute-Gaspésie--La Mitis--Matane--Matapédia,Jean-François Fortin,http://www.parl.gc.ca/parlinfo/Files/Parliamentarian.aspx?Item=27d16187-5e2a-448b-b76a-fd6229606f1b&Language=E&Section=ALL
4620542,ca.proc.d.2014-11-26.16473.97,2014-11-26,60f0a037-1e3d-4e48-902c-61a731ed99ab,581,"Hon. Greg Rickford (Minister of Natural Resources and Minister for the Federal Economic Development Initiative for Northern Ontario, CPC)",,Oral Questions,Natural Resources,,"Mr. Speaker, unlike the opposition, we will not take a position before the examination is complete.
The National Energy Board is tasked with hearing directly from the people concerned, who have relevant information or expertise in the field. We rely on science and facts to make decisions.
We have been clear. The projects will be studied only if they are safe for Canadians and pose no risks to the environment.",Conservative,Kenora,Greg Rickford,http://www.parl.gc.ca/parlinfo/Files/Parliamentarian.aspx?Item=60f0a037-1e3d-4e48-902c-61a731ed99ab&Language=E&Section=ALL
4620543,ca.proc.d.2014-11-26.16473.98,2014-11-26,6519cfba-0080-419d-baa9-8ae6e56d032f,256,The Speaker,,Oral Questions,Presence in Gallery,,"I would like draw the attention of hon. members to the presence in the gallery of the Hon. Randy Delorey, Minister of Environment and Minister of Gaelic Affairs for the Province of Nova Scotia. ",Conservative,Regina--Qu'Appelle,Andrew Scheer,http://www.parl.gc.ca/parlinfo/Files/Parliamentarian.aspx?Item=6519cfba-0080-419d-baa9-8ae6e56d032f&Language=E&Section=ALL
4620544,ca.proc.d.2014-11-26.16473.99,2014-11-26,,,,intervention,Oral Questions,Presence in Gallery,," Hear, hear!",,,Some hon. members,
4620545,ca.proc.d.2014-11-26.16473.100,2014-11-26,22a96405-bed6-45e9-811a-69d055416803,408,"Hon. Steven Blaney (Minister of Public Safety and Emergency Preparedness, CPC)",,Oral Questions,Points of Order,Oral Questions,"Mr. Speaker, I would like to rise on a point of order regarding question period. 
The leader of the Liberal Party made reckless, inaccurate and false comments on an important safety and security issue, therefore misleading the House. The member is wrong about the common sense firearms licensing act and the facts—",Conservative,Lévis--Bellechasse,Steven Blaney,http://www.parl.gc.ca/parlinfo/Files/Parliamentarian.aspx?Item=22a96405-bed6-45e9-811a-69d055416803&Language=E&Section=ALL
4620546,ca.proc.d.2014-11-26.16473.101,2014-11-26,6519cfba-0080-419d-baa9-8ae6e56d032f,256,The Speaker,,Oral Questions,Points of Order,Oral Questions,"Order, please. That seems like debate more than a point of order. The minister is free to make those points in a future question period perhaps or when the bill is debated.
I see the hon. member for Papineau rising. I am suspicious that this may not be a point of order either, but I will give him the benefit of the doubt.",Conservative,Regina--Qu'Appelle,Andrew Scheer,http://www.parl.gc.ca/parlinfo/Files/Parliamentarian.aspx?Item=6519cfba-0080-419d-baa9-8ae6e56d032f&Language=E&Section=ALL
4620547,ca.proc.d.2014-11-26.16473.102,2014-11-26,b8c04eca-f237-48a8-8975-374ccd40d1a9,567,"Mr. Justin Trudeau (Papineau, Lib.)",,Oral Questions,Points of Order,Oral Questions,"It is a response, Mr. Speaker. If that is not appropriate, I will sit down.",Liberal,Papineau,Justin Trudeau,http://www.parl.gc.ca/parlinfo/Files/Parliamentarian.aspx?Item=b8c04eca-f237-48a8-8975-374ccd40d1a9&Language=E&Section=ALL
4620548,ca.proc.d.2014-11-26.16473.103,2014-11-26,6519cfba-0080-419d-baa9-8ae6e56d032f,256,The Speaker,,Oral Questions,Points of Order,Oral Questions,"I do think this could create a great deal of disorder if we extend question period. It is already well past 3 o'clock. We will get back to that point of order.
I do have notice of a point of order from the hon. member for Bas-Richelieu—Nicolet—Bécancour.",Conservative,Regina--Qu'Appelle,Andrew Scheer,http://www.parl.gc.ca/parlinfo/Files/Parliamentarian.aspx?Item=6519cfba-0080-419d-baa9-8ae6e56d032f&Language=E&Section=ALL
4620549,ca.proc.d.2014-11-26.16473.104,2014-11-26,4b9cf7c8-d5db-4efa-a24e-c26afde48cc3,232,Mr. Louis Plamondon,Interjection,Oral Questions,Points of Order,Oral Questions,"Mr. Speaker, on November 9, in a symbolic vote, more than 80% of voters—2.2 million Catalans—voted on the independence of Catalonia. I seek the unanimous consent of the House to move this short motion: that the House of Commons recognize the right of the people of Catalonia to hold a referendum on its political future.",Bloc Québécois,Bas-Richelieu--Nicolet--Bécancour,Louis Plamondon,http://www.parl.gc.ca/parlinfo/Files/Parliamentarian.aspx?Item=4b9cf7c8-d5db-4efa-a24e-c26afde48cc3&Language=E&Section=ALL
4620550,ca.proc.d.2014-11-26.16473.105,2014-11-26,6519cfba-0080-419d-baa9-8ae6e56d032f,256,The Speaker,,Oral Questions,Points of Order,Oral Questions,Does the hon. member have the unanimous consent of the House to propose this motion?,Conservative,Regina--Qu'Appelle,Andrew Scheer,http://www.parl.gc.ca/parlinfo/Files/Parliamentarian.aspx?Item=6519cfba-0080-419d-baa9-8ae6e56d032f&Language=E&Section=ALL
4620551,ca.proc.d.2014-11-26.16473.106,2014-11-26,,,,intervention,Oral Questions,Points of Order,Oral Questions," Agreed.
 No.",,,Some hon. members,
4620552,ca.proc.d.2014-11-26.16473.107,2014-11-26,e44116f8-75a8-4ca6-9ba5-fe968dbd42b0,8392,Mr. Sean Casey,Interjection,Oral Questions,Points of Order,Oral Questions,"Mr. Speaker, I would like to ask for unanimous consent for the following motion: That notwithstanding any Standing Order or usual practice of the House, the amendment to the second reading motion of Bill C-583, an act to amend the Criminal Code (fetal alcohol spectrum disorder), be deemed to have been withdrawn, that the bill be deemed to have been read the second time and referred to the Standing Committee on Justice and Human Rights.",Liberal,Charlottetown,Sean Casey,http://www.parl.gc.ca/parlinfo/Files/Parliamentarian.aspx?Item=e44116f8-75a8-4ca6-9ba5-fe968dbd42b0&Language=E&Section=ALL
4620553,ca.proc.d.2014-11-26.16473.108,2014-11-26,6519cfba-0080-419d-baa9-8ae6e56d032f,256,The Speaker,,Oral Questions,Points of Order,Oral Questions,Does the hon. member have the unanimous consent of the House for this motion?,Conservative,Regina--Qu'Appelle,Andrew Scheer,http://www.parl.gc.ca/parlinfo/Files/Parliamentarian.aspx?Item=6519cfba-0080-419d-baa9-8ae6e56d032f&Language=E&Section=ALL
4620554,ca.proc.d.2014-11-26.16473.109,2014-11-26,,,,intervention,Oral Questions,Points of Order,Oral Questions," Agreed.
 No.",,,Some hon. members,
4620555,ca.proc.d.2014-11-26.16473.110,2014-11-26,72dace30-741a-4877-8c1c-31b5dc3e4a8e,28,"Mr. James Bezan (Parliamentary Secretary to the Minister of National Defence, CPC)",,Oral Questions,Points of Order,Oral Questions,"Mr. Speaker, I rise on a point of order. In question period the member for St. John's East suggested that I had committed the Minister of National Defence to provide cost estimates at the meeting of national defence committee. He took me out of context and—",Conservative,Selkirk--Interlake,James Bezan,http://www.parl.gc.ca/parlinfo/Files/Parliamentarian.aspx?Item=72dace30-741a-4877-8c1c-31b5dc3e4a8e&Language=E&Section=ALL
4620556,ca.proc.d.2014-11-26.16473.111,2014-11-26,6519cfba-0080-419d-baa9-8ae6e56d032f,256,The Speaker,,Oral Questions,Points of Order,Oral Questions,"We have 45 minutes every day for members to make these kinds of points. When question period ends, then so too does the debate on these issues and we move on to normally routine proceedings or orders of the day, and that is where we are at today.
If the member feels compelled to make that point, I am sure the subject matter will come up again tomorrow and he will be free to do so then. This is not a point of order.",Conservative,Regina--Qu'Appelle,Andrew Scheer,http://www.parl.gc.ca/parlinfo/Files/Parliamentarian.aspx?Item=6519cfba-0080-419d-baa9-8ae6e56d032f&Language=E&Section=ALL
4620557,ca.proc.d.2014-11-26.16473.112,2014-11-26,fe517b95-bc62-4fe8-96aa-998994aefd48,173,"Mr. Tom Lukiwski (Parliamentary Secretary to the Leader of the Government in the House of Commons, CPC)",,Routine Proceedings,Government Response to Petitions,,"Mr. Speaker, pursuant to Standing Order 38(6) I have the honour to table, in both official languages, the government's response to six petitions.",Conservative,Regina--Lumsden--Lake Centre,Tom Lukiwski,http://www.parl.gc.ca/parlinfo/Files/Parliamentarian.aspx?Item=fe517b95-bc62-4fe8-96aa-998994aefd48&Language=E&Section=ALL
4620558,ca.proc.d.2014-11-26.16473.113,2014-11-26,8ffa648a-5f24-477f-81a8-8a79aead2273,9132,"Hon. Kerry-Lynne D. Findlay (Minister of National Revenue, CPC)",,Routine Proceedings,Canada Revenue Agency,,"Mr. Speaker, it is my pleasure to table, in both official languages, the Canada Revenue Agency's updated underground economy strategy entitled “Reducing Participation in the Underground Economy”.",Conservative,Delta--Richmond East,Kerry-Lynne Findlay,http://www.parl.gc.ca/parlinfo/Files/Parliamentarian.aspx?Item=8ffa648a-5f24-477f-81a8-8a79aead2273&Language=E&Section=ALL
4620559,ca.proc.d.2014-11-26.16473.114,2014-11-26,c01339dd-da66-4748-8991-3c84a24e72ca,561,"Mr. Rodney Weston (Saint John, CPC)",,Routine Proceedings,Committees of the House,Fisheries and Oceans,"Mr. Speaker, I have the honour to present, in both official languages, the first report of the Standing Committee on Fisheries and Oceans in relation to Bill C-555, An Act respecting the Marine Mammal Regulations (seal fishery observation licence). 
The committee has studied the bill and has decided to report the bill back to the House without amendment.",Conservative,Saint John,Rodney Weston,http://www.parl.gc.ca/parlinfo/Files/Parliamentarian.aspx?Item=c01339dd-da66-4748-8991-3c84a24e72ca&Language=E&Section=ALL
4620560,ca.proc.d.2014-11-26.16473.115,2014-11-26,0bd5970c-e4c2-4044-8344-8123b16d75bd,594,"Hon. Peter Kent (Thornhill, CPC)",,Routine Proceedings,Committees of the House,National Defence,"Mr. Speaker, I have the honour to present, in both official languages, the seventh report of the Standing Committee on National Defence in relation to the supplementary estimates (B), 2014-15.",Conservative,Thornhill,Peter Kent,http://www.parl.gc.ca/parlinfo/Files/Parliamentarian.aspx?Item=0bd5970c-e4c2-4044-8344-8123b16d75bd&Language=E&Section=ALL
