basepk,hid,speechdate,pid,opid,speakeroldname,speakerposition,maintopic,subtopic,subsubtopic,speechtext,speakerparty,speakerriding,speakername,speakerurl
4620648,ca.proc.d.2014-11-26.16473.203,2014-11-26,c052aaf8-167e-4f44-982f-7f3744e7366d,595,"Mr. John Rafferty (Thunder Bay—Rainy River, NDP)",,Private Members’ Business,Department of Public Works and Government Services Act,,"Mr. Speaker, I am supporting this bill at second reading. It is important to refer the bill to committee because some amendments should be made to the bill, and the committee should hopefully take care of that and then bring it back to the House.
Let me just outline that very quickly with a little background.
 The bill is a resumption of a bill that was tabled in 2010, which we also voted on at the time. The bill would require that before soliciting bids for the construction, maintenance or repair of public works, federal immovables and federal real property, the Minister of Public Works and Government Services give preference to the concept that promotes the use of wood, while taking into account factors such as cost and greenhouse gas emissions.
I say “amendments” because I am not entirely happy with the wording of the bill where it says “give preference to”. I believe there is a better way to say this, perhaps “compare materials” or something of the kind. I certainly hope there will be some amendments to the bill.
The important part of this bill is not only the use of wood, and I will talk about why that is important in Canada. The government could save money with this bill, using more wood in the construction and repairs of federal buildings.
A life-cycle cost analysis produced by the U.S. defense department some years ago demonstrated that wooden structures cost 40% less per square foot than steel or masonry structures. Construction cost was 37% less for wood. Operation and maintenance costs were 55% less for wood than for other materials. This would help not only our wood industry, particularly the specialty wood industry.
 When we think of forest products and the use of wood, and a lot of people think of 2x4s and maybe pulp for pulpwood, and if we are to make our forest industry as diverse as possible, let us think of the construction of buildings, of beams, of curved beams, of the sorts of main parts of structures of buildings where we could find new uses for forest products.
I want to briefly mention what has happened to the forest industry in the last number of years. I will go through some facts and figures because it is very instructive. I will talk about direct employment in our forest industry, meaning those who actually work with the wood. It is usually indicated in the forest industry that for every direct job there are three indirect jobs, so we can extrapolate how important these jobs are, have been and were to Canada, and what we have lost in the meantime. 
In general, since 2008, with the big downturn in Canada and the rest of the world, we have lost 30% of its forestry jobs. The hardest-hit provinces were: Quebec, where the losses were 32.3% in direct jobs, and I am not talking about indirect jobs because that would be much more; Ontario, 34.2%; and British Columbia, 29.7%. All of the provinces had a loss. Newfoundland and Labrador had a net loss of 55.8% of its forest industry.
It is incumbent on us in Ottawa to ask how we can move forward with a very vibrant forest industry, which we have and have had, and help to ensure that forest products are used to their fullest extent and with their best possible uses. This bill would go a small way in that direction.
I like to think that the forest industry has perhaps bottomed out in terms of job losses. In my riding of Thunder Bay—Rainy River, in Fort Frances, the mill closed two years ago and is now going to be completely shuttered, and these losses still continue. In fact. in northern Ontario, if I remember my figures correctly, we lost 44,000 forestry jobs. That was more than half the forestry jobs that we had in northern Ontario. It was a huge loss. That is one of the reasons I am supporting this bill at second reading.
 It is important to note that in Canada the national codes, the federal codes, allow for the safe use of wood while providing occupants appropriate protection from fire, earthquakes, or storms, so if people are thinking that wood will not do the job that concrete will do, for example, they should know that it can do the same job.
A bill with these amendments that I was talking about would just make sure that when there is a federal building project, wood would be considered. The bill is not binding. The purpose is really to establish that wood is one of the options available and should be considered. 
Annual sales of Canadian forest products are about $57 billion and represent about 12% of Canada's manufacturing GDP. Even with these huge job losses across the country, the forestry sector is still one of the country's biggest employers. It has activities in more than 200 forestry communities. Many of them are in northern Ontario, but others stretch right across Canada. Two hundred communities depend on forestry to provide their tax base, to provide employment, and to make these communities vibrant.
I want to talk about Quebec very briefly. The wood charter has been adopted so that managers of public projects can systematically evaluate the option of using wood in producing a comparative analysis of the greenhouse gas emissions of materials. I think it is important to note that wood compares favourably with other building materials, such as steel and concrete, which consume 26% to 34% more energy and emit 57% to 81% more greenhouse gases than wood. As well, on average each cubic metre of wood captures one tonne of carbon dioxide from the atmosphere.
We can think of it in environmental terms. I talked about cost and I talked about environmental terms, and wood just simply makes sense. 
It is important for us in this place to show that we support forestry workers right across this country and that we support the use of local products, provided these products comply with the standards in effect across this country. We want the government to make judicious choices by giving consideration to life cycle and cost analysis when considering wood.
By the way, the government already has a policy on leadership in energy and environmental design. It is called LEED certification. It is a rating system recognized as the international brand of excellence for green buildings.
In any number of areas, the use of wood is something that should be considered. I will be supporting this bill at second reading, hoping to get it to committee where we will see an amendment or two that will make this bill even better and perhaps more palatable in this place. I will be following this bill very closely and, quite frankly, so will Canadians in 200 forest communities right across this country. ",New Democratic Party,Thunder Bay--Rainy River,John Rafferty,http://www.parl.gc.ca/parlinfo/Files/Parliamentarian.aspx?Item=c052aaf8-167e-4f44-982f-7f3744e7366d&Language=E&Section=ALL
4620649,ca.proc.d.2014-11-26.16473.204,2014-11-26,07cf5767-802c-406c-92a7-7dc92af79b40,4264,"Mr. Kevin Lamoureux (Winnipeg North, Lib.)",,Private Members’ Business,Department of Public Works and Government Services Act,,"Mr. Speaker, it is with pleasure that I rise today to speak to this private member's bill. 
It is not a long bill to read. It is fairly short, but I think it sends a strong message in terms of the importance of wood products and how the use of wood products could be enhanced by the industry as a whole.
We need to recognize that the forest industry is likely one of Canada's oldest industries, dating back to 100-plus years ago. When many communities first began to form, they relied on wood to sustain them. The member who spoke just prior to me made reference to 200 communities. I suspect that when he says 200, that is a minimum number of communities.
I know that in the province of Quebec, for example, there were likely 150-plus communities. An article that I can recall reading said there were many communities in the province of Quebec alone that are very much dependent on wood and recognize the value of our forestry industry. The Quebec provincial government has recognized that value, and now a member in the House from the province of Quebec has introduced this particular bill.
The forest industry goes far beyond the borders of Quebec. It includes all the different regions of Canada. British Columbia is very dependent on its forest industry, which contributes immensely to its economy. People who fly over, drive through, or take the train—which I have not had the opportunity to do to date, though I hope to at some point in the future, as it would be a wonderful experience—get a glimpse of the industry and the potential that is within the industry. 
Liberals do not want to minimize the potential of the industry. When I think of the industry as a whole, I see opportunities. I would love for us to explore the potential of exporting our forestry products. I do not think we are anywhere close to reaching the export potential for some of our forestry products, including pulp and paper, the finished products, and even raw logs. I remember some representatives from the Philippines asking me a number of years ago about the export of logs and how they could be utilized in the Philippines. There are all sorts of windows of opportunity in exporting, and we need to explore how we can build upon the industry. 
In terms of the raw numbers, the billions of dollars every year that are generated, I understand the contribution of our forestry industry to the Canadian GDP to be very close to half a trillion dollars. We are talking about billions of dollars and literally tens of thousands of good, valuable jobs within the industry. Even though I made reference to Quebec and B.C., there are many provinces that receive the benefits, whether it is northern Ontario or my home province of Manitoba.
Perhaps I can give a sense of the importance of the forest industry to Manitoba. During the 1990s, for example, there were between 5,000 and 7,000 jobs. A significant number of jobs were being created by the hundreds of millions of dollars in exports. At that time, Manitoba's contribution was probably closer to $1.15 million, and today it is $1.25 million. At the end of the day, the province of Manitoba has done exceptionally well with a very strong and vibrant forest industry. 
It is an industry that provides a lot of pulp and paper. I would not necessarily want to be quoted on this, but I believe in excess of 50% of our forest industry in the province of Manitoba, maybe even close to 60%, is driven by pulp and paper.
This is something I did look up. In 2008, we had in excess of $450 million in terms of exports. That is why I made reference to the potential that exists in exportation. In Manitoba back in 2008, 85% was being exported to the U.S. Next to the U.S., Europe is a much smaller percentage. When we look at Asia and other countries, it is that much smaller. I would argue that is something in which there is great growth.
Today, it is estimated that we have somewhere in the neighbourhood of 7,000 people in my home province who are employed within the forestry industry. Perhaps that is in pulp and paper, where we have seen an overall decline in demand for the product. There are many different ways in which we can develop our forest industry, especially when we talk about the final product. We can look at ways in which we can take a tree and convert it into something like furniture and then sell the furniture as a consumable item. I look at my own province and the way wood is being used. We have manufacturers of fine, wonderful furniture. We have building supplies. I cannot help but think of prefabrication, whether it is cottages, mobile homes, or windows. There are all sorts of things being prefabricated in my home city of Winnipeg and other communities in Manitoba.
 As has been pointed out, there is great consumption of wood in the province of Manitoba for the construction of homes. Depending on the province and location in Canada, we might find that some provinces have a higher per capita usage of wood than other building products. I suspect Manitoba might be at the higher end with respect to the use of wood products. I do not know that for a fact but just from general observations I have made in my travels in Canada.
The economy and the industry is doing relatively well in the province. Having said that, it is important that we recognize the ways we can support our industries in an economic way, keeping in mind that we have many municipalities. We have many municipalities that are fairly dependent on the direct jobs from our forests. If we see any continuation of a downward spiral in the forest industry in certain areas and communities in our country, it can have a devastating impact on our economy, especially when we have one-industry types of town or community that are so dependent on forestry. 
That is why, when we see private member's bills such as this, we should at the very least be talking about the importance of the forestry industry. It has a wonderful, lengthy history in Canada. It is important that we do what we can to protect and promote that industry going forward and that we do not take it for granted, because everything I have talked about generally has been with respect to those direct jobs. The indirect jobs easily go into the hundreds of thousands. It is an industry that needs to have more attention from the House.
 It is with pleasure that I conclude on that comment.",Liberal,Winnipeg North,Kevin Lamoureux,http://www.parl.gc.ca/parlinfo/Files/Parliamentarian.aspx?Item=07cf5767-802c-406c-92a7-7dc92af79b40&Language=E&Section=ALL
4620650,ca.proc.d.2014-11-26.16473.205,2014-11-26,6696452b-1ef5-449d-9002-fd1b57fb0c12,427,"Mr. Royal Galipeau (Ottawa—Orléans, CPC)",,Private Members’ Business,Department of Public Works and Government Services Act,," Mr. Speaker, as we said during the previous debate on this bill, the government is sympathetic with respect to the intent of this bill, and we appreciate the vital importance of the forestry industry to communities not just in Quebec, but across Canada.
We are also happy with the forest sector's contribution to our country's international trading activity, making Canada the second largest exporter of primary forest products in the world, which is why we do not in any way take this legislation or this debate lightly.
This discussion is an important one because thousands of Canadians in communities from coast to coast rely on forestry for their livelihoods. As my father said, forestry as an industry is part of the fabric of our country.
As many hon. members have already noted, the forest sector has been facing a number of challenges over the last few years. For example, today most of us get our news online rather than from reading newspapers. This impacts the demand for newsprint.
A weakened global economy and, until recently, the high dollar have also hurt the international sales of our various forest products.
For these reasons, the government has supported, and will continue to support, Canada's forest sector by continuing to encourage market diversification and the expansion of global markets while providing support to fuel innovation.
In fact, since 2006, the government has provided over $1.8 billion through a number of initiatives to support both the economic competitiveness and the environmental sustainability of Canada's forest sector. That is $4 million a week. Let me list a few examples. 
There is FPInnovations, which the Minister of Natural Resources helped to create and which in just seven years has become the world's largest public-private forest products research institute. 
There is the $197 million provided over four years under the 2012 and 2013 economic action plans for the forest innovation program. This program is designed to foster innovation and the adoption of emerging technologies by forest companies.
Then there is the $105 million over two years under economic action plan 2012. This is money allocated to support industry sector innovation and market development.
There was also another $92 million dedicated in the economic action plan of 2013 to develop innovative new products and diversify markets.
While speaking of the trade front, the Canada-U.S. softwood lumber agreement has been extended until October 2015, and the new Canada-EU trade agreement will provide Canadian wood products with preferential access to the massive European market.
Considering this is only a partial list of projects, programs and other measures the government has taken, we are proud of its record support to the industry.
Therefore, while we sympathize with the intent of this legislation, this bill has several fundamental flaws which make it impossible for us, in good conscience, to support.
This bill would require the Minister of Public Works and Government Services, before soliciting bids for construction, maintenance, or repair work, to give preference to the use of wood as a building material. On the face of it, this might sound like a good idea to some, but, as outlined in the previous debate, this proposed approach has several problems.
Some procurement principles dictate that solicitation requirements cannot be biased in favour of or against particular goods or services. This includes goods or services related to construction contracts or in favour of or against the suppliers of such goods and services.
These principles of fairness are fundamental to the government procurement process. While giving preference to a particular good or service would certainly provide an advantage to certain suppliers, would we really want the federal government to be seen as blatantly biased in its procurement processes?
These same principles are also reflected in the trade agreements our country has signed. Including a preference for wood products in tender requirements would contravene Canada's trade obligations under a number of agreements, causing us to run afoul not only of international rules but domestic rules as well. In fact, if tenders indicated a preference for the use of wood in construction, it is almost certain that the Department of Public Works and Government Services would quickly find itself before the Canadian International Trade Tribunal, whose mission, in part, is to ensure fair and transparent government procurement processes.
The practical effect of this bill is that it would prevent the Minister of Public Works and Government Services from fulfilling her mandate as stipulated in her own legislation, the Department of Public Works and Government Services Act.
By giving preference to the use of wood in the construction and renovation of federal buildings, the bill indirectly promotes one sector over other, also essential, sectors of the Canadian economy.
In essence, if adopted, the bill would favour the economies of some regions over others, in direct conflict with the mandate of the Department of Public Works and Government Services, which has procurement processes in place to ensure openness, fairness, and transparency in order to obtain the best value for the Crown.
I would be remiss if I did not remind that House that the bill mimics another bill introduced by the Bloc Québécois almost five years ago. Members who were here then will recall that the previous incarnation of the bill was soundly defeated at report stage in December 2012.
It is interesting to note that at that time, both the official opposition and the third party could not agree on a unified position when it came to this bill. The votes were split along regional and provincial lines, and many opposition members could see that this bill was fundamentally flawed and did not support it.
I admit that 101 opposition MPs voted for it. Their reward? Sixty-nine of them are gone. They remind me of the turkeys who voted for an early Christmas.
Of note, during consideration of the previous incarnation of the bill, my distinguished friend from Winnipeg Centre and the current official opposition critic for Public Works, said:
 We really shouldn't be seized of the issue of what kind of flooring we're going to put into the next public building.... I mean, are we going to have a private members' bill to dictate what kind of curtains we put in the next building we build? 
To sum up, while we laud the intent of the bill, the bill is fraught with problems. The reasons we cannot support it go to the very core of our responsibility as a democratic government to run procurement processes that are fair and transparent. They also reflect our country's standing as an international trading partner that respects the trade agreements to which we are signatory.
In closing, I am proud of the government's strong support for the forest industry in this country. Our significant investments in the forest sector provide clear evidence of this robust support.
And while we are sympathetic to the intent of this proposed legislation, the bill's fundamental flaws make it impossible for us to support it. ",Conservative,Ottawa--Orléans,Royal Galipeau,http://www.parl.gc.ca/parlinfo/Files/Parliamentarian.aspx?Item=6696452b-1ef5-449d-9002-fd1b57fb0c12&Language=E&Section=ALL
