basepk,hid,speechdate,pid,opid,speakeroldname,speakerposition,maintopic,subtopic,subsubtopic,speechtext,speakerparty,speakerriding,speakername,speakerurl
4591558,ca.proc.d.2014-03-06.15907.128,2014-03-06,424c647d-2438-4682-a944-e94e38383e7a,219,"Mr. Massimo Pacetti (Saint-Léonard—Saint-Michel, Lib.)",,Government Orders,Canada-Honduras Economic Growth and Prosperity Act,Bill C-20—Time Allocation Motion,"Mr. Speaker, I want to thank the minister for being here. 
I have a quick question for him. I am trying to reconcile his earlier statements in his first intervention, when he said that the Honduras negotiations for this free trade agreement took four or five years. He can correct me if I am wrong, but now, all of a sudden, we can debate it in a day or two or whatever time has been allocated to us.
It took forever to negotiate an agreement with a country to which we export only $38 million of goods a year. There seem to be all kinds of complexities involved in the deal if it took so long to negotiate. Meanwhile, we cannot even get the time to debate those complexities. 
 Can the minister clear up those contradicting statements?",Liberal,Saint-Léonard--Saint-Michel,Massimo Pacetti,http://www.parl.gc.ca/parlinfo/Files/Parliamentarian.aspx?Item=424c647d-2438-4682-a944-e94e38383e7a&Language=E&Section=ALL
4591559,ca.proc.d.2014-03-06.15907.129,2014-03-06,fc9a44ff-23e0-45df-8ec4-a9cccefa71e1,424,Hon. Ed Fast,Interjection,Government Orders,Canada-Honduras Economic Growth and Prosperity Act,Bill C-20—Time Allocation Motion,"Mr. Speaker, perhaps the reason we have only $38 million worth of exports to Honduras is that we do not have an open market there and we do not have a free trade agreement with Honduras. 
In fact, I would remind the member that the European Union has had a free trade agreement in place for years. The United States has a trade agreement with Honduras. Mexico has a trade agreement in place with Honduras. Chile has an agreement in place with Honduras. Why is that? It is because they have understood that Honduras needs our help. 
The countries I mentioned all have strong, robust human rights regimes and strong democracies. They understand that Hondurans needs someone to walk beside them to share best practices, to move them into the 21st century, and to welcome them into the family of nations that respect human rights. That is the key role that Canada can play here. 
We are absolutely committed to bringing this trade agreement into force. We have provided lots of opportunities since November for the opposition parties to view this agreement here in the House. It was tabled back in November. We make no apologies for that. We want to get this deal done.",Conservative,Abbotsford,Ed Fast,http://www.parl.gc.ca/parlinfo/Files/Parliamentarian.aspx?Item=fc9a44ff-23e0-45df-8ec4-a9cccefa71e1&Language=E&Section=ALL
4591560,ca.proc.d.2014-03-06.15907.130,2014-03-06,e625ab0e-bcf7-4a97-8fb0-d75c73c3b78e,8664,"Mrs. Sadia Groguhé (Saint-Lambert, NDP)",,Government Orders,Canada-Honduras Economic Growth and Prosperity Act,Bill C-20—Time Allocation Motion,"Mr. Speaker, today the government is moving yet another time allocation motion. 
We have made it quite clear in the House that we do not want our democracy to be undermined in this way. Members of all parties in the House and Canadians watching our debates have the right to be informed about what is going on. This is unacceptable.
My colleague was talking about democracy in these countries, particularly in Honduras. He praised the democratic systems in those different countries, but he would be better off ensuring that democracy is as strong within our government here in Canada. That is not the case today. ",New Democratic Party,Saint-Lambert,Sadia Groguhé,http://www.parl.gc.ca/parlinfo/Files/Parliamentarian.aspx?Item=e625ab0e-bcf7-4a97-8fb0-d75c73c3b78e&Language=E&Section=ALL
4591561,ca.proc.d.2014-03-06.15907.131,2014-03-06,fc9a44ff-23e0-45df-8ec4-a9cccefa71e1,424,Hon. Ed Fast,Interjection,Government Orders,Canada-Honduras Economic Growth and Prosperity Act,Bill C-20—Time Allocation Motion,"Mr. Speaker, I would again remind the member of the NDP's appalling record on trade. NDP members have opposed virtually every trade agreement Canada has ever signed, so it should not be surprising to see the NDP members stand up in this House today and oppose the Honduras trade agreement, just as we fully expect them to oppose the EU trade agreement and an agreement with Japan or Korea. They are ideologically opposed to trade, and I would remind them of their terrible record.
When we were negotiating a trade agreement with Colombia, what did NDP members do? For two and a half years they stalled, obstructed, and filibustered. They had no intention of having a robust debate on the merits of the deal. They are simply stuck in an ideological rut and they cannot get out of it.
On this side of the House, we support trade and we support investment with our key trading partners abroad. ",Conservative,Abbotsford,Ed Fast,http://www.parl.gc.ca/parlinfo/Files/Parliamentarian.aspx?Item=fc9a44ff-23e0-45df-8ec4-a9cccefa71e1&Language=E&Section=ALL
4591562,ca.proc.d.2014-03-06.15907.132,2014-03-06,26c8b0bc-42d4-4db5-bf7d-1e1544c7b4b5,9172,"Mr. Dan Albas (Parliamentary Secretary to the President of the Treasury Board, CPC)",,Government Orders,Canada-Honduras Economic Growth and Prosperity Act,Bill C-20—Time Allocation Motion,"Mr. Speaker, I thank the minister for his work on this particular file. Last week we had a meeting of parliamentarians—a reception, actually—based on our efforts to establish further ties with the Americas. It seemed that all parties want to see further ties with that part of the world.
We all know that free trade is the new stimulus. It does not cost the taxpayers. It allows Canadian businesses to compete. If we do not have these kinds of trade deals, places in my riding such as Nor-Mar Industries, UEE, and Gorman Brothers will not be able to compete on an even playing field.
Will the minister please comment and inform the House on Canada's strategy on the Americas?",Conservative,Okanagan--Coquihalla,Dan Albas,http://www.parl.gc.ca/parlinfo/Files/Parliamentarian.aspx?Item=26c8b0bc-42d4-4db5-bf7d-1e1544c7b4b5&Language=E&Section=ALL
4591563,ca.proc.d.2014-03-06.15907.133,2014-03-06,fc9a44ff-23e0-45df-8ec4-a9cccefa71e1,424,Hon. Ed Fast,Interjection,Government Orders,Canada-Honduras Economic Growth and Prosperity Act,Bill C-20—Time Allocation Motion,"Mr. Speaker, our strategy since 2006 has been to use trade and investment to drive economic growth at home. That means opening up new markets around the world for Canadian investors and Canadian exporters.
Let me talk again about Honduras, because that is the subject of this motion. It is really unfortunate that the NDP does not want to debate the merits of the bill. I will. 
There is a Canadian company that is very active in Honduras. The name of the company is Gildan. It employs 20,000 Hondurans in manufacturing textiles and apparel.
Gildan has won numerous awards for corporate social responsibility and sustainability. This company has asked our government to please sign a trade agreement with Honduras because it will allow that company to increase trade between Honduras and Canada and provide it with opportunities to employ even more Hondurans. 
I had the opportunity to be on the ground in Honduras to visit one of Gildan's plans. It is clean and organized and has modern machinery. The company treats its employees well. That is the Canada brand going forward. That is why we want to open up new markets all around the world for Canadians exporters and investors.",Conservative,Abbotsford,Ed Fast,http://www.parl.gc.ca/parlinfo/Files/Parliamentarian.aspx?Item=fc9a44ff-23e0-45df-8ec4-a9cccefa71e1&Language=E&Section=ALL
4591564,ca.proc.d.2014-03-06.15907.134,2014-03-06,95ed53a7-7538-4c0f-85a4-64af76065f95,616,Mr. Don Davies,Interjection,Government Orders,Canada-Honduras Economic Growth and Prosperity Act,Bill C-20—Time Allocation Motion,"Mr. Speaker, here is the truth. The Conservatives have brought in two motions today to do one thing: to disrupt the testimony of the Chief Electoral Officer. This is after the Conservatives gave their word to the parties in this House that we would end a filibuster in order to have that testimony on Thursday. That is the only reason this is happening. It is the Conservatives breaking their word.
Let us talk about Honduras a bit. The Economist calls Honduras a hybrid regime, rather than its previous designation as a flawed democracy. It is getting worse. Transparency International ranks Honduras as the most corrupt country in Central America, calling it a major drug smuggling centre. The U.S. State Department estimates that 79% of all cocaine shipments originating in South America land in Honduras.
In 2013 there have been, on average, 10 massacres per month. Massacres are defined as the murder of three or more people at a time for political reasons. Honduras is the murder capital of the world, with 81 murders per 100,000 people, and the United Nations Office on Drugs and Crime reports as well that it is the most dangerous place in the word for journalists.
If the Conservatives have the courage to look at the facts, why are they cutting off debate in this House after half a day of debate? If this deal is so good, if Honduras is such a great partner, if this is so important to the Canadian economy, then let us have at least three or four sessions so that Canadians can debate the facts. However, the Conservatives do not have—",New Democratic Party,Vancouver Kingsway,Don Davies,http://www.parl.gc.ca/parlinfo/Files/Parliamentarian.aspx?Item=95ed53a7-7538-4c0f-85a4-64af76065f95&Language=E&Section=ALL
4591565,ca.proc.d.2014-03-06.15907.135,2014-03-06,1b175d0f-9278-4e04-9fa8-0368e591c5a5,69,The Deputy Speaker,,Government Orders,Canada-Honduras Economic Growth and Prosperity Act,Bill C-20—Time Allocation Motion,"Order. Order, please. The member will take his seat.
The hon. Minister of International Trade.",New Democratic Party,Windsor--Tecumseh,Joe Comartin,http://www.parl.gc.ca/parlinfo/Files/Parliamentarian.aspx?Item=1b175d0f-9278-4e04-9fa8-0368e591c5a5&Language=E&Section=ALL
4591566,ca.proc.d.2014-03-06.15907.136,2014-03-06,fc9a44ff-23e0-45df-8ec4-a9cccefa71e1,424,Hon. Ed Fast,Interjection,Government Orders,Canada-Honduras Economic Growth and Prosperity Act,Bill C-20—Time Allocation Motion,"Mr. Speaker, the only part I agree with is that yes, Honduras is a challenging place for security. It is a challenging place for human rights. We acknowledge that, but these same arguments were made by the NDP when we negotiated a trade agreement with Colombia. It was the very same argument, and we have seen significant improvements in security in Colombia. We have seen significant increases in support for human rights in Colombia. 
What is interesting about Honduras is that it is the largest source of development support from Canada. We are very interested in helping Honduras escape its troubled past. We are helping it on the security side. We are helping it on the justice side and the police enforcement side. We are helping it on the democratic capacity side. We want to make sure that as we open up new trade opportunities for Hondurans to improve their prosperity, move more people out of poverty, and give people hope, we also address those other areas that the member has just raised.",Conservative,Abbotsford,Ed Fast,http://www.parl.gc.ca/parlinfo/Files/Parliamentarian.aspx?Item=fc9a44ff-23e0-45df-8ec4-a9cccefa71e1&Language=E&Section=ALL
4591567,ca.proc.d.2014-03-06.15907.137,2014-03-06,e6d671ec-9039-4ed6-bd6f-cca3ddd257e1,8790,"Mr. Ted Hsu (Kingston and the Islands, Lib.)",,Government Orders,Canada-Honduras Economic Growth and Prosperity Act,Bill C-20—Time Allocation Motion,"Mr. Speaker, on the face of it, what we are debating is whether the time allocated for debate on the bill to implement the trade treaty with Honduras should be limited. We have the Conservative Party supporting cutting off debate and the opposition parties opposing it. 
I just heard a Conservative member ask a question, because he wanted more information. What I heard was a Conservative member asking the minister for more information about trade with Honduras. I heard a minister who had plenty to say in his answer. He had interesting answers. Obviously he has a lot that he feels needs to be said. I do not quite understand how that is consistent with the Conservative Party's desire to cut off debate on this legislation.
I also heard the minister talk about how all these other countries had treaties with Honduras and that Canada was behind. Therefore, I have a question—",Liberal,Kingston and the Islands,Ted Hsu,http://www.parl.gc.ca/parlinfo/Files/Parliamentarian.aspx?Item=e6d671ec-9039-4ed6-bd6f-cca3ddd257e1&Language=E&Section=ALL
4591568,ca.proc.d.2014-03-06.15907.138,2014-03-06,1b175d0f-9278-4e04-9fa8-0368e591c5a5,69,The Deputy Speaker,,Government Orders,Canada-Honduras Economic Growth and Prosperity Act,Bill C-20—Time Allocation Motion,"Order, please. The member for Skeena—Bulkley Valley is rising on a point of order.",New Democratic Party,Windsor--Tecumseh,Joe Comartin,http://www.parl.gc.ca/parlinfo/Files/Parliamentarian.aspx?Item=1b175d0f-9278-4e04-9fa8-0368e591c5a5&Language=E&Section=ALL
4591569,ca.proc.d.2014-03-06.15907.139,2014-03-06,031462db-8f61-48ed-bf9f-b033eb8312bb,75,"Mr. Nathan Cullen (Skeena—Bulkley Valley, NDP)",,Government Orders,Canada-Honduras Economic Growth and Prosperity Act,Bill C-20—Time Allocation Motion,"Mr. Speaker, I apologize to my friend from Kingston and the Islands. The timing of this point of order is required.",New Democratic Party,Skeena--Bulkley Valley,Nathan Cullen,http://www.parl.gc.ca/parlinfo/Files/Parliamentarian.aspx?Item=031462db-8f61-48ed-bf9f-b033eb8312bb&Language=E&Section=ALL
4591570,ca.proc.d.2014-03-06.15907.140,2014-03-06,43e39949-6902-4d38-a760-fb83c0132de4,122,Hon. Gary Goodyear,,Government Orders,Canada-Honduras Economic Growth and Prosperity Act,Bill C-20—Time Allocation Motion, Did you just cut off his debate?,Conservative,Cambridge,Gary Goodyear,http://www.parl.gc.ca/parlinfo/Files/Parliamentarian.aspx?Item=43e39949-6902-4d38-a760-fb83c0132de4&Language=E&Section=ALL
4591571,ca.proc.d.2014-03-06.15907.141,2014-03-06,031462db-8f61-48ed-bf9f-b033eb8312bb,75,Mr. Nathan Cullen,,Government Orders,Canada-Honduras Economic Growth and Prosperity Act,Bill C-20—Time Allocation Motion," I just began speaking, if you don't mind.
The point of order the New Democrats are raising today is necessitated by the actions of the government, and it is incumbent upon us to raise it at this time. We are under a prescription right now in which time has been allocated to a bill before the government. The government has presented a time allocation motion. There is a duty to consult that exists within our Standing Orders whenever the government seeks to invoke such a clause.
The reason this Standing Order rule and practice in the House exists is that time allocation is a serious measure. It is the most serious measure a government can take on any piece of legislation, because it limits all members from all parties in their ability to debate and discuss any legislation before the House. That is what this is presenting.
The point of order we seek to raise is that from time to time objections have been raised, by Conservatives when they were in opposition and by New Democrats as well, as to the circumstances in which agreement was reached or the nature of the consultations undertaken by the government. As with closure, the Speaker has ruled that the Chair possesses no discretionary power or authority to refuse a motion of time allocation if all the procedural exigencies have been observed. 
The Speaker has stated that the wording of the rule does not define the nature of the consultations that are to be held by the minister and representatives of the other parties. The Speaker has further ruled that the Chair has no authority to determine whether consultations took place nor what constitutes consultation among the representatives of the parties. All of that is correct, because it is not the Speaker's purview to witness, as the Speaker has observed, the consultations that go on among the parties in advance of a decision to be taken by the government, in this case, to limit the democratic rights of members, their own members included, to debate a piece of legislation.
This is based upon a Standing Order in the House, and I will cite the Standing Order for reference for all members to understand what we are talking about. Standing Order 78(3)(a) states:
 A Minister of the Crown who from his or her place in the House, at a previous sitting, has stated that an agreement could not be reached under the provisions of sections (1) or (2) of this Standing Order in respect of proceedings at the stage at which a public bill was then under consideration either in the House or in any committee, and has given notice of his or her intention so to do, may propose a motion during proceedings under Government Orders, for the purpose of allotting a specified number of days or hours for the consideration and disposal of proceedings at that stage; provided that the time allotted for any stage is not to be less than one sitting day and provided that for the purposes of this paragraph an allocation may be proposed in one motion to cover the proceedings at both the report and the third reading stages on a bill if that motion is consistent with the provisions of Standing Order 76.1(10). The motion shall not be subject to debate or amendment, and the Speaker shall put the question on the said motion forthwith. Any proceedings interrupted pursuant to this section of this Standing Order shall be deemed adjourned. 
This is exactly what has just happened. The government brought in a time allocation motion under this Standing Order, which is its power to do. It is an extreme power, and it is meant to be used in rare cases. The government has used it more than 50 times, a record in Canadian history. However, also in the Standing Order is a duty and an obligation on the part of the government to consult with other parties in the House as to the—",New Democratic Party,Skeena--Bulkley Valley,Nathan Cullen,http://www.parl.gc.ca/parlinfo/Files/Parliamentarian.aspx?Item=031462db-8f61-48ed-bf9f-b033eb8312bb&Language=E&Section=ALL
4591572,ca.proc.d.2014-03-06.15907.142,2014-03-06,60f0a037-1e3d-4e48-902c-61a731ed99ab,581,Hon. Greg Rickford,,Government Orders,Canada-Honduras Economic Growth and Prosperity Act,Bill C-20—Time Allocation Motion, Debate.,Conservative,Kenora,Greg Rickford,http://www.parl.gc.ca/parlinfo/Files/Parliamentarian.aspx?Item=60f0a037-1e3d-4e48-902c-61a731ed99ab&Language=E&Section=ALL
4591573,ca.proc.d.2014-03-06.15907.143,2014-03-06,fc9a44ff-23e0-45df-8ec4-a9cccefa71e1,424,Hon. Ed Fast,,Government Orders,Canada-Honduras Economic Growth and Prosperity Act,Bill C-20—Time Allocation Motion, Debate.,Conservative,Abbotsford,Ed Fast,http://www.parl.gc.ca/parlinfo/Files/Parliamentarian.aspx?Item=fc9a44ff-23e0-45df-8ec4-a9cccefa71e1&Language=E&Section=ALL
4591574,ca.proc.d.2014-03-06.15907.144,2014-03-06,031462db-8f61-48ed-bf9f-b033eb8312bb,75,Mr. Nathan Cullen,,Government Orders,Canada-Honduras Economic Growth and Prosperity Act,Bill C-20—Time Allocation Motion," I would ask the hon. members across the way to allow me to continue.
This is a point of order. I will thank the finance minister for his comments on the length of the point of order, but the point of order stands. The Conservatives can have their way with the power they have in a majority government, but they cannot simply run roughshod over the rules that have governed all governments in the history of Canada simply because they want to.
The point I raise is that the government earlier introduced time allocation on this trade agreement with Honduras. Previously, on the same morning, cynically, they also introduced time allocation on a previous motion before the House without any consultation with the opposition parties whatsoever, thereby contravening the Standing Orders that exist for all uses of this very extraordinary tool. The government seems, having used time allocation so often, to have gotten lazy with the procedure that is at hand. 
The consultation can take any form. It can take the form of a conversation between me and the House leader of the government. It can take the form of an email or a note, anything. It does not take much, but it shows a modicum of respect, not for the opposition parties but for Parliament itself. To bring in time allocation, the government has to at least go through the motions of suggesting that perhaps the opposition party has an extraordinary number or speakers or seeks multiple days on any given legislation. 
The government has to at least consult. It did not do that in this case. It did not even bother to show basic respect for Parliament, further driving home the argument and the fact that it holds this place in contempt. There is no basis of democratic values in the legislation the government introduced or how it did it—",New Democratic Party,Skeena--Bulkley Valley,Nathan Cullen,http://www.parl.gc.ca/parlinfo/Files/Parliamentarian.aspx?Item=031462db-8f61-48ed-bf9f-b033eb8312bb&Language=E&Section=ALL
4591575,ca.proc.d.2014-03-06.15907.145,2014-03-06,1b175d0f-9278-4e04-9fa8-0368e591c5a5,69,The Deputy Speaker,,Government Orders,Canada-Honduras Economic Growth and Prosperity Act,Bill C-20—Time Allocation Motion,"Order, please. Does the hon. Leader of the Government in the House of Commons wish to respond?",New Democratic Party,Windsor--Tecumseh,Joe Comartin,http://www.parl.gc.ca/parlinfo/Files/Parliamentarian.aspx?Item=1b175d0f-9278-4e04-9fa8-0368e591c5a5&Language=E&Section=ALL
4591576,ca.proc.d.2014-03-06.15907.146,2014-03-06,aa58e8f5-4a46-4c79-8e97-b9ebe28c9d9a,295,"Hon. Peter Van Loan (Leader of the Government in the House of Commons, CPC)",,Government Orders,Canada-Honduras Economic Growth and Prosperity Act,Bill C-20—Time Allocation Motion,"Mr. Speaker, yes, I do. You, as a former House leader, would certainly be familiar with the fact that we have regular consultations with the other parties. With the House leaders we have weekly House leaders meetings. 
I do not want to get into the particulars of what happened on these particular bills. We do not do that. Of course, at those meetings, the government puts forward its proposed legislative agenda. We suggest to the other parties how many days we would like to see it debated. We look for input. We look for a response.
Again, I do not want to discuss details. I am not going to say how much difficulty I have had ever getting from one particular party an answer on its position or an agreement. Without betraying any confidences, I can say that I do not think I can ever remember an agreement with the NDP on timing on any particular bill coming out of those meetings.
As you know, Mr. Speaker, the precedents on this are clear. It is not up to the Speaker to inquire into and judge the adequacy or the extent of the consultation. You know that the consultation occurs. I can say to you with good assurance that we have circulated our proposed legislative agenda and the debates we would like to have on these matters. 
I still look forward always to responses, but consultation and communication is a two-way street. It requires that sometimes there are answers from the other side. I can assure the House that we have always consulted and will continue to consult on the legislative calendar and will seek whatever agreement we can from other parties on our agenda.
 I do not want to get into the specifics of those meetings again. It is not appropriate. However, I can tell the House that such consultation does occur, and we do put what we would like to see as debates to the other parties.",Conservative,York--Simcoe,Peter Van Loan,http://www.parl.gc.ca/parlinfo/Files/Parliamentarian.aspx?Item=aa58e8f5-4a46-4c79-8e97-b9ebe28c9d9a&Language=E&Section=ALL
4591577,ca.proc.d.2014-03-06.15907.147,2014-03-06,031462db-8f61-48ed-bf9f-b033eb8312bb,75,Mr. Nathan Cullen,Interjection,Government Orders,Canada-Honduras Economic Growth and Prosperity Act,Bill C-20—Time Allocation Motion,"Mr. Speaker, the government House leader rightly points out that there is a Tuesday afternoon House leaders meeting, which I attend with him. The government puts forward its government calendar. We recognize the calendar. We often offer up suggestions.
What has happened in this case, as in too many cases, is that the government absolutely did not ask for input on the number of speakers we required. They did not seek any consultative advice whatsoever. There was none on this. I can assure the member of that.
The government House leader can pretend what he would like, but the facts remain the facts. This is the only tool the government has in its toolbox anymore. If it is just a hammer that it has, every problem looks like a nail. 
It is Parliament that suffers, not just the Conservatives' reputation. ",New Democratic Party,Skeena--Bulkley Valley,Nathan Cullen,http://www.parl.gc.ca/parlinfo/Files/Parliamentarian.aspx?Item=031462db-8f61-48ed-bf9f-b033eb8312bb&Language=E&Section=ALL
