basepk,hid,speechdate,pid,opid,speakeroldname,speakerposition,maintopic,subtopic,subsubtopic,speechtext,speakerparty,speakerriding,speakername,speakerurl
4591634,ca.proc.d.2014-03-06.15907.204,2014-03-06,bfacb66c-68a3-4589-a5be-769e0614449e,8915,"Ms. Rathika Sitsabaiesan (Scarborough—Rouge River, NDP)",,Statements By Members,Democratic Reform,,"Mr. Speaker, the Conservative government tried its best today to prevent committee members from hearing testimony from Chief Electoral Officer Marc Mayrand, just like it has been trying to prevent Canadians from having their say on this bill.
It is clear that Conservatives are afraid of consultation. However, that is no surprise after hearing Mr. Mayrand's critique of this unfair bill. He has delivered a point-by-point rebuttal of almost everything that the minister has claimed. Mayrand warned that this bill focuses on voter fraud that does not exist, instead of voter participation, which is a growing problem.
The government refuses to take people at their word and treats law-abiding Canadians like criminals. Meanwhile, Conservatives are happy for millions of dollars to be paid out to political parties without a single receipt. 
This bill is an affront to our democracy. New Democrats know it. Canadians know it. In 2015, we will start fixing what is broken in Ottawa.",New Democratic Party,Scarborough--Rouge River,Rathika Sitsabaiesan,http://www.parl.gc.ca/parlinfo/Files/Parliamentarian.aspx?Item=bfacb66c-68a3-4589-a5be-769e0614449e&Language=E&Section=ALL
4591635,ca.proc.d.2014-03-06.15907.205,2014-03-06,d02c368a-0fe4-4a79-91b1-f8c176e29457,151,"Mr. Gerald Keddy (South Shore—St. Margaret's, CPC)",,Statements By Members,The Pictou Advocate,,"Mr. Speaker, today I was shocked to learn that The Pictou Advocate newspaper, in Pictou, Nova Scotia, recently ran an editorial cartoon featuring the Nazi flag flying over Canada's Parliament.
 It was here in this Parliament that members before us sent our soldiers to fight darkness and evil. Our men and women bravely fought for Canada in the Second World War, defending our liberty, freedom, and values. It was here that members from all parties voted to honour the memory of lives so viciously taken by Nazi brutality, sending a strong message that human rights, the rule of law, and human decency will always prevail, and that never again would we allow such atrocities to take place.
The crass and casual use of the Nazi flag flying over Canada's cradle of democracy is not only an insult to our men and women in uniform, it belittles the memory of the victims and the survivors who suffered at the hands of Nazi dictators. We condemn this shameful and cowardly act, and call on The Pictou Advocate to immediately retract the hurtful image and apologize.",Conservative,South Shore--St. Margaret's,Gerald Keddy,http://www.parl.gc.ca/parlinfo/Files/Parliamentarian.aspx?Item=d02c368a-0fe4-4a79-91b1-f8c176e29457&Language=E&Section=ALL
4591636,ca.proc.d.2014-03-06.15907.206,2014-03-06,551183c2-2f3e-41ba-8660-2d194cf60169,546,"Hon. Thomas Mulcair (Leader of the Opposition, NDP)",,Oral Questions,Agriculture and Agri-Food,,"Mr. Speaker, grain farmers and the western provinces are pleading with the federal government to finally act in order to move the millions of tonnes of Canadian grain that are at risk of rotting because there is no transportation available. 
There is a desperate need for stricter rules and harsher penalties for rail companies that shirk their duties and take our farmers hostage. The House will break tomorrow for two weeks, and the Conservatives still have not done anything about this.
What are they waiting for? When will they help our farmers and get the grain moving? ",New Democratic Party,Outremont,Thomas Mulcair,http://www.parl.gc.ca/parlinfo/Files/Parliamentarian.aspx?Item=551183c2-2f3e-41ba-8660-2d194cf60169&Language=E&Section=ALL
4591637,ca.proc.d.2014-03-06.15907.207,2014-03-06,213c7c78-812a-4123-ac14-dc73da49de1f,435,"Mr. Pierre Lemieux (Parliamentary Secretary to the Minister of Agriculture, CPC)",,Oral Questions,Agriculture and Agri-Food,,"Mr. Speaker, I am glad that the Leader of the Opposition is taking a belated interest in our farmers. 
For our government, the economy is our top priority, and certainly the agricultural sector and our grain farmers are a very important part of our economy. Farmers need a reliable, efficient, logistics system. We will be taking action to ensure that system meets their needs.",Conservative,Glengarry--Prescott--Russell,Pierre Lemieux,http://www.parl.gc.ca/parlinfo/Files/Parliamentarian.aspx?Item=213c7c78-812a-4123-ac14-dc73da49de1f&Language=E&Section=ALL
4591638,ca.proc.d.2014-03-06.15907.208,2014-03-06,551183c2-2f3e-41ba-8660-2d194cf60169,546,"Hon. Thomas Mulcair (Leader of the Opposition, NDP)",,Oral Questions,Agriculture and Agri-Food,,"Mr. Speaker, they do not need a logistics system; they need a government that acts.
Yesterday the Minister of Agriculture  said that new legislation to force rail carriers to get—",New Democratic Party,Outremont,Thomas Mulcair,http://www.parl.gc.ca/parlinfo/Files/Parliamentarian.aspx?Item=551183c2-2f3e-41ba-8660-2d194cf60169&Language=E&Section=ALL
4591639,ca.proc.d.2014-03-06.15907.209,2014-03-06,,,,intervention,Oral Questions,Agriculture and Agri-Food,," Oh, oh!",,,Some hon. members,
4591640,ca.proc.d.2014-03-06.15907.210,2014-03-06,6519cfba-0080-419d-baa9-8ae6e56d032f,256,The Speaker,,Oral Questions,Agriculture and Agri-Food,,"Order, please.
The hon. Leader of the Opposition has the floor.",Conservative,Regina--Qu'Appelle,Andrew Scheer,http://www.parl.gc.ca/parlinfo/Files/Parliamentarian.aspx?Item=6519cfba-0080-419d-baa9-8ae6e56d032f&Language=E&Section=ALL
4591641,ca.proc.d.2014-03-06.15907.211,2014-03-06,551183c2-2f3e-41ba-8660-2d194cf60169,546,Hon. Thomas Mulcair,Interjection,Oral Questions,Agriculture and Agri-Food,,"Mr. Speaker, thousands of prairie grain farmers are having their livelihood held hostage by the railways.
Yesterday the Minister of Agriculture and Agri-Food said that new legislation to force rail carriers to get this grain moving again would be brought forward “at the right time and place”.
Would the Minister of Transport, who is responsible for this file, finally act, assume her responsibility for this crisis, and help our prairie farmers get their grain to market?",New Democratic Party,Outremont,Thomas Mulcair,http://www.parl.gc.ca/parlinfo/Files/Parliamentarian.aspx?Item=551183c2-2f3e-41ba-8660-2d194cf60169&Language=E&Section=ALL
4591642,ca.proc.d.2014-03-06.15907.212,2014-03-06,213c7c78-812a-4123-ac14-dc73da49de1f,435,"Mr. Pierre Lemieux (Parliamentary Secretary to the Minister of Agriculture, CPC)",,Oral Questions,Agriculture and Agri-Food,,"Mr. Speaker, once again, I say that the opposition leader is very late to this file. Our government, on the other hand, has been actively engaged with all stakeholders on—",Conservative,Glengarry--Prescott--Russell,Pierre Lemieux,http://www.parl.gc.ca/parlinfo/Files/Parliamentarian.aspx?Item=213c7c78-812a-4123-ac14-dc73da49de1f&Language=E&Section=ALL
4591643,ca.proc.d.2014-03-06.15907.213,2014-03-06,,,,intervention,Oral Questions,Agriculture and Agri-Food,," Oh, oh!",,,Some hon. members,
4591644,ca.proc.d.2014-03-06.15907.214,2014-03-06,6519cfba-0080-419d-baa9-8ae6e56d032f,256,The Speaker,,Oral Questions,Agriculture and Agri-Food,,"Order, please.
The hon. parliamentary secretary now has the floor.",Conservative,Regina--Qu'Appelle,Andrew Scheer,http://www.parl.gc.ca/parlinfo/Files/Parliamentarian.aspx?Item=6519cfba-0080-419d-baa9-8ae6e56d032f&Language=E&Section=ALL
4591645,ca.proc.d.2014-03-06.15907.215,2014-03-06,213c7c78-812a-4123-ac14-dc73da49de1f,435,Mr. Pierre Lemieux,Interjection,Oral Questions,Agriculture and Agri-Food,,"That is right, Mr. Speaker. I have the floor.
Mr. Speaker, I am telling the opposition that our government has been actively engaged on this file for a very long time, with all stakeholders in the industry. Farmers know that we will take action.",Conservative,Glengarry--Prescott--Russell,Pierre Lemieux,http://www.parl.gc.ca/parlinfo/Files/Parliamentarian.aspx?Item=213c7c78-812a-4123-ac14-dc73da49de1f&Language=E&Section=ALL
4591646,ca.proc.d.2014-03-06.15907.216,2014-03-06,551183c2-2f3e-41ba-8660-2d194cf60169,546,"Hon. Thomas Mulcair (Leader of the Opposition, NDP)",,Oral Questions,Democratic Reform,,"Mr. Speaker, over a million Canadian seniors do not have a driver's licence. Many of them use the Elections Canada voter cards as identification.
In fact, the Chief Electoral Officer, who knows better than anyone else, says that the names and addresses on voter cards are more up to date than the information on driver's licences.
Why is the government banning the use of voter cards if they contain fewer errors than driver's licences?",New Democratic Party,Outremont,Thomas Mulcair,http://www.parl.gc.ca/parlinfo/Files/Parliamentarian.aspx?Item=551183c2-2f3e-41ba-8660-2d194cf60169&Language=E&Section=ALL
4591647,ca.proc.d.2014-03-06.15907.217,2014-03-06,ad4032f2-6bb1-497b-b146-f321cfb71ba9,233,"Hon. Pierre Poilievre (Minister of State (Democratic Reform), CPC)",,Oral Questions,Democratic Reform,,"Mr. Speaker, people do not need a driver's licence to vote in Canada. In fact, they do not even need photo identification. There are 39 forms of identification allowed.
These include old age security cards, hospital and medical clinic cards, hospital bracelets worn by residents of long-term care facilities, Veterans Affairs Canada health cards, and I could go on. There are many ID forms on that list of 39 that are specifically available to people of retirement age. We would encourage Elections Canada to ensure that those people know about those forms of ID.",Conservative,Nepean--Carleton,Pierre Poilievre,http://www.parl.gc.ca/parlinfo/Files/Parliamentarian.aspx?Item=ad4032f2-6bb1-497b-b146-f321cfb71ba9&Language=E&Section=ALL
4591648,ca.proc.d.2014-03-06.15907.218,2014-03-06,551183c2-2f3e-41ba-8660-2d194cf60169,546,"Hon. Thomas Mulcair (Leader of the Opposition, NDP)",,Oral Questions,Democratic Reform,,"Mr. Speaker, Canada's Chief Electoral Office testified today that the unfair elections act proposed by the Conservatives would in fact allow them to dress up campaign advertising as fundraising appeals to get around all existing campaign spending limits in the next election.
Mr. Mayrand said this change would make it “difficult, if not impossible to enforce” spending limits altogether.
This is exactly what we have been saying since day one. The only reason that the Conservatives are doing this is to stack the deck for the next election. 
What other reason could there be?",New Democratic Party,Outremont,Thomas Mulcair,http://www.parl.gc.ca/parlinfo/Files/Parliamentarian.aspx?Item=551183c2-2f3e-41ba-8660-2d194cf60169&Language=E&Section=ALL
4591649,ca.proc.d.2014-03-06.15907.219,2014-03-06,ad4032f2-6bb1-497b-b146-f321cfb71ba9,233,"Hon. Pierre Poilievre (Minister of State (Democratic Reform), CPC)",,Oral Questions,Democratic Reform,,"Mr. Speaker, point number one, the NDP excluded all fundraising expenses from its own leadership race, a position against which it is arguing right now.
Second, the Chief Electoral Officer is wrong on this point, as well as on other points. The bill we are bringing forward, the fair elections act, would require that all mass-calling scripts and all autodial scripts be kept for a year, so they can be available for investigators to examine them.
Finally, there would be external audits, which would allow the auditor to determine if money was spent on fundraising calls versus other calls.
There would be also a purpose section in this particular provision of the bill.
There are many layers of protection.",Conservative,Nepean--Carleton,Pierre Poilievre,http://www.parl.gc.ca/parlinfo/Files/Parliamentarian.aspx?Item=ad4032f2-6bb1-497b-b146-f321cfb71ba9&Language=E&Section=ALL
4591650,ca.proc.d.2014-03-06.15907.220,2014-03-06,551183c2-2f3e-41ba-8660-2d194cf60169,546,"Hon. Thomas Mulcair (Leader of the Opposition, NDP)",,Oral Questions,Democratic Reform,,"Mr. Speaker, the minister has stood in this House, week after week, to make fanciful claims about election irregularities and voter fraud.
Today, the Chief Electoral Officer of Canada demolished each and every one of those false arguments before committee. He said there was “no evidence” connecting administrative errors at Elections Canada to any form of electoral fraud whatsoever.
Will the minister finally admit that the only evidence of voter fraud that he has ever had is the fake testimony of the member of Parliament for Mississauga—Streetsville?",New Democratic Party,Outremont,Thomas Mulcair,http://www.parl.gc.ca/parlinfo/Files/Parliamentarian.aspx?Item=551183c2-2f3e-41ba-8660-2d194cf60169&Language=E&Section=ALL
4591651,ca.proc.d.2014-03-06.15907.221,2014-03-06,ad4032f2-6bb1-497b-b146-f321cfb71ba9,233,"Hon. Pierre Poilievre (Minister of State (Democratic Reform), CPC)",,Oral Questions,Democratic Reform,,"Mr. Speaker, this gives me occasion to correct the explicit factual error in the CEO's testimony when he said that the errors linked to vouching were strictly record-keeping that would not compromise an election.
This is what page 10 of his own report said:
 ...the Supreme Court made it clear that such errors in other circumstances could contribute to a court overturning an election. 
That sounds pretty serious to me.",Conservative,Nepean--Carleton,Pierre Poilievre,http://www.parl.gc.ca/parlinfo/Files/Parliamentarian.aspx?Item=ad4032f2-6bb1-497b-b146-f321cfb71ba9&Language=E&Section=ALL
4591652,ca.proc.d.2014-03-06.15907.222,2014-03-06,1a1a9dee-c228-40fc-b926-42f8441d84f0,121,"Hon. Ralph Goodale (Wascana, Lib.)",,Oral Questions,Agriculture and Agri-Food,,"Mr. Speaker, with respect to the grain crisis in western Canada, the Minister of Transport could act today under section 47 of the Canada Transportation Act to implement an emergency solution.
She could, in addition to that, seek unanimous consent for amendments to service level legislation to define service, to measure performance, and to pay damages to farmers when the railways fail. She could do those things.
Why is the minister failing in her responsibility to western Canadian farmers?",Liberal,Wascana,Ralph Goodale,http://www.parl.gc.ca/parlinfo/Files/Parliamentarian.aspx?Item=1a1a9dee-c228-40fc-b926-42f8441d84f0&Language=E&Section=ALL
4591653,ca.proc.d.2014-03-06.15907.223,2014-03-06,213c7c78-812a-4123-ac14-dc73da49de1f,435,"Mr. Pierre Lemieux (Parliamentary Secretary to the Minister of Agriculture, CPC)",,Oral Questions,Agriculture and Agri-Food,,"Mr. Speaker, as I explained, the economy is the number one priority for our government, and certainly the grain sector plays an active role in the strength of our economy.
Farmers deserve a reliable and efficient logistics system, but a key element of the logistics system is the railway system. The railway system has been performing poorly.
Farmers know that we will take action.",Conservative,Glengarry--Prescott--Russell,Pierre Lemieux,http://www.parl.gc.ca/parlinfo/Files/Parliamentarian.aspx?Item=213c7c78-812a-4123-ac14-dc73da49de1f&Language=E&Section=ALL
4591654,ca.proc.d.2014-03-06.15907.224,2014-03-06,1a1a9dee-c228-40fc-b926-42f8441d84f0,121,"Hon. Ralph Goodale (Wascana, Lib.)",,Oral Questions,Infrastructure,,"Mr. Speaker, we have repeatedly asked the government about its decision to gut funding for the building Canada infrastructure fund at the end of this month.
It is being cut by 87%. This fiscal year, building Canada's budget is running at $1.6 billion. Next fiscal year, starting April 1, the building Canada budget drops to just $210 million. The difference is a cut of 87%.
The government does not deny it. It just talks around it. The question remains. Why is it imposing this huge infrastructure cut on local municipalities at the beginning of next month?",Liberal,Wascana,Ralph Goodale,http://www.parl.gc.ca/parlinfo/Files/Parliamentarian.aspx?Item=1a1a9dee-c228-40fc-b926-42f8441d84f0&Language=E&Section=ALL
4591655,ca.proc.d.2014-03-06.15907.225,2014-03-06,655f75f0-7c4c-4dd1-b0d7-317be0595660,545,"Hon. Denis Lebel (Minister of Infrastructure, Communities and Intergovernmental Affairs and Minister of the Economic Development Agency of Canada for the Regions of Quebec, CPC)",,Oral Questions,Infrastructure,,"Mr. Speaker, our government has nearly tripled average annual infrastructure investments since 2006.
The economic action plan 2013 announced $70 billion over 10 years, a decade. We have to look at all 10 years, including the $53 billion for provincial, territorial, and municipal infrastructure.",Conservative,Roberval--Lac-Saint-Jean,Denis Lebel,http://www.parl.gc.ca/parlinfo/Files/Parliamentarian.aspx?Item=655f75f0-7c4c-4dd1-b0d7-317be0595660&Language=E&Section=ALL
4591656,ca.proc.d.2014-03-06.15907.226,2014-03-06,1a1a9dee-c228-40fc-b926-42f8441d84f0,121,"Hon. Ralph Goodale (Wascana, Lib.)",,Oral Questions,Infrastructure,,"Mr. Speaker, just to be clear, Conservative cuts to building Canada funding are laid out in painful detail in its own 2013 budget plan at page 178, table 3.3.1. It is there in black and white for everybody to see.
Building Canada is chopped by 87%, starting on April 1, just 25 days from now. Municipalities get dinged this coming year and the year after that, and every year until 2019.
Here is the question. Is table 3.3.1 true, or is the budget plan a lie? Canadian municipalities need to know.",Liberal,Wascana,Ralph Goodale,http://www.parl.gc.ca/parlinfo/Files/Parliamentarian.aspx?Item=1a1a9dee-c228-40fc-b926-42f8441d84f0&Language=E&Section=ALL
4591657,ca.proc.d.2014-03-06.15907.227,2014-03-06,655f75f0-7c4c-4dd1-b0d7-317be0595660,545,"Hon. Denis Lebel (Minister of Infrastructure, Communities and Intergovernmental Affairs and Minister of the Economic Development Agency of Canada for the Regions of Quebec, CPC)",,Oral Questions,Infrastructure,,"Mr. Speaker, as I have said, he has to look at the 10-year plan. It is a 10-year plan.
We have indexed the gas tax fund. We have doubled it. That is now permanent in the law; 71% of this plan is going straight to the municipalities of the country, and FCM is supporting that plan.",Conservative,Roberval--Lac-Saint-Jean,Denis Lebel,http://www.parl.gc.ca/parlinfo/Files/Parliamentarian.aspx?Item=655f75f0-7c4c-4dd1-b0d7-317be0595660&Language=E&Section=ALL
4591658,ca.proc.d.2014-03-06.15907.228,2014-03-06,9bcb731e-774b-4fe3-bb03-8c92f59eaa6c,1823,"Ms. Alexandrine Latendresse (Louis-Saint-Laurent, NDP)",,Oral Questions,Democratic Reform,,"Mr. Speaker, in committee today, the Chief Electoral Officer, Marc Mayrand, pointed out that political parties are reimbursed $33 million after each election, without providing a single receipt or piece of documentation.
The electoral deform bill is not a game-changer for political parties, but it will treat each and every voter as a potential cheat.
Why has the government introduced a bill that does not express any trust in voters, but shows complete trust in political parties?",New Democratic Party,Louis-Saint-Laurent,Alexandrine Latendresse,http://www.parl.gc.ca/parlinfo/Files/Parliamentarian.aspx?Item=9bcb731e-774b-4fe3-bb03-8c92f59eaa6c&Language=E&Section=ALL
4591659,ca.proc.d.2014-03-06.15907.229,2014-03-06,ad4032f2-6bb1-497b-b146-f321cfb71ba9,233,"Hon. Pierre Poilievre (Minister of State (Democratic Reform), CPC)",,Oral Questions,Democratic Reform,,"Mr. Speaker, we will be adding mandatory auditing of every cent of election expense money that parties are hoping to have reimbursed. That auditing process is new.
In addition, according to section 435, the Chief Electoral Officer can choose to ask for more information before reimbursing parties with taxpayers' money. He already has that authority and can exercise it.",Conservative,Nepean--Carleton,Pierre Poilievre,http://www.parl.gc.ca/parlinfo/Files/Parliamentarian.aspx?Item=ad4032f2-6bb1-497b-b146-f321cfb71ba9&Language=E&Section=ALL
4591660,ca.proc.d.2014-03-06.15907.230,2014-03-06,9bcb731e-774b-4fe3-bb03-8c92f59eaa6c,1823,"Ms. Alexandrine Latendresse (Louis-Saint-Laurent, NDP)",,Oral Questions,Democratic Reform,,"Mr. Speaker, that is exactly what we called for in a motion that was unanimously adopted in the House two years ago, and it is still not in the bill.
Mr. Mayrand also explained to the committee members that there is not a single democracy in the world whose elections agency has had restrictions imposed on it by the government in power regarding the information it can share with the public, including information about electoral fraud.
Can the minister name another democracy that muzzles its head of elections in this way?",New Democratic Party,Louis-Saint-Laurent,Alexandrine Latendresse,http://www.parl.gc.ca/parlinfo/Files/Parliamentarian.aspx?Item=9bcb731e-774b-4fe3-bb03-8c92f59eaa6c&Language=E&Section=ALL
4591661,ca.proc.d.2014-03-06.15907.231,2014-03-06,ad4032f2-6bb1-497b-b146-f321cfb71ba9,233,"Hon. Pierre Poilievre (Minister of State (Democratic Reform), CPC)",,Oral Questions,Democratic Reform,,"Mr. Speaker, there are none, and our Chief Electoral Officer will not be muzzled either. He will still be able to talk about democracy in Canada.
However, she refers to a motion in the House of Commons in which we voted for Elections Canada's powers, and it said we would support giving him the power to request all necessary documents from political parties to ensure compliance with the Elections Act. He already has that power.",Conservative,Nepean--Carleton,Pierre Poilievre,http://www.parl.gc.ca/parlinfo/Files/Parliamentarian.aspx?Item=ad4032f2-6bb1-497b-b146-f321cfb71ba9&Language=E&Section=ALL
4591662,ca.proc.d.2014-03-06.15907.232,2014-03-06,1c721843-28d0-423b-94ae-ede577509178,415,"Ms. Chris Charlton (Hamilton Mountain, NDP)",,Oral Questions,Democratic Reform,,"Mr. Speaker, Marc Mayrand has joined a chorus of other experts and a growing number of Canadians who are simply not buying the minister's weak explanation for his radical rewriting of the Elections Act.
Mr. Mayrand critiqued the bizarre distinction the Conservatives are trying to make between voter fraud and voter participation.
How can the minister possibly disagree with the Chief Electoral Officer when he says, “...the main challenge for our electoral democracy is not voter fraud, but voter participation”?",New Democratic Party,Hamilton Mountain,Chris Charlton,http://www.parl.gc.ca/parlinfo/Files/Parliamentarian.aspx?Item=1c721843-28d0-423b-94ae-ede577509178&Language=E&Section=ALL
4591663,ca.proc.d.2014-03-06.15907.233,2014-03-06,ad4032f2-6bb1-497b-b146-f321cfb71ba9,233,"Hon. Pierre Poilievre (Minister of State (Democratic Reform), CPC)",,Oral Questions,Democratic Reform,,"Mr. Speaker, I will simply read Elections Canada's own report, which says of irregularities related to vouching and procedures like it that, “The courts refer to such serious errors as ‘irregularities’ which can result in votes being declared invalid”.
There were 50,000 such irregularities in the last election related to vouching, according to Elections Canada's own report. 
If the NDP wants to take its message that people should be able to vote without any form of identification, that is fine. We on this side of the House of Commons will protect the integrity of the system.",Conservative,Nepean--Carleton,Pierre Poilievre,http://www.parl.gc.ca/parlinfo/Files/Parliamentarian.aspx?Item=ad4032f2-6bb1-497b-b146-f321cfb71ba9&Language=E&Section=ALL
4591664,ca.proc.d.2014-03-06.15907.234,2014-03-06,1c721843-28d0-423b-94ae-ede577509178,415,"Ms. Chris Charlton (Hamilton Mountain, NDP)",,Oral Questions,Democratic Reform,,"Mr. Speaker, this is about our elections, the cornerstone of our democracy, and all we get from the minister is weak and misleading excuses.
The Chief Electoral Officer said people are increasingly refusing to co-operate with Elections Canada's investigations. Since most of these are about Conservative wrongdoing, can the minister tell us if he will now agree to give Elections Canada the power to compel testimony?
 Before he claims that these are extraordinary powers, we are only asking for the same powers the Competition Bureau already has.",New Democratic Party,Hamilton Mountain,Chris Charlton,http://www.parl.gc.ca/parlinfo/Files/Parliamentarian.aspx?Item=1c721843-28d0-423b-94ae-ede577509178&Language=E&Section=ALL
4591665,ca.proc.d.2014-03-06.15907.235,2014-03-06,ad4032f2-6bb1-497b-b146-f321cfb71ba9,233,"Hon. Pierre Poilievre (Minister of State (Democratic Reform), CPC)",,Oral Questions,Democratic Reform,,"Mr. Speaker, the Commissioner of Canada Elections already has all of the investigative powers of a police force, which could investigate violent crime, for example. 
We will ensure that he keeps all of those powers. In fact, the fair elections act gives him sharper teeth and a longer reach. That includes tougher penalties for existing offences and more offences that will allow him to protect the system and protect our democracy.",Conservative,Nepean--Carleton,Pierre Poilievre,http://www.parl.gc.ca/parlinfo/Files/Parliamentarian.aspx?Item=ad4032f2-6bb1-497b-b146-f321cfb71ba9&Language=E&Section=ALL
