basepk,hid,speechdate,pid,opid,speakeroldname,speakerposition,maintopic,subtopic,subsubtopic,speechtext,speakerparty,speakerriding,speakername,speakerurl
4611066,ca.proc.d.2014-09-24.16338.72,2014-09-24,b6808e95-1c75-4909-ab86-319d3519016a,579,"Hon. Lisa Raitt (Minister of Transport, CPC)",,Oral Questions,Agriculture and Agri-Food,,"Mr. Speaker, again I want to personally thank the Minister of Agriculture and Agri-Food for his great work on the file, to ensure that we are working together as a government on this matter.
We should also talk to the people out there who are the ones who are the beneficiaries of Bill C-30.
 Brett Halstead, President of the Canadian Canola Growers Association stated:
 This action demonstrates that Government is listening to farmers' concerns. We look forward to working with the Government and other industry stakeholders. 
Quite frankly, the opposition is not in the game on this one. The government is the one that is dealing with this on a daily basis and is out front through the minister.",Conservative,Halton,Lisa Raitt,http://www.parl.gc.ca/parlinfo/Files/Parliamentarian.aspx?Item=b6808e95-1c75-4909-ab86-319d3519016a&Language=E&Section=ALL
4611067,ca.proc.d.2014-09-24.16338.73,2014-09-24,b4cc87d1-2354-4223-9853-43e200a73ce1,8350,"Mr. François Lapointe (Montmagny—L'Islet—Kamouraska—Rivière-du-Loup, NDP)",,Oral Questions,The Environment,,"Mr. Speaker, a Superior Court judge had to suspend drilling off the coast of Cacouna.
In her decision, she criticized Quebec, which never received the scientific opinions that were requested from Fisheries and Oceans Canada's science branch. The scientists' inability to speak up resulted in the premature commencement of an oil company's operations with complete disregard for our environmental obligations.
Contrary to what the minister said, they are drilling in beluga habitat without knowing what beluga experts think of the undertaking.
Will the minister finally let the experts speak and will she provide the scientific opinions? This whole screw-up happened because of how her department is run. They are not fooling anyone.",New Democratic Party,Montmagny--L'Islet--Kamouraska--Rivière-du-Loup,François Lapointe,http://www.parl.gc.ca/parlinfo/Files/Parliamentarian.aspx?Item=b4cc87d1-2354-4223-9853-43e200a73ce1&Language=E&Section=ALL
4611068,ca.proc.d.2014-09-24.16338.74,2014-09-24,70388a77-892d-4a62-b707-aef2a521b436,556,"Hon. Gail Shea (Minister of Fisheries and Oceans, CPC)",,Oral Questions,The Environment,,"Mr. Speaker, let me repeat again. The object of yesterday's ruling was a review of a Quebec provincial government law. I cannot speak for the Province of Quebec, but what I can say is that DFO conducted its own review of TransCanada's work and approved it based on strict conditions. The decision was based on science, carried out with the expertise of DFO scientists.
I find it ironic that the New Democrats claim to be on the side of science and then turn around and question our scientists' competence when it suits their politics.",Conservative,Egmont,Gail Shea,http://www.parl.gc.ca/parlinfo/Files/Parliamentarian.aspx?Item=70388a77-892d-4a62-b707-aef2a521b436&Language=E&Section=ALL
4611069,ca.proc.d.2014-09-24.16338.75,2014-09-24,a71a1741-7ff2-4246-b0da-4622e96b10cf,1082,"Mr. Guy Caron (Rimouski-Neigette—Témiscouata—Les Basques, NDP)",,Oral Questions,The Environment,,"Mr. Speaker, that is the problem. Fisheries and Oceans Canada did not provide a scientific opinion. There were opinions for seismic surveys, but not for drilling.
The judge was clear: none of the officials involved in reviewing the file had any expertise on marine mammals. She also noted that Quebec never obtained scientific opinions from Fisheries and Oceans Canada's science branch.
Does the minister realize that by keeping those scientists quiet and allowing drilling at Cacouna to begin prematurely, she is responsible for this whole mess and she failed to meet her environmental obligations?",New Democratic Party,Rimouski-Neigette--Témiscouata--Les Basques,Guy Caron,http://www.parl.gc.ca/parlinfo/Files/Parliamentarian.aspx?Item=a71a1741-7ff2-4246-b0da-4622e96b10cf&Language=E&Section=ALL
4611070,ca.proc.d.2014-09-24.16338.76,2014-09-24,70388a77-892d-4a62-b707-aef2a521b436,556,"Hon. Gail Shea (Minister of Fisheries and Oceans, CPC)",,Oral Questions,The Environment,,"Mr. Speaker, again let me repeat: the judge was not ruling on a federal authorization; the judge was ruling on a Quebec provincial authorization, and I cannot speak for the Province of Quebec.
However, I do know that our DFO scientists conducted reviews, reviewed TransCanada's work, and approved it based on the very strictest conditions.
 This is a legal matter. I have nothing more to add. As I said before, all of the scientific information is on the Internet.",Conservative,Egmont,Gail Shea,http://www.parl.gc.ca/parlinfo/Files/Parliamentarian.aspx?Item=70388a77-892d-4a62-b707-aef2a521b436&Language=E&Section=ALL
4611071,ca.proc.d.2014-09-24.16338.77,2014-09-24,86fed1de-3861-4448-8242-ad414073ef2e,550,"Ms. Joyce Murray (Vancouver Quadra, Lib.)",,Oral Questions,National Defence,,"Mr. Speaker, the navy trusted the Conservative government's claims that it would replace its aging ships. What a mistake. Now Canada's only naval supply ships are being retired, but replacements the government finally commissioned are way behind schedule and will not be available for years. That means our navy will simply not be functional. Now the government is panicking and it may have to buy old, used American ships instead.
 Let us give the parliamentary secretary another chance to level with Canadians. How much will the Conservatives' woeful incompetence cost when they have to cancel their made-in-Canada supply ships that they already commissioned?",Liberal,Vancouver Quadra,Joyce Murray,http://www.parl.gc.ca/parlinfo/Files/Parliamentarian.aspx?Item=86fed1de-3861-4448-8242-ad414073ef2e&Language=E&Section=ALL
4611072,ca.proc.d.2014-09-24.16338.78,2014-09-24,72dace30-741a-4877-8c1c-31b5dc3e4a8e,28,"Mr. James Bezan (Parliamentary Secretary to the Minister of National Defence, CPC)",,Oral Questions,National Defence,,"Mr. Speaker, that is really rich coming from the Liberal Party, a party that cancelled our replacements to the Sea Kings, the party that went and bought used submarines.
The member for Markham—Unionville back in 2008 said, when referring to the defence file, “I think the defence budget has gone up at an alarming rate”, so we will take no lessons from the Liberals while we are trying to help the Royal Canadian Navy. We are investing in modernizing the frigates and we have a $36.6 billion program in the national shipbuilding procurement.",Conservative,Selkirk--Interlake,James Bezan,http://www.parl.gc.ca/parlinfo/Files/Parliamentarian.aspx?Item=72dace30-741a-4877-8c1c-31b5dc3e4a8e&Language=E&Section=ALL
4611073,ca.proc.d.2014-09-24.16338.79,2014-09-24,634edc34-ea0d-406f-ade1-eeec6c5bad04,9289,"Mr. Adam Vaughan (Trinity—Spadina, Lib.)",,Oral Questions,Public Safety,,"Mr. Speaker, not only is climate change having a disastrous impact on the environment; it is wreaking havoc on municipalities and their budgets. Just like with climate change, the federal government's response to natural disasters is also missing in action when it comes to this issue.
 The Federation of Canadian Municipalities is pleading with the government to review and rewrite its disaster protocols. Cities should not have to wait months for financial help.
 On the environment, the government is at best negligent; on disaster relief, it is just plain incompetent.
When will Canadians and municipalities be able to depend on the government to show up when it is needed?",Liberal,Trinity--Spadina,Adam Vaughan,
4611074,ca.proc.d.2014-09-24.16338.80,2014-09-24,22a96405-bed6-45e9-811a-69d055416803,408,"Hon. Steven Blaney (Minister of Public Safety and Emergency Preparedness, CPC)",,Oral Questions,Public Safety,,"Mr. Speaker, our Canadian government has a remarkable record when it comes to supporting Canadian communities struggling to cope with natural disasters. What is insulting is that the Liberal member voted against a $200 million budget to prepare Canada and communities for natural disasters. If anyone is missing in action, Mr. Speaker, it is the gentleman on the other side of the House.",Conservative,Lévis--Bellechasse,Steven Blaney,http://www.parl.gc.ca/parlinfo/Files/Parliamentarian.aspx?Item=22a96405-bed6-45e9-811a-69d055416803&Language=E&Section=ALL
4611075,ca.proc.d.2014-09-24.16338.81,2014-09-24,551183c2-2f3e-41ba-8660-2d194cf60169,546,"Hon. Thomas Mulcair (Leader of the Opposition, NDP)",,Oral Questions,National Defence,,"Mr. Speaker, the Prime Minister has just stated in New York that the United States has requested additional resources from Canada in Iraq. The Prime Minister says that he needs to have some debate in cabinet before he can make any decision on this file.
Will there also be a debate and vote in the House of Commons?",New Democratic Party,Outremont,Thomas Mulcair,http://www.parl.gc.ca/parlinfo/Files/Parliamentarian.aspx?Item=551183c2-2f3e-41ba-8660-2d194cf60169&Language=E&Section=ALL
4611076,ca.proc.d.2014-09-24.16338.82,2014-09-24,72dace30-741a-4877-8c1c-31b5dc3e4a8e,28,"Mr. James Bezan (Parliamentary Secretary to the Minister of National Defence, CPC)",,Oral Questions,National Defence,,"Mr. Speaker, we have been supportive of U.S. efforts in forming the coalition to tackle ISIL, and that is why we have committed Canadian Forces in a non-combat role. We are coming up to the end of 30 days from September 5 and we will have these discussions as we review our progress and look at renewing our commitment.",Conservative,Selkirk--Interlake,James Bezan,http://www.parl.gc.ca/parlinfo/Files/Parliamentarian.aspx?Item=72dace30-741a-4877-8c1c-31b5dc3e4a8e&Language=E&Section=ALL
4611077,ca.proc.d.2014-09-24.16338.83,2014-09-24,3c3ee442-a873-4845-84d0-7da07a66ce61,939,"Mr. Alexandre Boulerice (Rosemont—La Petite-Patrie, NDP)",,Oral Questions,Canada Post,,"Mr. Speaker, you are quite right; this is called question period and not answer period, unfortunately.
Along with the NDP, there are now 87 municipalities that have passed resolutions opposing the end of home mail delivery in Canada. Now we have heard that Canada Post will need to rent commercial space in large cities for its mailboxes. Knowing the Conservatives, it will probably cost more to rent thousands of square feet of space than it would to just deliver the mail to people. Enough with the wasteful spending.
Will the Conservatives ask Canada Post to go back to the drawing board and defend and protect this service, which people really want?",New Democratic Party,Rosemont--La Petite-Patrie,Alexandre Boulerice,http://www.parl.gc.ca/parlinfo/Files/Parliamentarian.aspx?Item=3c3ee442-a873-4845-84d0-7da07a66ce61&Language=E&Section=ALL
4611078,ca.proc.d.2014-09-24.16338.84,2014-09-24,b6808e95-1c75-4909-ab86-319d3519016a,579,"Hon. Lisa Raitt (Minister of Transport, CPC)",,Oral Questions,Canada Post,,"Mr. Speaker, in 2013, Canada Post delivered one billion fewer letters than it did in 2006. Two-thirds of Canadians do not receive mail at their door.
In answer to the member's question, the Federation of Canadian Municipalities overwhelmingly defeated a motion asking the government to turn over the changes at Canada Post. Maybe he should check his facts.",Conservative,Halton,Lisa Raitt,http://www.parl.gc.ca/parlinfo/Files/Parliamentarian.aspx?Item=b6808e95-1c75-4909-ab86-319d3519016a&Language=E&Section=ALL
4611079,ca.proc.d.2014-09-24.16338.85,2014-09-24,7e234ca7-7f9c-4597-bad1-d0282538e845,126,"Mrs. Nina Grewal (Fleetwood—Port Kells, CPC)",,Oral Questions,Public Safety,,"Mr. Speaker, the community of Surrey is rightly outraged. On Monday, a convicted high-risk sex offender who was released into the community last year was charged with the second degree murder of 17-year-old Serena Vermeersch.
Cases such as these make it clear that we must continue to make the protection of our communities a top priority, especially when it comes to protecting our children.
Our government committed to supporting victims and punishing criminals. Could the Minister of Justice update the House on our progress?",Conservative,Fleetwood--Port Kells,Nina Grewal,http://www.parl.gc.ca/parlinfo/Files/Parliamentarian.aspx?Item=7e234ca7-7f9c-4597-bad1-d0282538e845&Language=E&Section=ALL
4611080,ca.proc.d.2014-09-24.16338.86,2014-09-24,46dccbed-4370-40f0-975f-d08fe1688aa2,177,"Hon. Peter MacKay (Minister of Justice and Attorney General of Canada, CPC)",,Oral Questions,Public Safety,,"Mr. Speaker, this is a horrific case. Our thoughts are with the Vermeersch family.
After years of soft on crime policies from the Liberal government, Canadians can now count on our government to re-establish Canada as a country where those who break the law are punished with penalties that match the crime.
To date, our government has presented over 30 justice bills. We made it a priority to protect our most vulnerable, our children, by cracking down on child sex predators. We have introduced more consecutive and mandatory minimum sentences for serious violent crime. We ended house arrest for child sex offences. We got rid of the faint hope clause, raised the age of consent, and gave more protection for victims.
Serious violent crime deserves serious time. That is what our government is delivering.",Conservative,Central Nova,Peter MacKay,http://www.parl.gc.ca/parlinfo/Files/Parliamentarian.aspx?Item=46dccbed-4370-40f0-975f-d08fe1688aa2&Language=E&Section=ALL
4611081,ca.proc.d.2014-09-24.16338.87,2014-09-24,a76af2a6-7a43-4f8f-a887-0d10b3a0a3c1,96,"Hon. Wayne Easter (Malpeque, Lib.)",,Oral Questions,International Trade,,"Mr. Speaker, finally but long overdue, the government signed an agreement with South Korea, such that we have implementation legislation before the House.
However, the government's tardiness in getting to this point has cost the beef and hog industry countless millions of dollars, allowing the United States to displace us in that important market. If it is not implemented by January 1, the government stands to give our competitors a further 2.5% tariff advantage.
Will the minister act with urgency and assure the industry that this will be implemented by the January 1 deadline?",Liberal,Malpeque,Wayne Easter,http://www.parl.gc.ca/parlinfo/Files/Parliamentarian.aspx?Item=a76af2a6-7a43-4f8f-a887-0d10b3a0a3c1&Language=E&Section=ALL
4611082,ca.proc.d.2014-09-24.16338.88,2014-09-24,fc9a44ff-23e0-45df-8ec4-a9cccefa71e1,424,"Hon. Ed Fast (Minister of International Trade, CPC)",,Oral Questions,International Trade,,"Mr. Speaker, our government was very pleased to host President Park of Korea this year, when we actually signed the final trade agreement. We have asked every party in the House to move this agreement forward legislatively in a timely way. This agreement is very important to Canada. It would increase our exports by 32%. We expect it to add close to $2 billion of economic activity to our economy. In more than 13 long, dark years under the Liberals, they got nothing done on the trade file. On this side, we get it. We are standing up for Canadians.",Conservative,Abbotsford,Ed Fast,http://www.parl.gc.ca/parlinfo/Files/Parliamentarian.aspx?Item=fc9a44ff-23e0-45df-8ec4-a9cccefa71e1&Language=E&Section=ALL
4611083,ca.proc.d.2014-09-24.16338.89,2014-09-24,86dd8955-957c-4ff9-9a81-76305a0f26ac,421,"Mr. Paul Dewar (Ottawa Centre, NDP)",,Oral Questions,Conflict Minerals,,"Mr. Speaker, tonight the House will vote on a bill that can help cut off—",New Democratic Party,Ottawa Centre,Paul Dewar,http://www.parl.gc.ca/parlinfo/Files/Parliamentarian.aspx?Item=86dd8955-957c-4ff9-9a81-76305a0f26ac&Language=E&Section=ALL
4611084,ca.proc.d.2014-09-24.16338.90,2014-09-24,1a1a9dee-c228-40fc-b926-42f8441d84f0,121,Hon. Ralph Goodale,Interjection,Oral Questions,Conflict Minerals,,What a joke.,Liberal,Wascana,Ralph Goodale,http://www.parl.gc.ca/parlinfo/Files/Parliamentarian.aspx?Item=1a1a9dee-c228-40fc-b926-42f8441d84f0&Language=E&Section=ALL
4611085,ca.proc.d.2014-09-24.16338.91,2014-09-24,6519cfba-0080-419d-baa9-8ae6e56d032f,256,The Speaker,,Oral Questions,Conflict Minerals,,"Order, please. We have moved on to the next question.
The hon. member for Ottawa Centre has the floor. ",Conservative,Regina--Qu'Appelle,Andrew Scheer,http://www.parl.gc.ca/parlinfo/Files/Parliamentarian.aspx?Item=6519cfba-0080-419d-baa9-8ae6e56d032f&Language=E&Section=ALL
4611086,ca.proc.d.2014-09-24.16338.92,2014-09-24,86dd8955-957c-4ff9-9a81-76305a0f26ac,421,Mr. Paul Dewar,Interjection,Oral Questions,Conflict Minerals,,"Mr. Speaker, tonight the House will vote on a bill that can help cut off resources to violent extremists in the Great Lakes region of Africa. These extremists have killed millions, used rape as a weapon of war, and enslaved children. Their atrocities are financed by the sale of conflict minerals that end up right here in Canada. Civil society and industry, including the Mining Association of Canada, want to see this bill move forward. I have a simple question. Will the Conservatives support this important legislation?",New Democratic Party,Ottawa Centre,Paul Dewar,http://www.parl.gc.ca/parlinfo/Files/Parliamentarian.aspx?Item=86dd8955-957c-4ff9-9a81-76305a0f26ac&Language=E&Section=ALL
4611087,ca.proc.d.2014-09-24.16338.93,2014-09-24,9f0040ba-a9d7-4aa4-b2e4-f3213a4e024f,216,"Hon. Deepak Obhrai (Parliamentary Secretary to the Minister of Foreign Affairs and for International Human Rights, CPC)",,Oral Questions,Conflict Minerals,,"Mr. Speaker, our government has long been committed to combatting conflict minerals and is always looking for ways to improve our efforts. Unfortunately, Bill C-486 is fundamentally flawed, and instead of making tangible progress on the issue, it stigmatizes the region in Africa and creates burdens and red tape that would only serve to harm the people of the Great Lakes. Canada will continue to work with the Great Lakes region and the Canadian industry to increase transparency and accountability in resource development.",Conservative,Calgary East,Deepak Obhrai,http://www.parl.gc.ca/parlinfo/Files/Parliamentarian.aspx?Item=9f0040ba-a9d7-4aa4-b2e4-f3213a4e024f&Language=E&Section=ALL
4611088,ca.proc.d.2014-09-24.16338.94,2014-09-24,96a020d2-e09c-4b46-8c57-f9fa5817e997,8823,"Mr. Wladyslaw Lizon (Mississauga East—Cooksville, CPC)",,Oral Questions,Health,,"Mr. Speaker, people in my riding are closely watching international efforts to address the faraway public health threat posed by Ebola and more familiar public health issues closer to home, such as the yearly flu season.
I myself have been very proud to see Canada at the forefront of the world's united response to the Ebola outbreak and the fact that our public health agency has had a significant hand in developing a number of experimental vaccines and treatments. Could the Minister of Health please update the House on the latest developments in Canada's public health agency?",Conservative,Mississauga East--Cooksville,Wladyslaw Lizon,http://www.parl.gc.ca/parlinfo/Files/Parliamentarian.aspx?Item=96a020d2-e09c-4b46-8c57-f9fa5817e997&Language=E&Section=ALL
4611089,ca.proc.d.2014-09-24.16338.95,2014-09-24,cf6f39df-d304-45e1-a559-70a0cf20a720,6,"Hon. Rona Ambrose (Minister of Health, CPC)",,Oral Questions,Health,,"Mr. Speaker, I would like to thank the member for his work on the health committee. He is, in fact, right that Canada is at the forefront of the fight on the Ebola crisis, and leading that effort is Dr. Gregory Taylor. It makes me very happy to inform the House and the country that Dr. Gregory Taylor has just accepted the appointment to become Canada's chief public health officer. I congratulate him. He has the confidence of the international public health community and, of course, the provinces and territories. I know he will work very hard to earn the confidence of all Canadians.",Conservative,Edmonton--Spruce Grove,Rona Ambrose,http://www.parl.gc.ca/parlinfo/Files/Parliamentarian.aspx?Item=cf6f39df-d304-45e1-a559-70a0cf20a720&Language=E&Section=ALL
4611090,ca.proc.d.2014-09-24.16338.96,2014-09-24,5dcb8c60-bb95-4d0f-9e2f-06dd3624a80f,8656,"Mrs. Djaouida Sellah (Saint-Bruno—Saint-Hubert, NDP)",,Oral Questions,Canada Post,,"Mr. Speaker, elected officials in the greater Longueuil community are angry about the Conservatives' intransigence and arrogance regarding Canada Post. The people of Saint-Bruno—Saint-Hubert, especially seniors and people with disabilities, are very concerned about the arrival of community mailboxes.
How can the government support the elimination of home mail delivery and continue to ignore the unanimous voice of elected officials in the greater Longueuil area?",New Democratic Party,Saint-Bruno--Saint-Hubert,Djaouida Sellah,http://www.parl.gc.ca/parlinfo/Files/Parliamentarian.aspx?Item=5dcb8c60-bb95-4d0f-9e2f-06dd3624a80f&Language=E&Section=ALL
4611091,ca.proc.d.2014-09-24.16338.97,2014-09-24,b6808e95-1c75-4909-ab86-319d3519016a,579,"Hon. Lisa Raitt (Minister of Transport, CPC)",,Oral Questions,Canada Post,,"Mr. Speaker, as I have said in the House before, Canada Post is facing a reality where people are simply not utilizing the mail anymore. They are using other means to send their transmissions. As a result, there were one billion fewer pieces of mail delivered in 2012. It has taken a five-point plan, put together to ensure that going forward it will be self-sufficient, as it is supposed to be under its legislation.
We support Canada Post and what it is doing.",Conservative,Halton,Lisa Raitt,http://www.parl.gc.ca/parlinfo/Files/Parliamentarian.aspx?Item=b6808e95-1c75-4909-ab86-319d3519016a&Language=E&Section=ALL
4611092,ca.proc.d.2014-09-24.16338.98,2014-09-24,137d51b0-f7d5-4ad7-9bc0-529314cc2d99,8538,"Mr. Claude Patry (Jonquière—Alma, BQ)",,Oral Questions,The Environment,,"Mr. Speaker, yesterday, the Quebec Superior Court issued an injunction to halt work on the Cacouna oil terminal until October 15. Quebec called on Fisheries and Oceans Canada to provide clarification on the scientific analysis that raised concerns about the project, but those requests were ignored.
What is more, the company refuses to commit in writing to protecting the belugas' natural habitat. The federal government is so confused that it seems to be more concerned about supporting TransCanada than protecting our environment. Will the government wait and comply with the studies and findings of the Bureau d'audiences publiques sur l'environnement, the BAPE, before proceeding with the project?",Bloc Québécois,Jonquière--Alma,Claude Patry,http://www.parl.gc.ca/parlinfo/Files/Parliamentarian.aspx?Item=137d51b0-f7d5-4ad7-9bc0-529314cc2d99&Language=E&Section=ALL
4611093,ca.proc.d.2014-09-24.16338.99,2014-09-24,70388a77-892d-4a62-b707-aef2a521b436,556,"Hon. Gail Shea (Minister of Fisheries and Oceans, CPC)",,Oral Questions,The Environment,,"Mr. Speaker, I cannot speak to Quebec's authorization, but that was the subject of yesterday's ruling. It was a review undertaken by the Quebec provincial government under Quebec provincial laws. 
DFO conducted its own review of TransCanada's work, and we did approve it, based on science advice and under the strictest conditions.",Conservative,Egmont,Gail Shea,http://www.parl.gc.ca/parlinfo/Files/Parliamentarian.aspx?Item=70388a77-892d-4a62-b707-aef2a521b436&Language=E&Section=ALL
4611094,ca.proc.d.2014-09-24.16338.100,2014-09-24,6519cfba-0080-419d-baa9-8ae6e56d032f,256,The Speaker,,Oral Questions,The Environment,,"That concludes question period for today.
The Chair has notice of a point of order from the hon. member for Skeena—Bulkley Valley.",Conservative,Regina--Qu'Appelle,Andrew Scheer,http://www.parl.gc.ca/parlinfo/Files/Parliamentarian.aspx?Item=6519cfba-0080-419d-baa9-8ae6e56d032f&Language=E&Section=ALL
4611095,ca.proc.d.2014-09-24.16338.101,2014-09-24,031462db-8f61-48ed-bf9f-b033eb8312bb,75,"Mr. Nathan Cullen (Skeena—Bulkley Valley, NDP)",,Oral Questions,Points of Order,Oral Questions,"Mr. Speaker, I rise in the House today on a point of order to draw your attention to something that happened yesterday in the House. The hon. member for Wascana misled the House.
As you know, Mr. Speaker, misleading the House is a grave offence. The precedents that support this view are extensive. It is important that I rise to raise this question to hold the member for Wascana accountable for what he says.
During question period yesterday, the member said:
 Mr. Speaker, the CFIB and economists like Mintz, Moffatt, and Gordon all support the jobs approach of my colleague, the member for Papineau. 
Stephen Gordon reacted to this on social media by saying the member for Wascana “...misrepresents my views of the House of Commons.... I never said anything nice about LPC EI proposal”. He then added, “...I think the...proposal is yet another gimmick in a long line of 'job-creation' gimmicks. I should be pleased if the hon. member for Wascana could read that into Hansard.”
I believe this problem could be easily fixed and I hope the member for Wascana will take this opportunity to correct the record and not bring Mr. Gordon into his ill-fated scheme.",New Democratic Party,Skeena--Bulkley Valley,Nathan Cullen,http://www.parl.gc.ca/parlinfo/Files/Parliamentarian.aspx?Item=031462db-8f61-48ed-bf9f-b033eb8312bb&Language=E&Section=ALL
