basepk,hid,speechdate,pid,opid,speakeroldname,speakerposition,maintopic,subtopic,subsubtopic,speechtext,speakerparty,speakerriding,speakername,speakerurl
4615650,ca.proc.d.2014-10-24.16383.84,2014-10-24,383ed93c-f141-4f87-b873-124d3051a31f,8621,"Ms. Élaine Michaud (Portneuf—Jacques-Cartier, NDP)",,Oral Questions,International Development,,"Mr. Speaker, these measures are a good start, but we need to do more. We need to be quicker at delivering the goods and contributing more to the World Health Organization. We need to control this epidemic because soon it will be too late. 
Does the government plan to strengthen our approach?",New Democratic Party,Portneuf--Jacques-Cartier,Élaine Michaud,http://www.parl.gc.ca/parlinfo/Files/Parliamentarian.aspx?Item=383ed93c-f141-4f87-b873-124d3051a31f&Language=E&Section=ALL
4615651,ca.proc.d.2014-10-24.16383.85,2014-10-24,b7266d04-f318-4305-ab9f-580a06be7d08,587,"Ms. Lois Brown (Parliamentary Secretary to the Minister of International Development, CPC)",,Oral Questions,International Development,,"Mr. Speaker, as I just said, we have signed agreements with the organizations with which we are working. These are organizations that are under the direction of the World Health Organization. We gave distributed $52 million as of today, and we will continue to work with all of our partners. We want to see this disease eradicated.",Conservative,Newmarket--Aurora,Lois Brown,http://www.parl.gc.ca/parlinfo/Files/Parliamentarian.aspx?Item=b7266d04-f318-4305-ab9f-580a06be7d08&Language=E&Section=ALL
4615652,ca.proc.d.2014-10-24.16383.86,2014-10-24,13a21d52-bc44-4a96-a206-f18432ef9191,8606,"Mr. Romeo Saganash (Abitibi—Baie-James—Nunavik—Eeyou, NDP)",,Oral Questions,Aboriginal Affairs,,"Mr. Speaker, Cindy Blackstock's lengthy battle is coming to an end this week, as she is giving her closing arguments before the Canadian Human Rights Tribunal. Child welfare agencies on reserves receive 22% less money from the federal government than agencies off reserve. Ms. Blackstock has been fighting for some time to correct this injustice.
Does the government plan to listen to her arguments and adjust its funding accordingly?",New Democratic Party,Abitibi--Baie-James--Nunavik--Eeyou,Romeo Saganash,http://www.parl.gc.ca/parlinfo/Files/Parliamentarian.aspx?Item=13a21d52-bc44-4a96-a206-f18432ef9191&Language=E&Section=ALL
4615653,ca.proc.d.2014-10-24.16383.87,2014-10-24,a2d5c8bf-d42e-4b53-be9e-70af2a6fe169,9130,"Mr. Mark Strahl (Parliamentary Secretary to the Minister of Aboriginal Affairs and Northern Development, CPC)",,Oral Questions,Aboriginal Affairs,,"Mr. Speaker, the health, safety and well-being of first nations children is a top priority for our government. That is why since 2006, we introduced a prevention-based approach to delivering child and family services on reserve, and our government has increased funding for on-reserve child and family services by 40% since taking office.
We will continue to take action to ensure that children and families have the support they need to lead healthy and safe lives.",Conservative,Chilliwack--Fraser Canyon,Mark Strahl,http://www.parl.gc.ca/parlinfo/Files/Parliamentarian.aspx?Item=a2d5c8bf-d42e-4b53-be9e-70af2a6fe169&Language=E&Section=ALL
4615654,ca.proc.d.2014-10-24.16383.88,2014-10-24,8977ace2-9337-4d5d-969b-806da407194c,74,"Ms. Jean Crowder (Nanaimo—Cowichan, NDP)",,Oral Questions,Aboriginal Affairs,,"Mr. Speaker, first nations children receive 22% less funding from child welfare services than what other children in Canada receive. That is a fact, and it is one that the minister continues to ignore.
Can the minister explain what he will do to ensure that child welfare services for first nations children meet the same standards as for all other children in this country?",New Democratic Party,Nanaimo--Cowichan,Jean Crowder,http://www.parl.gc.ca/parlinfo/Files/Parliamentarian.aspx?Item=8977ace2-9337-4d5d-969b-806da407194c&Language=E&Section=ALL
4615655,ca.proc.d.2014-10-24.16383.89,2014-10-24,a2d5c8bf-d42e-4b53-be9e-70af2a6fe169,9130,"Mr. Mark Strahl (Parliamentary Secretary to the Minister of Aboriginal Affairs and Northern Development, CPC)",,Oral Questions,Aboriginal Affairs,,"Mr. Speaker, what is a fact is that our government has increased funding for child and family services on reserve by 40% since taking office. Another fact is that every time we introduce new measures to protect children and families on reserve, the opposition votes against it.",Conservative,Chilliwack--Fraser Canyon,Mark Strahl,http://www.parl.gc.ca/parlinfo/Files/Parliamentarian.aspx?Item=a2d5c8bf-d42e-4b53-be9e-70af2a6fe169&Language=E&Section=ALL
4615656,ca.proc.d.2014-10-24.16383.90,2014-10-24,1d953ce9-12d9-447d-8d59-90b2338a59f0,446,"Mr. Rick Norlock (Northumberland—Quinte West, CPC)",,Oral Questions,National Defence,,"Mr. Speaker, our nation's resolve was tested, and the brave men and women of our armed forces came under threat. Warrant Officer Patrice Vincent and Corporal Nathan Cirillo both gave their lives serving their country. Corporal Cirillo paid the ultimate sacrifice undertaking the highest honour, guarding our nation's war memorial.
Could the Parliamentary Secretary to the Minister of International Trade please update the House on how the nation will honour these fallen heroes?",Conservative,Northumberland--Quinte West,Rick Norlock,http://www.parl.gc.ca/parlinfo/Files/Parliamentarian.aspx?Item=1d953ce9-12d9-447d-8d59-90b2338a59f0&Language=E&Section=ALL
4615657,ca.proc.d.2014-10-24.16383.91,2014-10-24,96924c12-efff-4de2-9f9e-578fe5434342,9243,"Mr. Erin O'Toole (Parliamentary Secretary to the Minister of International Trade, CPC)",,Oral Questions,National Defence,,"Mr. Speaker, it is with deep sadness that I inform the House that Canada's Highway of Heroes will see another hero travel its length.
Later this afternoon, Corporal Cirillo and his family will return to Hamilton and his unit along the Highway of Heroes. This will allow Canadians in communities like those in Northumberland and my riding of Durham to pay respect to Corporal Cirillo.
I know I speak for all members of the House and all Canadians when I say that our thoughts and prayers are with his family. We stand with the Canadian Armed Forces at this time.",Conservative,Durham,Erin O'Toole,http://www.parl.gc.ca/parlinfo/Files/Parliamentarian.aspx?Item=96924c12-efff-4de2-9f9e-578fe5434342&Language=E&Section=ALL
4615658,ca.proc.d.2014-10-24.16383.92,2014-10-24,a71a1741-7ff2-4246-b0da-4622e96b10cf,1082,"Mr. Guy Caron (Rimouski-Neigette—Témiscouata—Les Basques, NDP)",,Oral Questions,International Trade,,"Mr. Speaker, in Europe the debate over investor state dispute settlement is beginning to boil over. The new President of the European Commission is strongly opposed, as are Germany and Austria. The Financial Times is now reporting that it is unlikely CETA will pass the European parliament as is.
Given their potential to derail the implementation of this deal, is the government ready to drop these controversial provisions or will it insist on them?",New Democratic Party,Rimouski-Neigette--Témiscouata--Les Basques,Guy Caron,http://www.parl.gc.ca/parlinfo/Files/Parliamentarian.aspx?Item=a71a1741-7ff2-4246-b0da-4622e96b10cf&Language=E&Section=ALL
4615659,ca.proc.d.2014-10-24.16383.93,2014-10-24,96924c12-efff-4de2-9f9e-578fe5434342,9243,"Mr. Erin O'Toole (Parliamentary Secretary to the Minister of International Trade, CPC)",,Oral Questions,International Trade,,"Mr. Speaker, as that member well knows, both Canada and European negotiators were specifically instructed to provide for investor state dispute resolution within the agreement. Such dispute resolution has been used by Canada and by most European countries to provide certainty.
It is sad that the NDP continues to try to find ways to oppose trade and the one in five jobs that come from it.",Conservative,Durham,Erin O'Toole,http://www.parl.gc.ca/parlinfo/Files/Parliamentarian.aspx?Item=96924c12-efff-4de2-9f9e-578fe5434342&Language=E&Section=ALL
4615660,ca.proc.d.2014-10-24.16383.94,2014-10-24,a71a1741-7ff2-4246-b0da-4622e96b10cf,1082,"Mr. Guy Caron (Rimouski-Neigette—Témiscouata—Les Basques, NDP)",,Oral Questions,International Trade,,"Mr. Speaker, the parliamentary secretary should be following what is happening in Europe. He should take into account the fact that we have a robust justice system, as does the European Union. Both systems protect their own investors, and there is no need to harmonize those mechanisms. 
If the Conservatives really want their agreement with the European Union to be successfully concluded, why not concede that an investor state dispute settlement mechanism is unnecessary in the context of the Canada-European Union agreement and simply get rid of that measure?",New Democratic Party,Rimouski-Neigette--Témiscouata--Les Basques,Guy Caron,http://www.parl.gc.ca/parlinfo/Files/Parliamentarian.aspx?Item=a71a1741-7ff2-4246-b0da-4622e96b10cf&Language=E&Section=ALL
4615661,ca.proc.d.2014-10-24.16383.95,2014-10-24,96924c12-efff-4de2-9f9e-578fe5434342,9243,"Mr. Erin O'Toole (Parliamentary Secretary to the Minister of International Trade, CPC)",,Oral Questions,International Trade,,"Mr. Speaker, the member knows as well that legislators and leaders throughout the European Union and member states like Germany have pledged their support for these provisions and for CETA. This is an opportunity for Canada to create 80,000 net new jobs.
 This is just another way the member is trying to oppose trade. This agreement is robust. It has taken us a long time to get here, but it is a big win for Canada.",Conservative,Durham,Erin O'Toole,http://www.parl.gc.ca/parlinfo/Files/Parliamentarian.aspx?Item=96924c12-efff-4de2-9f9e-578fe5434342&Language=E&Section=ALL
4615662,ca.proc.d.2014-10-24.16383.96,2014-10-24,9bcb731e-774b-4fe3-bb03-8c92f59eaa6c,1823,"Ms. Alexandrine Latendresse (Louis-Saint-Laurent, NDP)",,Oral Questions,Quebec Bridge,,"Mr. Speaker, in Quebec City, we have a bridge in need of a paint job. Wednesday's ruling by the Quebec Superior Court clarifies matters, if nothing else. CN and Transport Canada have to stop passing the buck.
The federal government is now obliged to respect the agreements signed in 1997 in the context of privatizing the bridge.
Will the minister respect this ruling and get the Quebec Bridge painted?",New Democratic Party,Louis-Saint-Laurent,Alexandrine Latendresse,http://www.parl.gc.ca/parlinfo/Files/Parliamentarian.aspx?Item=9bcb731e-774b-4fe3-bb03-8c92f59eaa6c&Language=E&Section=ALL
4615663,ca.proc.d.2014-10-24.16383.97,2014-10-24,379a808d-9183-4a07-90c7-cdeb0ec3de63,302,"Mr. Jeff Watson (Parliamentary Secretary to the Minister of Transport, CPC)",,Oral Questions,Quebec Bridge,,"Mr. Speaker, we are disappointed with this ruling. Officials are reviewing this decision. We will wait for the second part of the ruling before commenting further. In the meantime, we continue to believe that CN should have respected its agreement with regard to painting the bridge.",Conservative,Essex,Jeff Watson,http://www.parl.gc.ca/parlinfo/Files/Parliamentarian.aspx?Item=379a808d-9183-4a07-90c7-cdeb0ec3de63&Language=E&Section=ALL
4615664,ca.proc.d.2014-10-24.16383.98,2014-10-24,9bcb731e-774b-4fe3-bb03-8c92f59eaa6c,1823,"Ms. Alexandrine Latendresse (Louis-Saint-Laurent, NDP)",,Oral Questions,Quebec Bridge,,"Mr. Speaker, this is really disappointing, especially considering that in 2005, the Prime Minister himself made fun of the Liberals, saying that they could not even get a bridge painted.
Now that the Superior Court ruling clearly shows that the federal government must do its part, will the government prove that it can get the Quebec Bridge painted?",New Democratic Party,Louis-Saint-Laurent,Alexandrine Latendresse,http://www.parl.gc.ca/parlinfo/Files/Parliamentarian.aspx?Item=9bcb731e-774b-4fe3-bb03-8c92f59eaa6c&Language=E&Section=ALL
4615665,ca.proc.d.2014-10-24.16383.99,2014-10-24,379a808d-9183-4a07-90c7-cdeb0ec3de63,302,"Mr. Jeff Watson (Parliamentary Secretary to the Minister of Transport, CPC)",,Oral Questions,Quebec Bridge,,"Mr. Speaker, as owner of the bridge, Canadian National is responsible for its maintenance and safety. In August 2013, Transport Canada inspected the rail section of the bridge, which is under federal jurisdiction. Transport Canada did not detect any problems with the rail section of the bridge. The road portion of the bridge falls under provincial jurisdiction.",Conservative,Essex,Jeff Watson,http://www.parl.gc.ca/parlinfo/Files/Parliamentarian.aspx?Item=379a808d-9183-4a07-90c7-cdeb0ec3de63&Language=E&Section=ALL
4615666,ca.proc.d.2014-10-24.16383.100,2014-10-24,6bf8e46d-35db-462e-a769-ead3dc2d7f84,578,"Mr. Frank Valeriote (Guelph, Lib.)",,Oral Questions,Health,,"Mr. Speaker, could the minister give us any additional information on the steps the government is taking to work with provinces and territories to ensure they are prepared to deal with a potential case of Ebola? 
Could the minister also update the House on the most recent actions the government has taken to ensure that front-line health care providers are prepared to deal with a potential case of Ebola?",Liberal,Guelph,Frank Valeriote,http://www.parl.gc.ca/parlinfo/Files/Parliamentarian.aspx?Item=6bf8e46d-35db-462e-a769-ead3dc2d7f84&Language=E&Section=ALL
4615667,ca.proc.d.2014-10-24.16383.101,2014-10-24,c4273cb6-4d3d-4d46-a5f9-2a6c1914a32e,8818,"Ms. Eve Adams (Parliamentary Secretary to the Minister of Health, CPC)",,Oral Questions,Health,,"Mr. Speaker, health matters should always transcend politics and partisanship.
The minister and the Chief Public Health Officer of Canada are in regular contact with their provincial and territorial partners.
It is PHAC, the Public Health Agency of Canada, that provides guidance to the provinces, but the provinces are responsible for training.
We have learned a lot from SARS and H1N1, and in the event of an Ebola case in Canada, the Public Health Agency is ready to provide support with five rapid response teams, lab expertise to quickly confirm diagnosis, and emergency supplies of masks, gowns, and gloves.",Conservative,Mississauga--Brampton South,Eve Adams,http://www.parl.gc.ca/parlinfo/Files/Parliamentarian.aspx?Item=c4273cb6-4d3d-4d46-a5f9-2a6c1914a32e&Language=E&Section=ALL
4615668,ca.proc.d.2014-10-24.16383.102,2014-10-24,634edc34-ea0d-406f-ade1-eeec6c5bad04,9289,"Mr. Adam Vaughan (Trinity—Spadina, Lib.)",,Oral Questions,Multiculturalism,,"Mr. Speaker, several candidates running in Monday's municipal election in Toronto have had their signs and campaign offices vandalized. They are being targeted because they are Muslim. 
Today, a young candidate, Munira Abukar, was assaulted and pelted with garbage. Her brother is a member of the Canadian Armed Forces.
These attacks are unacceptable. They too are an attack on democracy. What steps is the government taking to assure Canadians that not only are individuals, mosques, and places of worship safe, but will Conservatives join us in condemning these attacks on Muslims?",Liberal,Trinity--Spadina,Adam Vaughan,
4615669,ca.proc.d.2014-10-24.16383.103,2014-10-24,abeb1396-5319-4cef-8b3a-a2417c0f43ce,401,"Hon. John Baird (Minister of Foreign Affairs, CPC)",,Oral Questions,Multiculturalism,,"Mr. Speaker, I wholeheartedly agree with the member opposite. Canada is a country where pluralism is one of the cornerstones of our values. We welcome people in all parts of life, from all religious backgrounds. That is what makes Canada such a great country. I think I speak for all members of this House when I say that we find such acts despicable and not part of the Canadian way of doing things.",Conservative,Ottawa West--Nepean,John Baird,http://www.parl.gc.ca/parlinfo/Files/Parliamentarian.aspx?Item=abeb1396-5319-4cef-8b3a-a2417c0f43ce&Language=E&Section=ALL
4615670,ca.proc.d.2014-10-24.16383.104,2014-10-24,013eb624-68a5-402e-ac65-6ff6062ad8b9,8642,"Ms. Laurin Liu (Rivière-des-Mille-Îles, NDP)",,Oral Questions,Canada Post,,"Mr. Speaker, this week in Montreal's north shore, residents of Lorraine, Rosemère and Bois-des-Filion lost their home mail delivery service.
I met with hundreds of people to discuss this, and I can assure you that Canadians, particularly seniors and people with reduced mobility, are not happy about it.
Will the minister finally decide to intervene and restore home mail delivery service?",New Democratic Party,Rivière-des-Mille-Îles,Laurin Liu,http://www.parl.gc.ca/parlinfo/Files/Parliamentarian.aspx?Item=013eb624-68a5-402e-ac65-6ff6062ad8b9&Language=E&Section=ALL
4615671,ca.proc.d.2014-10-24.16383.105,2014-10-24,379a808d-9183-4a07-90c7-cdeb0ec3de63,302,"Mr. Jeff Watson (Parliamentary Secretary to the Minister of Transport, CPC)",,Oral Questions,Canada Post,,"Mr. Speaker, as the member well knows, Canada Post has seen a continuing plummeting of volumes of individual-addressed mail. In fact, there were 1.2 billion fewer pieces of mail in 2013 than in 2006.
The member would also know that two-thirds of Canadians currently do not receive their mail door to door. Those in the remaining one-third, as part of Canada Post's five-point action plan, will be seeing a change, but they will continue with their daily mail.",Conservative,Essex,Jeff Watson,http://www.parl.gc.ca/parlinfo/Files/Parliamentarian.aspx?Item=379a808d-9183-4a07-90c7-cdeb0ec3de63&Language=E&Section=ALL
4615672,ca.proc.d.2014-10-24.16383.106,2014-10-24,b4cc87d1-2354-4223-9853-43e200a73ce1,8350,"Mr. François Lapointe (Montmagny—L'Islet—Kamouraska—Rivière-du-Loup, NDP)",,Oral Questions,Canada Post,,"Mr. Speaker, a company in Saint-Jean-Port-Joli in my riding could have built the new community mailboxes. It has been building mailboxes for Canada Post for over 25 years.
However, that is not what management at Canada Post decided to do. Canadian manufacturers have not even been allowed participate in the bidding processes that have taken place in recent months. They cannot even bid. In 2015, our mailboxes will be manufactured in the United States.
Can the minister explain why she is forcibly imposing working conditions on crown corporations and yet doing nothing to create jobs for Canadians?",New Democratic Party,Montmagny--L'Islet--Kamouraska--Rivière-du-Loup,François Lapointe,http://www.parl.gc.ca/parlinfo/Files/Parliamentarian.aspx?Item=b4cc87d1-2354-4223-9853-43e200a73ce1&Language=E&Section=ALL
4615673,ca.proc.d.2014-10-24.16383.107,2014-10-24,379a808d-9183-4a07-90c7-cdeb0ec3de63,302,"Mr. Jeff Watson (Parliamentary Secretary to the Minister of Transport, CPC)",,Oral Questions,Canada Post,,"Mr. Speaker, I am not sure whether the member understands the structure of crown corporations. They are not government departments. They operate at arm's length from the government in their operational decisions. They have a board of directors who make those types of decisions. They have clearly made a decision in this matter. If the member has a problem with that, then he should take that up with Canada Post.",Conservative,Essex,Jeff Watson,http://www.parl.gc.ca/parlinfo/Files/Parliamentarian.aspx?Item=379a808d-9183-4a07-90c7-cdeb0ec3de63&Language=E&Section=ALL
4615674,ca.proc.d.2014-10-24.16383.108,2014-10-24,f6937160-f4b0-4abd-b74a-a24349b6c2b0,290,"Mr. Brad Trost (Saskatoon—Humboldt, CPC)",,Oral Questions,Foreign Affairs,,"Mr. Speaker, this past spring, Canada sent over 300 observers to monitor and observe Ukraine's presidential elections. This upcoming Sunday, the people of Ukraine will take one more step toward reaffirming their desire for a free and democratic Ukraine. 
On October 26, Ukrainians go to the polls to select their representatives for Ukraine's Verkhovna Rada. Can the Minister of Foreign Affairs please update the House on Canada's support for Ukraine's parliamentary election?",Conservative,Saskatoon--Humboldt,Bradley Trost,http://www.parl.gc.ca/parlinfo/Files/Parliamentarian.aspx?Item=f6937160-f4b0-4abd-b74a-a24349b6c2b0&Language=E&Section=ALL
4615675,ca.proc.d.2014-10-24.16383.109,2014-10-24,abeb1396-5319-4cef-8b3a-a2417c0f43ce,401,"Hon. John Baird (Minister of Foreign Affairs, CPC)",,Oral Questions,Foreign Affairs,,"Mr. Speaker, we strongly support the people of Ukraine as they go to the polls. Canada has a long and rich tradition of working to support the Ukrainian people in their quest for full democratic rights, a democracy, and to live in freedom without interference from their neighbours.
I am very pleased to say that Canada has sent 300 election observers for these parliamentary elections. We look forward to hearing back from them about the state and quality of the elections.
This is just another example of how Canada and this government is standing behind the people of Ukraine.",Conservative,Ottawa West--Nepean,John Baird,http://www.parl.gc.ca/parlinfo/Files/Parliamentarian.aspx?Item=abeb1396-5319-4cef-8b3a-a2417c0f43ce&Language=E&Section=ALL
4615676,ca.proc.d.2014-10-24.16383.110,2014-10-24,6fa03d6c-bbe7-4e72-b1de-3f877b6bcb02,78,"Mr. Rodger Cuzner (Cape Breton—Canso, Lib.)",,Oral Questions,International Trade,,"Mr. Speaker, with the CETA deal officially signed and the legal scrub of the text having started, there are still some questions that remain unanswered. One such question surrounds the articles around patent protections for pharmaceutical products.
Can the government tell us what commitments it has made to compensate the provinces and territories as a result of the pharma provisions of CETA?",Liberal,Cape Breton--Canso,Rodger Cuzner,http://www.parl.gc.ca/parlinfo/Files/Parliamentarian.aspx?Item=6fa03d6c-bbe7-4e72-b1de-3f877b6bcb02&Language=E&Section=ALL
4615677,ca.proc.d.2014-10-24.16383.111,2014-10-24,96924c12-efff-4de2-9f9e-578fe5434342,9243,"Mr. Erin O'Toole (Parliamentary Secretary to the Minister of International Trade, CPC)",,Oral Questions,International Trade,,"Mr. Speaker, I would like to thank the member for that question because CETA represents the most modern trade agreement in our nation's history. What is amazing about it is that it was coordinated with stakeholders, employers, and the provinces.
 We have worked directly with the provinces along the negotiation of this to make sure that, if any intellectual property changes impact their pharma regime, we can work with them to make sure, over time, that the provinces are kept whole, in addition to the increased transfers we are already giving to the provinces for health care each year. ",Conservative,Durham,Erin O'Toole,http://www.parl.gc.ca/parlinfo/Files/Parliamentarian.aspx?Item=96924c12-efff-4de2-9f9e-578fe5434342&Language=E&Section=ALL
4615678,ca.proc.d.2014-10-24.16383.112,2014-10-24,03af66a0-6884-454e-9b46-50683413d74c,8505,"Mr. Dany Morin (Chicoutimi—Le Fjord, NDP)",,Oral Questions,Health,,"Mr. Speaker, as I pointed out yesterday, borders cannot contain viruses. 
At least 200 Canadians have been infected with the chikungunya virus, which has affected hundreds of thousands of people in the Caribbean. Many others could catch this virus unless they can protect themselves. The parliamentary secretary remained vague yesterday.
What meaningful measures will this government take to protect Canadians against this virus here and abroad?",New Democratic Party,Chicoutimi--Le Fjord,Dany Morin,http://www.parl.gc.ca/parlinfo/Files/Parliamentarian.aspx?Item=03af66a0-6884-454e-9b46-50683413d74c&Language=E&Section=ALL
4615679,ca.proc.d.2014-10-24.16383.113,2014-10-24,c4273cb6-4d3d-4d46-a5f9-2a6c1914a32e,8818,"Ms. Eve Adams (Parliamentary Secretary to the Minister of Health, CPC)",,Oral Questions,Health,,"Mr. Speaker, this is a tropical mosquito-borne illness. Health officials advise that there is no evidence of person-to-person transmission in Canada.
The Public Health Agency has posted travel advice for Caribbean and Pacific tropics, asking Canadians to exercise precaution in order to avoid mosquito bites.",Conservative,Mississauga--Brampton South,Eve Adams,http://www.parl.gc.ca/parlinfo/Files/Parliamentarian.aspx?Item=c4273cb6-4d3d-4d46-a5f9-2a6c1914a32e&Language=E&Section=ALL
4615680,ca.proc.d.2014-10-24.16383.114,2014-10-24,f8ea336f-74b1-413f-a222-1943aef1b58d,9276,"Mr. David Yurdiga (Fort McMurray—Athabasca, CPC)",,Oral Questions,National Defence,,"Mr. Speaker, would the Parliamentary Secretary to the Minister of International Trade please provide this House with any new developments with respect to Operation Impact, Canada's contribution to the fight against ISIL?",Conservative,Fort McMurray--Athabasca,David Yurdiga,
4615681,ca.proc.d.2014-10-24.16383.115,2014-10-24,96924c12-efff-4de2-9f9e-578fe5434342,9243,"Mr. Erin O'Toole (Parliamentary Secretary to the Minister of International Trade, CPC)",,Oral Questions,National Defence,,"Mr. Speaker, I would like to thank the member for Fort McMurray—Athabasca for the question and for his support of the Canadian Forces since he has joined this House.
As the Minister of National Defence said to the House yesterday, Operation Impact is on time and on target.
 In addition to the CF-18s that left CFB Bagotville yesterday, later today, two CP-140 Aurora aircraft will be departing from CFB Greenwood. These Aurora aircraft are some of the most modern civilian aircraft in the world due to our government's update of the Aurora aircraft. 
Our CAF and our training personnel are now joining our allies to combat the threat that is ISIL.",Conservative,Durham,Erin O'Toole,http://www.parl.gc.ca/parlinfo/Files/Parliamentarian.aspx?Item=96924c12-efff-4de2-9f9e-578fe5434342&Language=E&Section=ALL
