basepk,hid,speechdate,pid,opid,speakeroldname,speakerposition,maintopic,subtopic,subsubtopic,speechtext,speakerparty,speakerriding,speakername,speakerurl
4615566,ca.proc.d.2014-10-24.16383.0,2014-10-24,,,,stagedirection,Government Orders,Canada-Korea Economic Growth and Prosperity Act,,"The House proceeded to the consideration of Bill C-41, An Act to implement the Free Trade Agreement between Canada and the Republic of Korea, as reported (without amendment) from the committee.",,,,
4615567,ca.proc.d.2014-10-24.16383.1,2014-10-24,6519cfba-0080-419d-baa9-8ae6e56d032f,256,The Speaker,,Government Orders,Canada-Korea Economic Growth and Prosperity Act,,"There is one motion in amendment standing on the notice paper for the report stage of Bill C-41. Motion No. 1 will be debated and voted upon.
The hon. member for Saanich—Gulf Islands is not present to move the motion at report stage. Therefore, the House will now proceed without debate to the putting of the question on the motion to concur in the bill at report stage.",Conservative,Regina--Qu'Appelle,Andrew Scheer,http://www.parl.gc.ca/parlinfo/Files/Parliamentarian.aspx?Item=6519cfba-0080-419d-baa9-8ae6e56d032f&Language=E&Section=ALL
4615568,ca.proc.d.2014-10-24.16383.2,2014-10-24,ad4032f2-6bb1-497b-b146-f321cfb71ba9,233,Hon. Pierre Poilievre,,Government Orders,Canada-Korea Economic Growth and Prosperity Act,, moved that the bill be concurred in at report stage. ,Conservative,Nepean--Carleton,Pierre Poilievre,http://www.parl.gc.ca/parlinfo/Files/Parliamentarian.aspx?Item=ad4032f2-6bb1-497b-b146-f321cfb71ba9&Language=E&Section=ALL
4615569,ca.proc.d.2014-10-24.16383.3,2014-10-24,6519cfba-0080-419d-baa9-8ae6e56d032f,256,The Speaker,,Government Orders,Canada-Korea Economic Growth and Prosperity Act,,Is it the pleasure of the House to adopt the motion?,Conservative,Regina--Qu'Appelle,Andrew Scheer,http://www.parl.gc.ca/parlinfo/Files/Parliamentarian.aspx?Item=6519cfba-0080-419d-baa9-8ae6e56d032f&Language=E&Section=ALL
4615570,ca.proc.d.2014-10-24.16383.4,2014-10-24,,,,intervention,Government Orders,Canada-Korea Economic Growth and Prosperity Act,, Agreed.,,,Some hon. members,
4615571,ca.proc.d.2014-10-24.16383.5,2014-10-24,6519cfba-0080-419d-baa9-8ae6e56d032f,256,The Speaker,,Government Orders,Canada-Korea Economic Growth and Prosperity Act,," I declare the motion carried.
(Motion agreed to)
 When shall the bill be read a third time? At the next sitting of the House.",Conservative,Regina--Qu'Appelle,Andrew Scheer,http://www.parl.gc.ca/parlinfo/Files/Parliamentarian.aspx?Item=6519cfba-0080-419d-baa9-8ae6e56d032f&Language=E&Section=ALL
4615572,ca.proc.d.2014-10-24.16383.6,2014-10-24,ad4032f2-6bb1-497b-b146-f321cfb71ba9,233,Hon. Pierre Poilievre,,Government Orders,Incorporation by Reference in Regulations Act,," moved that Bill S-2, An Act to amend the Statutory Instruments Act and to make consequential amendments to the Statutory Instruments Regulations, be read the second time and referred to a committee. ",Conservative,Nepean--Carleton,Pierre Poilievre,http://www.parl.gc.ca/parlinfo/Files/Parliamentarian.aspx?Item=ad4032f2-6bb1-497b-b146-f321cfb71ba9&Language=E&Section=ALL
4615573,ca.proc.d.2014-10-24.16383.7,2014-10-24,96924c12-efff-4de2-9f9e-578fe5434342,9243,"Mr. Erin O'Toole (Parliamentary Secretary to the Minister of International Trade, CPC)",,Government Orders,Incorporation by Reference in Regulations Act,,"Mr. Speaker, with the consent of the House, I will be dividing my time with the Parliamentary Secretary to the President of the Treasury Board. 
Today I rise to speak to Bill S-2, a bill that comes to us from the Senate, which is seeking to amend the Statutory Instruments Act and consequential amendments to the Statutory Instruments Regulations. 
In many ways, we have a bill before the House today that is technical in its name and technical in its nature and really can be looked at as the plumbing required in the legislative and regulatory regime. I am going to speak to that briefly today.
In many ways the bill--",Conservative,Durham,Erin O'Toole,http://www.parl.gc.ca/parlinfo/Files/Parliamentarian.aspx?Item=96924c12-efff-4de2-9f9e-578fe5434342&Language=E&Section=ALL
4615574,ca.proc.d.2014-10-24.16383.8,2014-10-24,6519cfba-0080-419d-baa9-8ae6e56d032f,256,The Speaker,,Government Orders,Incorporation by Reference in Regulations Act,,"Order, please. Does the member have the unanimous consent of the House to share his time?",Conservative,Regina--Qu'Appelle,Andrew Scheer,http://www.parl.gc.ca/parlinfo/Files/Parliamentarian.aspx?Item=6519cfba-0080-419d-baa9-8ae6e56d032f&Language=E&Section=ALL
4615575,ca.proc.d.2014-10-24.16383.9,2014-10-24,,,,intervention,Government Orders,Incorporation by Reference in Regulations Act,, Agreed.,,,Some hon. members,
4615576,ca.proc.d.2014-10-24.16383.10,2014-10-24,96924c12-efff-4de2-9f9e-578fe5434342,9243,Mr. Erin O'Toole,Interjection,Government Orders,Incorporation by Reference in Regulations Act,,"Mr. Speaker, I thank my colleagues for that consent.
As I was saying, Mr. Speaker, I will be dividing my time with the Parliamentary Secretary to the President of the Treasury Board, who is far more passionate than I about the plumbing of state and the updating of our legislative and drafting requirements.
 As a lawyer, prior to coming to this House, I know that these sorts of bills are important for governance and for drafting. This would have some measures that would allow our legislative and regulatory regime to be modern, and the broadest way is the technique of incorporation by reference.
Bill S-2, and the specific provision on incorporation by reference, has been studied by the Senate Committee on Legal and Constitutional Affairs and reported, without amendment, to this House.
The technique of incorporation by reference is already used in a vast array of federal regulations. It is difficult to actually think of an area, a regulated area federally, where incorporation by reference is not used to some degree.
Bill S-2, the bill before the House today, is about securing the government's access to a drafting technique that has already become essential to the way governance operates in Canada. It is also in line with international trends in the modernization of regulations, and as I said, it responds to Senate and House committees, including the Standing Joint Committee on the Scrutiny of Regulations. That is certainly a committee I want to try to avoid during my time here in Ottawa.
Incorporation by reference is an effective way to tap the resources of expertise in standards in writing bodies across Canada. Canada has a national standards system that is recognized around the world, and the incorporation of standards, whether developed here in Canada or internationally, allows the best science and the most widely accepted approaches to be used so that people can have a modern and comprehensive approach to the day-to-day use of regulations in Canada.
In fact, reliance on this sort of expertise, whether domestic or international, is essential to ensuring access to the technical knowledge needed for such regulations.
Witnesses from the Standards Council of Canada before the Senate Committee on Legal and Constitutional Affairs were clear in their testimony that Canada already relies extensively on international and national standards. The bill, in many ways, would ensure that regulators continue to have the ability to use incorporation by reference, or the ability to incorporate documents as they are amended from time to time, in our regulations so that Canadians can be assured that they are protected by the most up-to-date technology without the need to amend regulations or to constantly be referring to newer versions.
For these reasons, incorporation by reference is an important tool for regulators when they are designing our regulatory regimes.
The bill before the House today also strikes an important balance in respect of what may be incorporated by reference by limiting the types of documents that can be incorporated by the maker of regulations. Also, only the versions of such documents as they exist on a particular day can be incorporated when they are produced by the regulation maker. This is an important safeguard against circumvention of the regulatory process when incorporating documents that are internal to the government.
In addition to providing an express legal basis for the use of the technique of incorporation by reference, one of the most important aspects of Bill S-2 relates to accessibility. The bill would expressly impose, in legislation, an obligation on all regulators to ensure that the documents they incorporate are accessible. While this has always been something in the common law, and access to justice and common law principles always have applied to our regulatory regime in Canada, the bill would clearly enshrine that obligation in legislation.
There is no doubt that accessibility should be part of the bill. It is essential that documents that are incorporated by reference be accessible to those who are required, by regulation, to comply with those documents. That is an important and necessary step, and that is why it is included in Bill S-2.
The general approach to accessibility found in this bill would provide flexibility to regulatory bodies to take whatever steps might be necessary to ensure that these diverse types of materials, from a wide variety of sources, both domestic and international, could in fact be accessible.
 Material that is incorporated by reference is generally accessible, and as a result, in some cases, no further action on the part of a regulatory authority would be necessary. An example of this is provincial legislation across Canada that is already widely and generally accessible. Federal regulations that incorporated provincial legislation would undoubtedly allow the regulator to meet the requirement to ensure that the material was accessible.
 Sometimes accessing the document through the standards organization itself might be necessary. The proposed legislation would ensure that the regulated community would have access to whatever material was incorporated, with reasonable effort on their part. In this modern age, so many things are easily accessible by those that are regulated, so this reasonable-effort standard should be very easily met.
The bill, therefore, would create a meaningful obligation on the part of regulators to ensure accessibility while still allowing for innovation, modernity, flexibility, and creativity.
 Bill S-2 is intended to solidify the government's access to a regulatory drafting technique, essential and responsive, in our regulations. It also recognizes corresponding obligations regulators must meet when using this tool. This bill strikes an important balance that reflects the reality of modern regulation while ensuring that appropriate protections and accessibility measures are enshrined in law.
This proposal is consistent with the position the government has long taken on the question of whether the technique of incorporation by reference can or cannot be used in regulations. It would provide express legislative authority for the use of this technique in the future and would confirm the validity of existing regulations incorporating documents in a manner that was consistent with that authority.
 Parliament's ability to control the delegation of regulatory-making power would continue, as would the oversight of the Standing Joint Committee for the Scrutiny of Regulations. We expect that this standing joint committee would indeed continue to play an important role in ensuring that the use of the technique continued and was exercised in the way Parliament intended.
We have many years of successful experience with the use of incorporation by reference in regulations at the federal level, and this knowledge will be useful in providing guidance with respect to this legislation in the future. There is also every indication that the use of this technique will be essential in implementing regulatory modernization initiatives here in Canada in conjunction with some of our regulatory partners around the world, most notably our partners to the south, in the United States. 
We have before us today one of these bills that are essentially the plumbing in our laws and regulations in Canada. The enactment of Bill S-2 would be a logical and necessary next step to ensuring that there is access in a responsible manner to incorporation by reference documentation in a way that is accessible but that allows our regulations to be modern and to incorporate some of the best references from around the world.
I invite members to support this important legislative proposal in Bill S-2 and recognize the important steps it would take to ensure that our laws and regulations are modern, accessible, and the best they can be.",Conservative,Durham,Erin O'Toole,http://www.parl.gc.ca/parlinfo/Files/Parliamentarian.aspx?Item=96924c12-efff-4de2-9f9e-578fe5434342&Language=E&Section=ALL
4615577,ca.proc.d.2014-10-24.16383.11,2014-10-24,413f63e9-daa1-4444-b83b-c0135109dbba,9240,"Mr. Craig Scott (Toronto—Danforth, NDP)",,Government Orders,Incorporation by Reference in Regulations Act,,"Mr. Speaker, I would like to thank my colleague for introducing us to the debate. We already looked at this issue some time ago when it was Bill S-12. As at that time, and as I will say in my own speech, one of my concerns is how the general regulatory framework and this bill would deal with open or ambulatory incorporation by reference.
 I may not have been listening as carefully as I should have been to my hon. colleague, but I am wondering if he could address the question of open incorporation by reference and whether he feels that the collapse of closed and open incorporation by reference by the bill would be a problem and whether we should have very specific rules for open incorporation by reference.",New Democratic Party,Toronto--Danforth,Craig Scott,http://www.parl.gc.ca/parlinfo/Files/Parliamentarian.aspx?Item=413f63e9-daa1-4444-b83b-c0135109dbba&Language=E&Section=ALL
4615578,ca.proc.d.2014-10-24.16383.12,2014-10-24,96924c12-efff-4de2-9f9e-578fe5434342,9243,Mr. Erin O'Toole,Interjection,Government Orders,Incorporation by Reference in Regulations Act,,"Mr. Speaker, my friend may have taught a course on regulatory interpretation while he was at Osgoode Hall. I look forward to his learned remarks on this subject in the House.
The hon. member did reference the ambulatory incorporation by reference. The ability for a government to incorporate documents by reference, and I talked about provincial or international partners' documents, is an important part of the legislative modernization process to allow our regulatory regimes to ensure that they have the most up-to-date technology and references, without the need to constantly amend the regulations and refer to newer regulations.
This is increasingly becoming a standard practice with modern jurisdictions such as Canada. In many ways it is important to note, and in my remarks I also talked about, the accessibility and the reasonable ability for such documents incorporated by reference to be accessible. That is provided for in the bill and has been consistent with the practice of government in the past.",Conservative,Durham,Erin O'Toole,http://www.parl.gc.ca/parlinfo/Files/Parliamentarian.aspx?Item=96924c12-efff-4de2-9f9e-578fe5434342&Language=E&Section=ALL
4615579,ca.proc.d.2014-10-24.16383.13,2014-10-24,2e8ec565-8749-41c1-ac4c-98f9d939cf16,733,"Mr. Mike Sullivan (York South—Weston, NDP)",,Government Orders,Incorporation by Reference in Regulations Act,,"Mr. Speaker, first, I want to thank the government for not bringing forward Bill C-42, which was originally to have been debated. It is a bill to relax gun regulations in this country, and it is an inappropriate week to bring such a bill forward. I am glad we are not debating that. 
On this bill, I am the critic for persons with disabilities and the word “accessible” has a particular meaning to persons with disabilities. It means that if someone is blind, it is available in Braille. It means that if someone is partially sighted, the fonts and the contrast online are such that he or she can read it. The term “accessible” has a different meaning.
I wonder if the government could tell us whether or not the word “accessible” includes those meanings.",New Democratic Party,York South--Weston,Mike Sullivan,http://www.parl.gc.ca/parlinfo/Files/Parliamentarian.aspx?Item=2e8ec565-8749-41c1-ac4c-98f9d939cf16&Language=E&Section=ALL
4615580,ca.proc.d.2014-10-24.16383.14,2014-10-24,96924c12-efff-4de2-9f9e-578fe5434342,9243,Mr. Erin O'Toole,Interjection,Government Orders,Incorporation by Reference in Regulations Act,,"Mr. Speaker, I would like to thank the member for his question and for his work with people with disabilities across our country.
In many ways what I talked about in my remarks, the accessibility and the fact that documents incorporated by reference must be accessible using reasonable efforts, is a standard that would be, as my friend would know, quite similar to the legal standard for accommodation of people with disabilities. Reasonable methods of accommodation for people with different ranges of abilities must be provided. That is the legal standard across the country.
We are talking about a regulatory incorporation of documents by reference. It certainly does not confront folks with a disability on a day-to-day basis, such as a lot of basic accessibility issues would. However, it would have a reasonably close standard, where documents incorporated by reference would need to be accessible with reasonable effort to the folks impacted by the regulations. That is the right balance.",Conservative,Durham,Erin O'Toole,http://www.parl.gc.ca/parlinfo/Files/Parliamentarian.aspx?Item=96924c12-efff-4de2-9f9e-578fe5434342&Language=E&Section=ALL
