basepk,hid,speechdate,pid,opid,speakeroldname,speakerposition,maintopic,subtopic,subsubtopic,speechtext,speakerparty,speakerriding,speakername,speakerurl
4615618,ca.proc.d.2014-10-24.16383.52,2014-10-24,bc2e82f3-02f1-46e2-b9be-7d5f04ddddc9,572,"Mr. Marc Garneau (Westmount—Ville-Marie, Lib.)",,Oral Questions,National Defence,," Mr. Speaker, the deputy director of CSIS raised concerns about the agency's ability to effectively monitor the 93 people who are currently identified as potential threats to Canadian security. Yesterday, the RCMP commissioner also spoke about the lack of resources for carrying out these national security investigations.
Could the minister tell the House what plans are in place to ensure that our security agents have the resources they need to effectively carry out their responsibilities? ",Liberal,Westmount--Ville-Marie,Marc Garneau,http://www.parl.gc.ca/parlinfo/Files/Parliamentarian.aspx?Item=bc2e82f3-02f1-46e2-b9be-7d5f04ddddc9&Language=E&Section=ALL
4615619,ca.proc.d.2014-10-24.16383.53,2014-10-24,7e517cde-1b3a-46c1-afdb-4ddddeec7b81,1037,"Ms. Roxanne James (Parliamentary Secretary to the Minister of Public Safety and Emergency Preparedness, CPC)",,Oral Questions,National Defence,,"Mr. Speaker, to make all parliamentarians aware, we have actually increased funding and investments to our national security agencies, for both the RCMP and CSIS. As well, the director of CSIS recently stated that today's terrorist threats are diffuse and they develop rapidly. 
CSIS will continue to dedicate its resources to investigate the threat posed by terrorist travel and radicalization. Our government has brought forward a number of measures since forming office to give our agencies the proper tools they need. We will be doing that more so in the future. ",Conservative,Scarborough Centre,Roxanne James,http://www.parl.gc.ca/parlinfo/Files/Parliamentarian.aspx?Item=7e517cde-1b3a-46c1-afdb-4ddddeec7b81&Language=E&Section=ALL
4615620,ca.proc.d.2014-10-24.16383.54,2014-10-24,bc2e82f3-02f1-46e2-b9be-7d5f04ddddc9,572,"Mr. Marc Garneau (Westmount—Ville-Marie, Lib.)",,Oral Questions,National Defence,,"Mr. Speaker, the deputy director of CSIS raised concerns to Parliament about the agency's ability to effectively monitor the 90 people who are currently identified as potential threats to Canadian security. Yesterday, the RCMP commissioner said that if they put all of their resources on the 93 people being tracked they would not be able to do anything else.
Could the minister inform the House whether new measures, new resources have been put in place recently to ensure that we can effectively carry out these important responsibilities?",Liberal,Westmount--Ville-Marie,Marc Garneau,http://www.parl.gc.ca/parlinfo/Files/Parliamentarian.aspx?Item=bc2e82f3-02f1-46e2-b9be-7d5f04ddddc9&Language=E&Section=ALL
4615621,ca.proc.d.2014-10-24.16383.55,2014-10-24,7e517cde-1b3a-46c1-afdb-4ddddeec7b81,1037,"Ms. Roxanne James (Parliamentary Secretary to the Minister of Public Safety and Emergency Preparedness, CPC)",,Oral Questions,National Defence,," Mr. Speaker, as I just mentioned, we have actually increased investment in our security agencies, for both the RCMP and CSIS, and of course we are looking at new measures in the future, always examining ways that we can provide better tools for them to do their work. ",Conservative,Scarborough Centre,Roxanne James,http://www.parl.gc.ca/parlinfo/Files/Parliamentarian.aspx?Item=7e517cde-1b3a-46c1-afdb-4ddddeec7b81&Language=E&Section=ALL
4615622,ca.proc.d.2014-10-24.16383.56,2014-10-24,1c721843-28d0-423b-94ae-ede577509178,415,"Ms. Chris Charlton (Hamilton Mountain, NDP)",,Oral Questions,The Budget,,"Mr. Speaker, yesterday the Conservatives tabled yet another mammoth budget bill. It is 458 pages, with more than 400 clauses, dozens of laws repealed, rewritten, or amended, and all in a single omnibus bill. 
Canadians expect us to study, debate, and deliberate on their behalf, and to make thoughtful choices. Will the government agree not to shut down debate with closure or time allocation on this large piece of legislation?",New Democratic Party,Hamilton Mountain,Chris Charlton,http://www.parl.gc.ca/parlinfo/Files/Parliamentarian.aspx?Item=1c721843-28d0-423b-94ae-ede577509178&Language=E&Section=ALL
4615623,ca.proc.d.2014-10-24.16383.57,2014-10-24,f66407a4-934e-4c46-b524-b4dacd035ceb,613,"Mr. Andrew Saxton (Parliamentary Secretary to the Minister of Finance, CPC)",,Oral Questions,The Budget,,"Mr. Speaker, our government is moving forward with important measures to create jobs. For example, the bill creates jobs and opportunities across Canada through the new small business job credit. The budget implementation bill makes life more affordable for Canadian families by doubling the children's fitness tax credit to $1,000 and making it refundable, and ending pay-to-pay billing practices by telecommunications companies. 
I urge the opposition to support this important legislation. ",Conservative,North Vancouver,Andrew Saxton,http://www.parl.gc.ca/parlinfo/Files/Parliamentarian.aspx?Item=f66407a4-934e-4c46-b524-b4dacd035ceb&Language=E&Section=ALL
4615624,ca.proc.d.2014-10-24.16383.58,2014-10-24,1c721843-28d0-423b-94ae-ede577509178,415,"Ms. Chris Charlton (Hamilton Mountain, NDP)",,Oral Questions,The Budget,,"Mr. Speaker, let us talk about that jobs credit. The Conservatives are using their omnibus budget bill to push through changes to EI, a jobs plan that will not create jobs. The Conservatives' proposal has been panned by experts, economists, and the Parliamentary Budget Officer, who found it would create just 800 jobs while actually discouraging small businesses from growing.
Given all of these concerns, would it not be prudent to separate this proposal from the mammoth budget bill so that it gets the scrutiny it deserves?",New Democratic Party,Hamilton Mountain,Chris Charlton,http://www.parl.gc.ca/parlinfo/Files/Parliamentarian.aspx?Item=1c721843-28d0-423b-94ae-ede577509178&Language=E&Section=ALL
4615625,ca.proc.d.2014-10-24.16383.59,2014-10-24,f66407a4-934e-4c46-b524-b4dacd035ceb,613,"Mr. Andrew Saxton (Parliamentary Secretary to the Minister of Finance, CPC)",,Oral Questions,The Budget,,"Mr. Speaker, the budget bill will connect Canadians with available jobs, support families and communities, and improve the fairness and integrity of the tax system. The bill contains important measures, like creating a national DNA-based missing persons index, reducing administrative burden on charities, improving the temporary foreign worker program, and expanding eligibility for the accelerated capital cost allowance. 
The bill is a further step to returning to balanced budgets while keeping taxes low, creating jobs, and improving the economy.",Conservative,North Vancouver,Andrew Saxton,http://www.parl.gc.ca/parlinfo/Files/Parliamentarian.aspx?Item=f66407a4-934e-4c46-b524-b4dacd035ceb&Language=E&Section=ALL
4615626,ca.proc.d.2014-10-24.16383.60,2014-10-24,c861cfd8-ac30-4ddf-9d31-79dd34dcc59e,8479,"Ms. Ruth Ellen Brosseau (Berthier—Maskinongé, NDP)",,Oral Questions,The Budget,,"Mr. Speaker, the Conservatives are champions of secrecy.
As a piece of legislation, the new omnibus bill makes no sense. This is what we have come to expect from the Conservatives. The content of the bill is even more concerning. The tax credit for small businesses will cost $500 million for just 800 jobs.
Seriously, why is the government proposing such an ineffective program that will not truly create jobs here in Canada?",New Democratic Party,Berthier--Maskinongé,Ruth Ellen Brosseau,http://www.parl.gc.ca/parlinfo/Files/Parliamentarian.aspx?Item=c861cfd8-ac30-4ddf-9d31-79dd34dcc59e&Language=E&Section=ALL
4615627,ca.proc.d.2014-10-24.16383.61,2014-10-24,f66407a4-934e-4c46-b524-b4dacd035ceb,613,"Mr. Andrew Saxton (Parliamentary Secretary to the Minister of Finance, CPC)",,Oral Questions,The Budget,,"Mr. Speaker, the CFIB says the small business job credit will in fact create 25,000 person-years of employment. They call it, “fantastic news for Canada’s entrepreneurs and their employees, and as such, can only be a positive for the Canadian economy”.
We are lowering EI payroll taxes by 15% and saving small businesses over $550 million over two years. In contrast, the opposition are supporting a 45-day work year that would drastically increase premiums by 35%, adding a $4 billion tax burden on Canadians.",Conservative,North Vancouver,Andrew Saxton,http://www.parl.gc.ca/parlinfo/Files/Parliamentarian.aspx?Item=f66407a4-934e-4c46-b524-b4dacd035ceb&Language=E&Section=ALL
4615628,ca.proc.d.2014-10-24.16383.62,2014-10-24,c3000ffc-065c-47e0-be26-152a24090dbd,8618,"Mr. Mathieu Ravignat (Pontiac, NDP)",,Oral Questions,The Budget,,"Mr. Speaker, the budget implementation bill introduced yesterday shows this government's complete lack of vision.
The bill is 458 pages of fiscal nonsense. It makes no sense to include measures dealing with beekeeping, cable television, employment insurance and refugee health care in a single bill.
Will the government split its bill so that members can study it properly?",New Democratic Party,Pontiac,Mathieu Ravignat,http://www.parl.gc.ca/parlinfo/Files/Parliamentarian.aspx?Item=c3000ffc-065c-47e0-be26-152a24090dbd&Language=E&Section=ALL
4615629,ca.proc.d.2014-10-24.16383.63,2014-10-24,f66407a4-934e-4c46-b524-b4dacd035ceb,613,"Mr. Andrew Saxton (Parliamentary Secretary to the Minister of Finance, CPC)",,Oral Questions,The Budget,,"Mr. Speaker, Canada leads the G7 with more than one million jobs created since the global economic recession, but we are not immune to the challenges beyond our borders. That is why our government supports economic growth and job creation while keeping taxes low and returning to balanced budgets in 2015.
The budget bill will connect Canadians with available jobs, support families and communities, and improve the fairness and integrity of our tax system. I urge the opposition to get on board and support this important new legislation.",Conservative,North Vancouver,Andrew Saxton,http://www.parl.gc.ca/parlinfo/Files/Parliamentarian.aspx?Item=f66407a4-934e-4c46-b524-b4dacd035ceb&Language=E&Section=ALL
4615630,ca.proc.d.2014-10-24.16383.64,2014-10-24,5dcb8c60-bb95-4d0f-9e2f-06dd3624a80f,8656,"Mrs. Djaouida Sellah (Saint-Bruno—Saint-Hubert, NDP)",,Oral Questions,The Budget,,"Mr. Speaker, if words still mean anything, a budget bill should contain budgetary measures.
Once again, the Conservatives have used a budget bill to secretly introduce some reprehensible measures. This time, they are going after refugees by allowing the provinces to restrict access to social assistance. 
Do the Conservatives feel bad at all that they are trying to conceal their schemes in an omnibus bill?",New Democratic Party,Saint-Bruno--Saint-Hubert,Djaouida Sellah,http://www.parl.gc.ca/parlinfo/Files/Parliamentarian.aspx?Item=5dcb8c60-bb95-4d0f-9e2f-06dd3624a80f&Language=E&Section=ALL
4615631,ca.proc.d.2014-10-24.16383.65,2014-10-24,f66407a4-934e-4c46-b524-b4dacd035ceb,613,"Mr. Andrew Saxton (Parliamentary Secretary to the Minister of Finance, CPC)",,Oral Questions,The Budget,,"Mr. Speaker, this bill continues our plans for supporting growth and long-term prosperity by strengthening Canada's intellectual property regime to promote job creation and to improve conditions for business investment and access to international markets while reducing costs and red tape by making the tax system simpler and fairer for farming and fishing businesses, and by extending the existing tax credit for interest paid on government-sponsored student loans to interest paid on Canada apprentice loans.
I encourage the opposition to get on board and support this important new legislation.",Conservative,North Vancouver,Andrew Saxton,http://www.parl.gc.ca/parlinfo/Files/Parliamentarian.aspx?Item=f66407a4-934e-4c46-b524-b4dacd035ceb&Language=E&Section=ALL
4615632,ca.proc.d.2014-10-24.16383.66,2014-10-24,413f63e9-daa1-4444-b83b-c0135109dbba,9240,"Mr. Craig Scott (Toronto—Danforth, NDP)",,Oral Questions,The Budget,,"Mr. Speaker, that obviously did not address the question. Hiding a private member's bill to strip refugees of social assistance in an omnibus bill is both unjust and a serious abuse of parliamentary process. The government knew its proposal to pull support from people who have survived persecution would be unpopular with Canadians. It is using an omnibus bill to try to escape and avoid a public backlash.
Will the Minister of Finance agree to withdraw this measure from the budget bill?",New Democratic Party,Toronto--Danforth,Craig Scott,http://www.parl.gc.ca/parlinfo/Files/Parliamentarian.aspx?Item=413f63e9-daa1-4444-b83b-c0135109dbba&Language=E&Section=ALL
4615633,ca.proc.d.2014-10-24.16383.67,2014-10-24,0bb713a8-19fa-4695-8f26-64a5420953dc,8896,"Mr. Costas Menegakis (Parliamentary Secretary to the Minister of Citizenship and Immigration, CPC)",,Oral Questions,The Budget,,"Mr. Speaker, to continue Canada's tradition as a leader in international refugee protection, our government has increased the number of refugees resettled annually by 20%. Canada welcomes one in ten refugees resettled around the world, more than almost any other country in the world.
Our government is working to improve refugee outcomes as we will be able to better plan for their arrival.",Conservative,Richmond Hill,Costas Menegakis,http://www.parl.gc.ca/parlinfo/Files/Parliamentarian.aspx?Item=0bb713a8-19fa-4695-8f26-64a5420953dc&Language=E&Section=ALL
4615634,ca.proc.d.2014-10-24.16383.68,2014-10-24,8826a32c-2e29-49be-b6e2-c1f10363639b,440,"Ms. Irene Mathyssen (London—Fanshawe, NDP)",,Oral Questions,Canadian Broadcasting Corporation,,"Mr. Speaker, in response to the confusing and frightening events we have experienced, Canadian news coverage is being praised around the world, including the great work of the CBC. However, CBC employees were told this week about 400 more lost jobs. This brings the total number of job cuts at CBC and Radio-Canada to 1,057.
 Will the government now agree to reinvest in CBC and Radio-Canada so they can continue doing the vital work of informing the people of our country?",New Democratic Party,London--Fanshawe,Irene Mathyssen,http://www.parl.gc.ca/parlinfo/Files/Parliamentarian.aspx?Item=8826a32c-2e29-49be-b6e2-c1f10363639b&Language=E&Section=ALL
4615635,ca.proc.d.2014-10-24.16383.69,2014-10-24,e4fac630-d103-47ac-9170-4da50dd3aec8,423,"Mr. Rick Dykstra (Parliamentary Secretary to the Minister of Canadian Heritage, CPC)",,Oral Questions,Canadian Broadcasting Corporation,,"Mr. Speaker, the CBC already receives significant taxpayer funds and it can operate within its existing budget. While the CBC must adapt to changing technology and demographics in the broadcasting industry, our government believes the CBC can and should do so within its existing budget.",Conservative,St. Catharines,Rick Dykstra,http://www.parl.gc.ca/parlinfo/Files/Parliamentarian.aspx?Item=e4fac630-d103-47ac-9170-4da50dd3aec8&Language=E&Section=ALL
4615636,ca.proc.d.2014-10-24.16383.70,2014-10-24,6da8653f-692f-4bbc-acb2-86e088f0d60d,8571,"Mr. Pierre Nantel (Longueuil—Pierre-Boucher, NDP)",,Oral Questions,Canadian Broadcasting Corporation,,"Mr. Speaker, I am seeing people laugh when I talk about these cuts.
The majority of those watching pointed out how professional Canadian networks were, particularly CBC/Radio-Canada. However, this week—",New Democratic Party,Longueuil--Pierre-Boucher,Pierre Nantel,http://www.parl.gc.ca/parlinfo/Files/Parliamentarian.aspx?Item=6da8653f-692f-4bbc-acb2-86e088f0d60d&Language=E&Section=ALL
4615637,ca.proc.d.2014-10-24.16383.71,2014-10-24,,,,intervention,Oral Questions,Canadian Broadcasting Corporation,, Oh! Oh!,,,Some hon. members,
4615638,ca.proc.d.2014-10-24.16383.72,2014-10-24,6da8653f-692f-4bbc-acb2-86e088f0d60d,8571,Mr. Pierre Nantel,,Oral Questions,Canadian Broadcasting Corporation,," Are they going to quiet down? Their lack of respect is unbelievable.
This week, the president of CBC/Radio-Canada, Hubert Lacroix, announced to employees that 400 jobs will be eliminated between now and March 2016. There is even talk of getting rid of satellite trucks.
Her government's ideology aside, does the minister not see that budget cuts are having an even more devastating impact that anticipated?",New Democratic Party,Longueuil--Pierre-Boucher,Pierre Nantel,http://www.parl.gc.ca/parlinfo/Files/Parliamentarian.aspx?Item=6da8653f-692f-4bbc-acb2-86e088f0d60d&Language=E&Section=ALL
4615639,ca.proc.d.2014-10-24.16383.73,2014-10-24,e4fac630-d103-47ac-9170-4da50dd3aec8,423,"Mr. Rick Dykstra (Parliamentary Secretary to the Minister of Canadian Heritage, CPC)",,Oral Questions,Canadian Broadcasting Corporation,,"Mr. Speaker, the strategy that was implemented and is spoken about by the member opposite was announced in June of this year. This is a continuing and ongoing process that the CBC has undertaken and will continue to work through. I would add that Hubert Lacroix, the president of the CBC, also said: 
 ...a weak advertising market across the industry, lower-than-expected schedule performance in the key 25-54 year-old demographic on CBC Television, lower than expected ad revenues...and the loss of the NHL contract...have combined to create an important revenue shortfall.... 
 The CBC is doing what it is supposed to do: dealing with it.",Conservative,St. Catharines,Rick Dykstra,http://www.parl.gc.ca/parlinfo/Files/Parliamentarian.aspx?Item=e4fac630-d103-47ac-9170-4da50dd3aec8&Language=E&Section=ALL
4615640,ca.proc.d.2014-10-24.16383.74,2014-10-24,6da8653f-692f-4bbc-acb2-86e088f0d60d,8571,"Mr. Pierre Nantel (Longueuil—Pierre-Boucher, NDP)",,Oral Questions,Canadian Broadcasting Corporation,,"Mr. Speaker, there is no question that too many jobs have been cut at CBC/Radio-Canada in recent years, and this continues.
In June, CBC/Radio-Canada announced that 25% of its workforce would be let go between now and 2020, but things have gotten worse. It is our responsibility to respond. There is no way that one in four workers can be laid off without affecting the public broadcaster's mandate. It is impossible.
Can the minister stand up, show respect for the artists and journalists of our public broadcaster and ensure that Canadians get to keep the public broadcaster they cherish?",New Democratic Party,Longueuil--Pierre-Boucher,Pierre Nantel,http://www.parl.gc.ca/parlinfo/Files/Parliamentarian.aspx?Item=6da8653f-692f-4bbc-acb2-86e088f0d60d&Language=E&Section=ALL
4615641,ca.proc.d.2014-10-24.16383.75,2014-10-24,e4fac630-d103-47ac-9170-4da50dd3aec8,423,"Mr. Rick Dykstra (Parliamentary Secretary to the Minister of Canadian Heritage, CPC)",,Oral Questions,Canadian Broadcasting Corporation,,"Mr. Speaker, equating a strategy that the president and the organization of CBC are implementing in terms of dealing with the changes that are happening within the markets across this country, and trying to qualify that as something that has anything to do with this government, is completely unfair. We certainly understand the important role the CBC and Radio-Canada plays in remote and minority-language communities. Having said that, our government and all Canadians expect the CBC to fulfill its duty to provide quality programming to official-language minority communities under the Official Languages Act and the Broadcasting Act.",Conservative,St. Catharines,Rick Dykstra,http://www.parl.gc.ca/parlinfo/Files/Parliamentarian.aspx?Item=e4fac630-d103-47ac-9170-4da50dd3aec8&Language=E&Section=ALL
4615642,ca.proc.d.2014-10-24.16383.76,2014-10-24,669a6720-3704-48ff-a218-4035d05107a6,553,"Ms. Judy Foote (Random—Burin—St. George's, Lib.)",,Oral Questions,Public Safety,,"Mr. Speaker, the government has indicated it is considering new legislation with new powers for law enforcement. Can the minister confirm whether the existing tools that were passed by the House as part of Bill S-7, the Combating Terrorism Act, have been employed in any of the RCMP's 60-plus active national security investigations?",Liberal,Random--Burin--St. George's,Judy Foote,http://www.parl.gc.ca/parlinfo/Files/Parliamentarian.aspx?Item=669a6720-3704-48ff-a218-4035d05107a6&Language=E&Section=ALL
4615643,ca.proc.d.2014-10-24.16383.77,2014-10-24,7e517cde-1b3a-46c1-afdb-4ddddeec7b81,1037,"Ms. Roxanne James (Parliamentary Secretary to the Minister of Public Safety and Emergency Preparedness, CPC)",,Oral Questions,Public Safety,,"Mr. Speaker, this gives me an opportunity to talk about the upcoming legislation and why it is needed.
 As we know, the passage of the CSIS Act occurred back in 1984. We are talking 30 years ago. A lot has changed in 30 years. When we think about where any of us may have been, I may have still been in high school. I certainly did not have a computer, did not have a cellphone and did not have email.
 Things have changed, so has terrorism in this country and so have issues related to national security. That is why we need to modify and clarify the tools that CSIS has.",Conservative,Scarborough Centre,Roxanne James,http://www.parl.gc.ca/parlinfo/Files/Parliamentarian.aspx?Item=7e517cde-1b3a-46c1-afdb-4ddddeec7b81&Language=E&Section=ALL
4615644,ca.proc.d.2014-10-24.16383.78,2014-10-24,669a6720-3704-48ff-a218-4035d05107a6,553,"Ms. Judy Foote (Random—Burin—St. George's, Lib.)",,Oral Questions,Public Safety,,"Mr. Speaker, in the context of any new national security legislation, is the government prepared to create a national security oversight committee with representation from all parties consistent with those that exist among our allies, whose role will be to ensure that the right national security measures are in place, and also that there is a balance between the needs of our national security agencies and the rights that Canadians enjoy?",Liberal,Random--Burin--St. George's,Judy Foote,http://www.parl.gc.ca/parlinfo/Files/Parliamentarian.aspx?Item=669a6720-3704-48ff-a218-4035d05107a6&Language=E&Section=ALL
4615645,ca.proc.d.2014-10-24.16383.79,2014-10-24,7e517cde-1b3a-46c1-afdb-4ddddeec7b81,1037,"Ms. Roxanne James (Parliamentary Secretary to the Minister of Public Safety and Emergency Preparedness, CPC)",,Oral Questions,Public Safety,,"Mr. Speaker, first we are not any other country, we are Canada. In Canada we already have independent robust oversight that actually includes a former member of provincial parliament from the NDP. We are not interested in creating another bureaucracy that has the same responsibilities as the oversight body already in place.",Conservative,Scarborough Centre,Roxanne James,http://www.parl.gc.ca/parlinfo/Files/Parliamentarian.aspx?Item=7e517cde-1b3a-46c1-afdb-4ddddeec7b81&Language=E&Section=ALL
4615646,ca.proc.d.2014-10-24.16383.80,2014-10-24,4abeb9b5-279b-4117-9e04-b8901d9ccc53,255,"Mr. Francis Scarpaleggia (Lac-Saint-Louis, Lib.)",,Oral Questions,Public Safety,,"Mr. Speaker, I would like to talk about the new national security legislation. Will the government be creating a parliamentary oversight committee?
I am not talking about red tape but about a parliamentary oversight committee that includes our security agencies and all of the parties. Its role would be to ensure that appropriate security measures are put in place and that there is a balance between the needs of our security agencies and the rights of Canadians. That is what our allies are doing.",Liberal,Lac-Saint-Louis,Francis Scarpaleggia,http://www.parl.gc.ca/parlinfo/Files/Parliamentarian.aspx?Item=4abeb9b5-279b-4117-9e04-b8901d9ccc53&Language=E&Section=ALL
4615647,ca.proc.d.2014-10-24.16383.81,2014-10-24,7e517cde-1b3a-46c1-afdb-4ddddeec7b81,1037,"Ms. Roxanne James (Parliamentary Secretary to the Minister of Public Safety and Emergency Preparedness, CPC)",,Oral Questions,Public Safety,,"Mr. Speaker, as I just indicated, Canada already has independent, robust oversight over our security agencies.
In fact, the difference between us and the Liberals and the NDP is that we would rather focus our resources on giving law enforcement and security agencies the tools they need.",Conservative,Scarborough Centre,Roxanne James,http://www.parl.gc.ca/parlinfo/Files/Parliamentarian.aspx?Item=7e517cde-1b3a-46c1-afdb-4ddddeec7b81&Language=E&Section=ALL
4615648,ca.proc.d.2014-10-24.16383.82,2014-10-24,383ed93c-f141-4f87-b873-124d3051a31f,8621,"Ms. Élaine Michaud (Portneuf—Jacques-Cartier, NDP)",,Oral Questions,International Development,,"Mr. Speaker, the Ebola epidemic continues to threaten global health. Cases were reported yesterday for the first time in Mali and in New York.
Urgent global action is necessary to bring infection under control and save lives. What is the government doing to scale up Canada's Ebola response in West Africa?",New Democratic Party,Portneuf--Jacques-Cartier,Élaine Michaud,http://www.parl.gc.ca/parlinfo/Files/Parliamentarian.aspx?Item=383ed93c-f141-4f87-b873-124d3051a31f&Language=E&Section=ALL
4615649,ca.proc.d.2014-10-24.16383.83,2014-10-24,b7266d04-f318-4305-ab9f-580a06be7d08,587,"Ms. Lois Brown (Parliamentary Secretary to the Minister of International Development, CPC)",,Oral Questions,International Development,,"Mr. Speaker, I am very pleased to have that question today because I can now report that $52 million is being distributed to our trusted partners.
We continue to work with organizations like the World Health Organization, the World Food Programme, the World Food Programme logistics team, UNICEF and International Red Cross. We have been at the forefront of the international response efforts, and we will continue to be a world leader in the global response.",Conservative,Newmarket--Aurora,Lois Brown,http://www.parl.gc.ca/parlinfo/Files/Parliamentarian.aspx?Item=b7266d04-f318-4305-ab9f-580a06be7d08&Language=E&Section=ALL
