basepk,hid,speechdate,pid,opid,speakeroldname,speakerposition,maintopic,subtopic,subsubtopic,speechtext,speakerparty,speakerriding,speakername,speakerurl
4606610,ca.proc.d.2014-06-12.16277.304,2014-06-12,1288ae77-cf32-4b10-a560-1f75c4d4459b,8551,"Ms. Hélène LeBlanc (LaSalle—Émard, NDP)",,Government Orders,Protection of Communities and Exploited Persons Act,,"Mr. Speaker, I rise today to debate Bill C-36, An Act to amend the Criminal Code in response to the Supreme Court of Canada decision in Attorney General of Canada v. Bedford and to make consequential amendments to other Acts.
In my speech, I will read excerpts from the unanimous ruling of the Supreme Court to provide some context for the decision and the government's response, which takes the form of the bill we are debating. 
Last December, the Supreme Court ruled unanimously that section 210, as well as paragraphs 212(1)(j) and 213(1)(c) of the Criminal Code—which prohibit people from keeping a bawdy-house, living on the avails of prostitution and communicating for the purpose of engaging in prostitution—violate the charter, because they infringe upon the right of sex workers and the security of their person.
The court ruled that current laws impose:
 ...dangerous conditions on prostitution; they prevent people engaged in a risky—but legal—activity from taking steps to protect themselves from the risks. 
The court therefore asked the government to regulate prostitution “as long as it does so in a way that does not infringe the constitutional rights of prostitutes”. 
In addition, an article in today's edition of La Presse indicates that the government seems more interested in imposing a new repressive model than in eliminating the problems identified by the Supreme Court. 
Is the Minister of Justice's Bill C-36 a thoughtful and sensible response to the Supreme Court decision in the Bedford case? It would appear not. Once again, the Conservatives are using the big stick approach rather than a nuanced one. I would even go so far as to say that they are using a snowplow to remove everything in their path.
Will this bill protect the health and safety of sex workers? I do not think so. Will the bill protect women and girls caught in a cycle of dependence, violence and victimization? I do not think so. Will this bill prevent women, girls and boys from getting caught up in prostitution? I do not think so. Will this bill help support programs to assist people who want to get out of this situation? I do not think so.
I do not think so because this bill does not focus on prevention, but rather on repression. It does not consider the complexity of human nature and the reality of the society we live in, a society where appearances and money are strong lures, to the detriment of human beings and helping each other.
This was mentioned yesterday in the Winnipeg Sun's editorial:
 Like with other criminal activity, laws prohibiting it rarely eliminates the problem.... 
 While we want the government to crack down on pimps, human traffickers and people preying on the truly vulnerable, there’s nothing to suggest this law will reduce the demand or increase protections for women. 
This is a newspaper that I do not often quote, but it was quite revealing.
Last winter, I attended an information session organized by station 13 of the LaSalle police. Representatives from all the community organizations in greater southwest Montreal heard from two community officers with the multidisciplinary investigations and youth coordination unit of the Montreal police service.
These experienced police officers gave us a realistic and frank description of prostitution and pimping. They want to change people's thinking about prostitutes and, above all, suggest ways to help those prostitutes who want to get out of the business. The program that they have put in place, “Les survivantes” or “the survivors”, gives female victims of this vicious circle the means to break out of it.
They also said that the image of pimping was somewhat glorified in popular culture and could be appealing to individuals who decide that the sexual exploitation of others is an easy way to make money. In their presentation, they demonstrated that prostitution was not a choice for many, but rather a lack of choice.
In our opinion, this bill, introduced by the Minister of Justice, does not respond to the Supreme Court ruling regarding the safety and protection of prostitutes. By making successive cuts to programs to prevent violence against women, the Conservatives really dropped the ball when it comes to dealing with this problem. Their systematic refusal to move forward with a national inquiry into missing and murdered aboriginal women leads us to believe that they have a very limited understanding of prostitution and violence against women.
The NDP recognizes that real action needs to be taken right away to improve the safety of sex workers and help them to get out of the sex trade, if they are not there by choice. To that end, significant resources must be allocated to income support, education, training, poverty relief and substance abuse programs for these women. We need a government that works with them to implement a comprehensive strategy to protect and support women.
I would also like to point out that clauses 46 to 48 refer to an equally controversial bill that was criticized by the new Privacy Commissioner, and that is the bill on cyberbullying. We call on the government and the Minister of Justice and Attorney General of Canada to go back to the drawing board and hold real consultations that take into account the opinions of a wide range of legal experts, stakeholder groups, the appropriate authorities and the main people involved, sex workers. The minister should also refer Bill C-36 to the Supreme Court to get its opinion on whether the bill honours the ruling in the Bedford case.
This government, as a legislator, must ensure that the bills introduced in the House are consistent with our Constitution and the Canadian Charter of Rights and Freedoms. What is more, the government has a moral responsibility to protect and ensure the safety of communities and workers, no matter what their occupation. We believe that the measures introduced and the announcements made by the Minister of Justice are inadequate and will not achieve the expected results.",New Democratic Party,LaSalle--Émard,Hélène LeBlanc,http://www.parl.gc.ca/parlinfo/Files/Parliamentarian.aspx?Item=1288ae77-cf32-4b10-a560-1f75c4d4459b&Language=E&Section=ALL
4606611,ca.proc.d.2014-06-12.16277.305,2014-06-12,9d1e4c91-5600-4728-a706-d812d6695e8b,585,"Mr. Bob Dechert (Parliamentary Secretary to the Minister of Justice, CPC)",,Government Orders,Protection of Communities and Exploited Persons Act,,"Mr. Speaker, my colleague quoted some sex workers. I wonder if she has heard some of these quotes. 
Earlier today, Katarina MacLeod, who was beaten, abused, and raped repeatedly from the age of five, forced into the sex trade when she got a little older, and then worked for 15 years in that business, said that first of all there is no safe place to carry on the sex business, and second, had Bill C-36, the government's new prostitution legislation, been around when she was in the business, there would be no more demand and no more supply
Had that bill been in place, maybe she would be less scarred today.
One of her colleagues, Timea Nagy, a native of Budapest, Hungary, came to Canada 14 years ago as a housekeeper. However, when she arrived, she was kidnapped and forced to work in Toronto's sex industry until, one day, she escaped. She is now a founder of an organization that helps victims of trafficking. She said:
 I speak for the hundreds of children and girls I have met and talked to and rescued in the last 14 years who have been and continue to be raped, violated and exploited against their will. 
She challenged the idea that prostitution is a profession. She called it “oppression 90% of the time”.
She, too supports Bill C-36. She said women deserve to be protected by this country.
 Casandra Diamond, another former prostitute, who operated a brothel, said sex workers should feel safer because of this bill. She said:
 I wish Bill C-36 had been in place for me when I needed it. 
I wonder if the member would comment. ",Conservative,Mississauga--Erindale,Bob Dechert,http://www.parl.gc.ca/parlinfo/Files/Parliamentarian.aspx?Item=9d1e4c91-5600-4728-a706-d812d6695e8b&Language=E&Section=ALL
4606612,ca.proc.d.2014-06-12.16277.306,2014-06-12,1288ae77-cf32-4b10-a560-1f75c4d4459b,8551,Ms. Hélène LeBlanc,Interjection,Government Orders,Protection of Communities and Exploited Persons Act,,"Mr. Speaker, the Parliamentary Secretary to the Minister of Justice keeps using the same examples.
I would like to remind him that the Criminal Code already has provisions on human trafficking, exploitation and abuse. What he is talking about is not part of the bill. Rape and other such offences are already covered by the Criminal Code. Bill C-36 should be a response to the Bedford decision on the safety of sex workers. The Criminal Code of Canada already covers what the hon. member provided as an example. The Criminal Code has the answers for the cases he just mentioned. It is in the Criminal Code and not in Bill C-36. That is not the purpose of the bill. ",New Democratic Party,LaSalle--Émard,Hélène LeBlanc,http://www.parl.gc.ca/parlinfo/Files/Parliamentarian.aspx?Item=1288ae77-cf32-4b10-a560-1f75c4d4459b&Language=E&Section=ALL
4606613,ca.proc.d.2014-06-12.16277.307,2014-06-12,63525202-2bba-4063-8092-224f751f211d,1772,"Ms. Françoise Boivin (Gatineau, NDP)",,Government Orders,Protection of Communities and Exploited Persons Act,,"Mr. Speaker, I am going to pick up on what the parliamentary secretary was saying. I mentioned in my speech something that I have noticed many times when talking to people. There are those who strongly believe, with conviction, that the Swedish model is the way to go, while others believe that New Zealand's model, which is based on decriminalization, is the right choice. Neither of these models are perfect, even to those who defend them. Each group felt that their model was the best, but no one said that their model would get rid of prostitution completely.
However, I just heard the parliamentary secretary suggest that Bill C-36 would succeed in doing what no other country in this world, on our planet Earth, has done.
I would like the hon. member to say a few words about that and tell me whether she is as optimistic as the Conservatives about the 100% success rate we can expect from Bill C-36.",New Democratic Party,Gatineau,Françoise Boivin,http://www.parl.gc.ca/parlinfo/Files/Parliamentarian.aspx?Item=63525202-2bba-4063-8092-224f751f211d&Language=E&Section=ALL
4606614,ca.proc.d.2014-06-12.16277.308,2014-06-12,1288ae77-cf32-4b10-a560-1f75c4d4459b,8551,Ms. Hélène LeBlanc,Interjection,Government Orders,Protection of Communities and Exploited Persons Act,,"Mr. Speaker, I would like to take this opportunity to thank my colleague, who is our justice critic and who does an extraordinary job providing us with guidance on bills that we do not understand. It is true that the government often takes parts of the Criminal Code and rewrites them, even though things already exist.
 In fact, she is entirely right. The Conservatives carried out token consultations that they used as a basis for drafting a bill. They are always telling us about the same tragic and pathetic cases, even though they are already covered in the Criminal Code and could give rise to charges if there are complaints. 
 I think that the government is going to have to sit down, conduct real consultations and listen to a broader variety of points of view, so that it is able to put forward bills that comply with the Canadian Charter of Rights and Freedoms and will not be called into question by the Supreme Court.",New Democratic Party,LaSalle--Émard,Hélène LeBlanc,http://www.parl.gc.ca/parlinfo/Files/Parliamentarian.aspx?Item=1288ae77-cf32-4b10-a560-1f75c4d4459b&Language=E&Section=ALL
