basepk,hid,speechdate,pid,opid,speakeroldname,speakerposition,maintopic,subtopic,subsubtopic,speechtext,speakerparty,speakerriding,speakername,speakerurl
4606863,ca.proc.d.2014-06-13.16282.55,2014-06-13,0bb713a8-19fa-4695-8f26-64a5420953dc,8896,"Mr. Costas Menegakis (Parliamentary Secretary to the Minister of Citizenship and Immigration, CPC)",,Oral Questions,Citizenship and Immigration,,"Mr. Speaker, Canada is the fourth largest donor of humanitarian aid to Syria in the world. 
Canada continues to have one of the most generous immigration and refugee systems in the world. We welcome one out of every ten resettled refugees globally, more than any other industrialized country in the world.
Since the start of the Syrian conflict, Canada has provided protection to more than 1,100 Syrians. Members opposite should reflect on that record and be proud of what our government is doing.",Conservative,Richmond Hill,Costas Menegakis,http://www.parl.gc.ca/parlinfo/Files/Parliamentarian.aspx?Item=0bb713a8-19fa-4695-8f26-64a5420953dc&Language=E&Section=ALL
4606864,ca.proc.d.2014-06-13.16282.56,2014-06-13,4efcc2e2-bd91-4234-b907-a24838d4f1aa,1371,"Ms. Christine Moore (Abitibi—Témiscamingue, NDP)",,Oral Questions,Citizenship and Immigration,,"Mr. Speaker, yesterday, the Minister of Citizenship and Immigration was unable to give a clear answer, just like the day before, when he hung up on an interviewer.
The minister is unable to say how many Syrian refugees are in Canada right now, and when he does give answers, they are contradicted by the Syrian Canadian Council.
Can the minister tell us how many government-sponsored refugees are physically in Canada right now?",New Democratic Party,Abitibi--Témiscamingue,Christine Moore,http://www.parl.gc.ca/parlinfo/Files/Parliamentarian.aspx?Item=4efcc2e2-bd91-4234-b907-a24838d4f1aa&Language=E&Section=ALL
4606865,ca.proc.d.2014-06-13.16282.57,2014-06-13,0bb713a8-19fa-4695-8f26-64a5420953dc,8896,"Mr. Costas Menegakis (Parliamentary Secretary to the Minister of Citizenship and Immigration, CPC)",,Oral Questions,Citizenship and Immigration,,"Mr. Speaker, on May 28, the minister met with the United Nations High Commissioner for Refugees, Antonio Guterres, and highlighted how Canada was working to assist the world's most vulnerable populations. 
Since the start of the Syrian conflict, Canada has provided protection to more than 1,100 Syrians. Moreover, we are committed to resettling 1,300 Syrians by the end of 2014, and we are on track to do that. ",Conservative,Richmond Hill,Costas Menegakis,http://www.parl.gc.ca/parlinfo/Files/Parliamentarian.aspx?Item=0bb713a8-19fa-4695-8f26-64a5420953dc&Language=E&Section=ALL
4606866,ca.proc.d.2014-06-13.16282.58,2014-06-13,0253e859-f573-4a61-8c88-0466545df2fa,8547,"Ms. Ève Péclet (La Pointe-de-l'Île, NDP)",,Oral Questions,Privacy,,"Mr. Speaker, once again, the Conservatives have rejected almost all the opposition's amendments to Bill C-13 on cyberbullying.
This morning, the Supreme Court rebuffed the Conservatives again. The court unanimously ruled that a warrant is required in order to obtain a client's IP address from Internet providers. This casts serious doubt on the constitutionality of their Bill C-13. 
Why did the Conservatives not agree to the NDP's request to await the Supreme Court ruling before moving forward with the clause-by-clause study of their bill?",New Democratic Party,La Pointe-de-l'Île,Ève Péclet,http://www.parl.gc.ca/parlinfo/Files/Parliamentarian.aspx?Item=0253e859-f573-4a61-8c88-0466545df2fa&Language=E&Section=ALL
4606867,ca.proc.d.2014-06-13.16282.59,2014-06-13,9d1e4c91-5600-4728-a706-d812d6695e8b,585,"Mr. Bob Dechert (Parliamentary Secretary to the Minister of Justice, CPC)",,Oral Questions,Privacy,,"Mr. Speaker, we always respect the work of the court and appreciate its work. We have just received the decision and we will take the time to review it properly.
 However, we will continue to crack down on cyberbullies and online criminals who work against the best interests and safety of children and vulnerable people in Canada. ",Conservative,Mississauga--Erindale,Bob Dechert,http://www.parl.gc.ca/parlinfo/Files/Parliamentarian.aspx?Item=9d1e4c91-5600-4728-a706-d812d6695e8b&Language=E&Section=ALL
4606868,ca.proc.d.2014-06-13.16282.60,2014-06-13,0253e859-f573-4a61-8c88-0466545df2fa,8547,"Ms. Ève Péclet (La Pointe-de-l'Île, NDP)",,Oral Questions,Privacy,,"Mr. Speaker, this morning, the Supreme Court reminded the Conservatives that they cannot make up rules when it suits them.
The right to privacy and the protection of personal information are very important concerns for Canadians. The way in which the government rejects these concerns is unacceptable.
In light of this morning's ruling, will the government finally accept the NDP's request to split Bill C-13 in two, so that the provisions that constitute serious violations of privacy are taken out of the bill? This must be done so that victims of cyberbullying can quickly obtain justice.",New Democratic Party,La Pointe-de-l'Île,Ève Péclet,http://www.parl.gc.ca/parlinfo/Files/Parliamentarian.aspx?Item=0253e859-f573-4a61-8c88-0466545df2fa&Language=E&Section=ALL
4606869,ca.proc.d.2014-06-13.16282.61,2014-06-13,9d1e4c91-5600-4728-a706-d812d6695e8b,585,"Mr. Bob Dechert (Parliamentary Secretary to the Minister of Justice, CPC)",,Oral Questions,Privacy,,"Mr. Speaker, Bill C-13 has been extensively studied, as the member will know, both in committee and in the House of Commons. We have had 12 hours of debate in the House of Commons and 22 hours of study and extensive evidence from all witnesses and all experts on all sides of the issue. 
We respect the work of the court, but we will continue to crack down on cyberbullies and online criminals to protect children and all Canadians. ",Conservative,Mississauga--Erindale,Bob Dechert,http://www.parl.gc.ca/parlinfo/Files/Parliamentarian.aspx?Item=9d1e4c91-5600-4728-a706-d812d6695e8b&Language=E&Section=ALL
4606870,ca.proc.d.2014-06-13.16282.62,2014-06-13,50a18bf1-9be3-4563-b657-6af367453ba0,11,"Mr. Charlie Angus (Timmins—James Bay, NDP)",,Oral Questions,Privacy,,"Mr. Speaker, today's Supreme Court ruling is another setback to the government's reckless and unbalanced tough on crime agenda. Legal experts and the New Democrats told the government all along that allowing authorities to spy on Canadians without a warrant was not constitutional. Now the Supreme Court has released a ruling that shows the government's warrantless access legislation is just not going to cut it. 
Rather than picking another fight with the Supreme Court, will the government do the right thing, go back to the drawing board and respect the constitutional rights of Canadians to privacy?",New Democratic Party,Timmins--James Bay,Charlie Angus,http://www.parl.gc.ca/parlinfo/Files/Parliamentarian.aspx?Item=50a18bf1-9be3-4563-b657-6af367453ba0&Language=E&Section=ALL
4606871,ca.proc.d.2014-06-13.16282.63,2014-06-13,9d1e4c91-5600-4728-a706-d812d6695e8b,585,"Mr. Bob Dechert (Parliamentary Secretary to the Minister of Justice, CPC)",,Oral Questions,Privacy,,"Mr. Speaker, Canadians want us to protect children. They want us to protect all people who use the Internet and could be abused by cyberbullies who hide behind the anonymity of the Internet.
We will review the decision of the Supreme Court and determine the best course of action. In the meantime, we will continue to protect Canadians against online criminals. ",Conservative,Mississauga--Erindale,Bob Dechert,http://www.parl.gc.ca/parlinfo/Files/Parliamentarian.aspx?Item=9d1e4c91-5600-4728-a706-d812d6695e8b&Language=E&Section=ALL
4606872,ca.proc.d.2014-06-13.16282.64,2014-06-13,50a18bf1-9be3-4563-b657-6af367453ba0,11,"Mr. Charlie Angus (Timmins—James Bay, NDP)",,Oral Questions,Aboriginal Affairs,,"Mr. Speaker, I would like to believe it is there to protect children, but the government seems to have two kinds of victims. 
Let us talk about the government's treatment of the survivors of St. Anne's Residential School. It presented hearings with a false evidence narrative. It suppressed thousands of pages of police evidence relating to the abuse of these children. It was in an Ontario court this week, again, for obstructing a ruling where the judge said that it had denied these survivors access to justice. 
Why does the government use its enormous legal power to go after people whose only crime is that they were first nation children and subjected to horrific criminal abuse in a government institution?",New Democratic Party,Timmins--James Bay,Charlie Angus,http://www.parl.gc.ca/parlinfo/Files/Parliamentarian.aspx?Item=50a18bf1-9be3-4563-b657-6af367453ba0&Language=E&Section=ALL
4606873,ca.proc.d.2014-06-13.16282.65,2014-06-13,5d65749e-0cdb-4c03-88d4-f57a905acc33,8436,"Hon. Bernard Valcourt (Minister of Aboriginal Affairs and Northern Development, CPC)",,Oral Questions,Aboriginal Affairs,,"Mr. Speaker, the fact is that our government will continue to receive and disclose the documents through the process that was agreed to by all parties. 
The hon. member refers to a matter that is presently before the court. Out of respect for our court system, I will not make further comment. ",Conservative,Madawaska--Restigouche,Bernard Valcourt,http://www.parl.gc.ca/parlinfo/Files/Parliamentarian.aspx?Item=5d65749e-0cdb-4c03-88d4-f57a905acc33&Language=E&Section=ALL
4606874,ca.proc.d.2014-06-13.16282.66,2014-06-13,2e8ec565-8749-41c1-ac4c-98f9d939cf16,733,"Mr. Mike Sullivan (York South—Weston, NDP)",,Oral Questions,Social Development,,"Mr. Speaker, Conservatives are turning their backs on disabled Canadians across the country and gutting services that people rely on. Thousands of Canadians who have been denied disability benefits are still waiting for a hearing. As of last April, there were 1,000 fewer referees who were hearing appeals. The tribunal now has a backlog of 10,000 cases, and only managed to hear 348 appeals last year.
It is a great example of the Conservatives breaking something that did not need fixing. Why did the Conservatives create a tribunal that was designed to fail?",New Democratic Party,York South--Weston,Mike Sullivan,http://www.parl.gc.ca/parlinfo/Files/Parliamentarian.aspx?Item=2e8ec565-8749-41c1-ac4c-98f9d939cf16&Language=E&Section=ALL
4606875,ca.proc.d.2014-06-13.16282.67,2014-06-13,d34b2845-a4e3-457b-b0eb-e95ac232d51d,8337,"Mr. Scott Armstrong (Parliamentary Secretary to the Minister of Employment and Social Development, CPC)",,Oral Questions,Social Development,,"Mr. Speaker, I am not sure. We fixed a problem because we wanted to make sure that there was consistency among decisions from coast to coast to coast. Now, with the new Social Security Tribunal, we do have a case of backlogs that were left from the previous legacy tribunals. These are being cleared. As of April 1, 2014, these cases are now being heard. We are going to clear up the backlog.",Conservative,Cumberland--Colchester--Musquodoboit Valley,Scott Armstrong,http://www.parl.gc.ca/parlinfo/Files/Parliamentarian.aspx?Item=d34b2845-a4e3-457b-b0eb-e95ac232d51d&Language=E&Section=ALL
4606876,ca.proc.d.2014-06-13.16282.68,2014-06-13,aa391262-e2bb-43aa-a00e-454730c269ef,8603,"Ms. Isabelle Morin (Notre-Dame-de-Grâce—Lachine, NDP)",,Oral Questions,Social Development,,"Mr. Speaker, actually, the problem has not been fixed.
The Conservatives have no problem sticking their hands in our pockets, but things get complicated when it is time to pay people the benefits they are due. 
Consider how hard it is to collect the guaranteed income supplement or the disability tax credit. The poorest are always the first to suffer at the hands of the Conservative government.
What will the government do to fix the problem at the Social Security Tribunal and to ensure that those who contributed to the pension plan receive the disability benefits they are entitled to?",New Democratic Party,Notre-Dame-de-Grâce--Lachine,Isabelle Morin,http://www.parl.gc.ca/parlinfo/Files/Parliamentarian.aspx?Item=aa391262-e2bb-43aa-a00e-454730c269ef&Language=E&Section=ALL
4606877,ca.proc.d.2014-06-13.16282.69,2014-06-13,d34b2845-a4e3-457b-b0eb-e95ac232d51d,8337,"Mr. Scott Armstrong (Parliamentary Secretary to the Minister of Employment and Social Development, CPC)",,Oral Questions,Social Development,,"Mr. Speaker, the SST and the government are committed to providing fair, credible, and impartial appeal processes in a timely manner to those people who apply. The SST is an independent administrative tribunal. It operates at arm's length from the department. 
The department and the SST are now putting these legacy cases at the top of the priority list. We are going to clear up that backlog.",Conservative,Cumberland--Colchester--Musquodoboit Valley,Scott Armstrong,http://www.parl.gc.ca/parlinfo/Files/Parliamentarian.aspx?Item=d34b2845-a4e3-457b-b0eb-e95ac232d51d&Language=E&Section=ALL
4606878,ca.proc.d.2014-06-13.16282.70,2014-06-13,c5378648-5d94-4645-bc05-339090e1077b,577,"Ms. Kirsty Duncan (Etobicoke North, Lib.)",,Oral Questions,Natural Resources,,"Mr. Speaker, the government claims that the northern gateway will only be approved if it is “safe for Canadians and safe for the environment”. When the joint review panel examined the northern gateway project, it clearly said “the project would cause adverse environmental effects, after mitigation, on a number of valued ecosystems...”.
My question is very simple. Does the minister agree with the finding of the JRP, and, if so, will he commit to rejecting the northern gateway?",Liberal,Etobicoke North,Kirsty Duncan,http://www.parl.gc.ca/parlinfo/Files/Parliamentarian.aspx?Item=c5378648-5d94-4645-bc05-339090e1077b&Language=E&Section=ALL
4606879,ca.proc.d.2014-06-13.16282.71,2014-06-13,78cd5419-2f3c-4798-9c5b-0e55843ef9fb,604,"Mrs. Kelly Block (Parliamentary Secretary to the Minister of Natural Resources, CPC)",,Oral Questions,Natural Resources,,"Mr. Speaker, our government relies on independent regulatory review boards to make recommendations based on science. We are proud of the work that they do in ensuring that projects are safe for Canadians and safe for the environment. As we have said, we are reviewing their report, and we will make a decision in the days ahead.",Conservative,Saskatoon--Rosetown--Biggar,Kelly Block,http://www.parl.gc.ca/parlinfo/Files/Parliamentarian.aspx?Item=78cd5419-2f3c-4798-9c5b-0e55843ef9fb&Language=E&Section=ALL
4606880,ca.proc.d.2014-06-13.16282.72,2014-06-13,c5378648-5d94-4645-bc05-339090e1077b,577,"Ms. Kirsty Duncan (Etobicoke North, Lib.)",,Oral Questions,Natural Resources,,"Mr. Speaker, the review also said clearly that if there was an oil spill off of the B.C. coast, “there would be significant adverse effects on lands, waters, or resources used by residents, communities, and Aboriginal groups”.
It went on to say that local populations and species could be permanently affected by a spill. I ask the minister again, does he agree with the finding of the JRP? If so, will he commit to rejecting the northern gateway?",Liberal,Etobicoke North,Kirsty Duncan,http://www.parl.gc.ca/parlinfo/Files/Parliamentarian.aspx?Item=c5378648-5d94-4645-bc05-339090e1077b&Language=E&Section=ALL
4606881,ca.proc.d.2014-06-13.16282.73,2014-06-13,78cd5419-2f3c-4798-9c5b-0e55843ef9fb,604,"Mrs. Kelly Block (Parliamentary Secretary to the Minister of Natural Resources, CPC)",,Oral Questions,Natural Resources,,"Mr. Speaker, as we have said, the joint review panel has submitted its report on the proposed project to the government. We are carefully reviewing this report, and a decision will be forthcoming.",Conservative,Saskatoon--Rosetown--Biggar,Kelly Block,http://www.parl.gc.ca/parlinfo/Files/Parliamentarian.aspx?Item=78cd5419-2f3c-4798-9c5b-0e55843ef9fb&Language=E&Section=ALL
4606882,ca.proc.d.2014-06-13.16282.74,2014-06-13,6bf8e46d-35db-462e-a769-ead3dc2d7f84,578,"Mr. Frank Valeriote (Guelph, Lib.)",,Oral Questions,Citizenship and Immigration,,"Mr. Speaker, the Minister of Citizenship and Immigration continues to stand by his degrading comments about the loyalty of immigrants who arrived in Canada after 1977. By smearing generations of newcomers and talking about cheapened Canadian citizenship, he is creating different classes of Canadians. Many of the people that he is deliberately insulting are doctors, architects, shop owners, and legislators, among so many hard-working and contributing members of Canadian society.
Will he stand and apologize for his despicable comments, or do he and the Conservatives stand by his slur?",Liberal,Guelph,Frank Valeriote,http://www.parl.gc.ca/parlinfo/Files/Parliamentarian.aspx?Item=6bf8e46d-35db-462e-a769-ead3dc2d7f84&Language=E&Section=ALL
4606883,ca.proc.d.2014-06-13.16282.75,2014-06-13,0bb713a8-19fa-4695-8f26-64a5420953dc,8896,"Mr. Costas Menegakis (Parliamentary Secretary to the Minister of Citizenship and Immigration, CPC)",,Oral Questions,Citizenship and Immigration,,"Mr. Speaker, Canadians take pride in their Canadian citizenship. We are taking action by reforming the Canadian Citizenship Act. They are the first comprehensive changes to the act since 1977. The minister said nothing of the sort that the member is alluding to. 
When my parents came here in the mid-fifties, there was a five-year requirement. People had to be in Canada for five years before they could apply for their Canadian citizenship. In 1977, the Trudeau-led Liberals reduced that to three years. I would argue that is what cheapened it.",Conservative,Richmond Hill,Costas Menegakis,http://www.parl.gc.ca/parlinfo/Files/Parliamentarian.aspx?Item=0bb713a8-19fa-4695-8f26-64a5420953dc&Language=E&Section=ALL
4606884,ca.proc.d.2014-06-13.16282.76,2014-06-13,013eb624-68a5-402e-ac65-6ff6062ad8b9,8642,"Ms. Laurin Liu (Rivière-des-Mille-Îles, NDP)",,Oral Questions,Public Works and Government Services,," Mr. Speaker, it came as no surprise yesterday, when we learned from the panel on the replacement of Canada's fighter fleet, that the decision would be a political one.
However, we also know that the acquisition will be based on a document that is out of date and almost entirely unfunded, the Canada first defence strategy.
Would the government tell us why it is not using this stale strategy for the rest of the Department of National Defence's planning, but it thinks it is fine for the F-35s?",New Democratic Party,Rivière-des-Mille-Îles,Laurin Liu,http://www.parl.gc.ca/parlinfo/Files/Parliamentarian.aspx?Item=013eb624-68a5-402e-ac65-6ff6062ad8b9&Language=E&Section=ALL
4606885,ca.proc.d.2014-06-13.16282.77,2014-06-13,5a970b67-b862-4ca8-aa9f-4a97632f3a33,8753,"Mr. Bernard Trottier (Parliamentary Secretary to the Minister of Public Works and Government Services, CPC)",,Oral Questions,Public Works and Government Services,," Mr. Speaker, as I mentioned earlier, the government has received a report from the independent panel of experts, including several other reports that it is reviewing right now. It is looking at the different options in terms of defence capabilities, benefits to Canadian industry, and finally life-cycle costs. These are all important factors.
What is really important, though, is that the men and women in uniform have the equipment that they need to defend Canada and to participate in missions with our allies.",Conservative,Etobicoke--Lakeshore,Bernard Trottier,http://www.parl.gc.ca/parlinfo/Files/Parliamentarian.aspx?Item=5a970b67-b862-4ca8-aa9f-4a97632f3a33&Language=E&Section=ALL
4606886,ca.proc.d.2014-06-13.16282.78,2014-06-13,013eb624-68a5-402e-ac65-6ff6062ad8b9,8642,"Ms. Laurin Liu (Rivière-des-Mille-Îles, NDP)",,Oral Questions,Public Works and Government Services,,"Mr. Speaker, days come and go, and still the Conservatives refuse to answer our questions. We still have no guarantee about the industrial benefits of buying the F-35s.
The report from the independent review panel has yet to be made public. Government members have it in their hands. If it contained good news, they would not hesitate to talk about it at every opportunity.
What is in the report? When will it be made public?",New Democratic Party,Rivière-des-Mille-Îles,Laurin Liu,http://www.parl.gc.ca/parlinfo/Files/Parliamentarian.aspx?Item=013eb624-68a5-402e-ac65-6ff6062ad8b9&Language=E&Section=ALL
4606887,ca.proc.d.2014-06-13.16282.79,2014-06-13,5a970b67-b862-4ca8-aa9f-4a97632f3a33,8753,"Mr. Bernard Trottier (Parliamentary Secretary to the Minister of Public Works and Government Services, CPC)",,Oral Questions,Public Works and Government Services,,"Mr. Speaker, as I just said, the government has received a report from the independent panel of experts. There are several other reports. Many of them are available on the National Fighter Procurement Secretariat's website. I invite the member to take a look. 
Meanwhile, the decision will be based on the benefits to Canadian industry, as she said. We will also look at life cycle costs.
What is really important, though, is knowing what the Canadian Forces need to protect Canada and participate in missions with our allies.",Conservative,Etobicoke--Lakeshore,Bernard Trottier,http://www.parl.gc.ca/parlinfo/Files/Parliamentarian.aspx?Item=5a970b67-b862-4ca8-aa9f-4a97632f3a33&Language=E&Section=ALL
4606888,ca.proc.d.2014-06-13.16282.80,2014-06-13,c3000ffc-065c-47e0-be26-152a24090dbd,8618,"Mr. Mathieu Ravignat (Pontiac, NDP)",,Oral Questions,Public Works and Government Services,,"Mr. Speaker, yesterday's report on the fighter jet replacements was clear: the decision, regardless of what it is, will be made by the ministers alone. Public officials did the work and now the final decision is in the hands of the Conservatives. This will be a political decision, period.
However, the only way to get the best jet at the best price and to guarantee industrial benefits is to proceed with an open and transparent bidding process. 
Why are the Conservatives going to make a political decision instead of letting competition do its job?",New Democratic Party,Pontiac,Mathieu Ravignat,http://www.parl.gc.ca/parlinfo/Files/Parliamentarian.aspx?Item=c3000ffc-065c-47e0-be26-152a24090dbd&Language=E&Section=ALL
4606889,ca.proc.d.2014-06-13.16282.81,2014-06-13,5a970b67-b862-4ca8-aa9f-4a97632f3a33,8753,"Mr. Bernard Trottier (Parliamentary Secretary to the Minister of Public Works and Government Services, CPC)",,Oral Questions,Public Works and Government Services,,"Mr. Speaker, the member is completely wrong. The decision will be based on the needs of our military, but what is even more important is that it will be made on the basis of what equipment the Canadian Forces need to protect Canada. That is what matters most at the end of the day. This includes participation in foreign missions.
This decision will be made. We do not need any lectures from the member's party.",Conservative,Etobicoke--Lakeshore,Bernard Trottier,http://www.parl.gc.ca/parlinfo/Files/Parliamentarian.aspx?Item=5a970b67-b862-4ca8-aa9f-4a97632f3a33&Language=E&Section=ALL
4606890,ca.proc.d.2014-06-13.16282.82,2014-06-13,c3000ffc-065c-47e0-be26-152a24090dbd,8618,"Mr. Mathieu Ravignat (Pontiac, NDP)",,Oral Questions,Labour,,"Mr. Speaker, we will see.
Cascade Aerospace, in B.C., does maintenance work for our military transport on search and rescue planes, but now Cascade is asking for huge concessions from its workers. Even worse, it is bringing scabs into a labour dispute.
 Would the government sit down with Cascade Aerospace and ask it to take its demand for a two-tier contract off the table? 
Does the minister not agree that the maintenance and upkeep of our Hercules aircraft, and other search and rescue aircraft, is too important to be put on the line by these bullying tactics?",New Democratic Party,Pontiac,Mathieu Ravignat,http://www.parl.gc.ca/parlinfo/Files/Parliamentarian.aspx?Item=c3000ffc-065c-47e0-be26-152a24090dbd&Language=E&Section=ALL
4606891,ca.proc.d.2014-06-13.16282.83,2014-06-13,9c9a64e6-58f1-4367-9f49-93ad31744c96,612,"Mrs. Cathy McLeod (Parliamentary Secretary to the Minister of Labour and for Western Economic Diversification, CPC)",,Oral Questions,Labour,,"Mr. Speaker, our government is committed to safe and fair labour practices. Of course, if anyone has any concerns in terms of practice, they do have the ability to make reference to the Industrial Relations Board. We have no intention of making any changes to our regulations at this time.",Conservative,Kamloops--Thompson--Cariboo,Cathy McLeod,http://www.parl.gc.ca/parlinfo/Files/Parliamentarian.aspx?Item=9c9a64e6-58f1-4367-9f49-93ad31744c96&Language=E&Section=ALL
4606892,ca.proc.d.2014-06-13.16282.84,2014-06-13,688c6645-b71f-4182-a105-c85eb869e1f7,9183,"Mr. Bob Zimmer (Prince George—Peace River, CPC)",,Oral Questions,International Trade,,"Mr. Speaker, our government continues to advance the most ambitious pro-trade plan in Canadian history. In March, the Prime Minister and the president of South Korea announced the conclusion of the Canada-Korea free trade agreement. The agreement is a landmark achievement. It is Canada's first free trade agreement in the Asia-Pacific, which is one of the fastest-growing and most dynamic regions in the world.
Would the hard-working Minister of International Trade advise this House on the next step in implementing this important free trade agreement, which would help create jobs and opportunities?",Conservative,Prince George--Peace River,Bob Zimmer,http://www.parl.gc.ca/parlinfo/Files/Parliamentarian.aspx?Item=688c6645-b71f-4182-a105-c85eb869e1f7&Language=E&Section=ALL
