basepk,hid,speechdate,pid,opid,speakeroldname,speakerposition,maintopic,subtopic,subsubtopic,speechtext,speakerparty,speakerriding,speakername,speakerurl
4606450,ca.proc.d.2014-06-12.16277.144,2014-06-12,9afd15e3-d6df-4779-ba0f-5a305ebb77b5,268,Mrs. Joy Smith,Interjection,Government Orders,Protection of Communities and Exploited Persons Act,Second Reading,"Mr. Speaker, I thank my colleague, the public safety minister, for this very important question, and I commend all of his great work on this file.
I have met with many trafficked victims. Trafficked victims are vulnerable, beautiful, young women and, these last five years, more and more young boys. The bill would provide them the freedom to be able to leave prostitution or the claws of human traffickers and start new lives. This bill would also make the buying of sex illegal, so the traffickers would not be the big bullies anymore. They would be marginalized. 
Canada has made a tremendous statement. It has said that this country will not allow youth—because the youth enter prostitution, on the average, between 14 and 16 years of age—and others to be bought and sold. There is no typical person. It is the predator who looks at the opportunity to draw them in.",Conservative,Kildonan--St. Paul,Joy Smith,http://www.parl.gc.ca/parlinfo/Files/Parliamentarian.aspx?Item=9afd15e3-d6df-4779-ba0f-5a305ebb77b5&Language=E&Section=ALL
4606451,ca.proc.d.2014-06-12.16277.145,2014-06-12,cfbb2e3f-a8fa-43c0-ad2a-1d2e4c7b865d,442,"Mrs. Maria Mourani (Ahuntsic, Ind.)",,Government Orders,Protection of Communities and Exploited Persons Act,Second Reading,"Mr. Speaker, I would like to thank my colleague for her speech and all the work she has been able to do. 
I think it would be important to add a few things. I listened to my opposition colleagues, and after analyzing the Bedford decision and the bill from start to finish, I think that it would hold up constitutionally. I will explain why.
The Bedford decision states that in the current legal context, we cannot criminalize the practice of prostitution. The decision also tells legislators to decide on the legal context that will be put in place to deal with prostitution. The government decided to declare prostitution illegal.
In doing so, the government has established its right to criminalize certain players as pimps and johns. In addition, the government gave immunity to prostitutes. In my opinion, this approach is the fairest for Canada. It presents a Canadian model and, on that point, I hand it to them.
However, I disagree with criminalizing prostitutes in a public place. When immunity is adopted, it must be provided across the board, be it in massage parlours or in public places.
I would encourage the government to reconsider its position because criminalizing johns acting in public view is enough. Criminalizing pimps acting in public view is enough.
There is no need to criminalize prostitutes working in public places. This is how we can give these women, the most vulnerable people on the streets, the opportunity to report the people who assault them.
I would like to propose a friendly amendment. ",Independent,Ahuntsic,Maria Mourani,http://www.parl.gc.ca/parlinfo/Files/Parliamentarian.aspx?Item=cfbb2e3f-a8fa-43c0-ad2a-1d2e4c7b865d&Language=E&Section=ALL
4606452,ca.proc.d.2014-06-12.16277.146,2014-06-12,9afd15e3-d6df-4779-ba0f-5a305ebb77b5,268,Mrs. Joy Smith,Interjection,Government Orders,Protection of Communities and Exploited Persons Act,Second Reading,"Mr. Speaker, I thank my colleague across the way for her support of the bill and her very good comments.
This bill has a really good balance. I was a school teacher for 23 years, and people had to report to the office when they came in. There were pedophiles outside the fence who would lure the older girls. With this bill, we would be protecting the children too. It is not so much the prostitutes; it is the johns. The johns not only solicit the prostitutes or the trafficked women, but if they see attractive girls, they will go after them as well. It the bill has a nice balance. There is no arresting of the prostitutes, but that is something we need to bring to committee and hammer out at committee, where those concerns can come forward.",Conservative,Kildonan--St. Paul,Joy Smith,http://www.parl.gc.ca/parlinfo/Files/Parliamentarian.aspx?Item=9afd15e3-d6df-4779-ba0f-5a305ebb77b5&Language=E&Section=ALL
4606453,ca.proc.d.2014-06-12.16277.147,2014-06-12,63525202-2bba-4063-8092-224f751f211d,1772,"Ms. Françoise Boivin (Gatineau, NDP)",,Government Orders,Protection of Communities and Exploited Persons Act,Second Reading,"Mr. Speaker, this is not exactly a clear-cut debate. The member for Ahuntsic was saying that the government had decreed that prostitution was illegal, but that it was not saying that prostitution is now illegal in Canada. Selling is okay, but buying is not, and under some circumstances, selling is not okay.
With Bill C-36, the government tried to take considerable liberties, but it did not have the courage or the deep conviction to do what the member for Kildonan—St. Paul would like to see. The member took great pains to talk about all aspects related to pimps and vulnerable people, but she did not give very good answers to questions about the major problem with Bill C-36: clause 15. This clause criminalizes the very women, the very victims that the Conservatives go on and on about wanting to protect. 
Positions aside, we all take our role seriously. I take my role as the official opposition's justice critic seriously, especially when I have to go before the NDP caucus, where it is not always easy to make recommendations. 
The member for Kildonan—St. Paul is quite right in saying that we all have concerns about prostitution and human trafficking. However, it is not always easy to enforce laws that comply with the Constitution and our charter, since this government is extremely secretive.
Instead of sharing its information with us, the government introduced Bill C-36 at first reading, which was a response to a Supreme Court ruling. We are not asking for 15 legal opinions. We only want one opinion of the Supreme Court assuring us that the clauses of Bill C-36 are in compliance. This would make us fell more confident that we had a solid foundation. We are often forced to rely on our own resources, which are not government resources, to try to fulfill our common obligation as members of the House. 
We sometimes have to enforce laws and set aside our own personal convictions. The other day, a news report made it clear just how passionate the member for Kildonan—St. Paul is about this issue. I understood her personal and religious convictions, and I respect that. However, in my role as justice critic, I need to examine laws and sometimes set my personal convictions aside. That is part of my role as representative for the people of Gatineau.
The government is so secretive that it is more than happy to use this expeditious process on an issue as important as prostitution, the world's oldest profession. Good luck to anyone who thinks they can get rid of it. We are all working to ensure that one day no one will feel the need to turn to prostitution. We hope that one day people will choose this line of work solely because of their own personal choices or beliefs. We are doing everything we can do achieve that, but no method in the world is perfect.
The government did a quick online consultation but no one has no idea how scientifically valid it is. It did not deny the fact that pretty much anyone was able to say whatever they wanted, whenever they wanted. We do not know where the responses came from; we do not have all of the details.
However, the government is not making that scientific poll public, and it will not release it unless it is forced to do so. I believe that it will not share the information before the end of July, based on how the minister has responded to questions in the House. 
We will likely be examining Bill C-36 by then, given that it is subject to a time allocation motion. We will vote on it tomorrow, if not today. The committee will meet in early July, so that leads me to believe that we will have the opportunity to study the bill, but without that information. I find that unfortunate.
As I said, we rely on our resources. This bill is important to me; I want to do the right thing.
When I make a recommendation to my colleagues, I want it to be based not on my convictions and my own impressions, but on a careful analysis of the Bedford decision and on consultations. Like many here in the House, I consulted a lot of people. Many people wanted to talk to me about every aspect of this issue.
I heard from those who are advocating decriminalization and others who want prostitution to be legalized. Groups came to talk to me about the Nordic model. I heard from sex workers. Some of them like the idea of the Nordic model, others do not. I met with nearly every individual and every group that will come in July to tell us what they think about the issue.
I always shared my concerns with everyone I spoke to, and I think that we came to a consensus about the issue of safety.
As for the issue of safety, I believe it is very important to repeat the points made by the Supreme Court of Canada. The government and various Conservative members who spoke before me took a bit of liberty when quoting the Supreme Court. They attributed to the Supreme Court some things that it did not necessarily say, or they omitted, probably because it is to their advantage, certain aspects or certain words in some phrases, which are worth their weight in gold. 
When we go out into our constituencies and people talk to us about prostitution, they all refer to the Bedford ruling. What is the Bedford ruling? I think it is important to review the main principles established in the Bedford ruling to determine whether Bill C-36 is in keeping with the ruling and whether it will pass the test included in that ruling. I am reading from the ruling:
 ...current or former prostitutes, brought an application seeking declarations that three provisions of the Criminal Code, R.S.C. 1985, c. C-46, which criminalize various activities related to prostitution, infringe their rights under s. 7 of the Charter... 
Despite Bill C-36, section 7 of the charter still exists.
What are the three provisions?
 ...s. 210 makes it an offence to keep or be in a bawdy-house; s. 212(1)(j) prohibits living on the avails of prostitution; and, s. 213(1)(c) prohibits communicating in public for the purposes of prostitution. They argued that these restrictions on prostitution put the safety and lives of prostitutes at risk, by preventing them from implementing certain safety measures—such as hiring security guards or “screening” potential clients—that could protect them from violence. B, L and S also alleged that s. 213(1)(c) infringes the freedom of expression guarantee under s. 2(b) of the Charter, and that none of the provisions are saved under s. 1. 
Everyone knows that the charter can be violated. If it is all right in a free and democratic society, it passes the test of section 1. Those were the arguments made by the three plaintiffs in the case.
I will spare you everything that was said in the Supreme Court, but suffice it to say that the three plaintiffs won on every count. Sections 210, 212(1)(j) and 213(1)(c) of the Criminal Code were declared incompatible with the charter. The declaration of invalidity was suspended for one year, giving the government time—",New Democratic Party,Gatineau,Françoise Boivin,http://www.parl.gc.ca/parlinfo/Files/Parliamentarian.aspx?Item=63525202-2bba-4063-8092-224f751f211d&Language=E&Section=ALL
4606454,ca.proc.d.2014-06-12.16277.148,2014-06-12,de0591ef-9a02-4f97-9541-63de484c96e3,87,The Acting Speaker (Mr. Barry Devolin),,Government Orders,Protection of Communities and Exploited Persons Act,Second Reading,"I am sorry, but the time provided for the consideration of government orders has expired. As a result, the hon. member for Gatineau will have 10 minutes remaining after question period.",Conservative,Haliburton--Kawartha Lakes--Brock,Barry Devolin,http://www.parl.gc.ca/parlinfo/Files/Parliamentarian.aspx?Item=de0591ef-9a02-4f97-9541-63de484c96e3&Language=E&Section=ALL
4606455,ca.proc.d.2014-06-12.16277.149,2014-06-12,137d51b0-f7d5-4ad7-9bc0-529314cc2d99,8538,"Mr. Claude Patry (Jonquière—Alma, BQ)",,Statements By Members,City of Arvida,,"Mr. Speaker, I have recently had the honour of being appointed, with 17 other public figures in my region, to the Club des ambassadeurs d'Arvida, the historic capital of aluminum. The objective of the Club des ambassadeurs is to have UNESCO recognize and protect Arvida.
This small labour city, which stands out for its urban planning and industrial infrastructure, is unique in the world. Its first 270 houses were built in 135 days. In 2012, Arvida was recognized as a national historic site of Canada.
Like all my constituents, I wish to help showcase the Saguenay-Lac-Saint-Jean region on the international stage. A good way to do this would be to ensure the sustainability of Arvida, a place steeped in our collective history that exhibits the beauty and style of the so-called French-Canadian houses.
To conclude, I invite all my colleagues in the House to come and admire this industrial city that was built on our natural resources and the courage of the workers in my region.",Bloc Québécois,Jonquière--Alma,Claude Patry,http://www.parl.gc.ca/parlinfo/Files/Parliamentarian.aspx?Item=137d51b0-f7d5-4ad7-9bc0-529314cc2d99&Language=E&Section=ALL
4606456,ca.proc.d.2014-06-12.16277.150,2014-06-12,427b77c3-bbe5-4c5e-ad6a-2a31f7d79c77,1241,"Ms. Wai Young (Vancouver South, CPC)",,Statements By Members,International Trade,,"Mr. Speaker, I am honoured to represent my great riding of Vancouver South, gateway to the Asia-Pacific, where growing economies provide a rich opportunity for Canada to play an ever more important role as we expand our trade and people-to-people ties between our diverse communities with those diverse nations.
In addition to serving my constituents as their member of Parliament, I am also the co-chair of the Canada-China Legislative Association. In this role, I was pleased to welcome a senior delegation to Vancouver and Ottawa this week, which travelled here to explore how Canada's first-rate AAA finance sector weathered the global downturn of 2008 and how our two countries could work together to open China's financial sector to become more international and market-based and to learn about Canada's many leading-edge green technologies that have been supported by some $18 billion of investment by our government, which can help China reduce its greenhouse gas emissions and mitigate its environmental challenges.
I am pleased to report that these meetings between China and Canada have been very productive.",Conservative,Vancouver South,Wai Young,http://www.parl.gc.ca/parlinfo/Files/Parliamentarian.aspx?Item=427b77c3-bbe5-4c5e-ad6a-2a31f7d79c77&Language=E&Section=ALL
4606457,ca.proc.d.2014-06-12.16277.151,2014-06-12,f40d602c-1ae6-414e-bac3-23a2f31f1cdf,608,"Ms. Linda Duncan (Edmonton—Strathcona, NDP)",,Statements By Members,The Environment,,"Mr. Speaker, contrary to false claims by the government, it has dragged its heels on action to deliver on our nation's commitments to reduce greenhouse gases.
Regulations for the coal-fired power sector still allow Canadian plants to emit carbon for many coming decades. Clear evidence that these regulations are weak is that the minute they were issued, Alberta's coal-fired generators withdrew from the carbon capture pilot project. The government has failed to trigger investment in available cleaner technologies.
While the government mocks U.S. action on its largest carbon source, thermal electric plants, it abjectly refuses to regulate Canada's fastest-growing source, the oil sands.
The International Energy Agency says that trillions are needed to address the dual global energy and climate crises, and has called for substantial investment in green energy and efficiency. The Prime Minister refuses to hear this message. Instead, it is the same tired refrain that only oil delivers jobs.
Wake up, Canada. We could be part of the fastest-growing global economic sector: green energy.",New Democratic Party,Edmonton Strathcona,Linda Duncan,http://www.parl.gc.ca/parlinfo/Files/Parliamentarian.aspx?Item=f40d602c-1ae6-414e-bac3-23a2f31f1cdf&Language=E&Section=ALL
4606458,ca.proc.d.2014-06-12.16277.152,2014-06-12,7835967c-e9d9-4669-9725-395f6624bc26,8959,"Mr. Mark Adler (York Centre, CPC)",,Statements By Members,The Philippines,,"Mr. Speaker, today I am pleased to welcome a delegation of Filipinos from across Ontario to Parliament Hill to celebrate the 116th anniversary of the Philippines' independence. The visit was marked by the flag of the Philippines being raised on Parliament Hill as songs were sung and children danced.
We are so fortunate in Canada to have so many Canadians of Filipino descent. In fact, my riding of York Centre has one of the largest Filipino communities in Canada. It is a community of great warmth, strong family values, and hard work. We welcome them all to our Canadian family.
This was demonstrated no better than when Typhoon Yolanda struck the Philippines, devastating the country with substantial loss of life. Families were uprooted from their homes. Canadians and our government immediately rallied behind our Canadian Filipino family, with financial assistance to the tune of $170 million. It is a testament to the Filipino community that so many Canadians of all ethnic backgrounds donated to help their Filipino friends and neighbours.
On behalf of the residents of York Centre, Araw ng Kasarainlan.",Conservative,York Centre,Mark Adler,http://www.parl.gc.ca/parlinfo/Files/Parliamentarian.aspx?Item=7835967c-e9d9-4669-9725-395f6624bc26&Language=E&Section=ALL
4606459,ca.proc.d.2014-06-12.16277.153,2014-06-12,4abeb9b5-279b-4117-9e04-b8901d9ccc53,255,"Mr. Francis Scarpaleggia (Lac-Saint-Louis, Lib.)",,Statements By Members,Pointe-Claire Canoe Club,,"Mr. Speaker, this past weekend I had the pleasure of attending the 25th anniversary celebrations of the Pointe-Claire Canoe Club.
The club was founded by Jean Fournel, along with Bill Cordner, Gaetan Desmarais, Maurice Lamoureux, and Tom Dienstmann. Jean himself competed as a kayaker at the 1976 Montreal summer games.
Before his premature death in 1997, Jean trained many young athletes, including his daughter, Émilie, who competed as a kayaker in the 2008 and 2012 Olympic Games, and his son, Hugues, who also competed as a kayaker in the London games.
Kayaking is a family passion. Jean's wife, Guylaine St-Georges, was also a member of the Canadian national kayak team and participated in the Pan American Games. 
The Pointe-Claire Canoe Club is home to Canadian sprint canoer Thomas Hall, who won bronze in Beijing in 2008, and to champion paracanoer Christine Gauthier.
I ask all members of the House to join me in congratulating the Pointe-Claire Canoe Club on this milestone anniversary.",Liberal,Lac-Saint-Louis,Francis Scarpaleggia,http://www.parl.gc.ca/parlinfo/Files/Parliamentarian.aspx?Item=4abeb9b5-279b-4117-9e04-b8901d9ccc53&Language=E&Section=ALL
4606460,ca.proc.d.2014-06-12.16277.154,2014-06-12,b37cad30-26f6-40c6-8e4c-dd3a0ba841bb,113,"Mrs. Cheryl Gallant (Renfrew—Nipissing—Pembroke, CPC)",,Statements By Members,Krista Johnston Memorial Run for Change,,"Mr. Speaker, the Krista Johnston Memorial Run for Change is set to hit downtown Pembroke this Saturday. The run was started four years ago by Pembroke's Krista Johnston, with the goal of raising $1,000 to support The Grind, the Salvation Army youth centre. The run ended up raising over $5,000. Krista hoped the run would also have the effect of inspiring young people to embrace a healthier, more positive future. 
Tragically, Krista died on October 18, 2012, here in Ottawa, when she was struck by a car while cycling near Carleton University. The run was renamed the Krista Johnston Memorial Run for Change in her memory, and the 2013 run saw over 800 participants and raised over $15,000 for Pembroke area charities and youth fitness initiatives.
I ask all members of the House to join me in wishing all participants a great run this weekend.",Conservative,Renfrew--Nipissing--Pembroke,Cheryl Gallant,http://www.parl.gc.ca/parlinfo/Files/Parliamentarian.aspx?Item=b37cad30-26f6-40c6-8e4c-dd3a0ba841bb&Language=E&Section=ALL
4606461,ca.proc.d.2014-06-12.16277.155,2014-06-12,86dd8955-957c-4ff9-9a81-76305a0f26ac,421,"Mr. Paul Dewar (Ottawa Centre, NDP)",,Statements By Members,Italian Week,,"Mr. Speaker, I rise to celebrate the 40th anniversary of Italian Week in Ottawa. This celebration of Ottawa's Italian-Canadian community is one of the most cherished traditions of our city. From food to music to dance, this week celebrates all aspects of Italian culture and heritage.
As the member of Parliament for Ottawa Centre, I have been fortunate to work with members of the local Italian community, including small business owners on Corso Italia and Via Marconi. I was pleased to join them and many others for the opening of this year's festival. Italian Week 2014 has been truly exceptional, a worthy tribute to the important contributions of Italian Canadians who have made our city fantastic for over 100 years.
I thank all of the dedicated volunteers and sponsors who have made Italian Week Ottawa successful for four decades. I congratulate this year's organizers for their achievements. To all the members of the Italian community in Ottawa, grazie e a presto.",New Democratic Party,Ottawa Centre,Paul Dewar,http://www.parl.gc.ca/parlinfo/Files/Parliamentarian.aspx?Item=86dd8955-957c-4ff9-9a81-76305a0f26ac&Language=E&Section=ALL
4606462,ca.proc.d.2014-06-12.16277.156,2014-06-12,f66407a4-934e-4c46-b524-b4dacd035ceb,613,"Mr. Andrew Saxton (North Vancouver, CPC)",,Statements By Members,Phillipine Independence Day,,"Mr. Speaker, Mabuhay. On June 12, Filipino Canadians across the country celebrate a very special occasion, Philippine Independence Day, and today marks the 160th anniversary of the declaration of Philippine independence from Spanish colonial rule.
In my riding of North Vancouver, we host the largest Philippine Independence Day festival in British Columbia, organized by the Metro Vancouver Philippine Arts and Cultural Exposition Society.
This is a great opportunity to celebrate the diversity and rich cultural heritage of the Philippines. Booths filled with tantalizing aromas from traditional foods and drinks offer everything from chicken adobo to sweet pastry ensaymadas. Local businesses also showcase their products and services, making it another great opportunity for the whole community to come together. This is a wonderful day to spend with family and friends and an important day to celebrate the strong ties our two nations share. Having recently visited Manila, I can say more than ever just how similar our values of freedom, peace, and democracy are.
To all I say, Maligayang Araw ng Kalayaan.",Conservative,North Vancouver,Andrew Saxton,http://www.parl.gc.ca/parlinfo/Files/Parliamentarian.aspx?Item=f66407a4-934e-4c46-b524-b4dacd035ceb&Language=E&Section=ALL
4606463,ca.proc.d.2014-06-12.16277.157,2014-06-12,213c7c78-812a-4123-ac14-dc73da49de1f,435,"Mr. Pierre Lemieux (Glengarry—Prescott—Russell, CPC)",,Statements By Members,Trinity Western Law School,,"Mr. Speaker, Trinity Western University is a private Christian university in Langley, British Columbia. It is a place of rigorous scholarship that focuses on the preparation of graduates to practise law while emphasizing ethics, professionalism, and service to the community. Students join the school's Christian community and pledge to respect standards on the sacredness of marriage between a man and a woman. This is a choice they freely make.
It needs to be noted that Trinity Western's law school graduates are fully qualified to practise law. There is just one problem: their views are not acceptable to those who rule the Law Society of Upper Canada. Unless they abandon their views and accept the beliefs of those who rule the law society, these students will not be permitted to practise law in Ontario, as the graduates of other law schools can.
Its policy seems to be contrary to the Charter of Rights and Freedoms, section 2, which guarantees Canadians' right to freedom of conscience and religion and freedom of thought, belief, opinion, and expression.
I call on the Law Society of Upper Canada to reverse its discriminatory and intolerant decision regarding Trinity Western Law graduates.",Conservative,Glengarry--Prescott--Russell,Pierre Lemieux,http://www.parl.gc.ca/parlinfo/Files/Parliamentarian.aspx?Item=213c7c78-812a-4123-ac14-dc73da49de1f&Language=E&Section=ALL
