basepk,hid,speechdate,pid,opid,speakeroldname,speakerposition,maintopic,subtopic,subsubtopic,speechtext,speakerparty,speakerriding,speakername,speakerurl
4606299,ca.proc.d.2014-06-12.16265.346,2014-06-12,1b175d0f-9278-4e04-9fa8-0368e591c5a5,69,The Deputy Speaker,,Government Orders,"Economic Action Plan 2014 Act, No. 1",,Order. The time for debate on this legislation has expired. The member for York Centre will have eight minutes when we resume debate.,New Democratic Party,Windsor--Tecumseh,Joe Comartin,http://www.parl.gc.ca/parlinfo/Files/Parliamentarian.aspx?Item=1b175d0f-9278-4e04-9fa8-0368e591c5a5&Language=E&Section=ALL
4606300,ca.proc.d.2014-06-12.16265.347,2014-06-12,,,,stagedirection,Adjournment Proceedings,,,A motion to adjourn the House under Standing Order 38 deemed to have been moved. ,,,,
4606301,ca.proc.d.2014-06-12.16265.348,2014-06-12,eaa6694f-1e20-4aae-ad3b-e694b0e12c59,9187,"Ms. Elizabeth May (Saanich—Gulf Islands, GP)",,Adjournment Proceedings,The Environment,,"Mr. Speaker, I rise this evening in adjournment proceedings to pursue a question I put to the Minister of the Environment on May 12. The question was one of many I have put to the minister and the Prime Minister in an attempt to get a clear answer as to whether this Conservative administration remains committed to the Copenhagen target, which the Prime Minister personally adopted when he participated in the United Nations conference in 2009. He attended briefly toward the end of the meeting, and there was, as close observers of the climate debate will know, a non-UN process that took place in a back room among a number of the world leaders, including Barack Obama, the President of the United States, and the Chinese government. Canada was not in that room, but when those leaders emerged with something called a non-binding political agreement, Canada signed onto that. In doing so, the Prime Minister adopted the same target that President Obama had announced. All countries within this politically binding agreement, in other words, not binding at all, agreed to take on different targets. Canada decided to take the U.S. target, which was 17% below 2005 levels by 2020. 
This amounted to the second reduction in targets from the time the current Prime Minister assumed that position back in 2006. The first step was his announcement that Canada did not consider itself obligated to meet what was then a legally binding target under the Kyoto protocol. He chose a weaker target of 20% below 2006 levels by 2020, and changed it in 2009 to a weaker target, because ironically, the year 2005 had higher emissions than the year 2006, so it became convenient to adopt the U.S. target. It actually weakened our targets once again.
The reason I keep trying to find out if we are even committed to this weak target is that according to Environment Canada, based on all current steps that have been taken within Canada, federally and provincially, all targets combined amount to a three megatonne reduction below 2005 levels, when a 130-megatonne reduction below 2005 levels was promised.
It seems to be a matter of some substance and importance to know if the current administration is committed to the target it chose. I think we could still get there. We could still do it, but it would require a plan. It would require an economy-wide plan. It would require some form of carbon pricing. It would require the elimination of subsidies to fossil fuels. In other words, it would have to be a serious effort to meet a weak target, because as things stand right now, 2005 levels were 737 megatonnes, and we are projecting for 2020 734 megatonnes, a three megatonne drop. The target is 613 megatonnes. These numbers come from Environment Canada. There is no dispute about them. The only question is, where is the plan?
 Is the government still committed to the target that the Prime Minister adopted personally, not through his environment minister, not from the previous Prime Minister, not from the Liberals, not from Jean Chrétien, and not from Paul Martin. The current Prime Minister adopted this target in a world forum and continues to act as though we have made some progress, when in fact we are standing still. I hope for a better answer this evening.",Green,Saanich--Gulf Islands,Elizabeth May,http://www.parl.gc.ca/parlinfo/Files/Parliamentarian.aspx?Item=eaa6694f-1e20-4aae-ad3b-e694b0e12c59&Language=E&Section=ALL
4606302,ca.proc.d.2014-06-12.16265.349,2014-06-12,b7266d04-f318-4305-ab9f-580a06be7d08,587,"Ms. Lois Brown (Parliamentary Secretary to the Minister of International Development, CPC)",,Adjournment Proceedings,The Environment,,"Mr. Speaker, here we are, Wednesday night, after midnight. Déjà vu, all over again. 
Our government is committed to achieving Canada's targets and our record speaks for itself. We will continue to take action with our sector-by-sector approach that has been achieving real results while fostering economic growth. So far, our government has contributed to reducing Canada's emissions through stringent regulations for the transportation and electricity sectors, two of the largest sources of emissions in Canada. 
I would now like to take a moment to highlight some of the great achievements we have made so far. First, Canada has strengthened its position as a world leader in clean energy production by becoming the first major coal user to ban future construction of traditional coal-fired electricity generation units. Second, 2025 passenger vehicles and light trucks will emit about half as many greenhouse gases as 2008 models. Third, greenhouse gas emissions from 2018 model year heavy-duty vehicles will be reduced by up to 23%.
Let me reiterate. Our government's collective actions are achieving real results. Thanks to our actions, carbon emissions will go down close to 130 megatonnes from what they would have been under the Liberals. This is a reduction equivalent to the elimination of 37 coal-fired electricity plants. We are accomplishing this without the NDP's carbon tax, which would raise the price of everything. 
Between 2005 and 2011, greenhouse gas emissions have decreased by 4.8%, while the economy has grown by 8.4%. Per capita emissions are at an historic low. In addition to doing our part through the United Nations, we are also actively involved in fora such as the Arctic Council, the Montreal protocol, and the climate and clean air coalition, to develop practical and collaborative initiatives to reduce greenhouse gas emissions and short-lived climate pollutants. 
Canada has strong international commitments to support developing country mitigation and adaptation efforts. Our Conservative government, in partnership with other developed countries, has fully delivered on the fast start financing commitment, which provided $30 billion over the three-year period of 2010 to 2012. In fact, we exceeded the commitment by providing $33 billion. As can clearly be seen, the figures speak for themselves. Our government has committed the largest ever contribution to support international efforts to address climate change, a contribution that has supported mitigation and adaptation efforts in over 60 developing countries. 
We remain committed to working with other countries to address climate change. ",Conservative,Newmarket--Aurora,Lois Brown,http://www.parl.gc.ca/parlinfo/Files/Parliamentarian.aspx?Item=b7266d04-f318-4305-ab9f-580a06be7d08&Language=E&Section=ALL
4606303,ca.proc.d.2014-06-12.16265.350,2014-06-12,eaa6694f-1e20-4aae-ad3b-e694b0e12c59,9187,Ms. Elizabeth May,Interjection,Adjournment Proceedings,The Environment,,"Mr. Speaker, I am so sorry that me dear friend, the parliamentary secretary has to debate this after midnight when we started the day together at 7 a.m. 
However, the reality is that although everything she said is true, none of it adds up to a plan to meet the Copenhagen target. The coal regs do not take effect until 2015 and are fully considered when Environment Canada projects that by 2020 we will have reduced by 3 megatonnes. 
The statistic she just gave us of what the emissions were between 2005 and 2011 is also accurate. However, between 2011 and 2020, what she did not add is that Environment Canada projects that emissions will keep rising. They are rising to reach 734 megatonnes by 2020, not dropping. 
It is not her fault because it is repeated ad nauseam. The nonsense that this is 130 megatonnes less than what would have happened under the Liberals is their spin around a concept called business as usual, which is a hypothetical imagining of what would happen in some future if nothing happened anywhere, not counting Ontario's or B.C.'s reductions. In other words, business as usual as a figure is irrelevant to the Copenhagen target, which required absolute reductions by 17%. We need a plan. ",Green,Saanich--Gulf Islands,Elizabeth May,http://www.parl.gc.ca/parlinfo/Files/Parliamentarian.aspx?Item=eaa6694f-1e20-4aae-ad3b-e694b0e12c59&Language=E&Section=ALL
4606304,ca.proc.d.2014-06-12.16265.351,2014-06-12,b7266d04-f318-4305-ab9f-580a06be7d08,587,Ms. Lois Brown,Interjection,Adjournment Proceedings,The Environment,,"Mr. Speaker, our government recognizes that climate change is a shared challenge that requires action by provinces and territories, businesses, and all Canadians. Provincial and territorial governments and others are taking action on climate change, according to their own circumstances. The federal government supports the efforts of provinces and territories, businesses, and consumers to lower their emissions and these measures will also contribute toward Canada's climate change objectives.
If I may just say, I believe it is incumbent on each one of us as consumers to start making different choices. That is what is going to lower emissions in the long run: when we each take responsibility for the things that we use, the things that we purchase,and the things that we consume. It is up to us. ",Conservative,Newmarket--Aurora,Lois Brown,http://www.parl.gc.ca/parlinfo/Files/Parliamentarian.aspx?Item=b7266d04-f318-4305-ab9f-580a06be7d08&Language=E&Section=ALL
4606305,ca.proc.d.2014-06-12.16265.352,2014-06-12,1b175d0f-9278-4e04-9fa8-0368e591c5a5,69,The Deputy Speaker,,Adjournment Proceedings,The Environment,,"Pursuant to an order made on Tuesday, May 27, 2014, the motion to adjourn the House is now deemed to have been adopted.
Accordingly, the House stands adjourned until later this day at 10 a.m., pursuant to Standing Order 24(1).
(The House adjourned at 12:11 a.m.)",New Democratic Party,Windsor--Tecumseh,Joe Comartin,http://www.parl.gc.ca/parlinfo/Files/Parliamentarian.aspx?Item=1b175d0f-9278-4e04-9fa8-0368e591c5a5&Language=E&Section=ALL
4606306,ca.proc.d.2014-06-12.16277.0,2014-06-12,6519cfba-0080-419d-baa9-8ae6e56d032f,256,The Speaker,,Routine Proceedings,Information Commissioner of Canada,,"I have the honour to lay upon the table the annual reports on the Access to Information Act and the Privacy Act from the Information Commissioner of Canada for the year 2013-14.
These documents are deemed to have been permanently referred to the Standing Committee on Justice and Human Rights. ",Conservative,Regina--Qu'Appelle,Andrew Scheer,http://www.parl.gc.ca/parlinfo/Files/Parliamentarian.aspx?Item=6519cfba-0080-419d-baa9-8ae6e56d032f&Language=E&Section=ALL
4606307,ca.proc.d.2014-06-12.16277.1,2014-06-12,6519cfba-0080-419d-baa9-8ae6e56d032f,256,The Speaker,,Routine Proceedings,Commissioner of Lobbying,,"I have the honour to lay upon the table the annual reports on the Access to Information Act and the Privacy Act from the Commissioner of Lobbying for the year 2013-14. 
This document is deemed to have been permanently referred to the Standing Committee on Justice and Human Rights.
Pursant to section 11 of the Lobbying Act, I have the honour to lay upon the table the report of the Commissioner of Lobbying for the fiscal year ended March 31, 2014.",Conservative,Regina--Qu'Appelle,Andrew Scheer,http://www.parl.gc.ca/parlinfo/Files/Parliamentarian.aspx?Item=6519cfba-0080-419d-baa9-8ae6e56d032f&Language=E&Section=ALL
4606308,ca.proc.d.2014-06-12.16277.2,2014-06-12,fe517b95-bc62-4fe8-96aa-998994aefd48,173,"Mr. Tom Lukiwski (Parliamentary Secretary to the Leader of the Government in the House of Commons, CPC)",,Routine Proceedings,Government Response to Petitions,,"Mr. Speaker, pursuant to Standing Order 36(8), I have the honour to table, in both official languages, the government's response to 447 petitions.",Conservative,Regina--Lumsden--Lake Centre,Tom Lukiwski,http://www.parl.gc.ca/parlinfo/Files/Parliamentarian.aspx?Item=fe517b95-bc62-4fe8-96aa-998994aefd48&Language=E&Section=ALL
4606309,ca.proc.d.2014-06-12.16277.3,2014-06-12,bb27e38b-4887-48e1-b182-ba18b39d411b,46,"Mr. Gordon Brown (Leeds—Grenville, CPC)",,Routine Proceedings,Committees of the House,Canadian Heritage,"Mr. Speaker, I have the honour to present, in both official languages, the fifth report of the Standing Committee on Canadian Heritage, entitled “Review of the Canadian Music Industry”.
Pursuant to Standing Order 109, the committee requests that the government table a comprehensive response to this report.",Conservative,Leeds--Grenville,Gord Brown,http://www.parl.gc.ca/parlinfo/Files/Parliamentarian.aspx?Item=bb27e38b-4887-48e1-b182-ba18b39d411b&Language=E&Section=ALL
4606310,ca.proc.d.2014-06-12.16277.4,2014-06-12,0fa70595-d7af-41f0-a0c9-4b7b8ebc1582,239,"Mr. James Rajotte (Edmonton—Leduc, CPC)",,Routine Proceedings,Committees of the House,Finance,"Mr. Speaker, I have the honour to present, in both official languages, the sixth report of the Standing Committee on Finance
The report is entitled, “Youth Employment in Canada: Challenges and Potential Solutions”. Pursuant to Standing Order 109, the committee requests that the government table a comprehensive response to this report. 
As it is the end of the session, I would like to thank very much all of our hard-working staff, our clerk, our analyst, and all the legislative staff for their excellent work on what will probably be our last report of this session.",Conservative,Edmonton--Leduc,James Rajotte,http://www.parl.gc.ca/parlinfo/Files/Parliamentarian.aspx?Item=0fa70595-d7af-41f0-a0c9-4b7b8ebc1582&Language=E&Section=ALL
4606311,ca.proc.d.2014-06-12.16277.5,2014-06-12,1d953ce9-12d9-447d-8d59-90b2338a59f0,446,"Mr. Rick Norlock (Northumberland—Quinte West, CPC)",,Routine Proceedings,Committees of the House,National Defence,"Mr. Speaker, after two years' hearing from many witnesses, and hard work on behalf of all the clerks, staff, and members of the defence committee, I have the honour to present, in both official languages, the fourth report of the Standing Committee on National Defence, entitled “Caring for Canada's Ill and Injured Military Personnel”.
Pursuant to Standing Order 109, the committee requests that the government table a comprehensive response to the report.",Conservative,Northumberland--Quinte West,Rick Norlock,http://www.parl.gc.ca/parlinfo/Files/Parliamentarian.aspx?Item=1d953ce9-12d9-447d-8d59-90b2338a59f0&Language=E&Section=ALL
4606312,ca.proc.d.2014-06-12.16277.6,2014-06-12,c846297d-8bc7-4e69-b6eb-31d0e19f7ec1,554,"Mr. Jack Harris (St. John's East, NDP)",,Routine Proceedings,Committees of the House,National Defence,"Mr. Speaker, as vice-chair, I would like to state the dissenting opinion of the official opposition to this report. We heard witnesses for two full years on this critical issue of ill and injured military personnel, injuries both physical and psychological.
We do know, of course, that with regard to the physical injuries, Canada is doing a great job. We heard that evidence, and the report deals with that very well.
However, in terms of psychological injuries, it is a different story. Over time, even in the Afghanistan mission, despite early warnings, the military seemed to be constantly playing catch-up in terms of the treatment of soldiers suffering from psychological injuries.
The projections that were made by Statistics Canada in 2002, adopted by the military in 2005, still have not been met. 
So many soldiers came back from Afghanistan and other missions, including Bosnia, Rwanda, et cetera, with their bodies intact but with underlying psychological trauma, with long-term consequences not always recognized, not well understood, and they received inadequate treatment and support.
We are moving forward, but complacency is not an option. Our report outlines some very important measures that need to be taken immediately.",New Democratic Party,St. John's East,Jack Harris,http://www.parl.gc.ca/parlinfo/Files/Parliamentarian.aspx?Item=c846297d-8bc7-4e69-b6eb-31d0e19f7ec1&Language=E&Section=ALL
4606313,ca.proc.d.2014-06-12.16277.7,2014-06-12,288315ef-2fe8-48ad-8ae0-833ac097bac0,3658,"Mr. Philip Toone (Gaspésie—Îles-de-la-Madeleine, NDP)",,Routine Proceedings,VIA Rail Canada Act,," moved for leave to introduce Bill C-614, An Act respecting VIA Rail Canada and making consequential amendments to another Act.
Mr. Speaker, today I have the honour of introducing a bill about VIA Rail. We know that VIA Rail is in crisis. Service is threatened in many regions of Canada. Vancouver Island has lost its service. There is no more service on the Gaspé coast. Service in the Maritimes has been cut by 50%, and there is a real concern that all service in eastern Quebec could be completely eliminated.
We know that even with the significant investments that have been made in the past 10 years, VIA Rail is still in a downward spiral. There are fewer passengers and fewer resources, and the equipment is in terrible shape. We need a legislative framework that will promote VIA Rail service in Canada. We want a legislative framework that is modelled after the American one, which saved another service that was threatened, namely Amtrak.
A similar framework here would put us on the right track. We could save VIA Rail. I am relying heavily on the bill that was introduced a few months ago by my former colleague, Olivia Chow, before she left the House.
I hope that members of the House will support this bill so that we can have appropriate VIA Rail service.
(Motions deemed adopted, bill read the first time and printed)",New Democratic Party,Gaspésie--Îles-de-la-Madeleine,Philip Toone,http://www.parl.gc.ca/parlinfo/Files/Parliamentarian.aspx?Item=288315ef-2fe8-48ad-8ae0-833ac097bac0&Language=E&Section=ALL
4606314,ca.proc.d.2014-06-12.16277.8,2014-06-12,eb8710eb-e6dd-4c04-9d9a-60e7c8503565,3139,"Mr. Kennedy Stewart (Burnaby—Douglas, NDP)",,Routine Proceedings,Criminal Code,," moved for leave to introduce Bill C-615, An Act to amend the Criminal Code (cruelty to animals—electric shock collars).
Mr. Speaker, I am proud to rise today to introduce a private member's bill promoting animal welfare in Canada. This bill would ban the use of harmful electric shock collars on companion animals, better known as “household pets”. Using shock collars is widely recognized as causing needless pain and being cruel and inhumane, and use has been restricted in numerous other jurisdictions.
 I am particularly honoured to be putting this bill forward, because it is a truly constituent-driven initiative. It is inspired by Gwendy and Alfie Williams, two committed advocates from my riding of Burnaby—Douglas, who have been mobilizing concerned citizens to protect animals for more than seven years. Without a doubt, never before has my office received so many petitions and letters on a single specific issue. However, really what swung me to action is a local elementary school. Students from this school joined the chorus of voices seeking a ban on the use of these harmful shock collars. 
I believe this is how our democracy should function. MPs should come here to Ottawa and put forward ideas on behalf of their community that elects them. When this happens, we are doing our duty to serve Canadians.
 (Motions deemed adopted, bill read the first time and printed) ",New Democratic Party,Burnaby--Douglas,Kennedy Stewart,http://www.parl.gc.ca/parlinfo/Files/Parliamentarian.aspx?Item=eb8710eb-e6dd-4c04-9d9a-60e7c8503565&Language=E&Section=ALL
4606315,ca.proc.d.2014-06-12.16277.9,2014-06-12,98770e62-a7ff-4df1-aa6e-fb827476bb16,455,"Mr. Brian Storseth (Westlock—St. Paul, CPC)",,Routine Proceedings,Criminal Code,," moved for leave to introduce Bill C-616, An Act to amend the Criminal Code and the Corrections and Conditional Release Act (failure to comply with a condition).
Mr. Speaker, it pleases me today to rise to introduce my private member's bill, an act to amend the Criminal Code and the Corrections and Conditional Release Act.
The reality of our justice system is that a disproportionately small number of offenders is responsible for a disproportionately large number of offences. This act would create two important parole reforms that target these repeat and high-risk offenders. Its enactment would create a new offence for the breach of conditional release and require the reporting of those breaches to the appropriate authorities. It is critically important that an accurate record be maintained with respect to an offender's breach of conditions while on early release, so that future justice decisions may take this conduct into account.
These amendments are proposed in the belief that early release from a court sentence is a privilege to be earned and not a right to be demanded.
 (Motions deemed adopted, bill read the first time and printed) ",Conservative,Westlock--St. Paul,Brian Storseth,http://www.parl.gc.ca/parlinfo/Files/Parliamentarian.aspx?Item=98770e62-a7ff-4df1-aa6e-fb827476bb16&Language=E&Section=ALL
4606316,ca.proc.d.2014-06-12.16277.10,2014-06-12,37174f12-1dc0-44f0-8065-4c09cf9ebca1,557,"Ms. Megan Leslie (Halifax, NDP)",,Routine Proceedings,Interprovincial Waste Movement Act,," moved for leave to introduce Bill C-617, An Act to amend the Canadian Environmental Protection Act, 1999 (interprovincial movement of waste).
Mr. Speaker, a few years ago, my colleague from Skeena—Bulkley Valley started a project called “Create your Canada”, whereby students could learn about the legislative process, learn about the role of media, for example, talk about some of the problems in their communities, and come up with legislative solutions. 
I took on that project in Halifax, and the grade 12 French immersion class taught by Rob Williams at Citadel High School took on the challenge. The students came up with all kinds of great ideas, from the promotion of local foods to lowering the voting age to some really complicated changes to the tax code. 
 The class actually decided to pick a bill whose concept was developed by Ben Smithers and Finlay Miller, and it was about changes to the Environmental Protection Act to ban the interprovincial transportation of waste. Their thoughts were that we are producing too much waste, and if authorities in the provinces actually had to deal with the waste their provinces produce, then they would come up with innovative solutions to combat how much waste we are producing.
I am proud to table this bill today. I am proud to represent these incredible students who know so much more about the legislative process now and who are so committed to the environment. I look forward to debate on this bill; it will be pretty exciting.
 (Motions deemed adopted, bill read the first time and printed) ",New Democratic Party,Halifax,Megan Leslie,http://www.parl.gc.ca/parlinfo/Files/Parliamentarian.aspx?Item=37174f12-1dc0-44f0-8065-4c09cf9ebca1&Language=E&Section=ALL
4606317,ca.proc.d.2014-06-12.16277.11,2014-06-12,aa58e8f5-4a46-4c79-8e97-b9ebe28c9d9a,295,"Hon. Peter Van Loan (Leader of the Government in the House of Commons, CPC)",,Routine Proceedings,Conflict of Interest and Ethics Commissioner,," moved: 
 That, in accordance with section 81 of the Parliament of Canada Act, R.S.C., 1985, c. P-1, this House approve the reappointment of Mary Elizabeth Dawson as Conflict of Interest and Ethics Commissioner. 
",Conservative,York--Simcoe,Peter Van Loan,http://www.parl.gc.ca/parlinfo/Files/Parliamentarian.aspx?Item=aa58e8f5-4a46-4c79-8e97-b9ebe28c9d9a&Language=E&Section=ALL
4606318,ca.proc.d.2014-06-12.16277.12,2014-06-12,6519cfba-0080-419d-baa9-8ae6e56d032f,256,The Speaker,,Routine Proceedings,Conflict of Interest and Ethics Commissioner,, Is it the pleasure of the House to adopt the motion? ,Conservative,Regina--Qu'Appelle,Andrew Scheer,http://www.parl.gc.ca/parlinfo/Files/Parliamentarian.aspx?Item=6519cfba-0080-419d-baa9-8ae6e56d032f&Language=E&Section=ALL
4606319,ca.proc.d.2014-06-12.16277.13,2014-06-12,,,,intervention,Routine Proceedings,Conflict of Interest and Ethics Commissioner,," Agreed. 
 No. ",,,Some hon. members,
4606320,ca.proc.d.2014-06-12.16277.14,2014-06-12,6519cfba-0080-419d-baa9-8ae6e56d032f,256,The Speaker,,Routine Proceedings,Conflict of Interest and Ethics Commissioner,, All those in favour of the motion will please say yea. ,Conservative,Regina--Qu'Appelle,Andrew Scheer,http://www.parl.gc.ca/parlinfo/Files/Parliamentarian.aspx?Item=6519cfba-0080-419d-baa9-8ae6e56d032f&Language=E&Section=ALL
4606321,ca.proc.d.2014-06-12.16277.15,2014-06-12,,,,intervention,Routine Proceedings,Conflict of Interest and Ethics Commissioner,, Yea. ,,,Some hon. members,
4606322,ca.proc.d.2014-06-12.16277.16,2014-06-12,6519cfba-0080-419d-baa9-8ae6e56d032f,256,The Speaker,,Routine Proceedings,Conflict of Interest and Ethics Commissioner,, All those opposed will please say nay. ,Conservative,Regina--Qu'Appelle,Andrew Scheer,http://www.parl.gc.ca/parlinfo/Files/Parliamentarian.aspx?Item=6519cfba-0080-419d-baa9-8ae6e56d032f&Language=E&Section=ALL
4606323,ca.proc.d.2014-06-12.16277.17,2014-06-12,,,,intervention,Routine Proceedings,Conflict of Interest and Ethics Commissioner,, Nay. ,,,Some hon. members,
