basepk,hid,speechdate,pid,opid,speakeroldname,speakerposition,maintopic,subtopic,subsubtopic,speechtext,speakerparty,speakerriding,speakername,speakerurl
4606952,ca.proc.d.2014-06-13.16282.144,2014-06-13,f40d602c-1ae6-414e-bac3-23a2f31f1cdf,608,Ms. Linda Duncan,Interjection,Government Orders,Victims Bill of Rights Act,,"Thank you for your intervention, Mr. Speaker. It is important that we show respect to all members of this place, particularly given the nature of the bill before us, Bill C-32, the victims bill of rights act.
 As I have mentioned, we fully support this bill, but we have raised a number of issues. The bill could be strengthened with some straightforward amendments. I note that a good number of the inadequacies that we have pointed out mirror those raised by the ombudsman, and I will reiterate those shortly.
I am pleased to say that in the courts in my province, and most likely courts across Canada, victims of crime and families of victims have been allowed in many instances to present victim statements both for sentencing purposes and during parole proceedings. It is very important that those most impacted by crime have an opportunity to be heard.
We fully support the principles of this legislation. These promised provisions have been a long time coming. It is good that the government has finally come forward with the bill. It is regrettable, however, that the government failed to include resources in the budget to enable people to participate constructively in these processes. That is one of the inadequacies clearly identified by the victims and the families of the victims and the ombudsman herself.
We support sending the bill to committee. We look forward to recommendations from many quarters as to how the bill could be strengthened to protect the rights of victims while participating in the criminal process.
The media covers bad cases in every jurisdiction. There is great sympathy for the families of victims of serious crimes. In my city there was the case of Dougald Miller, who was attacked and seriously injured and has been bedridden ever since. He is being tended to by his wonderful wife Lesley Miller, who has attended every court session and every parole hearing. Our heart goes out to her. At committee we hope that one of the recommendations will be for more resources to be provided to the families who are left to deal with the impacts of crime.
As I have mentioned, one of the most cogent presentations on this bill was made by the Office of the Federal Ombudsman for Victims of Crime. I would like to reiterate to the House what the ombudsman's comments have been on this bill. 
She, as we have, commended the government for introducing the first ever victims bill of rights and for the consultative process that took place, but there continues to be debate about the bill's contents and some of its inadequacies. She said that Bill C-32 marks a significant cultural shift. She recommended that it be strengthened by adding additional provisions. I would like to outline some of those provisions to the House. 
The federal ombudsman previously made 30 recommendations to the government to be included in the bill. Her commentary speaks to where she feels the government has and has not addressed those recommendations.
It is important for us to keep in mind that the ombudsman prepared her recommendations after direct consultation with many victims of crime. They are solidly based recommendations premised on the actual experiences and needs of the victims and their families.
The ombudsman also stated that she supports expanding the definition of “victim” to include those who experience property damage, but she is concerned that it excludes certain categories of persons who might be harmed. She suggested that could be revisited.
The ombudsman supports, as do we, victims of crime being recognized, but there is no way for them to exercise that right. While it is called a right, there is no recourse to exercize that right. Normally when rights are enacted, there is some kind of mechanism whereby those rights can be enforced, such as in the courts, at a tribunal, or some kind of formal complaint process where there is redress. Unfortunately, the bill does not provide that. A number of people have raised that issue. I think that will be discussed in committee. We are hopeful, as is the ombudsman, that those inadequacies will be addressed.
It also allows the victim, on request, to have access to the defender's bail or probation order. Suggestions have been made that this should not have to be a request, because many victims or their families may not be aware of these rights and opportunities, and that this information should simply be automatically provided. 
Here is one issue that has been raised by one of my colleagues, our critic for public safety. Interestingly, simultaneous to the tabling of this bill, there was another bill tabled that dealt with victims' rights. It was victims' rights before the Parole Board, I understand. These two bills will come forward to two different committees simultaneously. One will go to the justice committee and one to the public safety committee. However, they do not seem to be particularly consistent. Therefore, it is recommended that this be considered during the review of Bill C-32. 
One of the recommendations has been that in many cases with these crimes—and certainly I can speak to this because I was one of the founders of the sexual assault centre in Edmonton—victims may not feel comfortable attending proceedings and coming face to face with the accused. Therefore, the recommendation is that, in the review of the bill, perhaps we give consideration to video conferencing so that the victims could, potentially, just observe the proceedings, or they may even be willing to give testimony or statements, but not be physically present.
In addition, the ombudsman has commended the fact that judges will have to take victim safety and security into account at various stages of the criminal process including bail, plea bargaining, sentencing, protecting against production orders, testimonial aids and measures to protect witnesses. Indeed, it is good that victims of crime and their families who are impacted should have potential access to all of these proceedings. However, from my experience, the biggest barrier for impacted persons—whether it is a regulatory offence, or whether or not it is an important decision impacting a community, or whether or not it is an alleged crime—is that they do not have equal access to the resources to participate constructively. This has certainly been the problem in many environmental reviews, many environmental appeals, and is also the same problem with victims coming forward. 
Regrettably, there are also few to no resources made available in many cases. For example, there may be a crime that occurs in Fort McMurray, Alberta, but the family of the victim may be based in Newfoundland and Labrador. Obviously, it would be a huge expense for them to appear at a trial or a parole hearing and actually testify. They would have to pay the travel expenses. They may have to take time off work. They may have to get child care. There are two potential solutions here. One is to provide the funding so that they can genuinely intervene, or secondly, use video conferencing. 
Therefore, I look forward to all parties taking a close look at this bill in committee. It is one thing to suggest that it is good that victims should be able to participate. It is another thing to actualize that right. That right is only actualized when they can constructively and realistically participate.
I look forward to questions from members on the bill. Again, I commend the government for coming forward, but we look forward to the government actually being open to amendments, and open to amendments coming from all quarters. I know that all parties look forward to witnesses coming forward and testifying. ",New Democratic Party,Edmonton Strathcona,Linda Duncan,http://www.parl.gc.ca/parlinfo/Files/Parliamentarian.aspx?Item=f40d602c-1ae6-414e-bac3-23a2f31f1cdf&Language=E&Section=ALL
4606953,ca.proc.d.2014-06-13.16282.145,2014-06-13,288315ef-2fe8-48ad-8ae0-833ac097bac0,3658,"Mr. Philip Toone (Gaspésie—Îles-de-la-Madeleine, NDP)",,Government Orders,Victims Bill of Rights Act,,"Mr. Speaker, I would like to thank my colleague for her excellent speech. The amount of work she put into it reflects really well on the amount of work she puts in her own riding. She is probably the best MP that riding has ever had. 
As for the bill, she mentioned toward the end that there is a problem with financing. Once again, we are in a situation where the government is downloading onto the provinces the costs of these programs. There seems to be a real misunderstanding with the government when it comes to affording individuals rights without any ability to exercise them. It would seem it only cares for rich people, the bourgeois, who can afford rights. If one is less well off, how can one possibly be able to afford the rights that are being presented? Is this not just another example of the government ignoring the average Canadian and just making bills for people who are wealthy and probably already have sufficient access to the courts?
I am wondering how we can address the problem of the lack of funding.",New Democratic Party,Gaspésie--Îles-de-la-Madeleine,Philip Toone,http://www.parl.gc.ca/parlinfo/Files/Parliamentarian.aspx?Item=288315ef-2fe8-48ad-8ae0-833ac097bac0&Language=E&Section=ALL
4606954,ca.proc.d.2014-06-13.16282.146,2014-06-13,f40d602c-1ae6-414e-bac3-23a2f31f1cdf,608,Ms. Linda Duncan,Interjection,Government Orders,Victims Bill of Rights Act,,"Mr. Speaker, actually, that was one aspect I meant to mention but did not. My understanding is that this law would empower the courts to impose restitution orders. The problem is that in not all cases does a convicted person have the resources to compensate the victim or the family of the victim.
There are a lot of cost issues related to crime. One of them is direct compensation if one's property or person are harmed. The ombudsman has pointed out that the bill would also not accommodate people if there was damage to property in the course of a crime.
In addition to that, I note that the MP for Toronto—Danforth said that what we do not have is a fund to generally support the victims of crime who might suffer trauma. We talk a lot about support for mental health. There are a lot of needs associated with the victims of crime, and we look forward to finally seeing something in the budget to address this bigger issue. However, it should also be addressed in the bill to be a real right.",New Democratic Party,Edmonton Strathcona,Linda Duncan,http://www.parl.gc.ca/parlinfo/Files/Parliamentarian.aspx?Item=f40d602c-1ae6-414e-bac3-23a2f31f1cdf&Language=E&Section=ALL
4606955,ca.proc.d.2014-06-13.16282.147,2014-06-13,1a840a29-fe0b-427c-b4f8-7cffd78e9e68,1172,"Mrs. Anne-Marie Day (Charlesbourg—Haute-Saint-Charles, NDP)",,Government Orders,Victims Bill of Rights Act,,"Mr. Speaker, I have some questions and I would like to put one of them to the member, who gave an excellent speech.
In Quebec, there is a law that helps victims of crime. Has the member noticed whether laws have been harmonized or the provinces have been consulted about harmonizing different laws in order to move in that direction?",New Democratic Party,Charlesbourg--Haute-Saint-Charles,Anne-Marie Day,http://www.parl.gc.ca/parlinfo/Files/Parliamentarian.aspx?Item=1a840a29-fe0b-427c-b4f8-7cffd78e9e68&Language=E&Section=ALL
4606956,ca.proc.d.2014-06-13.16282.148,2014-06-13,f40d602c-1ae6-414e-bac3-23a2f31f1cdf,608,Ms. Linda Duncan,Interjection,Government Orders,Victims Bill of Rights Act,,"Mr. Speaker, that is a good question. I am afraid I cannot answer it, but it is obviously an important factor. 
It will be important when the bill comes to committee that we hear testimony from the Attorneys General and the Solicitors General across the country, not simply from victims rights groups that are NGOs and are probably grossly underfunded. It will also be really important to know which of these provisions would duplicate what is already going on in the provincial courts. Do they conflict in any cases? Are there any cases where there could be dual funding for some of these initiatives?
It is an excellent factor that should be considered in the review of this bill.",New Democratic Party,Edmonton Strathcona,Linda Duncan,http://www.parl.gc.ca/parlinfo/Files/Parliamentarian.aspx?Item=f40d602c-1ae6-414e-bac3-23a2f31f1cdf&Language=E&Section=ALL
4606957,ca.proc.d.2014-06-13.16282.149,2014-06-13,a710e2c4-20f9-4df8-ba6c-2dc50c03bb75,8517,"Ms. Marjolaine Boutin-Sweet (Hochelaga, NDP)",,Government Orders,Victims Bill of Rights Act,,"Mr. Speaker, the Conservatives always say that they are tough on crime and that they stand up for people affected by crime. However, my colleague just said that the people targeted by this bill will not necessarily be aware of the recourse they have.
Will victims advocacy groups be required to give them that information? What does my colleague think the government could do to ensure that there is greater awareness of victims' rights and that the law is fully implemented?",New Democratic Party,Hochelaga,Marjolaine Boutin-Sweet,http://www.parl.gc.ca/parlinfo/Files/Parliamentarian.aspx?Item=a710e2c4-20f9-4df8-ba6c-2dc50c03bb75&Language=E&Section=ALL
4606958,ca.proc.d.2014-06-13.16282.150,2014-06-13,f40d602c-1ae6-414e-bac3-23a2f31f1cdf,608,Ms. Linda Duncan,Interjection,Government Orders,Victims Bill of Rights Act,,"Mr. Speaker, I guess I could briefly reference the ombudsman's report. She has very carefully laid out a number of recommendations that would embellish and strengthen this bill.
It is certainly important that if people are going to access rights, they have to be informed of their rights. There should be an obligation on the government in this bill to inform all victims of what their rights are under the bill, who is responsible, and what the process would be.",New Democratic Party,Edmonton Strathcona,Linda Duncan,http://www.parl.gc.ca/parlinfo/Files/Parliamentarian.aspx?Item=f40d602c-1ae6-414e-bac3-23a2f31f1cdf&Language=E&Section=ALL
4606959,ca.proc.d.2014-06-13.16282.151,2014-06-13,aa391262-e2bb-43aa-a00e-454730c269ef,8603,"Ms. Isabelle Morin (Notre-Dame-de-Grâce—Lachine, NDP)",,Government Orders,Victims Bill of Rights Act,,"Mr. Speaker, I am very pleased to rise today to speak to Bill C-32, An Act to enact the Canadian Victims Bill of Rights and to amend certain Acts.
I would like to begin by saying that the NDP is going to support this bill so that it can be examined in committee. We should examine it clause by clause as carefully as possible. We are going to ask the witnesses called by the government, the NDP and the third party good questions, because that is important.
We have been waiting eight years for this bill. Finally, it is here and we have to be able to work with the government to make changes and amendments if necessary.
I am going to provide a bit of background. This is a promise that the Conservatives made eight years ago. When the Conservative government took office, it promised, at several press conferences, that it would introduce a bill to enact a Canadian victims bill of rights. It happened this year. Until September 2013, Justice Canada held in-person and online consultations and finally Bill C-32 was introduced.
The Office of the Federal Ombudsman for Victims of Crime actively participated in these consultations and provided a list of nine recommendations, most of which the government took into account.
My speech will focus on our concerns and what aspects of the bill we should examine together in committee.
The office made the following recommendations for a bill of rights: enforceable and usable; integrated, accessible and simple services and resources with minimum standards across the country; inclusive definition of victim to include anyone in Canada harmed by crime; equitable, respectful and individualized; voice and standing; right to information; financial protection and support; psychological support and resources; and limit opportunities for offenders to profit from crimes or re-offend. 
At first glance, the Canadian victims bill of rights takes into account most of these recommendations. However, there are a few that I am concerned about, and that I believe weaken this bill. As I mentioned a number of times, I hope that we will be able to work together as good parliamentarians should. The victims of our country are already fragile enough and we must give them all the help we can. That is how we will make progress.
The problem with this bill is that it does not provide for any financial assistance. We have heard that no one knows just how familiar victims will be with their rights. My colleague also talked about that. We do not know whether victims will be aware of what assistance they can request. We have to wonder whether support will fall to community groups. 
I have an interesting statistic that shows that, right now, community groups provide the bulk of assistance to victims. The work is often done by volunteers. Groups that provide services to victims usually have employees, but they also have volunteers who provide assistance to victims. In 2011-12, 72% of victim service providers relied on volunteers.
I love volunteering and I think it is important, but I am not sure whether victims of crime should be dealing with volunteers. Should they not have access to someone with training in that field? It is not always easy to work with crime victims. They are dealing with a lot of feelings, emotions and an incredible amount of stress. It would be good for the bill of rights to provide for some funding to organizations that provide assistance to crime victims.
I have another concern about the money being allocated. A study released in 2011 by the Department of Justice found that the total cost of crime is an estimated $99.6 billion a year, 83% of which is borne by the victims.
A victims bill of rights should, first and foremost, provide financial assistance. Costs borne by victims could be associated with transportation, communication or support, for example, when they need help getting to a particular location. A first step would be to help cover the costs associated with the consequences of being the victim of a crime.
Furthermore, according to the 2009 General Social Survey, 7.4 million Canadians reported being a victim of a criminal incident in the preceding 12 months. Since this bill affects one-quarter of Canadians, we must listen to them. I am sure that that the topic of costs came up during the consultations that were held.
According to that same survey, 47% of women over the age of 15 who said that they had been sexually assaulted by their spouse or a partner in the preceding 12 months said that they did not report the assault to police. It was sometimes out of shame, out of fear of retribution or out of fear that no one would believe them or that they would be blamed for what had happened. If nearly half of women who are victims of assault do not feel they can report it to police, out of shame or for other reasons, perhaps it is because we need to provide services to those women.
If women are ashamed to report that they are victims of a crime, we need to ask ourselves what can be done. The victims bill of rights will help victims who go to the police and take legal action, but we need to make sure that we have something to help the men, women and children who are afraid to go to the police. Unfortunately, this bill does not contain any provisions to address that problem.
We are calling on the government to send this bill to committee. We want victims to have access to the support and services they need. That is of the utmost importance to us. That is how we can best address victims' needs. We acknowledge that, for many victims, being able to participate in sentencing and parole hearings is progress. However, as I said, there are elements in the bill that could be strengthened.
To conclude, I would like to quote Steve Sullivan, the first ombudsman for victims of crime. On April 3, he said:
 It’s a good bill, as far as it goes. I think the biggest problem though is that the minister of justice promised this would put victims at the heart of the justice system, and it falls very short of that. 
He added: 
 The concern I have is that a lot of victims who are out there who aren’t going to read the bill, who aren’t going to go through the fine print are going to read the headlines and think that the system has fundamentally changed and it hasn’t. 
These days, it is all about keeping people informed. Without financial backing, it will be difficult to make sure that victims are well informed. The bill of rights should include provisions to ensure that victims get the support and help they need. The government says it is tough on crime, but when 50% of female victims of crime do not report the crime to the police, we have to ask ourselves some questions. We have to convince these women that there will be progress and that the police will take them seriously and be with them every step of the way as they deal with their very difficult situations.
I would like to reiterate that I will be proud to support this bill, but I hope that my Conservative colleagues will be able to work with us to improve the final version of it.",New Democratic Party,Notre-Dame-de-Grâce--Lachine,Isabelle Morin,http://www.parl.gc.ca/parlinfo/Files/Parliamentarian.aspx?Item=aa391262-e2bb-43aa-a00e-454730c269ef&Language=E&Section=ALL
4606960,ca.proc.d.2014-06-13.16282.152,2014-06-13,288315ef-2fe8-48ad-8ae0-833ac097bac0,3658,"Mr. Philip Toone (Gaspésie—Îles-de-la-Madeleine, NDP)",,Government Orders,Victims Bill of Rights Act,,"Mr. Speaker, I thank my colleague for her excellent speech. Clearly, she knows what she is talking about. This goes to show how knowledgeable she is about issues that affect her community. She is doing extraordinary work in her riding.
Our party will definitely support this bill at second reading because it deserves to go to committee for further discussion. The bill does have some flaws that we need to talk about. 
The Conservatives have been promising us this bill for years, but have not introduced it until now. They keep campaigning on empty promises and never come through with something we can read. They try to convince Canadians to support bills without telling them exactly what is in those bills. We are glad that they have finally put things down in black and white in this case.
Even though we have it in black and white now, it is still a mirage. The government introduced a bill that is supposed to help victims, but it is not giving them the means to use the tools that will be available to them. Moreover, as my colleague pointed out, because none of this will be advertised, victims will not even know what tools are available to them.
The tools will be in place, but unfortunately no one will know it. Furthermore, the victims will have a hard time using those tools.
What does my colleague think of the lack of funding in this bill?",New Democratic Party,Gaspésie--Îles-de-la-Madeleine,Philip Toone,http://www.parl.gc.ca/parlinfo/Files/Parliamentarian.aspx?Item=288315ef-2fe8-48ad-8ae0-833ac097bac0&Language=E&Section=ALL
4606961,ca.proc.d.2014-06-13.16282.153,2014-06-13,aa391262-e2bb-43aa-a00e-454730c269ef,8603,Ms. Isabelle Morin,Interjection,Government Orders,Victims Bill of Rights Act,,"Mr. Speaker, I thank my colleague for his question. I know that he was here when we were talking about this bill and that he is also very interested in moving it forward.
I would like to read an excerpt from a press release issued by the Association québécoise Plaidoyer-Victimes on April 3 that supports what my colleague is saying. Although this association supports this bill, it feels that “certain conditions must be met if this bill of rights is going to have real influence and not just make empty promises”. 
That is kind of what my colleague was saying. When the government proposes a charter like the Canadian victims bill of rights, it has a responsibility to ensure that victims will be given all the psychological and financial support they need to move forward in the justice system.
It is important to give the justice system leverage, but the victims have to be at the heart of that approach and that is not the case at the moment. By providing victims with financial support, we would be putting them at the heart of these initiatives.",New Democratic Party,Notre-Dame-de-Grâce--Lachine,Isabelle Morin,http://www.parl.gc.ca/parlinfo/Files/Parliamentarian.aspx?Item=aa391262-e2bb-43aa-a00e-454730c269ef&Language=E&Section=ALL
4606962,ca.proc.d.2014-06-13.16282.154,2014-06-13,a710e2c4-20f9-4df8-ba6c-2dc50c03bb75,8517,"Ms. Marjolaine Boutin-Sweet (Hochelaga, NDP)",,Government Orders,Victims Bill of Rights Act,,"Mr. Speaker, my colleague rightfully noted that there is a general lack of funding. Community groups do very good work and are very generous, but their resources are limited. There is going to be a big problem.
Speaking of resources, this will take police training or legal training. Will the provinces or municipalities have to cover these costs through their police forces? The bill does not seem to provide funding for training, but I would think that funding is required.
I would like to hear what my colleague has to say about that.",New Democratic Party,Hochelaga,Marjolaine Boutin-Sweet,http://www.parl.gc.ca/parlinfo/Files/Parliamentarian.aspx?Item=a710e2c4-20f9-4df8-ba6c-2dc50c03bb75&Language=E&Section=ALL
