basepk,hid,speechdate,pid,opid,speakeroldname,speakerposition,maintopic,subtopic,subsubtopic,speechtext,speakerparty,speakerriding,speakername,speakerurl
4605407,ca.proc.d.2014-06-10.16259.98,2014-06-10,a71a1741-7ff2-4246-b0da-4622e96b10cf,1082,Mr. Guy Caron,Interjection,Government Orders,Business of Supply,Opposition Motion—Income Splitting,"Mr. Speaker, the question is appropriate. I addressed this to some extent in my speech, and I can expand upon it now.
Making life affordable for people is something we are very concerned about. The NDP has come up with a number of measures under the leadership of the member for Sudbury and the member for Québec, who are doing excellent work on this.
These measures are intended to help not only Canadian consumers with respect to credit cards and ATM fees, among other things, but also small and medium-sized enterprises, an important economic driver that is often overlooked in our economic policies.
This measure will cost the Canadian government over $3 billion in lost revenue. It is imperative to know how those surpluses should be allocated. Since 2006, Canada's debt has increased by 60%. Sixty per cent since 2006. We need to start recognizing this situation.
I know that the former finance minister, Mr. Flaherty, cared about this situation. That is probably one of the reasons why he voiced strong reservations about income splitting.
With any future budget surplus, the Canadian government must consider paying down the debt and possibly cutting taxes, which will benefit many Canadians, as well as reinvesting in public services. After the huge cuts, they really need it. They have often been misguided by various departments.",New Democratic Party,Rimouski-Neigette--Témiscouata--Les Basques,Guy Caron,http://www.parl.gc.ca/parlinfo/Files/Parliamentarian.aspx?Item=a71a1741-7ff2-4246-b0da-4622e96b10cf&Language=E&Section=ALL
4605408,ca.proc.d.2014-06-10.16259.99,2014-06-10,7ee20ab9-2d43-420c-8027-f6403cb498a2,9271,"Mr. Emmanuel Dubourg (Bourassa, Lib.)",,Government Orders,Business of Supply,Opposition Motion—Income Splitting,"Mr. Speaker, I would first like to say to my colleague that I listened with interest to his speech on income splitting.
I would like to know whether he thinks this measure is generating controversy among the Conservatives. Is he aware of anything like that?",Liberal,Bourassa,Emmanuel Dubourg,
4605409,ca.proc.d.2014-06-10.16259.100,2014-06-10,a71a1741-7ff2-4246-b0da-4622e96b10cf,1082,Mr. Guy Caron,Interjection,Government Orders,Business of Supply,Opposition Motion—Income Splitting,"Mr. Speaker, I thank my colleague from Bourassa for his question. I think this is the first time we have had the opportunity to talk directly to each other since his election to this institution.
Yes, I think the situation is a bone of contention, which has been widely reported in the media. The controversy did in fact start when Mr. Flaherty expressed serious reservations about whether income splitting was viable and appropriate. We then saw that the members of the Conservative caucus where very divided on it. There are some who are very much in favour of this measure. The voices supporting it are generally the ones of social Conservatives. That is because income splitting is an incentive. This measure is seen by a number of groups who are in favour of social conservatism in Canada as a measure that will encourage women to stay at home. 
Take, for example, people with incomes of $100,000 or $150,000. Whether we like it or not, income disparity in our society is still considerable. There are significantly more men than women with high incomes. Clearly, if women stay at home, income splitting will be possible, whereas if women work, the gains will not be nearly as great. That might explain why the social Conservatives are in favour of these measures and why the fiscal Conservatives are against them. The fiscal Conservatives, as we see here, want the government to eventually use the surplus to pay down the debt and reinvest in important public services. 
In that respect, I can indeed see a division within the Conservative caucus, and I look forward to seeing how our colleagues opposite will vote on this motion.",New Democratic Party,Rimouski-Neigette--Témiscouata--Les Basques,Guy Caron,http://www.parl.gc.ca/parlinfo/Files/Parliamentarian.aspx?Item=a71a1741-7ff2-4246-b0da-4622e96b10cf&Language=E&Section=ALL
4605410,ca.proc.d.2014-06-10.16259.101,2014-06-10,0fa70595-d7af-41f0-a0c9-4b7b8ebc1582,239,"Mr. James Rajotte (Edmonton—Leduc, CPC)",,Government Orders,Business of Supply,Opposition Motion—Income Splitting,"Mr. Speaker, I have so much respect for my colleague in this that I have to return to the subject.
The criticism from the other side is that targeted tax measures like income splitting, like pension income splitting, ought not to be done because they would not benefit the entire population. If we look at pension income splitting, that is true. It does not benefit people in my age group. If I look at my parents, they are both school teachers. They have pensions that are very similar. They do not benefit as much from the policy. However, there are many Canadians across this country who benefit from pension income splitting who are very positive on that. 
I think it is incumbent upon the official opposition to be very clear with respect to that policy. Would it reverse the policy of pension income splitting that was put in place by this government in 2006?
Frankly, if the NDP ever forms government, I could see the member as a possible minister of finance. He is going to have to make that decision. 
I think the NDP needs to be clear with Canadians as to where it stands. Does it support the pension income splitting that was put in place in 2006, and if not, would it seek to reverse that policy?",Conservative,Edmonton--Leduc,James Rajotte,http://www.parl.gc.ca/parlinfo/Files/Parliamentarian.aspx?Item=0fa70595-d7af-41f0-a0c9-4b7b8ebc1582&Language=E&Section=ALL
4605411,ca.proc.d.2014-06-10.16259.102,2014-06-10,a71a1741-7ff2-4246-b0da-4622e96b10cf,1082,Mr. Guy Caron,Interjection,Government Orders,Business of Supply,Opposition Motion—Income Splitting,"Mr. Speaker, I would like to thank the hon. member for his question and for his persistence. It is an important question.
I am not here to lay out the NDP's 2015 election platform. I think he will acknowledge that, just as I would not necessarily ask him to share the Conservatives' economic platform for the next election.
However, what I spoke about—because it needed to be done—was the nuts and bolts of these measures and how they would work. What we have here is a measure that benefits primarily those with the largest pensions, and I am sure he would acknowledge this. If the government believes that tax relief should truly benefit those who need it most, this measure is not as effective as it could be. A the very least, it needs to be calibrated differently.
I used this example to warn the government. If ever it is re-elected in 2015 and decides to move forward with this measure, it should be careful. People can expect that the negative impact on Canada's economy, Canada's tax situation and all Canadian households will be far different from the promises that were made.",New Democratic Party,Rimouski-Neigette--Témiscouata--Les Basques,Guy Caron,http://www.parl.gc.ca/parlinfo/Files/Parliamentarian.aspx?Item=a71a1741-7ff2-4246-b0da-4622e96b10cf&Language=E&Section=ALL
4605412,ca.proc.d.2014-06-10.16259.103,2014-06-10,106c623c-3606-40ae-a2f6-f4a619cf02f6,152,"Hon. Jason Kenney (Minister of Employment and Social Development and Minister for Multiculturalism, CPC)",,Government Orders,Business of Supply,Opposition Motion—Income Splitting,"Mr. Speaker, I am pleased to rise to speak to the official opposition's motion.
The government is obviously against the motion. The premise of the motion is incorrect. It states:
 That, in the opinion of the House, the drastic increase in income inequality under recent Liberal and Conservative governments harms Canadian society... 
There is no drastic increase in income inequality. Income inequality has not increased in Canada in recent years. On the contrary, income inequality has decreased in Canada in recent years.
The problem is that the motion is based on the NDP's political ideological. It is not based on data, facts or statistics, which clearly show that income inequality has decreased in Canada.
In fact, contrary to what the motion would suggest, we have seen a reduction, not an increase, in so-called income inequality in Canada. The truth is that in the past many years, the Canadian economy, notwithstanding the impact of the largest global recession since the 1930s, has done quite well, as a rising tide has lifted all boats.
We see that Canadians are generally better off in terms of their income. Canadians overall are significantly better off in terms of their net worth and assets. The lowest-income Canadians are better off as well. In fact they are closer to the mean than they used to be.
Child poverty is at an all-time low in Canada. The number of people living below the low-income cutoff, often referred to as the poverty line, has diminished. The government has eliminated nearly one million people from the tax rolls altogether, so they do not have to pay taxes, by increasing exemptions and other progressive measures in the tax system.
The entire premise of the NDP motion is incorrect. In fact, families at all income levels had higher incomes in 2011 than prior to the recession, according to Statistics Canada. With robust income growth, the share of Canadians living in low-income families was at 8.8%, according to the most recent figures, the lowest level in three decades. Let me repeat that. The number of Canadians living below the low-income cutoff line is at its lowest level in 30 years.
That is not my opinion. That is not a figment of my imagination. That is a fact based on data from Statistics Canada. I would invite my friends from the NDP to actually contend with the facts on this matter, rather than reciting stale and misleading talking points.
That is not to say that we should be satisfied.
Of course, as a society, as a government and as parliamentarians, we must always work to improve the living conditions and economic opportunities for all our citizens, including, and particularly, those living with low incomes.
That said, we need to recognize that we have made progress and that the percentage of Canadian families living below the low-income cutoff has diminished.
Indeed, the median real income of Canadians, and this is very important, according to the recent study conducted by the Luxembourg Income Study and The New York Times, hardly a Conservative house organ, indicated that for the first time in history, Canadian median family incomes have exceeded those of the United States.
The American dream was always considered the gold standard in terms of middle-class prosperity around the world. However, according to this recent exhaustive study of all the available data, the Canadian middle class is better off than its counterpart in any other major developed economy in the world, having exceeded that of the United States. This did not happen by coincidence or accident. It happened, of course, because of the hard work of Canadians but also because of the prudent economic policies of Canadian governments, and I would submit this government in particular, which has reduced enormously the tax burden on Canadian families. We have reduced the tax burden, through 160 separate tax relief measures, by an average of $3,400 for an average family of four per year. That is not cumulative. That is to say that year after year, the average Canadian family is paying $3,400 less in federal taxes than it did when our government came to office, and that happened because we made necessary but prudent decisions to better manage our spending and decided that taxpayers would come first. 
Here is the basic problem with the motion in front of us. The NDP's view is that government should come first and that we should feed the insatiable appetite of government bureaucracies and programs by taxing people more. That is what drives policies that lead to unemployment, stagnant incomes, and fewer economic opportunities. 
Fundamentally what this government believes at its core is that hard-working families know better how to spend an extra dollar than politicians or bureaucrats do. New Democrats have a different view. It is a defensible view. It is a view they sometimes obscure at election time, but their fundamental view is that they know better, as politicians, how to spend that extra dollar than working moms and dads do.
Take for example the issue of day care. The NDP and its Liberal friends on the left believe that we should raise taxes on hard-working Canadian families, so that they have to work harder and their after-tax disposable income shrinks, so that we can take that tax revenue, coercively taken from those families, and cycle it through the enormously expensive bureaucracy of the Ottawa government and then send it to the bureaucracies in the provincial governments, which will then cycle it through various programs. In the case of Manitoba, I recall the failed child care policy of the former Liberal government. What did it end up doing? It raised government union wage rates in the child care sector. It did not actually add a single child care spot.
Again, that is a defensible view. It is a view my friends on the other side will articulate. They believe that we should put more economic pressure on hard-working families, more stress, and reduce their take-home pay by increasing their taxes in order to cycle all of that money through two bureaucracies and send it back out in the form of a putative public benefit, when huge amounts of those resources have, in fact, been absorbed by administration and bureaucracy.
Our approach is different. Our approach is to leave the money in the hands of mom and dad in the first place, because we believe that they are the best experts with respect to child care, not government bureaucracies or politicians. That is why we introduced the universal child care benefit that sends a $100 cheque per child under the age of six to every family, which then gets to decide how to spend that themselves, rather than politicians and bureaucrats making that decision for them. It is very simple.
It is also why we raised, by the way, the basic personal exemption. One of the issues I am going to get to is so-called income splitting, what I call family tax fairness. Under the status quo and a Liberal unfair tax policy, it is unbelievable but true that they actually used to say that a spouse working outside the home was of greater value to our society and economy than a spouse working at home.
They reflected the perceived devaluation of dads and moms who work at home by having a lower spousal exemption in the tax code than the basic personal exemption. For a two-income family with one spouse out in the paid workforce and another at home in the unpaid workforce, guess what? The person in the paid workforce would get a higher basic personal exemption against their income taxes than the spouse at home in the unpaid workforce. What kind of weird mentality says that dads or moms who are at home taking care of their kids or their elder relatives are worth less for making what is for many of them a sacrificial decision for their families? 
We believe that they are serving the common good, that such dads and moms are making a choice that is best for their families, which we should respect and not penalize. We should respect the choices families make and not penalize them for making choices that they think are best for themselves. That is why this government eliminated that one dimension of family tax unfairness when we raised the basic spousal exemption to be equivalent to the basic personal exemption.
 These are some of the reasons we have seen an increase in average family income and net worth. In fact, the median net worth of Canadian families has increased by 45% in real inflation-adjusted terms since 2006. Canadian children from poor families have a higher probability of moving up the income scale than in such comparable countries as the U.S., U.K., France, or Sweden. That is to say, not only do we have fewer Canadian families and children living in poverty than before, and not only are we at a record low in child poverty in this country, but we have greater upward social mobility for those families. We actually do have the Canadian dream. 
This is what The New York Times was so astonished by when this study came out last month. The so-called American dream, the notion of upward mobility for low-income families, had become much more of a dream than a reality. However, here in Canada, it is a reality. We continue to have a society characterized by such upward social mobility.
The facts are that the middle class in Canada is doing better. There are fewer poor families and fewer poor children and less income inequality, regardless of what the opposition says.
I would like to talk about the second part of the NDP's motion, which states:
 ...and that the House express its opposition to the Conservative income splitting proposal which will make this problem worse and provide no benefit to 86% of Canadians. 
Once again, the premise of the motion is incorrect. The New Democrats are wrong. They are mistaken.
With the premise of this motion, the opposition is simply wrong.
I find it very interesting that in the political rhetoric and positioning of the NDP, those members always talk about working families. The late Jack Layton, whose memory we honour, always focused on kitchen-table economics. In the last election, he visited a lot of families around their kitchen tables. Yet the position of the NDP here today could not be clearer. It does not actually support the family as an economic unit. Those members actually think that some families should be actively discriminated against through unfair preferences in the tax code. We fundamentally disagree.
That is why, in our 2011 election platform, the Conservative Party of Canada committed that if we balanced the budget, we would, at the end of our mandate, introduce family tax fairness by allowing splitting of income between two-parent families.
As the Prime Minister has done, I am pleased to reconfirm that it is absolutely our intention to keep that commitment that we made to Canadians in the last election to introduce family tax fairness, to end the discrimination against certain families, to end the unfairness. 
How do we do that? I would like to accept the rhetoric of the NDP position and turn it into policy substance. When New Democrats talk about kitchen table economics and the importance of supporting working families, we do not just do that rhetorically, we want to do that substantively. We do not want to do it as a political tactic or trick. We want to do it by amending the tax code to say that we will treat the family as an economic unit, because after all, it is an economic unit. Is that not the point? Dads and moms who arrange their affairs together as couples with kids or other dependents are making a choice to share their property, to share their income, to share the burdens of life. In so doing, they become the best social programs, the best schools, the best crime prevention programs in raising children.
There is no social program that produces stronger social outcomes than a strong family. Can we all agree on that? We should be honouring and respecting the often difficult and sacrificial choices that families make. That is what family tax fairness through income splitting seeks to do.
What does this mean? Right now, perhaps a dad in a family decides to stay at home to take care of young, pre-school children, or perhaps elderly dependent parents who are living with the family, and we will see more and more of that with the aging of our society. His wife or his spouse goes out and works and makes, let us say, $75,000 a year, which is not much above the average income level in Canada. I do not know why New Democrats are laughing. It is a lot less than they make as MPs. If the wife is the income earner making $75,000 a year and dad is at home taking care of young kids or maybe elderly parents, they end of paying 30% more in taxes, $2,000 more in taxes than a family making the same amount of revenue with both parents in the paid workforce.
What this so-called preference, what this discrimination, what this unfairness does is say that the work the dad puts in at home does not have any economic value. The government says it is worth nothing.
I am not just saying this. I will never forget being in the opposition as revenue or finance critic asking the Liberal government why they permitted this tax unfairness against such families. The then minister of state for finance, the hon. Jim Peterson, for whom I have great regard, committed the ultimate political gaffe. He accidentally told the truth. He actually said the government believed that stay-at-home parents were not working. I guess he had never met a stay-at-home dad or mom, because they work harder than most of us do every single day of the week and they deserve our recognition and our support.
That is why the Royal Commission on Taxation in 1966 recommended that the appropriate tax unit should be the family, as the income and expenditure of two individuals are not independent when they live together. That is why the Royal Commission on the Status of Women, 60 years ago, supported elective joint taxation, voluntary income splitting. It is why the U.K. and France and most other developed countries treat the family unit as an economic unit for purposes of taxation.
It is about time that we said we value families, we support the choices they make, and we will end the unfairness. Will the opposition join us in that?",Conservative,Calgary Southeast,Jason Kenney,http://www.parl.gc.ca/parlinfo/Files/Parliamentarian.aspx?Item=106c623c-3606-40ae-a2f6-f4a619cf02f6&Language=E&Section=ALL
4605413,ca.proc.d.2014-06-10.16259.104,2014-06-10,031462db-8f61-48ed-bf9f-b033eb8312bb,75,"Mr. Nathan Cullen (Skeena—Bulkley Valley, NDP)",,Government Orders,Business of Supply,Opposition Motion—Income Splitting,"Mr. Speaker, essentially the minister said that income inequality is not a problem. Let us look at the statistics from Statistics Canada. Median income from 1976 to just a couple of years ago grew by a staggering 0.2% for the middle class. In 2002, the average CEO in Canada earned 84 times what the average worker in that same company earned. Flash forward 10 years later, just a couple of years ago, that went up to 122 times the amount for the CEO as compared to the worker. In 1982, the top 1% earned 7% of all of Canada's income. Now that same group earns 12%. We have seen median wages stagnate over that same period, but the minister denies that.
 Let us get to income inequality, which his colleagues ignored. Let us talk about who does not benefit from my friend's myopic vision of the world. People who make under $44,000 a year do not benefit. Would a couple who make $44,000 each but are both in the same tax bracket benefit? Absolutely not. Single parents do not benefit. People who do not have kids do not benefit. People who are divorced do not benefit. Of all Canadians, 86% do not benefit from this $5-billion tax scheme.
The Conservatives have the audacity to talk about fairness. What about the 86%? What about the idea that fairness should apply to all as opposed to this very narrow scheme that costs so much money, skews to the wealthy, and leaves out more than 85% of this country?",New Democratic Party,Skeena--Bulkley Valley,Nathan Cullen,http://www.parl.gc.ca/parlinfo/Files/Parliamentarian.aspx?Item=031462db-8f61-48ed-bf9f-b033eb8312bb&Language=E&Section=ALL
4605414,ca.proc.d.2014-06-10.16259.105,2014-06-10,106c623c-3606-40ae-a2f6-f4a619cf02f6,152,Hon. Jason Kenney,Interjection,Government Orders,Business of Supply,Opposition Motion—Income Splitting,"Mr. Speaker, there we have it, the finance critic for the official opposition, for the NDP, saying that families making $50,000, $60,000, $70,000 a year are wealthy. If I were making $60,000 a year, like most public sector union members who are the core of the NDP's constituency, I would be terrified of this guy becoming the finance minister because he thinks they are wealthy. We know that means that the NDP would impose bigger taxes.
We heard the same thing from the leader of the Liberal Party. He said he would not impose taxes on the middle class. Then when he was asked to define the middle class, he said that it excludes people who have assets like seniors on fixed incomes.
The data is clear. In the past decade there has been shrinking income inequality, fewer children living under the low-income cut-off than ever in our history, and the lowest level of families under the LICO in 30 years.
I have a question for my NDP friend. If he were in government would he repeal income splitting for pensioners?",Conservative,Calgary Southeast,Jason Kenney,http://www.parl.gc.ca/parlinfo/Files/Parliamentarian.aspx?Item=106c623c-3606-40ae-a2f6-f4a619cf02f6&Language=E&Section=ALL
