basepk,hid,speechdate,pid,opid,speakeroldname,speakerposition,maintopic,subtopic,subsubtopic,speechtext,speakerparty,speakerriding,speakername,speakerurl
4605672,ca.proc.d.2014-06-10.16259.363,2014-06-10,6519cfba-0080-419d-baa9-8ae6e56d032f,256,The Speaker,,,"Main Estimates, 2014-15",Concurrence in Vote 1--Senate,"I would give the floor to the hon. member for Bonavista—Gander—Grand Falls—Windsor, but I am worried that there are may be other conversations going on that might distract him. However, if I get the sense that things are calming over there, I will give the floor to the hon. member for Bonavista—Gander—Grand Falls—Windsor.",Conservative,Regina--Qu'Appelle,Andrew Scheer,http://www.parl.gc.ca/parlinfo/Files/Parliamentarian.aspx?Item=6519cfba-0080-419d-baa9-8ae6e56d032f&Language=E&Section=ALL
4605673,ca.proc.d.2014-06-10.16259.364,2014-06-10,d282a075-d49f-40b7-ab6d-64455eb9a5a8,265,"Mr. Scott Simms (Bonavista—Gander—Grand Falls—Windsor, Lib.)",,,"Main Estimates, 2014-15",Concurrence in Vote 1--Senate,"Mr. Speaker, I just have a quick question. The very nub of this issue is to deny the money that goes to fund the activities within the Senate. Does the member realize, too, is that it would also defund people who work for the Senate, and that many of the employees are unionized?",Liberal,Bonavista--Gander--Grand Falls--Windsor,Scott Simms,http://www.parl.gc.ca/parlinfo/Files/Parliamentarian.aspx?Item=d282a075-d49f-40b7-ab6d-64455eb9a5a8&Language=E&Section=ALL
4605674,ca.proc.d.2014-06-10.16259.365,2014-06-10,50a18bf1-9be3-4563-b657-6af367453ba0,11,Mr. Charlie Angus,Interjection,,"Main Estimates, 2014-15",Concurrence in Vote 1--Senate,"Mr. Speaker, that is fascinating. I thought that the only party that had any unionized staff was the New Democratic Party, so I am fascinated about the Senate.
The issue here is that this is a complete side issue. Notice that the Liberals are now suddenly defending the working people who had to carry the bags for Senator Mac Harb when he was going off on his international journeys as a lobbyist for Niko Resources. We are talking about holding that bunch to some level of financial accountability, but we never, ever hear a Liberal stand up and talk about the financial accountability of their cronies, because they filled that place with their bagmen and their operators.
This has been the system of corruption that they created. Now we have them standing up tonight and saying that they are suddenly concerned about the hard-working secretaries. My God. The gall.",New Democratic Party,Timmins--James Bay,Charlie Angus,http://www.parl.gc.ca/parlinfo/Files/Parliamentarian.aspx?Item=50a18bf1-9be3-4563-b657-6af367453ba0&Language=E&Section=ALL
4605675,ca.proc.d.2014-06-10.16259.366,2014-06-10,2576a113-8173-4faf-9a51-558c6087a2a1,8406,"Mr. Robert Chisholm (Dartmouth—Cole Harbour, NDP)",,,"Main Estimates, 2014-15",Concurrence in Vote 1--Senate,"Mr. Speaker, I have only been in the House for three years, so I have not had the opportunity to hear the member for Timmins—James Bay go on about this issue in the way that he has, and to clearly articulate what the problems are with the Senate. In this forum, we are talking about holding some accountability on $92 million and the fact that not only will the government not respond, but the Liberal Party will not respond as to why Canadians deserve to have some answers and understand why we do not have a better sense of control over that $92 million.
Could the member explain to us why these two parties continue to fight to protect the Senate and that $92 million of taxpayers' money that gets flushed down the toilet every single year?",New Democratic Party,Dartmouth--Cole Harbour,Robert Chisholm,http://www.parl.gc.ca/parlinfo/Files/Parliamentarian.aspx?Item=2576a113-8173-4faf-9a51-558c6087a2a1&Language=E&Section=ALL
4605676,ca.proc.d.2014-06-10.16259.367,2014-06-10,50a18bf1-9be3-4563-b657-6af367453ba0,11,Mr. Charlie Angus,Interjection,,"Main Estimates, 2014-15",Concurrence in Vote 1--Senate,"Mr. Speaker, I would like to thank my hon. colleague for understanding the fundamental issue before us tonight. We are not talking about defying the Supreme Court. We are talking about our job as the elected members of this House representing the taxpayers of this country to establish some manner of rules.
We have given the crowd in the so-called upper chamber 150 years to reform themselves. They refused. When the Accountability Act was brought in, they said that they were exempt from it. They limited the ability of the investigative officer, the ethics officer for the Senate, to even begin an investigation without their permission. That is how defiant they are. They believe that they are above us.
If we look at the House of Lords, they only get paid if they show up. They only get a per diem. That is not a bad model. That has nothing to do with the constitutionality of the Senate. We have to put the financial spending of the Senate on the table, because every Canadian has been told to tighten the belt. Every Canadian has been told that the cupboard is bare.
My hon. Liberal colleagues said nothing about the fact that the government is going after the pensions of civil servants, or the fact that people have to make their medical payments when they retire. The crowd over in the Senate—",New Democratic Party,Timmins--James Bay,Charlie Angus,http://www.parl.gc.ca/parlinfo/Files/Parliamentarian.aspx?Item=50a18bf1-9be3-4563-b657-6af367453ba0&Language=E&Section=ALL
4605677,ca.proc.d.2014-06-10.16259.368,2014-06-10,2576a113-8173-4faf-9a51-558c6087a2a1,8406,Mr. Robert Chisholm,Interjection,,"Main Estimates, 2014-15",Concurrence in Vote 1--Senate,EI.,New Democratic Party,Dartmouth--Cole Harbour,Robert Chisholm,http://www.parl.gc.ca/parlinfo/Files/Parliamentarian.aspx?Item=2576a113-8173-4faf-9a51-558c6087a2a1&Language=E&Section=ALL
4605678,ca.proc.d.2014-06-10.16259.369,2014-06-10,50a18bf1-9be3-4563-b657-6af367453ba0,11,Mr. Charlie Angus,Interjection,,"Main Estimates, 2014-15",Concurrence in Vote 1--Senate,"Mr. Speaker, EI. There was $57 billion that the Liberals stole from hard-working people. They probably gave it to the Senate for all we know, because there is no accountability. That is the issue
The bigger issue is the fact that senators can sit on the boards of all matter of corporations. Why waste money if people are lobbyists? Do not waste money trying to buy a lowly member of Parliament; just go and appoint a senator to the board of directors and get all of the august pooh-bahs of the great Liberal establishment to sit on all of those boards. They are in telecommunications, banking, and pharmacies. They have been doing it for years—",New Democratic Party,Timmins--James Bay,Charlie Angus,http://www.parl.gc.ca/parlinfo/Files/Parliamentarian.aspx?Item=50a18bf1-9be3-4563-b657-6af367453ba0&Language=E&Section=ALL
4605679,ca.proc.d.2014-06-10.16259.370,2014-06-10,6519cfba-0080-419d-baa9-8ae6e56d032f,256,The Speaker,,,"Main Estimates, 2014-15",Concurrence in Vote 1--Senate,"Order, please. We will move on to the next member.
Resuming debate, the hon. member for Bonavista—Gander—Grand Falls—Windsor.",Conservative,Regina--Qu'Appelle,Andrew Scheer,http://www.parl.gc.ca/parlinfo/Files/Parliamentarian.aspx?Item=6519cfba-0080-419d-baa9-8ae6e56d032f&Language=E&Section=ALL
4605680,ca.proc.d.2014-06-10.16259.371,2014-06-10,d282a075-d49f-40b7-ab6d-64455eb9a5a8,265,"Mr. Scott Simms (Bonavista—Gander—Grand Falls—Windsor, Lib.)",,,"Main Estimates, 2014-15",Concurrence in Vote 1--Senate,"Mr. Speaker, the issue here is regarding the votes in funding the institutions that we have in this country, such as the Senate in this particular case, and denying the funds. I questioned the member earlier about the money surrounding the support staff because that is a pertinent question. The vote we are having denies the funding of that institution. That includes not just the senators, but the support staff as well. I am not sure the member understood the gist of my question.
What was said about the behaviour of many of the senators, in many cases, yes, nefarious in many of these instances and I agree with his outrage in many cases. Is the Senate in a situation right now where it is becoming more accountable? Yes, it is, but we all are as parliamentarians.
The complaint was that some senators were out campaigning on public funds. Imagine that. That is a violation of the money that we are receiving here from taxpayers to do our jobs. We cannot take this money and go out and campaign. My hon. colleague who just spoke was in Labrador during the byelection. Perhaps he could explain to us how that was paid for. And several other members from the NDP were there. Were the flights and meals covered by the party itself? Just asking.
I would also like to talk about the Senate and the Supreme Court decision, but one of the things that disturbs me beyond the question that is being asked about the funding of the Senate itself is regarding the fundamental concept of the sober second thought, the original concept of the Senate way back when. I know my colleague from the NDP talked about it. It was originally set up to protect the rich. If we go to the Debates, yes, a lot of these upper-middle-class people comprised the Senate, but really it was about sober second thought and the binding of regions in a very large country. The regions being Ontario, Quebec, and the three Maritime provinces.
 When we started with the Constitution there had been several amendments to the Constitution pertaining to many aspects of Parliament. How do we change the Constitution in the future? My Conservative friend from Ontario earlier talked about a concept of what is contained within the Constitution Act, 1982, sections 38 to 44, which talks about how we can change the Constitution pertaining to the Senate. Do we have an elected Senate or do we have an abolished Senate? I use those two examples for very good reason.
The Conservatives want to have an elected Senate. I am sorry if I am paraphrasing too much. The NDP members want to abolish the Senate, which I do not think I am paraphrasing, I think that is about it. Fundamentally what the Supreme Court said was in order to do this, according to the Constitution and the federation that we are in, we need permission of the legislatures of each of the provinces in this country, along with Parliament's okay.
Earlier I talked about the NDP members getting rid of the Senate and that was not true. I was mistaken. They go way back. They talked about it from the very beginning even when they were the CCF. What I take issue with is that the concept of bringing the provinces into this conversation about getting rid of the Senate never took place. Where is the work to be done in order to abolish the Senate? I joked that for many members of the NDP it became a Twitter campaign, “let's abolish the Senate #disingenuous”, but the problem is the work was not done. 
I do not know of any conversation that the federal party has had with provinces to decide how to deal with the Senate, not just abolishing it but electing it, appointing it, nine-year terms, 13-year terms, all the concepts that were upheld by the Supreme Court in its recent decision. People were shocked and said they could not believe the Supreme Court would say that all provinces were needed to abolish the Senate. I am not a constitutional lawyer and I am not surprised that is what it said. Nobody was. Yet it became a campaign in doing something that is just not possible to do.
Let us put aside the element of sober second thought and whether this is fundamental to our country. Provinces got rid of their senates, other countries get rid of their upper chambers, that is true, but in order to have that conversation in this country, it seems to me that the two parties never opened that conversation, never opened the idea of conversing about getting rid of the Senate or electing the Senate.
Every now and then there would be a musing from a province about what it wanted to do. The premier of Saskatchewan wanted to abolish the Senate. Why did he say that? I do not know. Certainly the NDP never asked. He just came out with it and volunteered the information. Other provinces had the same reservations. Other provinces wanted an elected Senate, but nobody was really engaged in that conversation whatsoever.
Let me return to what the Supreme Court said. For fundamental changes in the Constitution, how we change the Constitution, one says that we need seven out of 10 provinces that represent over 50% of the population. Ergo, we come into the idea of an elected Senate, or a consulted one, like how the Prime Minister consults with the public. What the Prime Minister wanted to happen was to allow the provinces to run these elections. I did not see any first ministers conference by the current Prime Minister, stating, “Oh, by the way, this is what we want you to do”. Therefore, it was more of a conversation of, “We think this is a good idea, now come on you people, get on with it”. 
When the Prime Minister talks about starting a conversation with the provinces, he does not start conversations with provinces. He starts arguments with provinces. In this case, with the NDP, it is an ignored argument. It is an ignored conversation. It is one thing if they were able to do it, if they were able to unilaterally make the changes of getting rid of the Senate and not bother talking to the provinces. That is one thing. Someone could call that being very brazen, to say the least, very arrogant, but they cannot even do that.
For years, was it not incumbent upon a federal party such as the NDP to even ask how it could do it? We always use the expression the ends justify the means. This end was not going to happen because the means would not justify it to happen. It is almost like the Constitution did not exist. It was like an imaginary piece of paper that hung on the wall like some kind of glorified magna carta that people looked at as some kind of map and said, “This is what we used to be”. The Constitution is not what we used to be, the Constitution is what we are. It is a living, breathing document that we use to govern our country. 
Ergo, in 1982, we received the Charter of Rights and Freedoms for that very reason. It was not just an add-on to say this is a nice thing to say, it was an add-on because the courts could use it, and we as legislators must adhere to it, which was illustrated by a few of their decisions recently, certainly in the past two years. That is why I say #disingenuous.
Certainly somebody in the party had to say at some point, “We can't do this”. Therefore, what do we do? Now we are going to say, “Let's make sure the Senate does not get money in order to operate”. What the hell is that going to do? Seriously. It gets to the point where it is like if we lose the game, we take our ball and go home, except we do not even go home, we just side on the sidelines and pout with ball in hand. “Fine. We are not going to give you the ball. We're going to sit here, but we're not going to give you the ball”.
Sometimes debate in this House elevates itself to a level where it becomes informative. Then there is the debate that degrades itself into becoming absolutely ridiculous. It is the theatre of the absurd. If we want to make a statement, the statement was already said by them. Again, I acknowledge the fact that it is not a recent thing for the NDP/CCF. It goes way back. However, the question was always “what” as opposed to “how”.
They knock our party for not having ideas on certain issues. This is the longest non-idea issue they have ever had. It absolutely is bereft of any road map, of any GPS, of anything. We are going to do this just because. I am going to take a long walk on a short wharf just because. I am not going to tell people how I am going to do it. It is just going to happen. It becomes this argument they put up every now and then based on the lowest common denominator.
 They brought out the names of the people who cheated the Senate in the worst kind of way, and I agree with them that it was the worst kind of way. What happened was a dereliction of duty, to put it mildly, but it was also something that was an absolute disgrace for the Canadian taxpayer. 
Recently there have been actions by all parties. Some people get in trouble and get ejected from caucus. That happens. It has happened recently to them. Would I disband the NDP? No. However, for some reason, they can take the lowest common denominator and extrapolate it to a solution, which is to just get rid of them.
 They say it has no democratic value whatsoever, but actually, their idea of abolishing the Senate flies in the face of democratic values. If we abolish the Senate, a vote has to take place, not just in this legislature but also in 10 legislatures across this country. Each legislature of course has a mandate from the people. If the elected people of, say, the greatest province, Newfoundland and Labrador, bias accepted—",Liberal,Bonavista--Gander--Grand Falls--Windsor,Scott Simms,http://www.parl.gc.ca/parlinfo/Files/Parliamentarian.aspx?Item=d282a075-d49f-40b7-ab6d-64455eb9a5a8&Language=E&Section=ALL
4605681,ca.proc.d.2014-06-10.16259.372,2014-06-10,90949cbf-d62b-4701-9523-b589b86bb2d8,8700,Hon. Chris Alexander,,,"Main Estimates, 2014-15",Concurrence in Vote 1--Senate, And the last province.,Conservative,Ajax--Pickering,Chris Alexander,http://www.parl.gc.ca/parlinfo/Files/Parliamentarian.aspx?Item=90949cbf-d62b-4701-9523-b589b86bb2d8&Language=E&Section=ALL
4605682,ca.proc.d.2014-06-10.16259.373,2014-06-10,d282a075-d49f-40b7-ab6d-64455eb9a5a8,265,Mr. Scott Simms,,,"Main Estimates, 2014-15",Concurrence in Vote 1--Senate," Yes, you're right.
Mr. Speaker, let us say the people of Newfoundland and Labrador, through their elected representatives, the members of the House of Assembly, vote to keep the Senate. What would be the answer from the NDP? It would be “sorry, too bad; unilaterally we do not care about your vote”. Let us assume that they want to do a referendum. Now we are talking. If that is what they want to do, to me that is the only thing I can see the NDP doing. My question is this. Would they have a referendum across the nation, like the Charlottetown Accord? According to the Supreme Court in its recent decision, they need unanimity to get rid of the Senate, unanimity of all provinces. Therefore, they have to have a referendum in each and every province.",Liberal,Bonavista--Gander--Grand Falls--Windsor,Scott Simms,http://www.parl.gc.ca/parlinfo/Files/Parliamentarian.aspx?Item=d282a075-d49f-40b7-ab6d-64455eb9a5a8&Language=E&Section=ALL
4605683,ca.proc.d.2014-06-10.16259.374,2014-06-10,07cf5767-802c-406c-92a7-7dc92af79b40,4264,Mr. Kevin Lamoureux,,,"Main Estimates, 2014-15",Concurrence in Vote 1--Senate, And pass them.,Liberal,Winnipeg North,Kevin Lamoureux,http://www.parl.gc.ca/parlinfo/Files/Parliamentarian.aspx?Item=07cf5767-802c-406c-92a7-7dc92af79b40&Language=E&Section=ALL
4605684,ca.proc.d.2014-06-10.16259.375,2014-06-10,d282a075-d49f-40b7-ab6d-64455eb9a5a8,265,Mr. Scott Simms,,,"Main Estimates, 2014-15",Concurrence in Vote 1--Senate," They would have to pass them, I might add. Good luck.
Mr. Speaker, the hon. colleague from Timmins—James Bay talked about one of the solutions in the House of Lords: they show up and they get a per diem. It is about time; it is an idea to change the Senate that could be feasible. It is the first time I have heard it in the 10 years I have been here. If they do not like them, they get rid of them.
They constantly go on about the corruption aspect of the Senate. As I said, the lowest common denominator that existed in there is absolutely deplorable. Deal with it, which is what we need to do with transparency. It could be something like proactive disclosure. Proactive disclosure goes further than what is required for transparency. We did it. The Conservatives did it. What was the last party to say no, it was not going to do that? It has not done it yet.",Liberal,Bonavista--Gander--Grand Falls--Windsor,Scott Simms,http://www.parl.gc.ca/parlinfo/Files/Parliamentarian.aspx?Item=d282a075-d49f-40b7-ab6d-64455eb9a5a8&Language=E&Section=ALL
4605685,ca.proc.d.2014-06-10.16259.376,2014-06-10,07cf5767-802c-406c-92a7-7dc92af79b40,4264,Mr. Kevin Lamoureux,,,"Main Estimates, 2014-15",Concurrence in Vote 1--Senate, They will accept it kicking and screaming.,Liberal,Winnipeg North,Kevin Lamoureux,http://www.parl.gc.ca/parlinfo/Files/Parliamentarian.aspx?Item=07cf5767-802c-406c-92a7-7dc92af79b40&Language=E&Section=ALL
4605686,ca.proc.d.2014-06-10.16259.377,2014-06-10,d282a075-d49f-40b7-ab6d-64455eb9a5a8,265,Mr. Scott Simms,,,"Main Estimates, 2014-15",Concurrence in Vote 1--Senate," Right, Mr. Speaker.
They can practice what they preach, or they can just keep preaching. Either way, they are preaching from an empty book.
If we look at this argument about the Senate, again I go back to the fact that there was never a road map. There was never a way of getting rid of the Senate. There was a promise that abolishing the Senate would be taken care of.
As I mentioned earlier, one idea was brought up, and it was the first time I had heard of it. The Supreme Court, in its decision, said that there is a fundamental way to do it so that the federation is involved in the decision. The one thing that has to be done is that all the provinces have to agree to get rid of the Senate. Instead, what we got was that they could not do it, and therefore we should just give up on the argument. Let us just not bother.
What the New Democrat members are going to do today is vote to deny money going to Senate. Is it just me, or is that the first time that has ever been said in this House? I am just trying to illustrate the point here.
The New Democrats can lash out in anger in all different directions, madly off in all directions, I might add, but at the end of the day, if it is not feasible, it has fed into an untruth. If they want to have a conversation about the Senate, why do they start with an argument or a campaign or illustrate the most nefarious factor of an organization?
The New Democrats complained during many of the immigration bills brought in over the past little while. They said that what the Conservatives were doing was basing their theory, their logic, and their legislation on a small minority of bad things that happened. Is that not what the New Democrats are doing here with the Senate?
 Let us assume for a moment that the Liberals want to either elect the Senate or get rid of the Senate. Let us assume that for a moment. At least we are starting with a conversation about how to change it to get the most nefarious factor, the lowest common denominator in the Senate, out.
 However, we did not ignore the family. We did not ignore the people who built this nation, not just this House but 10 legislatures across this country that played a fundamental role in building this country, with provincial jurisdiction for health care, education, and other areas that are so vitally important. It is as if they did not exist altogether. 
If that is the argument about the fundamental existence of the Senate, then surely there has to be room for a mature conversation about how we are doing it.
The Prime Minister tried to get around the fundamental elements, which were illustrated in the Supreme Court decision, of how to have an elected Senate. At least there was some element of trying to do something the Conservatives thought might fly. It did not work.
Now what we need to do is have a discussion with the provinces, which is fundamentally lacking in this House, about how we deal with the question of the Senate.",Liberal,Bonavista--Gander--Grand Falls--Windsor,Scott Simms,http://www.parl.gc.ca/parlinfo/Files/Parliamentarian.aspx?Item=d282a075-d49f-40b7-ab6d-64455eb9a5a8&Language=E&Section=ALL
4605687,ca.proc.d.2014-06-10.16259.378,2014-06-10,1d344f9b-3ba2-4b25-bd54-ea0ef1ec3ab0,617,"Mr. John Weston (West Vancouver—Sunshine Coast—Sea to Sky Country, CPC)",,,"Main Estimates, 2014-15",Concurrence in Vote 1--Senate,"Mr. Speaker, I was very interested in my colleague's comments. I know that a lot of Conservatives, and perhaps members of other parties, are interested in Senate reform, including making the Senate more democratic with elected members and perhaps making it more representative.
May I ask the hon. member whether there has been any progress with the Supreme Court's decision and whether the road to Senate reform is now clearer?",Conservative,West Vancouver--Sunshine Coast--Sea to Sky Country,John Weston,http://www.parl.gc.ca/parlinfo/Files/Parliamentarian.aspx?Item=1d344f9b-3ba2-4b25-bd54-ea0ef1ec3ab0&Language=E&Section=ALL
