basepk,hid,speechdate,pid,opid,speakeroldname,speakerposition,maintopic,subtopic,subsubtopic,speechtext,speakerparty,speakerriding,speakername,speakerurl
4605568,ca.proc.d.2014-06-10.16259.259,2014-06-10,4f75a958-c69f-4762-a668-856a7ee16207,1816,"Mr. Raymond Côté (Beauport—Limoilou, NDP)",,Government Orders,Business of Supply,Opposition Motion—Income Splitting,"Mr. Speaker, I thank my colleague for his speech, even though it was just a long series of slogans. It did not contain any facts, except for when he was bragging about the supposed measures that would help the middle class.
Let us get down to business. The fact of the matter is that the middle class has been deeply in debt for many years. Under this government, household debt has increased and reached 165% of income. This is a very significant indicator of the poor financial health of Canadian households.
However, the government keeps pushing for tax cuts, especially for corporations, which cost the treasury tens of billions of dollars. It dramatically increased the amount of dead money in companies' coffers, which did absolutely nothing to stimulate the Canadian economy. On the contrary, incomes are still stagnating. 
How can I make my colleague understand that he is on the wrong track? How can I make him realize how bad the situation is for the majority of Canadian households?",New Democratic Party,Beauport--Limoilou,Raymond Côté,http://www.parl.gc.ca/parlinfo/Files/Parliamentarian.aspx?Item=4f75a958-c69f-4762-a668-856a7ee16207&Language=E&Section=ALL
4605569,ca.proc.d.2014-06-10.16259.260,2014-06-10,f66407a4-934e-4c46-b524-b4dacd035ceb,613,Mr. Andrew Saxton,Interjection,Government Orders,Business of Supply,Opposition Motion—Income Splitting,"Mr. Speaker, my hon. colleague talks about household debt, and yes, household debt is a concern. The majority of that debt is in mortgages. That is an investment that will be going up in value over the years. With low interest rates, Canadians are able to afford that. 
We have also been cautioning Canadians that interest rates will eventually go up, and they should be prepared for that scenario. When it comes to the actual net worth of Canadian families, Statistics Canada found that the median net worth of Canadian families has actually risen by almost 45% since 2005. This is a significant improvement in the wealth of Canadian families, who are benefiting from the policies of our Conservative government.
The proof is in the numbers. We have lowered taxes over 160 times, and the average Canadian family will have $3,400 more in its pockets this year than it would have had under the previous government. ",Conservative,North Vancouver,Andrew Saxton,http://www.parl.gc.ca/parlinfo/Files/Parliamentarian.aspx?Item=f66407a4-934e-4c46-b524-b4dacd035ceb&Language=E&Section=ALL
4605570,ca.proc.d.2014-06-10.16259.261,2014-06-10,43e39949-6902-4d38-a760-fb83c0132de4,122,"Hon. Gary Goodyear (Minister of State (Federal Economic Development Agency for Southern Ontario), CPC)",,Government Orders,Business of Supply,Opposition Motion—Income Splitting,"Mr. Speaker, one of the problems we have here is that members ask for more debate, but then they do not listen to the debate or they do not show up for the debate. 
The member just gave a great speech about the totality of the taxation reductions the government has given. He used the number 160, which is the number I use, but I have just done a little more research, and it is actually 180 times our government has lowered taxes for Canadians. 
This is just another opportunity to lower taxes for Canadians. We have done it for seniors. We have done it for families. We have done it for children. We have done it for students. I know that students in Canada can now earn just over $20,000 without paying any federal tax. That takes individual policy changes. Here we are talking about yet one other opportunity to lower taxes for Canadians to continue our government's plan to improve the quality of life for Canadians. 
I wonder if the member could mention one more time how much the average family in Cambridge and North Dumfries is saving as a result of this side of the House voting yes to tax cuts, but unfortunately, that side continuing to vote no. ",Conservative,Cambridge,Gary Goodyear,http://www.parl.gc.ca/parlinfo/Files/Parliamentarian.aspx?Item=43e39949-6902-4d38-a760-fb83c0132de4&Language=E&Section=ALL
4605571,ca.proc.d.2014-06-10.16259.262,2014-06-10,f66407a4-934e-4c46-b524-b4dacd035ceb,613,Mr. Andrew Saxton,Interjection,Government Orders,Business of Supply,Opposition Motion—Income Splitting,"Mr. Speaker, my hon. colleague was absolutely correct. In fact, we have reduced taxes almost 180 times since this speech was written. This shows how quickly we are lowering taxes for all Canadians.
To answer his question specifically, we have lowered taxes. The average Canadian family will have $3,400 more in their pockets at the end of 2014 as a result of our low-tax plan for Canadian families.
In addition, I should also point out that Canadian families at all income levels have seen increases of about 10% or more in their real after-tax, after-transfer income since 2006. It is the lowest-income families that have benefited the most, with a 14% increase in that period of time.",Conservative,North Vancouver,Andrew Saxton,http://www.parl.gc.ca/parlinfo/Files/Parliamentarian.aspx?Item=f66407a4-934e-4c46-b524-b4dacd035ceb&Language=E&Section=ALL
4605572,ca.proc.d.2014-06-10.16259.263,2014-06-10,4f75a958-c69f-4762-a668-856a7ee16207,1816,"Mr. Raymond Côté (Beauport—Limoilou, NDP)",,Government Orders,Business of Supply,Opposition Motion—Income Splitting,"Mr. Speaker, I listened to what the Minister of State for the Federal Economic Development Agency for Southern Ontario had to say and the question he asked the Parliamentary Secretary to the Minister of Finance, and it was rather unbelievable.
It is all very well to list 180 tax measures, even though some are still very marginal, but this does not address the heart of the matter. The indicators are very clear and the situation has deteriorated rather quickly. There has also been a dramatic increase in income inequality, and it has happened much more quickly in Canada than in the United States, regardless of what the studies might suggest.
Let us be sure to put things in perspective properly because some studies—and I know which study the hon. member was talking about—can skew information. In the meantime, Statistics Canada has found that the middle class has been hard hit and the decline is far from slowing down. The foundation of our motion has to do with the growing income inequality. Income splitting will only help the rich because more than 90% of households will not benefit or will only slightly benefit from this measure.
Why is this government trying to do everything it can to help the wealthy?",New Democratic Party,Beauport--Limoilou,Raymond Côté,http://www.parl.gc.ca/parlinfo/Files/Parliamentarian.aspx?Item=4f75a958-c69f-4762-a668-856a7ee16207&Language=E&Section=ALL
4605573,ca.proc.d.2014-06-10.16259.264,2014-06-10,f66407a4-934e-4c46-b524-b4dacd035ceb,613,Mr. Andrew Saxton,Interjection,Government Orders,Business of Supply,Opposition Motion—Income Splitting,"Mr. Speaker, the only income splitting the member opposite understands is the splitting of Canadians' hard-earned income from their pockets.
Our government believes that income splitting has been good for seniors and that it would be good for Canadian families as well. We have not balanced the books yet, but once we balance the budget, we will look at all ways of reducing the tax burden on Canadian families.
Under this Conservative government, Canadians in all income groups are better off. Middle incomes in Canada have surpassed those in the United States for the first time, putting Canadian median incomes near the top of global rankings.
Canadian families in all income groups have seen increases of about 10% or more in their real, take-home, after-tax pay since 2006, and the median net worth of Canadian families, as I mentioned, has increased by almost 45% since 2005.
Our low-tax plan for the economy and for jobs is working for Canadians.",Conservative,North Vancouver,Andrew Saxton,http://www.parl.gc.ca/parlinfo/Files/Parliamentarian.aspx?Item=f66407a4-934e-4c46-b524-b4dacd035ceb&Language=E&Section=ALL
4605574,ca.proc.d.2014-06-10.16259.265,2014-06-10,4cb0ba6b-f142-4b9d-921b-e1ee27d48e24,413,"Hon. Ron Cannan (Kelowna—Lake Country, CPC)",,Government Orders,Business of Supply,Opposition Motion—Income Splitting,"Mr. Speaker, it is the home of some of the international award-winning wine, so I appreciate the opportunity to ask a question of my hon. colleague from British Columbia, from North Vancouver, another beautiful part of our province and our country. 
I thank him for the great work he has been doing. I know he had worked closely with our former colleague, Minister Flaherty, who had a memorial service in the other House yesterday. I think about the great foundation he laid to help our seniors, low-income people, middle-income people, and persons with disabilities, as well as his passion for his registered disability savings plan.
 I have been working on another issue for eight and a half years. I have been working on the trade committee, and we have this historic 21st century trade agreement that we signed with the European Union in the fall.
I wonder if my hon. colleague could share with the House some of the positive effects for low- and medium-income families and individual Canadians, as well as the economic opportunities for average Canadian families that this comprehensive economic trade agreement with the European Union will provide.",Conservative,Kelowna--Lake Country,Ron Cannan,http://www.parl.gc.ca/parlinfo/Files/Parliamentarian.aspx?Item=4cb0ba6b-f142-4b9d-921b-e1ee27d48e24&Language=E&Section=ALL
4605575,ca.proc.d.2014-06-10.16259.266,2014-06-10,f66407a4-934e-4c46-b524-b4dacd035ceb,613,Mr. Andrew Saxton,Interjection,Government Orders,Business of Supply,Opposition Motion—Income Splitting,"Mr. Speaker, I thank my hon. colleague for the excellent question and for the excellent work he does on the trade committee.
This trade agreement, the largest in Canadian history, will have a significant impact on our economy. In fact, we expect that over 80,000 jobs will be created as a result of this free trade agreement.
It means that Canada would be one of only a few countries in the world that would have free market access to both the United States and the European Union. That is over 800 million consumers that Canadians businesses would have access to on a free market basis.
We can imagine the number of jobs and the number of opportunities that would be created as a result of this ground-breaking free trade agreement. It brings over 20 countries from the European Union into a free trade agreement with Canada, and we look forward to signing that agreement and having it put in place.",Conservative,North Vancouver,Andrew Saxton,http://www.parl.gc.ca/parlinfo/Files/Parliamentarian.aspx?Item=f66407a4-934e-4c46-b524-b4dacd035ceb&Language=E&Section=ALL
4605576,ca.proc.d.2014-06-10.16259.267,2014-06-10,1288ae77-cf32-4b10-a560-1f75c4d4459b,8551,"Ms. Hélène LeBlanc (LaSalle—Émard, NDP)",,Government Orders,Business of Supply,Opposition Motion—Income Splitting,"Mr. Speaker, as a woman and the chair of the Standing Committee on the Status of Women, I am pleased to rise in the House today to support this NDP motion decrying the increase in income inequality in Canada under successive Conservative and Liberal governments and stating the NDP’s position on the Conservatives’ income splitting proposal.
 Pardon the pun, but there is a split between the perspectives of the Conservatives and the New Democrats. The Conservatives seem to want to return to the 1950s, as evidenced by the many retrograde initiatives they bring in. They are nostalgic for an era when the traditional family—as portrayed in the famous U.S. television series Leave It To Beaver—cast women in the role of housewife.
 I was born in the 1950s, but I must admit that, as a woman, I am in not at all nostalgic for that period. Not only am I proud that, over the years, women have been liberated through numerous struggles, I am also proud of women’s participation in the labour force, their financial autonomy, and their political and economic leadership.
 However, we must not become complacent: although Canada ranked first in the area of gender equality according to the United Nations Human Development Report for the decade from 1990 to 2000, since 2001 Canada’s ranking has plummeted to 20th and 31st, respectively.
 How is it that a progressive and modern nation like Canada could become a global laughingstock in the area of gender equality? Successive austerity budgets, starting in the mid-1990s, and recent fiscal policies have only widened the gap between the rich and the poor and deepened economic disparities between men and women.
 Even though about 70% of mothers with children under the age of five work, their employment rate is still far lower than that of fathers, according to Statistics Canada. In my opinion, it is our responsibility as parliamentarians to introduce policies to restore balance and establish working conditions that make it possible for parents—not only women—to balance work and family.
 In Quebec, the child care program has led to the creation of good jobs, and a 9% rise in mothers’ labour force participation. The program has also benefited the economy because every dollar invested has boosted the GDP by $2.30, according to a study by the Université de Sherbrooke.
 Since the Conservatives announced their intention to fulfill their pledge to institute income splitting, as a former coach of the Canadiens would say, a lot of ink has gone under the bridge.
I would like to quote a number of newspaper headlines. Le Devoir published two articles: “Income splitting: The wrong track” and “Federal taxation: Income splitting lines the pockets of the wealthy”. The Globe and Mail ran a article with the following headline:
“Probing the pledge: The Tories' flawed tax break for families”.
One recent report states:
“The Big Split: Income Splitting's Unequal Distribution of Benefits Across Canada”. From the Progressive Economics Forum, we have “Income Splitting: A Bad Idea Returns”. Then there is “Income Inequalities in Canada: Fiscal and Gender Dimensions”, a briefing paper to the finance committee, and “Income Splitting in Canada: Inequality by Design”, from the Canadian Centre for Policy Alternatives.
Even the C.D. Howe Institute came out against this measure.
Barrie McKenna stated in The Globe and Mail that this measure was seriously flawed because it would mainly benefit the wealthy.
A recent Broadbent Institute study, based on Statistics Canada data, shows interesting regional disparities. In particular, the study shows that most of the couples who would benefit from this measure are in Alberta and Saskatchewan. If I may say so, that is fertile territory for the Conservatives. It comes as no surprise that these measures would be less beneficial to provinces like Prince Edward Island and Quebec.
The C.D. Howe Institute's comments on this are as follows:
The measure would:
 ...fail to achieve its particular notion of horizontal equity, likely by overtaxing dual-earner couples. It would also distribute gains disproportionately to a small share of all households (mostly at the highest incomes), fail to assist families that most need help..., and create new distortions to work incentives. 
I must pause to announce some good news, which is that I will share my time with the hon. member for Trois-Rivières.
I will continue with quotes that denounce income splitting. Economist Erin Weir pointed out the significant impact that this measure would have on the federal government's revenues:
 Another aspect of the proposal that should be questioned is its likely impact on provincial governments, whose taxes generally apply to income as defined by federal tax rules. If it would reduce annual federal revenues by $2.5 billion, it could also reduce combined provincial revenues by about a billion dollars. 
Mr. Weir then continued by asking:
 The Conservatives have promised to wait until the federal budget is balanced. Would they also wait until provincial budgets are balanced? 
It seems to us that these revenues could be judiciously used to promote increased labour market participation by parents and greater recognition of work that is currently unpaid.
These revenues could also be used to reduce the gap between the rich and poor, a gap that is growing very rapidly in Canada, where 86 Canadians have the wealth of the 11.4 million poorest Canadians and where 14% of the country's total revenues go into the pockets of the richest 1%.
The Conference Board of Canada stated:
 Do government taxes and transfers help to reduce inequality? 
 Yes. Personal income taxes and government transfers (such as social assistance, employment insurance, child benefits, and old age security) have helped to reduce income inequality. 
No one can say that the Conference Board of Canada is leftist.
To conclude, the federal government has the means at its disposal to reduce inequalities and propose measures that will benefit all taxpayers, not just a narrow group of Conservatives. We believe in a sustainable and equitable economy, which includes a fairer, simpler and more progressive tax system.
Canadians are social democrats. They recognize the importance of the fair sharing of wealth, the value of work and fair compensation.
They recognize the importance of creating a climate conducive to full employment for everyone. They also want to be able to look after their families and loved ones, whether as parents or caregivers. It is therefore the moral responsibility of the government of a prosperous country such as Canada to foster a climate that will help our country become a country without inequalities, a country where prosperity will be accessible to all.",New Democratic Party,LaSalle--Émard,Hélène LeBlanc,http://www.parl.gc.ca/parlinfo/Files/Parliamentarian.aspx?Item=1288ae77-cf32-4b10-a560-1f75c4d4459b&Language=E&Section=ALL
4605577,ca.proc.d.2014-06-10.16259.268,2014-06-10,43e39949-6902-4d38-a760-fb83c0132de4,122,"Hon. Gary Goodyear (Minister of State (Federal Economic Development Agency for Southern Ontario), CPC)",,Government Orders,Business of Supply,Opposition Motion—Income Splitting,"Mr. Speaker, if I may offer a very sincere compliment, I find it hard to believe the member was around in the 1950s.
The NDP seems to have taken on this charge about the Conservatives wanting to return to the 1950s as if it is some kind of a bad thing.
Currently, under various policies by this government, we have some of the lowest federal corporate tax rates in the G20. We have the first entirely tariff-free zone for manufacturers. We see less children in poverty. We see less seniors paying any federal tax whatsoever. Right now, I think it is fair to say that we have the best, most fertile economic landscape in our country for business growth since the 1950s.
What we would not disagree with is that, of course, we would like to see taxation on Canadians all across the country as low, if not lower, than it was in the 1950s. If we want to go back to the 1950s, let us lower our tax rates to meet that criteria. This is one piece in the puzzle in doing that.
 Why can the NDP not vote yes to at least one lowering-tax initiative by the Conservative government?",Conservative,Cambridge,Gary Goodyear,http://www.parl.gc.ca/parlinfo/Files/Parliamentarian.aspx?Item=43e39949-6902-4d38-a760-fb83c0132de4&Language=E&Section=ALL
4605578,ca.proc.d.2014-06-10.16259.269,2014-06-10,1288ae77-cf32-4b10-a560-1f75c4d4459b,8551,Ms. Hélène LeBlanc,Interjection,Government Orders,Business of Supply,Opposition Motion—Income Splitting,"Mr. Speaker, I think the double taxation in the 1950s was probably higher.
He actually did not listen very carefully to my speech because, since the Conservatives and the Liberals came to power in the late 1990s, the gap between the rich and the poor has widened. We are talking here about poverty—there are more and more inequalities—and the government's role in sharing the wealth. In fact, the beauty of our federal system is the redistribution of wealth to reduce these gaps between the rich and the poor. I believe this government has completely abrogated its moral duty as a government to ensure that, regardless of where we live or the circumstances in which we were born, we have our fair share of that wealth.",New Democratic Party,LaSalle--Émard,Hélène LeBlanc,http://www.parl.gc.ca/parlinfo/Files/Parliamentarian.aspx?Item=1288ae77-cf32-4b10-a560-1f75c4d4459b&Language=E&Section=ALL
4605579,ca.proc.d.2014-06-10.16259.270,2014-06-10,07cf5767-802c-406c-92a7-7dc92af79b40,4264,"Mr. Kevin Lamoureux (Winnipeg North, Lib.)",,Government Orders,Business of Supply,Opposition Motion—Income Splitting,"Mr. Speaker, the redistribution of wealth is a critical issue in all regions of our country. Income inequality frustrates a great number of people. We need to recognize that, yes, there is a role that Ottawa and our provinces have to play.
Earlier today, for example, I mentioned the 10 years in which the NDP was in government in British Columbia and the income inequality was a whole lot worse. British Columbia was number four, but it was driven to number 10 as being the worse province in Canada. I say that because it draws into the comparison that it is the political will of the leadership.
 When we have individuals coming forward saying that they want to deal with income inequality, maybe one way we could do that is by ensuring we look at the shared responsibilities of taxation policies and so forth. Would the member want to provide some comment on how important it is that Ottawa work with different stakeholders, particularly the provinces, to ensure there is less income inequality in all regions of our country?",Liberal,Winnipeg North,Kevin Lamoureux,http://www.parl.gc.ca/parlinfo/Files/Parliamentarian.aspx?Item=07cf5767-802c-406c-92a7-7dc92af79b40&Language=E&Section=ALL
4605580,ca.proc.d.2014-06-10.16259.271,2014-06-10,1288ae77-cf32-4b10-a560-1f75c4d4459b,8551,Ms. Hélène LeBlanc,Interjection,Government Orders,Business of Supply,Opposition Motion—Income Splitting,"Mr. Speaker, in a confederation, the federal government's role is to ensure that it meets with the provinces. I would even take it further than that. Cities are increasingly being called upon to play a very important role, not just in the Canadian economy, but also in the fair distribution of wealth.
My colleague spoke about housing.The federal government and its partners need to find common solutions to the challenges Canada is facing. It needs to show some goodwill.",New Democratic Party,LaSalle--Émard,Hélène LeBlanc,http://www.parl.gc.ca/parlinfo/Files/Parliamentarian.aspx?Item=1288ae77-cf32-4b10-a560-1f75c4d4459b&Language=E&Section=ALL
