basepk,hid,speechdate,pid,opid,speakeroldname,speakerposition,maintopic,subtopic,subsubtopic,speechtext,speakerparty,speakerriding,speakername,speakerurl
4606664,ca.proc.d.2014-06-12.16277.358,2014-06-12,07cf5767-802c-406c-92a7-7dc92af79b40,4264,"Mr. Kevin Lamoureux (Winnipeg North, Lib.)",,Government Orders,Strengthening Canadian Citizenship Act,,"Mr. Speaker, I know the former minister of immigration has been waiting in great anticipation of what I might have to say, because he knows full well that when I get the opportunity to talk about immigration and citizenship, I like to reflect on not only the current minister but the past minister. I like to take a holistic approach in dealing with the issues as I see them and as many of my Liberal colleagues see them. The government often chooses to use immigration and citizenship in an inappropriate fashion, if I can put it that way, maybe putting politics ahead of what is in the best interest of good, solid, sound immigration and citizenship policy. I would not mind talking a bit about that, being afforded the opportunity to again share my thoughts.
I come to this issue because, over the last 20-plus years, I have had the opportunity of representing in a very real and tangible way a community in Winnipeg North that has allowed me to deal with immigration and citizenship issues, at one time maybe on a weekly basis. That has evolved into dealing with numerous immigration cases on a daily basis. Depending on who we might talk to and depending on the week and the time of the year, it could be anywhere from 200 to 300 or 400 cases.
There is a great deal of satisfaction in working with people and helping them on immigration files and citizenship files. I could provide the House with endless examples that will give an indication of just how off base the government of the day has been in regard to immigration policy. The government has fallen short, not in one or two areas but in a number of areas. I am hoping, by being able to provide direct input to those who are ultimately responsible, both the former minister and the current Minister of Citizenship and Immigration, that they will recognize that they need to start working on behalf of our immigrant community. When I say immigrant community, I am talking about the wider grouping of individuals who live in Canada, call Canada their home, and do so in a very proud fashion.
I was very pleased to have been appointed immigration critic when I was first elected after the general election, and I enjoyed it immensely. When I think of immigration policy, I can say that there has not been that much change in the government's attitude in terms of policy and the direction in which the department is going. This is something that I would like to highlight.
There are so many things I could be talking about. Let me start by commenting specifically on a bill known as “425”. Bill C-425 was a private member's bill that was introduced last year by a backbench Conservative member of Parliament. What was that member of Parliament hoping to be able to do through that legislation? He came up with an idea that we should give citizenship out to individuals who have been here for three out of four years. His idea was to allow for military personnel to acquire their citizenship after two years. This is something that was proposed by a Conservative member of Parliament, and it actually received fairly good support from all members of this House. Maybe he did not have the green light from the Prime Minister's Office. The bill passed the House and went into committee, and the arguments that were brought forward at the time were that three out of four years was a good overall policy, that it would work, and that there was nothing wrong with it.
 What the member and others around the table were talking about was, in fact, reducing it for certain individuals who decide to serve in the Canadian Forces. I remember the debate well, because I was the critic at the time.
Listening to the comments in this chamber, I did not hear one member—not one Conservative, not one New Democrat, and definitely not one Liberal—make the suggestion that we needed to increase the residency requirement. No one was talking about that, not even the then minister of immigration.
When it came time to provide comment on Bill C-425, what did the then minister of immigration choose to talk about? He chose to talk about the dual citizens. He chose to talk about how important it is to be able to deport or take away citizenship from individuals who commit a crime of treason, and he cited a couple of other things. That was the minister's concern. He not once mentioned that we should be increasing the residency requirement from three years to four years. 
Something happened over that late fall from October to November that triggered a thought. I do not know what triggered it, but the thought was to make it more difficult, or increase the requirements, for someone to achieve citizenship. I question why the government made that decision, because it definitely was not an issue. We know that. If it had been an issue, if MPs or the government were being challenged on the issue, it would have been brought up at the immigration committee. The minister of immigration back then would have raised the issue. However, they chose not to, because it was not an issue then. It is only the current Minister of Citizenship and Immigration who decided this was an issue.
I will put one caveat on that. I suspect that someone within the Prime Minister's Office might have had a say on that issue. Maybe a new minister, being eager and wanting to please the leader, decided he would do that even though there was no need. There was no need. This is what I believe has actually taken place. It is a change that is being dictated from the Prime Minister's Office, which wants to make it four years as opposed to three years, even though it was not an issue. I suggest that is bad policy.
I was not surprised when the government made the decision it would double the cost of the application for citizenship, because it hinted about that in the immigration committee. We could tell by some of the questions Conservatives were asking. We anticipated that the government was considering an increase. That was not a surprise. The surprise was the fact that it wanted to increase the residency period.",Liberal,Winnipeg North,Kevin Lamoureux,http://www.parl.gc.ca/parlinfo/Files/Parliamentarian.aspx?Item=07cf5767-802c-406c-92a7-7dc92af79b40&Language=E&Section=ALL
4606665,ca.proc.d.2014-06-12.16277.359,2014-06-12,,,,intervention,Government Orders,Strengthening Canadian Citizenship Act,, Louder.,,,An hon. member,
4606666,ca.proc.d.2014-06-12.16277.360,2014-06-12,07cf5767-802c-406c-92a7-7dc92af79b40,4264,Mr. Kevin Lamoureux,,Government Orders,Strengthening Canadian Citizenship Act,," If the member does not like my volume, he is welcome to leave the chamber.
At the end of the day, we believe that the government has made a bad decision, and the vast majority of the Conservative caucus recognize that. However, of course, there will not be any free vote on this legislation.
What have the Conservatives done in citizenship? They have created a crisis. When they took office, they increased the processing time for a person to acquire the eligibility requirements to apply for citizenship. They rapidly increased the processing time.
When the Conservatives took office, it took roughly a year for a person to acquire the necessary paperwork when applying for his or her citizenship. What is it today? When I say 28 months, I am being very generous. It is likely closer to 30 months. That is for the majority of individuals who put in their applications; I will give the government that much. What does that mean in a very real way? It means, Mr. Speaker, that if you had put in your application today, under the Paul Martin or Jean Chrétien governments you would have had it a year from today. Now we are talking about at least three years, and heaven forbid that a residential background check is required. If that has to be done, we are talking about five years, six years, and even beyond that.
This is the government that created the crisis with processing times. Now what does it say about this legislation? It says it is going to fix the problem. It has a new process and it is going to fix the processing times. It did not require legislation to fix the processing times. It required the political will, and that is what has been lacking with the government. It does not have the political will to improve the processing time; and that does not only apply to citizenship. It has no qualms about processing times for other immigration types of programs. What does it do? It always blames the other government. It constantly does that, and it is just not true.
The minister who had the most significant increase in backlog in the skilled worker program was, in fact, the former minister, the individual sitting across from me right now. When he issued ministerial instructions, he increased the backlog by more than 130,000—I believe that was the number—over a period of weeks. How did the government deal with backlogs? It froze the program of sponsoring parents and grandparents for over three years. It hit the delete button. Imagine deleting 300,000 people who were waiting for years.
The point is that the government has been playing politics when it comes to immigration and citizenship, and it has done a miserable job. It has failed, and I would ultimately argue that it has intentionally failed, because it could have been doing more. The current Minister of Citizenship and Immigration says, “Look at how wonderful we are. We have this legislation and we are developing a new process. Our target is to reduce the processing times from three years to one year, and we will do it by 2016.” This is the government that created the crisis that built it up to three years, and it does not require legislation to get down under a year. That could have been done without legislation.
What will be the real impact on people in our communities—outstanding, wonderful, contributing individuals? What will the real, tangible impact be? Let me tell a couple of stories.
Someone met up with me at my local McDonald's on a Saturday and told me his passport had expired. I will use the example of the Philippines, because this is what in fact happened. The problem is that he has applied for his citizenship, which means he does not have the ability to go to the Philippines after a death in the family. He has now been waiting for well over a year for his citizenship. He asked me if there is anything I can do.
Maybe if there is a two- or three-week period of time and it looks very close to being finalized, a member of Parliament might be able to assist to a certain degree, depending on the situation. However, when there is a waiting period of two and half years, and a person is one year in, and the homeland passport is no longer valid, there is very little one can do when the person needs to get the documents quickly so that they can be there for a funeral or something of that nature.
How many permanent residents do we have in Canada today who have been waiting for their citizenship well beyond a year? We are not talking about a few thousand. We are talking about well over 200,000 people who have been waiting for over a year.
One of the privileges of having Canadian citizenship is having a passport. I do not know if the government is sensitive to that fact, because it is denying Canadian passports, due to its incompetence or its decision to frustrate the system, to tens of thousands of people who should be Canadians today.
Imagine wanting to be a long-distance truck driver obligated to cross the Canada-U.S. border. What do they want? They want valid passports.
What if one wanted to travel to the United States to see friends or travel anywhere outside of Canada? What about getting on a plane? One of the most common pieces of identification asked for is one's Canadian passport.
Why are we making people wait three years? Do not tell me it is because we needed this legislation, because that is a bogus argument. It is not necessary.",Liberal,Winnipeg North,Kevin Lamoureux,http://www.parl.gc.ca/parlinfo/Files/Parliamentarian.aspx?Item=07cf5767-802c-406c-92a7-7dc92af79b40&Language=E&Section=ALL
4606667,ca.proc.d.2014-06-12.16277.361,2014-06-12,,,,intervention,Government Orders,Strengthening Canadian Citizenship Act,, Wrong.,,,Some hon. members,
4606668,ca.proc.d.2014-06-12.16277.362,2014-06-12,07cf5767-802c-406c-92a7-7dc92af79b40,4264,Mr. Kevin Lamoureux,,Government Orders,Strengthening Canadian Citizenship Act,," No, right. Just because there are a number of Conservatives on the other side saying “wrong”, including the Minister of Citizenship and Immigration, does not mean that they are right.",Liberal,Winnipeg North,Kevin Lamoureux,http://www.parl.gc.ca/parlinfo/Files/Parliamentarian.aspx?Item=07cf5767-802c-406c-92a7-7dc92af79b40&Language=E&Section=ALL
4606669,ca.proc.d.2014-06-12.16277.363,2014-06-12,,,,intervention,Government Orders,Strengthening Canadian Citizenship Act,," Oh, oh!",,,Some hon. members,
4606670,ca.proc.d.2014-06-12.16277.364,2014-06-12,de0591ef-9a02-4f97-9541-63de484c96e3,87,The Acting Speaker (Mr. Barry Devolin),,Government Orders,Strengthening Canadian Citizenship Act,,"Order. To all hon. members, it is not the practice in the House to refer to members who are here or are not here. I would remind all hon. members of that.
The hon. member for Winnipeg North.",Conservative,Haliburton--Kawartha Lakes--Brock,Barry Devolin,http://www.parl.gc.ca/parlinfo/Files/Parliamentarian.aspx?Item=de0591ef-9a02-4f97-9541-63de484c96e3&Language=E&Section=ALL
4606671,ca.proc.d.2014-06-12.16277.365,2014-06-12,07cf5767-802c-406c-92a7-7dc92af79b40,4264,Mr. Kevin Lamoureux,Interjection,Government Orders,Strengthening Canadian Citizenship Act,,"I appreciate that, Mr. Speaker.
There is an election taking place today in the province of Ontario. Imagine the tens of thousands of people who should be able to vote today, but because of the Conservative government's incompetence in dealing with the issue, because of the three-year-plus waiting period to get citizenship, they are being denied the opportunity to vote. I speak first-hand about the great sense of pride new Canadians have when it comes time to be able to express themselves by going to the polls and voting, yet what sort of response do we get from the government? It is most unfortunate.
There are many aspects of the legislation the Liberal Party is uncomfortable with. The Liberal Party critic has enunciated a number of flaws. Our expectations are far greater.
I must conclude my remarks by saying that the comments by the Minister of Citizenship and Immigration about millions of second-class citizens during the 1970s and 1980s because of a change in government policy backed by Pierre Elliott Trudeau was really a disservice. I suggest that the Minister of Citizenship and Immigration apologize for those comments.
However, I am thankful for this opportunity to share a few thoughts.",Liberal,Winnipeg North,Kevin Lamoureux,http://www.parl.gc.ca/parlinfo/Files/Parliamentarian.aspx?Item=07cf5767-802c-406c-92a7-7dc92af79b40&Language=E&Section=ALL
4606672,ca.proc.d.2014-06-12.16277.366,2014-06-12,1e6e9765-853d-440f-be8f-e39b76082465,675,"Mr. Chungsen Leung (Parliamentary Secretary for Multiculturalism, CPC)",,Government Orders,Strengthening Canadian Citizenship Act,,"Mr. Speaker, it is a privilege to be a Canadian citizen, and it is a privilege for me to rise in this House to address this point.
Women in this country were given their citizenship and the right to vote about 100 years ago. The Chinese did not get their right to vote until 1947. The South Asians did not get their right to citizenship until 1948. Although many Japanese during the internment period were born in Canada, they did not have the right to vote in the 1950s. This was all under the rules of the former Liberal government.
If we had let the Chinese write their laws when we first came to this country in 1421, if I remember properly, we probably would have written them in such a way that one would have to live here a lifetime before being permitted to be a citizen. Under Chinese law, if one parent was from Switzerland and the other from Japan, the children would have to be either Japanese, Swiss, or Chinese and they would have to change their name before they could be citizens. 
It is a privilege to be a Canadian citizen. As we define that privilege, I think this current act does a good job. What are we looking for? We are looking for the intent to stay, a commitment to this country, to be grounded in this environment, to pay taxes, and to learn the language so that people can communicate as Canadian citizens. Those are the elements that are necessary.",Conservative,Willowdale,Chungsen Leung,http://www.parl.gc.ca/parlinfo/Files/Parliamentarian.aspx?Item=1e6e9765-853d-440f-be8f-e39b76082465&Language=E&Section=ALL
4606673,ca.proc.d.2014-06-12.16277.367,2014-06-12,07cf5767-802c-406c-92a7-7dc92af79b40,4264,Mr. Kevin Lamoureux,Interjection,Government Orders,Strengthening Canadian Citizenship Act,,"Mr. Speaker, the member brings up an interesting point. I suspect that many of those issues would have been resolved when Mr. Trudeau, as prime minister, would have brought in the legislation. I think the Conservatives need to recognize a good thing. We had a better thing in terms of three out of four years versus what is being proposed in this legislation. My gut feeling is that the member who posed the question knows that, because he sat on the immigration committee with me. He will recall that not one member of Parliament, not one presenter, made the suggestion that three out of four years was not good enough. Why did the government make the decision to change it to four years?
I am sure the member has posed that question to himself, because it was a surprise. A tip probably came from the Prime Minister's office.",Liberal,Winnipeg North,Kevin Lamoureux,http://www.parl.gc.ca/parlinfo/Files/Parliamentarian.aspx?Item=07cf5767-802c-406c-92a7-7dc92af79b40&Language=E&Section=ALL
4606674,ca.proc.d.2014-06-12.16277.368,2014-06-12,4efcc2e2-bd91-4234-b907-a24838d4f1aa,1371,"Ms. Christine Moore (Abitibi—Témiscamingue, NDP)",,Government Orders,Strengthening Canadian Citizenship Act,,"Mr. Speaker, since my colleague spoke at length about this in his speech, I would like to go back to expedited access to citizenship for persons who are serving in the Canadian Armed Forces.
Of course we support this measure. It makes sense that someone who has served in the armed forces should have faster access to citizenship. That being said, the problem with this measure is that it applies to almost nobody. The simple fact is that to be a member of the Canadian Armed Forces, one must be a Canadian citizen. If one is not a citizen, one cannot join the forces. I did not even know that, but I looked into it and I found out that in some cases, the Chief of the Defence Staff can authorize an individual with the necessary training to serve in a position where there is a skills shortage.
When I asked how many people this would affect, I was told that it was fewer than 10. Currently, fewer than 10 people serving in the armed forces will be able to benefit from this measure.
I would like to know what the member thinks about that. Did the government try to include a measure that looks good on the surface but that really applies to almost nobody as a way of making the rest of it, which is pretty bad, look better?",New Democratic Party,Abitibi--Témiscamingue,Christine Moore,http://www.parl.gc.ca/parlinfo/Files/Parliamentarian.aspx?Item=4efcc2e2-bd91-4234-b907-a24838d4f1aa&Language=E&Section=ALL
4606675,ca.proc.d.2014-06-12.16277.369,2014-06-12,07cf5767-802c-406c-92a7-7dc92af79b40,4264,Mr. Kevin Lamoureux,Interjection,Government Orders,Strengthening Canadian Citizenship Act,,"Mr. Speaker, I appreciate the question.
If we go to the Canadian Forces website, it says that one has to be a Canadian to apply. The question is why we would allow the residency requirement to be reduced for someone to become a Canadian. There are very few this would actually apply to.
 The member is quite right. Generally speaking, there may be individuals outside of Canada who might be recruited by the hierarchy within the military, brought to Canada, and offered something of this nature. There are very few. I had the opportunity to question the military directly on the issue, and I can confirm that it is a very low number.
This goes back to Bill C-425, if that is what the member was trying to get across. It is only meant as a gesture of symbolism to try to give an impression. It is not as if there is going to be a Canadian Forces recruitment banner at the airport as new immigrants come walking in.",Liberal,Winnipeg North,Kevin Lamoureux,http://www.parl.gc.ca/parlinfo/Files/Parliamentarian.aspx?Item=07cf5767-802c-406c-92a7-7dc92af79b40&Language=E&Section=ALL
4606676,ca.proc.d.2014-06-12.16277.370,2014-06-12,a76af2a6-7a43-4f8f-a887-0d10b3a0a3c1,96,"Hon. Wayne Easter (Malpeque, Lib.)",,Government Orders,Strengthening Canadian Citizenship Act,,"Mr. Speaker, the member from Winnipeg North talked about the government creating its own crisis relative to this bill. It would be nice if the member could tell us what he really thinks. He is not being very direct.
The member mentioned truck drivers and the need to have a passport. That is a big issue in my own province of Prince Edward Island. Several trucking firms have approached me. They need drivers. We do a lot of international business across the U.S. border. The addition of one year really impacts those individuals.
As well, I wonder if the member could tell me the impact on the economy. The government talks about the economy, but really undermines it in many ways. This is just another way. We do not have the drivers to do the business that drives the economy.",Liberal,Malpeque,Wayne Easter,http://www.parl.gc.ca/parlinfo/Files/Parliamentarian.aspx?Item=a76af2a6-7a43-4f8f-a887-0d10b3a0a3c1&Language=E&Section=ALL
4606677,ca.proc.d.2014-06-12.16277.371,2014-06-12,07cf5767-802c-406c-92a7-7dc92af79b40,4264,Mr. Kevin Lamoureux,Interjection,Government Orders,Strengthening Canadian Citizenship Act,,"Mr. Speaker, there is a high demand for long-haul truck drivers. Does it have an impact?
It is closer to three years in terms of the waiting period to get citizenship. A truck driver could be waiting a long time to acquire Canadian citizenship and a passport. It is purely processing time.
I want to pick up on it being a crisis. This is not unique to citizenship. One of the most controversial issues in the House of Commons over the last few months has been the temporary foreign worker program. It is the Conservative government that created the crisis. The Conservatives say that the Liberals did not deal with the issue. The simple answer is that there was no crisis back then. It is the Conservatives that created the crisis. Now they are in a position to try to fix it.
It is no different with the citizenship process or dealing with economic immigrants. The Conservatives come up with weird ways to resolve a crisis. Let us remember what they did with the skilled workers. There were over 300,000 applications, and the previous minister of immigration hit the delete button. He deleted 300,000 applications.
There are court actions and all sorts of problems with it. The Conservative government creates the crisis and then it tries to blame it on someone else. Then it tries to take credit for hopefully fixing it. I do not think there is enough time left in its mandate to rectify the serious problems in the immigration and citizenship file.",Liberal,Winnipeg North,Kevin Lamoureux,http://www.parl.gc.ca/parlinfo/Files/Parliamentarian.aspx?Item=07cf5767-802c-406c-92a7-7dc92af79b40&Language=E&Section=ALL
